Marea,Planta,Embarcacion,Lleg. zona,Inicio Envase,Fin Envase,Salid. zona,Arrib. Puerto,Inic. Descarga,Fin Descarga,Descarg.,Bodega,CBOD,% Llenado,# Calas,TDC-ArrPue,TDC-Desc,TDC-PondArribo,TDC-PondDesc,TVN,% Juveniles,Tamaño,Peso,%Grasa MP,%Ceniza,Temp Mar Cala,año,mes,dia,fecha,Zona,temporada_año,temporada,Embarcacion_modificada
76794,MALABRIGO,TASA 414,01/01/2014 09:25,01/01/2014 10:45,01/01/2014 11:00,01/01/2014 13:51,01/01/2014 15:10,01/01/2014 15:33,01/01/2014 17:10,53.605,Tradicional,424.12,13,1,4.42,4.8,4.42,4.8,18.56,0.0,15.08,22.78,6.07,3.97,18.6,2014,1,1,2014-01-01,1,2013-II,II,1
76795,MALABRIGO,TASA 42,01/01/2014 10:00,01/01/2014 10:57,01/01/2014 11:20,01/01/2014 17:32,01/01/2014 20:06,01/01/2014 22:43,02/01/2014 00:49,167.62,Frio,473.22,35,3,9.15,11.77,5.34,7.96,17.59,2.2,14.89,20.83,6.07,3.97,18.81,2014,1,1,2014-01-01,1,2013-II,II,0
76796,MALABRIGO,TASA 53,01/01/2014 09:30,01/01/2014 11:30,01/01/2014 11:40,01/01/2014 18:37,01/01/2014 20:20,01/01/2014 23:34,02/01/2014 01:28,153.08,Frio,568.3,27,3,8.83,12.07,4.4,7.63,19.56,14.29,13.87,19.18,6.07,3.97,24.2,2014,1,1,2014-01-01,1,2013-II,II,0
76797,MALABRIGO,TASA 427,01/01/2014 10:20,01/01/2014 11:17,01/01/2014 11:30,01/01/2014 18:33,01/01/2014 20:48,02/01/2014 00:58,02/01/2014 02:46,201.895,Frio,430.11,47,3,9.52,13.68,6.29,10.45,21.93,10.32,14.01,19.42,6.07,3.97,18.19,2014,1,1,2014-01-01,1,2013-II,II,0
76798,MALABRIGO,TASA 71,01/01/2014 04:30,01/01/2014 06:13,01/01/2014 06:18,01/01/2014 18:53,01/01/2014 20:55,02/01/2014 01:28,02/01/2014 05:14,442.975,Frio,861.75,51,6,14.7,19.25,7.48,12.03,33.01,1.22,14.92,23.7,6.07,3.97,19.17,2014,1,1,2014-01-01,1,2013-II,II,0
76799,MALABRIGO,TASA 420,01/01/2014 06:00,01/01/2014 08:15,01/01/2014 08:25,01/01/2014 17:07,01/01/2014 19:43,01/01/2014 20:50,01/01/2014 22:24,140.79,Tradicional,375.88,37,2,11.47,12.58,10.27,11.38,32.08,0.0,14.82,21.3,6.07,3.97,18.21,2014,1,1,2014-01-01,1,2013-II,II,0
76800,MALABRIGO,TASA 412,01/01/2014 07:00,01/01/2014 08:40,01/01/2014 09:10,01/01/2014 12:39,01/01/2014 14:15,01/01/2014 14:51,01/01/2014 16:47,184.375,Tradicional,402.44,46,2,5.58,6.18,5.32,5.92,18.63,0.0,14.95,22.74,6.07,3.97,19.67,2014,1,1,2014-01-01,1,2013-II,II,0
76804,MALABRIGO,TASA 415,01/01/2014 14:00,01/01/2014 15:00,01/01/2014 15:20,01/01/2014 17:17,01/01/2014 19:49,01/01/2014 22:20,02/01/2014 00:01,100.68,Tradicional,435.8,23,2,4.82,7.33,4.48,7.0,22.58,16.36,13.96,18.35,6.07,3.97,19.28,2014,1,1,2014-01-01,1,2013-II,II,1
76806,MALABRIGO,TASA 38,01/01/2014 05:30,01/01/2014 06:30,01/01/2014 07:00,01/01/2014 13:27,01/01/2014 15:00,01/01/2014 15:44,01/01/2014 17:06,100.94,Tradicional,322.06,31,2,8.5,9.23,7.31,8.04,22.85,0.0,13.99,21.49,6.07,3.97,20.03,2014,1,1,2014-01-01,1,2013-II,II,0
76807,MALABRIGO,TASA 424,01/01/2014 07:30,01/01/2014 08:40,01/01/2014 09:05,01/01/2014 16:48,01/01/2014 19:40,01/01/2014 20:41,02/01/2014 01:25,298.425,Tradicional,403.7,74,5,11.0,12.02,7.65,8.67,20.53,0.0,15.0,22.48,6.07,3.97,19.57,2014,1,1,2014-01-01,1,2013-II,II,0
76808,MALABRIGO,TASA 22,01/01/2014 06:25,01/01/2014 07:20,01/01/2014 07:40,01/01/2014 13:52,01/01/2014 15:15,01/01/2014 15:48,01/01/2014 17:08,88.305,Tradicional,322.05,27,2,7.92,8.47,6.83,7.38,26.02,0.0,15.04,22.94,6.07,3.97,18.7,2014,1,1,2014-01-01,1,2013-II,II,1
76809,MALABRIGO,TASA 426,01/01/2014 00:00,01/01/2014 06:45,01/01/2014 06:55,01/01/2014 17:27,01/01/2014 20:13,02/01/2014 00:02,02/01/2014 02:11,236.14,Tradicional,397.33,59,5,13.47,17.28,8.82,12.64,32.64,15.31,13.98,18.4,6.07,3.97,19.51,2014,1,1,2014-01-01,1,2013-II,II,0
76810,MALABRIGO,TASA 32,01/01/2014 07:30,01/01/2014 09:05,01/01/2014 09:30,01/01/2014 14:16,01/01/2014 15:30,01/01/2014 16:53,01/01/2014 18:33,115.465,Tradicional,399.88,29,2,6.42,7.8,5.67,7.05,27.24,0.0,14.65,23.44,6.07,3.97,19.43,2014,1,1,2014-01-01,1,2013-II,II,0
76811,MALABRIGO,TASA 417,01/01/2014 07:10,01/01/2014 08:00,01/01/2014 08:10,01/01/2014 16:34,01/01/2014 19:20,01/01/2014 20:13,01/01/2014 22:19,151.05,Tradicional,441.12,34,3,11.33,12.22,8.92,9.8,32.53,0.0,14.59,22.07,6.07,3.97,19.87,2014,1,1,2014-01-01,1,2013-II,II,0
76827,CHIMBOTE,TASA 45,02/01/2014 03:00,02/01/2014 04:30,02/01/2014 04:57,02/01/2014 09:22,02/01/2014 20:30,02/01/2014 20:58,02/01/2014 23:32,351.79,Tradicional,364.84,96,3,16.0,16.47,14.25,14.72,25.98,0.0,14.87,20.39,6.49,3.42,19.36,2014,2,1,2014-02-01,1,2013-II,II,1
76834,MALABRIGO,TASA 414,02/01/2014 01:50,02/01/2014 03:25,02/01/2014 03:58,02/01/2014 09:02,02/01/2014 12:35,02/01/2014 14:41,02/01/2014 18:42,390.46,Tradicional,424.12,92,3,9.17,11.27,5.99,8.09,24.51,0.0,14.79,20.92,6.72,3.89,18.79,2014,2,1,2014-02-01,1,2013-II,II,1
76835,MALABRIGO,TASA 412,02/01/2014 01:30,02/01/2014 02:40,02/01/2014 03:00,02/01/2014 10:26,02/01/2014 13:55,02/01/2014 15:10,02/01/2014 20:07,394.36,Tradicional,402.44,98,3,11.25,12.5,6.88,8.13,25.28,0.0,14.82,21.37,6.72,3.89,19.22,2014,2,1,2014-02-01,1,2013-II,II,0
76836,MALABRIGO,TASA 22,02/01/2014 01:30,02/01/2014 03:00,02/01/2014 03:30,02/01/2014 06:45,02/01/2014 10:35,02/01/2014 10:58,02/01/2014 13:51,322.53,Tradicional,322.05,100,2,7.58,7.97,6.21,6.59,17.3,0.0,14.81,21.8,6.72,3.89,18.5,2014,2,1,2014-02-01,1,2013-II,II,1
76837,MALABRIGO,TASA 32,02/01/2014 03:00,02/01/2014 05:40,02/01/2014 06:20,02/01/2014 10:57,02/01/2014 14:00,02/01/2014 17:39,02/01/2014 20:10,220.945,Tradicional,399.88,55,2,8.33,11.98,6.26,9.91,25.24,1.0,14.59,20.93,6.72,3.89,19.24,2014,2,1,2014-02-01,1,2013-II,II,0
76838,MALABRIGO,TASA 417,02/01/2014 02:00,02/01/2014 04:00,02/01/2014 04:30,02/01/2014 07:06,02/01/2014 10:40,02/01/2014 11:11,02/01/2014 14:09,367.605,Tradicional,441.12,83,2,6.67,7.18,5.72,6.24,17.83,0.0,14.81,21.54,6.72,3.89,19.52,2014,2,1,2014-02-01,1,2013-II,II,0
76839,MALABRIGO,TASA 38,02/01/2014 01:30,02/01/2014 03:00,02/01/2014 03:45,02/01/2014 08:44,02/01/2014 12:05,02/01/2014 12:31,02/01/2014 14:55,307.215,Tradicional,322.06,95,3,9.08,9.52,7.26,7.69,20.34,3.3,14.44,20.13,6.72,3.89,19.66,2014,2,1,2014-02-01,1,2013-II,II,0
76840,MALABRIGO,TASA 415,02/01/2014 01:45,02/01/2014 02:50,02/01/2014 03:25,02/01/2014 07:45,02/01/2014 10:45,02/01/2014 11:37,02/01/2014 14:32,278.22,Tradicional,435.8,64,3,7.92,8.78,6.01,6.88,21.46,0.0,14.76,20.71,6.72,3.89,18.75,2014,2,1,2014-02-01,1,2013-II,II,1
76841,MALABRIGO,TASA 420,02/01/2014 02:45,02/01/2014 03:50,02/01/2014 04:05,02/01/2014 08:46,02/01/2014 12:15,02/01/2014 14:04,02/01/2014 16:59,273.24,Tradicional,375.88,73,3,8.42,10.23,6.33,8.15,23.49,0.0,14.58,20.68,6.72,3.89,17.88,2014,2,1,2014-02-01,1,2013-II,II,0
76842,CHIMBOTE,TASA 42,02/01/2014 03:30,02/01/2014 05:02,02/01/2014 05:37,02/01/2014 08:29,02/01/2014 21:49,02/01/2014 21:55,03/01/2014 01:17,415.3,Frio,473.22,88,2,16.78,16.88,16.0,16.1,17.58,0.0,14.98,22.25,6.49,3.42,19.0,2014,2,1,2014-02-01,1,2013-II,II,0
76843,CHIMBOTE,TASA 53,02/01/2014 03:00,02/01/2014 04:35,02/01/2014 04:55,02/01/2014 09:57,02/01/2014 21:37,02/01/2014 23:50,03/01/2014 03:19,467.835,Frio,568.3,82,3,17.03,19.25,15.46,17.67,20.67,0.0,14.84,22.78,6.49,3.42,18.83,2014,2,1,2014-02-01,1,2013-II,II,0
76844,MALABRIGO,TASA 424,02/01/2014 04:00,02/01/2014 05:40,02/01/2014 06:25,02/01/2014 11:19,02/01/2014 15:00,02/01/2014 18:16,02/01/2014 21:53,266.14,Tradicional,403.7,66,4,9.33,12.6,7.55,10.82,25.8,0.0,14.71,22.82,6.72,3.89,19.6,2014,2,1,2014-02-01,1,2013-II,II,0
76845,CHIMBOTE,TASA 427,02/01/2014 06:55,02/01/2014 07:30,02/01/2014 08:20,02/01/2014 13:37,03/01/2014 02:00,03/01/2014 02:02,03/01/2014 05:11,379.52,Frio,430.11,88,3,18.5,18.53,16.63,16.67,29.04,0.0,14.76,21.3,6.49,3.42,18.55,2014,2,1,2014-02-01,1,2013-II,II,0
76846,MALABRIGO,TASA 426,02/01/2014 05:15,02/01/2014 08:30,02/01/2014 08:50,02/01/2014 12:23,02/01/2014 15:15,02/01/2014 22:28,03/01/2014 00:34,224.5,Tradicional,397.33,57,2,6.75,13.97,5.75,12.97,29.15,0.0,14.51,20.09,6.72,3.89,19.79,2014,2,1,2014-02-01,1,2013-II,II,0
76847,MALABRIGO,TASA 71,02/01/2014 08:15,02/01/2014 09:20,02/01/2014 09:31,02/01/2014 18:19,02/01/2014 21:05,02/01/2014 23:25,03/01/2014 02:30,241.28,Frio,861.75,28,6,11.75,14.08,8.74,11.08,20.47,8.41,14.35,18.41,6.72,3.89,19.46,2014,2,1,2014-02-01,1,2013-II,II,0
76860,MALABRIGO,TASA 22,03/01/2014 01:45,03/01/2014 02:55,03/01/2014 03:05,03/01/2014 08:38,03/01/2014 13:00,03/01/2014 13:45,03/01/2014 17:08,283.395,Tradicional,322.05,88,3,10.08,10.83,7.49,8.24,22.04,0.0,14.84,21.45,6.97,3.75,18.88,2014,3,1,2014-03-01,1,2013-II,II,1
76861,MALABRIGO,TASA 414,03/01/2014 02:00,03/01/2014 03:40,03/01/2014 04:10,03/01/2014 09:22,03/01/2014 13:35,03/01/2014 13:56,03/01/2014 17:23,332.45,Tradicional,424.12,78,3,9.92,10.27,7.72,8.07,22.47,0.0,14.88,21.26,6.97,3.75,19.17,2014,3,1,2014-03-01,1,2013-II,II,1
76862,MALABRIGO,TASA 412,03/01/2014 01:00,03/01/2014 02:30,03/01/2014 02:50,03/01/2014 09:49,03/01/2014 14:00,03/01/2014 14:56,03/01/2014 18:00,376.04,Tradicional,402.44,93,4,11.5,12.43,8.86,9.8,24.99,0.0,14.84,21.84,6.97,3.75,19.61,2014,3,1,2014-03-01,1,2013-II,II,0
76863,MALABRIGO,TASA 415,03/01/2014 01:30,03/01/2014 02:33,03/01/2014 02:51,03/01/2014 04:45,03/01/2014 08:25,03/01/2014 09:38,03/01/2014 11:27,152.95,Tradicional,435.8,35,2,5.87,7.08,5.19,6.41,18.69,0.0,14.81,21.0,6.97,3.75,19.89,2014,3,1,2014-03-01,1,2013-II,II,1
76864,MALABRIGO,TASA 38,03/01/2014 01:30,03/01/2014 03:05,03/01/2014 03:30,03/01/2014 06:22,03/01/2014 09:45,03/01/2014 10:28,03/01/2014 12:13,162.61,Tradicional,322.06,50,2,6.67,7.38,5.46,6.18,22.25,0.0,14.88,21.43,6.97,3.75,20.0,2014,3,1,2014-03-01,1,2013-II,II,0
76865,MALABRIGO,TASA 417,03/01/2014 02:30,03/01/2014 03:45,03/01/2014 04:00,03/01/2014 06:21,03/01/2014 09:40,03/01/2014 10:24,03/01/2014 12:34,205.185,Tradicional,441.12,47,2,5.92,6.65,4.97,5.7,21.72,0.0,14.92,21.15,6.97,3.75,20.12,2014,3,1,2014-03-01,1,2013-II,II,0
76875,MALABRIGO,TASA 45,03/01/2014 11:15,03/01/2014 12:18,03/01/2014 12:32,03/01/2014 17:40,03/01/2014 21:05,04/01/2014 01:48,04/01/2014 03:26,174.175,Tradicional,364.84,48,2,8.78,13.5,7.77,12.48,37.76,0.0,14.8,23.57,6.97,3.75,20.27,2014,3,1,2014-03-01,1,2013-II,II,1
76876,MALABRIGO,TASA 42,03/01/2014 08:40,03/01/2014 10:13,03/01/2014 10:25,03/01/2014 14:54,03/01/2014 17:00,03/01/2014 17:36,03/01/2014 19:11,91.815,Frio,473.22,19,2,6.78,7.38,6.42,7.02,12.37,5.0,14.54,19.94,6.97,3.75,14.86,2014,3,1,2014-03-01,1,2013-II,II,0
76877,MALABRIGO,TASA 71,03/01/2014 05:00,03/01/2014 06:21,03/01/2014 06:28,03/01/2014 17:24,03/01/2014 21:05,03/01/2014 21:52,04/01/2014 01:46,481.435,Frio,861.75,56,6,14.73,15.52,10.85,11.63,22.28,0.0,14.79,21.9,6.97,3.75,19.45,2014,3,1,2014-03-01,1,2013-II,II,0
76878,MALABRIGO,TASA 53,03/01/2014 22:00,04/01/2014 01:35,04/01/2014 01:50,04/01/2014 08:27,04/01/2014 15:13,04/01/2014 18:35,04/01/2014 21:51,420.285,Frio,568.3,74,3,13.63,17.0,11.04,14.41,23.53,0.0,14.91,21.05,6.6,3.85,23.2,2014,4,1,2014-04-01,1,2013-II,II,0
76879,CHIMBOTE,TASA 427,04/01/2014 00:40,04/01/2014 01:40,04/01/2014 02:00,04/01/2014 08:32,04/01/2014 19:10,04/01/2014 19:17,04/01/2014 22:11,378.89,Frio,430.11,88,3,17.5,17.62,15.6,15.72,23.72,0.0,14.81,22.2,6.72,3.37,18.71,2014,4,1,2014-04-01,1,2013-II,II,0
76880,MALABRIGO,TASA 426,03/01/2014 03:30,03/01/2014 04:40,03/01/2014 05:15,03/01/2014 07:46,03/01/2014 11:20,03/01/2014 11:43,03/01/2014 13:48,238.67,Tradicional,397.33,60,2,6.67,7.05,5.76,6.14,19.84,0.0,14.86,21.63,6.97,3.75,19.89,2014,3,1,2014-03-01,1,2013-II,II,0
76917,MALABRIGO,TASA 414,04/01/2014 02:00,04/01/2014 05:00,04/01/2014 05:28,04/01/2014 11:45,04/01/2014 15:11,04/01/2014 18:09,04/01/2014 21:26,291.455,Tradicional,424.12,69,3,10.18,13.15,7.96,10.93,27.52,0.0,14.7,20.43,6.6,3.85,19.19,2014,4,1,2014-04-01,1,2013-II,II,1
76918,MALABRIGO,TASA 22,04/01/2014 01:30,04/01/2014 02:55,04/01/2014 03:15,04/01/2014 10:42,04/01/2014 13:44,04/01/2014 14:03,04/01/2014 16:29,172.035,Tradicional,322.05,53,3,10.82,11.13,8.6,8.92,25.26,1.01,14.85,20.9,6.6,3.85,18.82,2014,4,1,2014-04-01,1,2013-II,II,1
76919,MALABRIGO,TASA 412,04/01/2014 01:30,04/01/2014 02:40,04/01/2014 03:10,04/01/2014 06:22,04/01/2014 10:00,04/01/2014 10:36,04/01/2014 12:30,166.18,Tradicional,402.44,41,2,7.33,7.93,6.1,6.7,21.94,0.0,14.87,22.09,6.6,3.85,19.86,2014,4,1,2014-04-01,1,2013-II,II,0
76920,MALABRIGO,TASA 38,04/01/2014 01:20,04/01/2014 02:47,04/01/2014 03:15,04/01/2014 10:44,04/01/2014 13:44,04/01/2014 14:15,04/01/2014 16:12,208.11,Tradicional,322.06,65,3,10.95,11.47,8.6,9.12,22.06,0.0,14.94,21.99,6.6,3.85,20.18,2014,4,1,2014-04-01,1,2013-II,II,0
76921,CHIMBOTE,TASA 42,04/01/2014 01:45,04/01/2014 03:14,04/01/2014 03:34,04/01/2014 19:37,05/01/2014 06:10,05/01/2014 06:35,05/01/2014 09:59,389.59,Frio,473.22,82,4,26.93,27.35,8.79,9.2,18.39,0.0,14.67,20.68,6.72,3.37,18.88,2014,4,1,2014-04-01,1,2013-II,II,0
76924,MALABRIGO,TASA 71,04/01/2014 05:00,04/01/2014 06:00,04/01/2014 06:45,04/01/2014 14:16,04/01/2014 17:24,04/01/2014 20:13,04/01/2014 22:38,130.715,Frio,861.75,15,4,11.4,14.22,7.3,10.12,23.41,0.0,15.01,21.61,6.6,3.85,19.6,2014,4,1,2014-04-01,1,2013-II,II,0
76925,MALABRIGO,TASA 45,04/01/2014 05:57,04/01/2014 07:01,04/01/2014 07:19,04/01/2014 11:10,04/01/2014 14:00,04/01/2014 14:51,04/01/2014 16:52,202.12,Tradicional,364.84,55,3,6.98,7.83,5.03,5.88,19.27,0.0,14.84,21.58,6.6,3.85,19.7,2014,4,1,2014-04-01,1,2013-II,II,1
76959,MALABRIGO,TASA 414,05/01/2014 03:00,05/01/2014 06:02,05/01/2014 07:00,05/01/2014 11:34,05/01/2014 14:30,05/01/2014 15:00,05/01/2014 17:26,237.36,Tradicional,424.12,56,2,8.47,8.97,7.37,7.87,22.16,0.0,14.5,23.71,6.0,3.59,18.8,2014,5,1,2014-05-01,1,2013-II,II,1
76962,MALABRIGO,TASA 53,05/01/2014 03:30,05/01/2014 06:15,05/01/2014 06:30,05/01/2014 12:01,05/01/2014 14:10,05/01/2014 14:43,05/01/2014 16:45,169.215,Frio,568.3,30,2,7.92,8.47,6.86,7.41,22.48,3.49,14.38,20.01,6.0,3.59,21.1,2014,5,1,2014-05-01,1,2013-II,II,0
76964,MALABRIGO,TASA 71,05/01/2014 03:30,05/01/2014 05:02,05/01/2014 05:06,05/01/2014 17:19,05/01/2014 19:50,05/01/2014 20:34,06/01/2014 00:06,334.365,Frio,861.75,39,7,14.8,15.53,8.29,9.02,27.08,0.0,14.37,22.88,6.0,3.59,19.28,2014,5,1,2014-05-01,1,2013-II,II,0
76970,MALABRIGO,TASA 44,06/01/2014 00:00,06/01/2014 09:34,06/01/2014 09:54,06/01/2014 12:45,06/01/2014 15:05,06/01/2014 15:47,06/01/2014 18:18,294.725,Tradicional,399.94,74,2,5.52,6.22,3.7,4.4,23.31,4.12,14.61,19.17,6.55,3.53,18.83,2014,6,1,2014-06-01,1,2013-II,II,1
76975,MALABRIGO,TASA 414,06/01/2014 05:20,06/01/2014 06:30,06/01/2014 06:53,06/01/2014 10:33,06/01/2014 12:46,06/01/2014 13:02,06/01/2014 14:49,132.305,Tradicional,424.12,31,2,6.27,6.53,5.77,6.03,23.38,5.05,14.58,18.51,6.55,3.53,18.37,2014,6,1,2014-06-01,1,2013-II,II,1
76977,MALABRIGO,TASA 71,06/01/2014 05:00,06/01/2014 11:34,06/01/2014 11:55,06/01/2014 18:45,06/01/2014 20:50,06/01/2014 21:21,07/01/2014 01:25,412.465,Frio,861.75,48,5,9.27,9.78,6.92,7.44,16.25,0.5,14.78,22.38,6.55,3.53,19.22,2014,6,1,2014-06-01,1,2013-II,II,0
76997,CHIMBOTE,TASA 44,07/01/2014 01:30,07/01/2014 03:00,07/01/2014 03:12,07/01/2014 07:57,07/01/2014 12:45,07/01/2014 13:25,07/01/2014 15:24,302.955,Tradicional,399.94,76,3,9.75,10.42,7.09,7.75,23.33,0.0,15.31,23.89,6.82,3.72,19.42,2014,7,1,2014-07-01,1,2014-I,I,1
76998,CHIMBOTE,TASA 71,07/01/2014 06:00,07/01/2014 07:06,07/01/2014 07:46,07/01/2014 09:15,07/01/2014 14:01,07/01/2014 14:24,07/01/2014 18:07,623.06,Frio,861.75,72,1,6.92,7.3,6.92,7.3,19.64,0.0,15.27,24.24,6.82,3.72,20.1,2014,7,1,2014-07-01,1,2014-I,I,0
77015,CHIMBOTE,TASA 414,08/01/2014 03:00,08/01/2014 06:40,08/01/2014 07:20,08/01/2014 13:19,08/01/2014 15:50,08/01/2014 16:44,08/01/2014 19:30,327.76,Tradicional,424.12,77,2,9.17,10.07,6.62,7.52,23.22,0.0,15.17,25.77,7.09,3.47,20.51,2014,8,1,2014-08-01,1,2014-I,I,1
77016,CHIMBOTE,TASA 44,08/01/2014 05:30,08/01/2014 07:15,08/01/2014 07:55,08/01/2014 10:47,08/01/2014 13:25,08/01/2014 13:58,08/01/2014 16:37,367.005,Tradicional,399.94,92,2,6.17,6.72,4.6,5.15,21.32,0.0,15.2,26.41,7.09,3.47,20.18,2014,8,1,2014-08-01,1,2014-I,I,1
77017,CHIMBOTE,TASA 71,08/01/2014 02:00,08/01/2014 07:01,08/01/2014 07:10,08/01/2014 15:29,08/01/2014 17:45,08/01/2014 18:40,08/01/2014 22:32,631.22,Frio,861.75,73,4,10.73,11.65,7.19,8.1,17.84,0.0,14.96,24.18,7.09,3.47,16.27,2014,8,1,2014-08-01,1,2014-I,I,0
77030,CHIMBOTE,TASA 44,09/01/2014 00:00,09/01/2014 07:15,09/01/2014 07:34,09/01/2014 15:07,09/01/2014 17:22,09/01/2014 17:45,09/01/2014 20:34,396.83,Tradicional,399.94,99,3,10.12,10.5,6.69,7.07,24.6,0.0,15.08,22.93,7.32,3.54,20.44,2014,9,1,2014-09-01,1,2014-I,I,1
77032,CHIMBOTE,TASA 71,09/01/2014 03:00,09/01/2014 08:28,09/01/2014 08:44,09/01/2014 16:33,09/01/2014 18:38,09/01/2014 18:52,09/01/2014 23:41,688.89,Frio,861.75,80,3,10.17,10.4,6.82,7.05,19.17,0.0,15.16,25.35,7.32,3.54,20.92,2014,9,1,2014-09-01,1,2014-I,I,0
77046,CHIMBOTE,TASA 44,10/01/2014 01:00,10/01/2014 07:39,10/01/2014 08:35,10/01/2014 08:49,10/01/2014 11:20,10/01/2014 11:49,10/01/2014 13:14,215.53,Tradicional,399.94,54,1,3.68,4.17,3.68,4.17,21.76,0.0,15.05,24.26,7.26,3.26,19.7,2014,10,1,2014-10-01,1,,,1
77640,ILO,TASA 17,21/03/2014 05:00,21/03/2014 10:29,21/03/2014 10:40,21/03/2014 16:05,21/03/2014 17:15,21/03/2014 18:40,21/03/2014 19:36,46.74,Tradicional,193.69,24,2,6.77,8.18,5.71,7.12,21.49,0.76,14.44,19.66,5.83,3.77,18.66,2014,3,21,2014-03-21,2,2013-II,II,0
77641,ILO,TASA 111,20/03/2014 11:00,20/03/2014 13:13,20/03/2014 13:25,20/03/2014 15:00,20/03/2014 17:45,20/03/2014 19:21,20/03/2014 20:08,21.47,Tradicional,189.81,11,1,4.53,6.13,4.53,6.13,22.53,0.0,15.13,20.23,5.65,3.64,19.0,2014,3,20,2014-03-20,2,2013-II,II,0
77642,ILO,TASA 411,20/03/2014 05:00,20/03/2014 07:45,20/03/2014 08:00,20/03/2014 15:04,20/03/2014 17:00,20/03/2014 18:53,20/03/2014 20:09,70.68,Tradicional,444.09,16,3,9.25,11.13,7.51,9.4,22.16,0.0,15.33,22.3,5.65,3.64,19.33,2014,3,20,2014-03-20,2,2013-II,II,0
77644,ILO,TASA 43,20/03/2014 05:00,20/03/2014 07:25,20/03/2014 07:45,20/03/2014 14:57,20/03/2014 16:35,20/03/2014 17:35,20/03/2014 18:46,84.615,Tradicional,401.08,21,3,9.17,10.17,7.36,8.36,21.47,0.0,15.5,23.36,5.65,3.64,19.86,2014,3,20,2014-03-20,2,2013-II,II,1
77645,ILO,TASA 416,20/03/2014 05:00,20/03/2014 09:20,20/03/2014 09:37,20/03/2014 14:59,20/03/2014 16:35,20/03/2014 17:35,20/03/2014 18:45,92.445,Tradicional,421.36,22,2,7.25,8.25,6.58,7.58,22.67,0.0,15.49,22.6,5.65,3.64,20.22,2014,3,20,2014-03-20,2,2013-II,II,0
77648,ILO,TASA 416,21/03/2014 05:00,21/03/2014 12:40,21/03/2014 12:50,21/03/2014 16:06,21/03/2014 17:00,21/03/2014 18:02,21/03/2014 18:38,21.005,Tradicional,421.36,5,1,4.33,5.37,4.33,5.37,23.24,0.87,13.98,17.16,5.83,3.77,18.8,2014,3,21,2014-03-21,2,2013-II,II,0
77649,ILO,TASA 43,21/03/2014 08:20,21/03/2014 10:17,21/03/2014 10:30,21/03/2014 16:06,21/03/2014 17:10,21/03/2014 18:07,21/03/2014 18:47,40.65,Tradicional,401.08,10,2,6.88,7.83,6.45,7.4,26.77,0.0,14.42,18.91,5.83,3.77,19.4,2014,3,21,2014-03-21,2,2013-II,II,1
77651,ILO,TASA 411,22/03/2014 05:00,22/03/2014 14:00,22/03/2014 14:15,22/03/2014 17:00,22/03/2014 18:10,22/03/2014 18:56,22/03/2014 19:24,32.515,Tradicional,444.09,7,1,4.17,4.93,4.17,4.93,24.6,0.0,14.1,17.31,6.02,3.42,17.9,2014,3,22,2014-03-22,2,2013-II,II,0
77652,ILO,TASA 111,21/03/2014 06:00,21/03/2014 09:50,21/03/2014 10:11,21/03/2014 16:07,21/03/2014 17:20,21/03/2014 18:51,21/03/2014 19:23,11.43,Tradicional,189.81,6,1,7.5,9.02,7.5,9.02,21.46,0.0,13.97,23.62,5.83,3.77,20.0,2014,3,21,2014-03-21,2,2013-II,II,0
77681,ILO,TASA 416,22/03/2014 05:00,22/03/2014 10:35,22/03/2014 10:50,22/03/2014 13:41,22/03/2014 13:50,22/03/2014 14:21,22/03/2014 15:19,53.94,Tradicional,421.36,13,1,3.25,3.77,3.25,3.77,25.06,1.23,13.54,16.5,6.02,3.42,18.8,2014,3,22,2014-03-22,2,2013-II,II,0
77682,ILO,TASA 43,22/03/2014 05:00,22/03/2014 09:48,22/03/2014 10:05,22/03/2014 17:00,22/03/2014 18:10,22/03/2014 19:13,22/03/2014 20:05,27.6,Tradicional,401.08,7,1,8.37,9.42,8.37,9.42,25.65,0.0,14.1,16.81,6.02,3.42,19.0,2014,3,22,2014-03-22,2,2013-II,II,1
77692,ILO,TASA 411,23/03/2014 05:00,23/03/2014 05:50,23/03/2014 06:00,23/03/2014 15:07,23/03/2014 16:56,23/03/2014 19:06,23/03/2014 20:58,160.805,Tradicional,444.09,36,3,11.1,13.27,5.7,7.87,22.25,1.07,14.01,19.43,6.58,3.36,17.09,2014,3,23,2014-03-23,2,2013-II,II,0
77693,ILO,TASA 43,23/03/2014 07:00,23/03/2014 08:28,23/03/2014 08:40,23/03/2014 15:12,23/03/2014 16:16,23/03/2014 16:50,23/03/2014 18:00,78.455,Tradicional,401.08,20,3,7.8,8.37,5.45,6.02,27.45,0.85,14.74,20.92,6.58,3.36,17.46,2014,3,23,2014-03-23,2,2013-II,II,1
77694,ILO,TASA 111,23/03/2014 10:00,23/03/2014 11:00,23/03/2014 12:58,23/03/2014 14:38,23/03/2014 16:48,23/03/2014 19:05,23/03/2014 19:53,30.455,Tradicional,189.81,16,1,5.8,8.08,5.8,8.08,23.92,0.0,14.54,20.9,6.58,3.36,18.6,2014,3,23,2014-03-23,2,2013-II,II,0
77696,ILO,TASA 416,23/03/2014 07:00,23/03/2014 10:25,23/03/2014 10:35,23/03/2014 14:21,23/03/2014 16:17,23/03/2014 17:05,23/03/2014 18:01,93.665,Tradicional,421.36,22,2,5.87,6.67,4.41,5.21,27.66,0.0,14.84,20.71,6.58,3.36,17.7,2014,3,23,2014-03-23,2,2013-II,II,0
77700,ILO,TASA 411,24/03/2014 10:00,24/03/2014 11:45,24/03/2014 13:10,24/03/2014 15:23,24/03/2014 16:10,24/03/2014 17:57,24/03/2014 19:52,147.035,Tradicional,444.09,33,2,4.42,6.2,3.79,5.58,26.22,2.5,13.85,16.25,5.22,3.45,16.97,2014,3,24,2014-03-24,2,2013-II,II,0
77701,ILO,TASA 43,24/03/2014 11:00,24/03/2014 12:30,24/03/2014 13:47,24/03/2014 16:40,24/03/2014 17:24,24/03/2014 18:52,24/03/2014 19:27,22.22,Tradicional,401.08,6,2,4.9,6.37,3.61,5.08,25.84,0.0,15.57,23.72,5.22,3.45,18.3,2014,3,24,2014-03-24,2,2013-II,II,1
77702,ILO,TASA 416,24/03/2014 11:00,24/03/2014 15:40,24/03/2014 16:15,24/03/2014 16:38,24/03/2014 17:19,24/03/2014 18:11,24/03/2014 18:50,18.88,Tradicional,421.36,4,1,1.65,2.52,1.65,2.52,27.87,0.0,15.26,23.27,5.22,3.45,18.4,2014,3,24,2014-03-24,2,2013-II,II,0
77703,ILO,TASA 111,24/03/2014 11:00,24/03/2014 14:00,24/03/2014 15:32,24/03/2014 15:38,24/03/2014 17:40,24/03/2014 19:46,24/03/2014 20:11,25.985,Tradicional,189.81,14,1,3.67,5.77,3.67,5.77,25.93,1.2,13.65,17.23,5.22,3.45,18.7,2014,3,24,2014-03-24,2,2013-II,II,0
77715,ILO,TASA 17,25/03/2014 10:00,25/03/2014 11:02,25/03/2014 12:25,25/03/2014 16:58,25/03/2014 18:20,25/03/2014 19:42,25/03/2014 20:15,43.77,Tradicional,193.69,23,2,7.3,8.67,6.29,7.66,25.0,0.0,13.87,16.4,5.27,3.36,16.64,2014,3,25,2014-03-25,2,2013-II,II,0
77716,ILO,TASA 411,25/03/2014 11:00,25/03/2014 12:40,25/03/2014 14:15,25/03/2014 16:11,25/03/2014 18:45,25/03/2014 20:35,25/03/2014 21:22,71.96,Tradicional,444.09,16,2,6.08,7.92,5.19,7.02,19.0,1.04,13.84,15.4,5.27,3.36,17.63,2014,3,25,2014-03-25,2,2013-II,II,0
77717,ILO,TASA 416,25/03/2014 11:00,25/03/2014 12:00,25/03/2014 13:15,25/03/2014 16:29,25/03/2014 19:10,25/03/2014 22:06,25/03/2014 22:51,37.29,Tradicional,421.36,9,2,7.17,10.1,5.97,8.9,31.49,1.23,13.86,16.49,5.27,3.36,17.62,2014,3,25,2014-03-25,2,2013-II,II,0
77718,ILO,TASA 43,25/03/2014 06:00,25/03/2014 07:30,25/03/2014 09:20,25/03/2014 16:23,25/03/2014 18:50,25/03/2014 21:12,25/03/2014 22:06,103.86,Tradicional,401.08,26,4,11.33,13.7,6.31,8.67,31.61,0.0,13.95,16.92,5.27,3.36,17.48,2014,3,25,2014-03-25,2,2013-II,II,1
77719,ILO,TASA 111,25/03/2014 11:00,25/03/2014 13:00,25/03/2014 14:20,25/03/2014 16:57,25/03/2014 18:55,25/03/2014 21:25,25/03/2014 21:56,14.94,Tradicional,189.81,8,1,5.92,8.42,5.92,8.42,32.25,0.0,13.83,15.83,5.27,3.36,18.8,2014,3,25,2014-03-25,2,2013-II,II,0
77727,ILO,TASA 17,26/03/2014 09:00,26/03/2014 09:20,26/03/2014 10:55,26/03/2014 15:58,26/03/2014 17:34,26/03/2014 18:15,26/03/2014 19:34,100.87,Tradicional,193.69,52,2,8.23,8.92,7.88,8.56,24.75,0.0,13.86,15.61,5.21,3.55,17.65,2014,3,26,2014-03-26,2,2013-II,II,0
77729,ILO,TASA 111,26/03/2014 10:00,26/03/2014 10:20,26/03/2014 11:20,26/03/2014 16:43,26/03/2014 18:25,26/03/2014 20:04,26/03/2014 20:52,50.44,Tradicional,189.81,27,2,8.08,9.73,6.28,7.93,26.11,2.2,13.28,14.47,5.21,3.55,17.62,2014,3,26,2014-03-26,2,2013-II,II,0
77730,ILO,TASA 43,26/03/2014 09:00,26/03/2014 10:10,26/03/2014 11:25,26/03/2014 17:36,26/03/2014 18:20,26/03/2014 19:07,26/03/2014 19:43,29.665,Tradicional,401.08,7,3,8.17,8.95,5.0,5.78,28.83,0.69,14.35,18.34,5.21,3.55,18.1,2014,3,26,2014-03-26,2,2013-II,II,1
77731,ILO,TASA 416,26/03/2014 11:00,26/03/2014 12:00,26/03/2014 13:05,26/03/2014 16:44,26/03/2014 17:42,26/03/2014 18:25,26/03/2014 19:06,43.055,Tradicional,421.36,10,2,5.7,6.42,4.4,5.12,16.33,0.0,14.46,19.15,5.21,3.55,18.96,2014,3,26,2014-03-26,2,2013-II,II,0
77734,ILO,TASA 37,27/03/2014 06:00,27/03/2014 11:10,27/03/2014 12:35,27/03/2014 16:27,27/03/2014 17:25,27/03/2014 19:05,27/03/2014 20:14,45.74,Tradicional,321.56,14,2,6.25,7.92,4.31,5.97,25.63,2.14,14.15,17.75,5.4,3.44,17.53,2014,3,27,2014-03-27,2,2013-II,II,1
77735,ILO,TASA 34,28/03/2014 06:00,28/03/2014 07:33,28/03/2014 09:05,28/03/2014 12:30,28/03/2014 13:20,28/03/2014 14:26,28/03/2014 16:33,257.785,Tradicional,334.38,77,2,5.78,6.88,4.98,6.08,22.4,0.0,14.4,17.86,5.22,3.38,18.64,2014,3,28,2014-03-28,2,2013-II,II,1
77736,ILO,TASA 35,28/03/2014 06:00,28/03/2014 07:20,28/03/2014 08:25,28/03/2014 15:04,28/03/2014 16:00,28/03/2014 18:53,28/03/2014 19:48,39.095,Tradicional,322.75,12,2,8.67,11.55,7.33,10.22,20.11,0.79,14.35,17.69,5.22,3.38,17.8,2014,3,28,2014-03-28,2,2013-II,II,1
77738,ILO,TASA 220,28/03/2014 10:00,28/03/2014 11:10,28/03/2014 12:45,28/03/2014 15:03,28/03/2014 15:55,28/03/2014 18:43,28/03/2014 19:16,15.62,Tradicional,213.26,7,1,4.75,7.55,4.75,7.55,20.11,8.28,13.33,14.42,5.22,3.38,20.4,2014,3,28,2014-03-28,2,2013-II,II,0
77739,ILO,TASA 411,27/03/2014 06:00,27/03/2014 07:00,27/03/2014 08:45,27/03/2014 18:28,27/03/2014 19:50,27/03/2014 22:57,28/03/2014 00:26,157.11,Tradicional,444.09,35,4,12.83,15.95,7.17,10.29,25.39,1.85,14.75,19.66,5.4,3.44,17.44,2014,3,27,2014-03-27,2,2013-II,II,0
77740,ILO,TASA 111,27/03/2014 09:00,27/03/2014 10:40,27/03/2014 12:00,27/03/2014 16:28,27/03/2014 17:15,27/03/2014 18:51,27/03/2014 19:29,31.545,Tradicional,189.81,17,2,6.58,8.18,5.92,7.52,27.04,0.64,14.01,16.46,5.4,3.44,18.71,2014,3,27,2014-03-27,2,2013-II,II,0
77741,ILO,TASA 17,27/03/2014 10:00,27/03/2014 11:45,27/03/2014 13:05,27/03/2014 16:06,27/03/2014 17:05,27/03/2014 18:00,27/03/2014 18:49,61.15,Tradicional,193.69,32,2,5.33,6.25,4.71,5.63,24.34,3.41,13.93,16.68,5.4,3.44,18.53,2014,3,27,2014-03-27,2,2013-II,II,0
77742,ILO,TASA 43,27/03/2014 10:00,27/03/2014 11:10,27/03/2014 12:30,27/03/2014 18:10,27/03/2014 19:25,27/03/2014 20:27,27/03/2014 22:03,150.515,Tradicional,401.08,38,4,8.25,9.28,5.16,6.19,25.98,3.36,13.89,15.86,5.4,3.44,17.83,2014,3,27,2014-03-27,2,2013-II,II,1
77744,ILO,TASA 416,27/03/2014 06:00,27/03/2014 07:00,27/03/2014 07:45,27/03/2014 16:06,27/03/2014 17:10,27/03/2014 17:48,27/03/2014 19:01,79.065,Tradicional,421.36,19,3,10.17,10.8,6.54,7.17,27.47,0.62,14.69,17.71,5.4,3.44,17.57,2014,3,27,2014-03-27,2,2013-II,II,0
77750,ILO,TASA 17,28/03/2014 06:00,28/03/2014 12:00,28/03/2014 13:10,28/03/2014 16:01,28/03/2014 17:10,28/03/2014 20:13,28/03/2014 21:09,83.87,Tradicional,193.69,43,2,5.17,8.22,3.39,6.44,23.42,1.2,13.91,16.59,5.22,3.38,19.81,2014,3,28,2014-03-28,2,2013-II,II,0
77751,ILO,TASA 111,28/03/2014 06:00,28/03/2014 08:00,28/03/2014 09:40,28/03/2014 15:02,28/03/2014 16:00,28/03/2014 19:35,28/03/2014 20:07,33.55,Tradicional,189.81,18,1,8.0,11.58,8.0,11.58,21.59,1.38,14.3,17.86,5.22,3.38,18.0,2014,3,28,2014-03-28,2,2013-II,II,0
77753,ILO,TASA 37,28/03/2014 06:00,28/03/2014 07:15,28/03/2014 09:20,28/03/2014 12:44,28/03/2014 13:40,28/03/2014 16:35,28/03/2014 17:41,120.025,Tradicional,321.56,37,2,6.42,9.33,5.7,8.62,26.44,0.0,14.56,18.36,5.22,3.38,17.76,2014,3,28,2014-03-28,2,2013-II,II,1
77754,ILO,TASA 416,28/03/2014 06:00,28/03/2014 07:30,28/03/2014 09:05,28/03/2014 12:43,28/03/2014 13:20,28/03/2014 14:25,28/03/2014 16:05,169.825,Tradicional,421.36,40,2,5.83,6.92,5.5,6.58,22.03,2.26,14.18,17.21,5.22,3.38,18.42,2014,3,28,2014-03-28,2,2013-II,II,0
77755,ILO,TASA 43,28/03/2014 06:00,28/03/2014 07:40,28/03/2014 08:50,28/03/2014 16:20,28/03/2014 16:50,28/03/2014 20:00,28/03/2014 20:52,64.485,Tradicional,401.08,16,2,9.17,12.33,7.98,11.14,25.04,4.68,13.96,22.09,5.22,3.38,18.0,2014,3,28,2014-03-28,2,2013-II,II,1
77791,ILO,TASA 416,29/03/2014 07:00,29/03/2014 10:00,29/03/2014 11:35,29/03/2014 16:12,29/03/2014 16:40,29/03/2014 17:05,29/03/2014 17:49,30.295,Tradicional,421.36,7,1,6.67,7.08,6.67,7.08,27.41,0.0,14.13,21.93,6.16,3.26,18.1,2014,3,29,2014-03-29,2,2013-II,II,0
77819,ILO,TASA 411,30/03/2014 05:00,30/03/2014 07:10,30/03/2014 07:20,30/03/2014 13:22,30/03/2014 13:50,30/03/2014 16:04,30/03/2014 17:17,44.985,Tradicional,444.09,10,2,6.67,8.9,4.22,6.45,28.32,10.49,13.46,14.74,5.04,3.6,16.82,2014,3,30,2014-03-30,2,2013-II,II,0
77820,ILO,TASA 37,30/03/2014 05:00,30/03/2014 11:10,30/03/2014 11:50,30/03/2014 13:00,30/03/2014 13:39,30/03/2014 15:09,30/03/2014 16:12,81.71,Tradicional,321.56,25,1,2.48,3.98,2.48,3.98,28.68,0.54,14.4,17.59,5.04,3.6,18.6,2014,3,30,2014-03-30,2,2013-II,II,1
77823,ILO,TASA 43,30/03/2014 05:00,30/03/2014 10:50,30/03/2014 11:05,30/03/2014 14:28,30/03/2014 15:10,30/03/2014 17:29,30/03/2014 18:45,117.135,Tradicional,401.08,29,2,4.33,6.65,3.92,6.24,26.68,4.23,13.61,14.66,5.04,3.6,17.62,2014,3,30,2014-03-30,2,2013-II,II,1
77824,ILO,TASA 34,30/03/2014 05:00,30/03/2014 10:36,30/03/2014 10:47,30/03/2014 13:24,30/03/2014 14:10,30/03/2014 15:09,30/03/2014 16:02,47.19,Tradicional,334.38,14,1,3.57,4.55,3.57,4.55,26.07,0.0,14.38,17.15,5.04,3.6,18.4,2014,3,30,2014-03-30,2,2013-II,II,1
77825,ILO,TASA 111,30/03/2014 05:00,30/03/2014 07:00,30/03/2014 07:10,30/03/2014 13:23,30/03/2014 13:50,30/03/2014 16:28,30/03/2014 16:51,16.075,Tradicional,189.81,8,1,6.83,9.47,6.83,9.47,29.36,0.0,14.18,17.04,5.04,3.6,18.8,2014,3,30,2014-03-30,2,2013-II,II,0
77828,ILO,TASA 210,30/03/2014 05:00,30/03/2014 12:10,30/03/2014 12:20,30/03/2014 13:24,30/03/2014 14:25,30/03/2014 23:43,31/03/2014 00:52,17.485,Tradicional,290.58,6,1,2.25,11.55,2.25,11.55,24.75,3.88,13.27,13.27,5.04,3.6,18.83,2014,3,30,2014-03-30,2,2013-II,II,0
77849,ILO,TASA 411,01/04/2014 05:00,01/04/2014 11:20,01/04/2014 11:35,01/04/2014 16:45,01/04/2014 18:50,02/04/2014 01:37,02/04/2014 02:48,109.67,Tradicional,444.09,25,3,7.5,14.28,5.77,12.55,23.34,0.0,14.87,20.32,5.51,3.36,18.78,2014,1,4,2014-01-04,2,2013-II,II,0
77850,ILO,TASA 34,01/04/2014 03:00,01/04/2014 05:26,01/04/2014 05:30,01/04/2014 18:40,01/04/2014 18:50,02/04/2014 02:35,02/04/2014 04:22,192.215,Tradicional,334.38,57,2,13.4,21.15,4.77,12.52,31.9,0.0,14.94,23.68,5.51,3.36,19.71,2014,1,4,2014-01-04,2,2013-II,II,1
77851,ILO,TASA 37,01/04/2014 05:00,01/04/2014 10:59,01/04/2014 11:20,01/04/2014 17:13,01/04/2014 22:50,02/04/2014 05:39,02/04/2014 06:58,127.64,Tradicional,321.56,40,3,11.85,18.67,8.74,15.56,36.25,0.0,14.96,20.5,5.51,3.36,19.06,2014,1,4,2014-01-04,2,2013-II,II,1
77852,ILO,TASA 210,01/04/2014 05:00,01/04/2014 11:25,01/04/2014 11:30,01/04/2014 12:04,01/04/2014 15:15,01/04/2014 16:08,01/04/2014 16:24,14.485,Tradicional,290.58,5,1,3.83,4.72,3.83,4.72,28.83,0.53,14.71,20.29,5.51,3.36,18.83,2014,1,4,2014-01-04,2,2013-II,II,0
77853,ILO,TASA 35,01/04/2014 05:00,01/04/2014 10:47,01/04/2014 10:55,01/04/2014 17:15,01/04/2014 22:48,02/04/2014 04:54,02/04/2014 06:00,99.405,Tradicional,322.75,31,4,12.02,18.12,7.83,13.93,37.32,0.0,14.71,20.42,5.51,3.36,18.91,2014,1,4,2014-01-04,2,2013-II,II,1
77854,ILO,TASA 111,01/04/2014 05:00,01/04/2014 12:01,01/04/2014 12:16,01/04/2014 16:47,01/04/2014 22:30,02/04/2014 04:23,02/04/2014 05:22,79.31,Tradicional,189.81,42,3,10.48,16.37,8.66,14.55,34.82,0.0,15.11,22.1,5.51,3.36,19.71,2014,1,4,2014-01-04,2,2013-II,II,0
77855,ILO,TASA 220,01/04/2014 05:00,01/04/2014 07:10,01/04/2014 07:20,01/04/2014 16:19,01/04/2014 18:50,02/04/2014 01:13,02/04/2014 02:33,95.49,Tradicional,213.26,45,3,11.67,18.05,5.15,11.53,31.83,0.0,14.8,22.9,5.51,3.36,19.14,2014,1,4,2014-01-04,2,2013-II,II,0
77856,ILO,TASA 43,31/03/2014 05:00,31/03/2014 10:15,31/03/2014 10:25,31/03/2014 18:00,31/03/2014 18:15,31/03/2014 19:07,31/03/2014 19:50,24.705,Tradicional,401.08,6,3,8.0,8.87,5.89,6.76,28.85,0.0,13.85,18.26,5.32,3.46,20.07,2014,3,31,2014-03-31,2,2013-II,II,1
77857,ILO,TASA 17,01/04/2014 05:00,01/04/2014 11:05,01/04/2014 11:25,01/04/2014 17:06,01/04/2014 22:55,02/04/2014 06:02,02/04/2014 07:11,109.01,Tradicional,193.69,56,4,11.83,18.95,8.52,15.64,38.22,0.0,14.6,18.8,5.51,3.36,18.72,2014,1,4,2014-01-04,2,2013-II,II,0
77859,ILO,TASA 416,01/04/2014 05:00,01/04/2014 10:30,01/04/2014 10:40,01/04/2014 16:20,01/04/2014 17:40,01/04/2014 18:40,02/04/2014 01:12,111.14,Tradicional,421.36,26,3,7.17,8.17,5.8,6.8,32.45,0.0,14.6,20.46,5.51,3.36,19.24,2014,1,4,2014-01-04,2,2013-II,II,0
77882,ILO,TASA 43,01/04/2014 05:00,01/04/2014 08:50,01/04/2014 10:00,01/04/2014 16:19,01/04/2014 18:30,02/04/2014 00:23,02/04/2014 01:34,152.9,Tradicional,401.08,38,4,9.67,15.55,5.63,11.51,31.53,0.0,15.22,24.44,5.51,3.36,19.13,2014,1,4,2014-01-04,2,2013-II,II,1
77924,ATICO,TASA 413,04/04/2014 00:02,04/04/2014 07:50,04/04/2014 08:05,04/04/2014 17:30,04/04/2014 23:28,05/04/2014 01:31,05/04/2014 02:59,106.765,Tradicional,447.5,24,3,15.63,17.68,11.89,13.94,34.2,0.0,13.89,19.68,4.21,3.39,19.94,2014,4,4,2014-04-04,2,2013-II,II,0
77925,MATARANI,TASA 43,03/04/2014 05:00,03/04/2014 06:20,03/04/2014 06:40,03/04/2014 13:44,03/04/2014 19:30,03/04/2014 20:37,03/04/2014 22:18,237.77,Tradicional,401.08,59,4,13.17,14.28,10.0,11.12,23.31,0.0,13.85,19.42,4.96,3.53,17.9,2014,3,4,2014-03-04,2,2013-II,II,1
77926,MATARANI,TASA 411,03/04/2014 05:00,03/04/2014 06:40,03/04/2014 06:50,03/04/2014 13:47,03/04/2014 21:05,03/04/2014 21:24,04/04/2014 01:47,341.275,Tradicional,444.09,77,4,14.42,14.73,11.26,11.58,22.71,0.0,14.25,20.38,4.96,3.53,17.44,2014,3,4,2014-03-04,2,2013-II,II,0
77927,ILO,TASA 416,03/04/2014 05:00,03/04/2014 07:00,03/04/2014 07:15,03/04/2014 13:00,03/04/2014 14:50,03/04/2014 15:13,03/04/2014 16:08,116.12,Tradicional,421.36,28,3,7.83,8.22,6.25,6.63,22.87,0.0,15.07,21.2,6.56,3.23,18.02,2014,3,4,2014-03-04,2,2013-II,II,0
77939,ILO,TASA 35,03/04/2014 05:00,03/04/2014 07:05,03/04/2014 07:20,03/04/2014 15:47,03/04/2014 16:45,03/04/2014 19:42,03/04/2014 20:42,111.435,Tradicional,322.75,35,3,9.67,12.62,7.48,10.43,29.36,0.0,14.52,18.69,6.56,3.23,17.83,2014,3,4,2014-03-04,2,2013-II,II,1
77945,ATICO,TASA 310,04/04/2014 04:22,04/04/2014 06:50,04/04/2014 07:19,04/04/2014 13:40,04/04/2014 20:15,04/04/2014 23:10,05/04/2014 00:59,286.675,Tradicional,336.4,85,3,13.42,16.33,11.62,14.54,28.02,0.0,13.59,18.48,4.21,3.39,17.69,2014,4,4,2014-04-04,2,2013-II,II,0
77963,ATICO,TASA 43,04/04/2014 05:00,04/04/2014 06:20,04/04/2014 06:40,04/04/2014 15:00,04/04/2014 19:56,04/04/2014 20:35,04/04/2014 22:30,325.84,Tradicional,401.08,81,4,13.6,14.25,12.32,12.97,21.46,0.0,13.7,17.79,4.21,3.39,17.45,2014,4,4,2014-04-04,2,2013-II,II,1
77967,MATARANI,TASA 35,04/04/2014 05:00,04/04/2014 07:00,04/04/2014 07:15,04/04/2014 13:55,04/04/2014 19:24,05/04/2014 04:01,05/04/2014 06:02,199.95,Tradicional,322.75,62,3,12.4,21.02,10.53,19.14,25.65,8.26,13.17,17.26,5.89,3.47,17.13,2014,4,4,2014-04-04,2,2013-II,II,1
77968,MATARANI,TASA 210,04/04/2014 00:59,04/04/2014 07:40,04/04/2014 07:55,04/04/2014 13:01,04/04/2014 19:21,05/04/2014 02:32,05/04/2014 03:54,79.4,Tradicional,290.58,27,2,11.68,18.87,8.68,15.87,22.67,3.26,13.64,18.83,5.89,3.47,18.83,2014,4,4,2014-04-04,2,2013-II,II,0
77975,MATARANI,TASA 37,04/04/2014 05:00,04/04/2014 09:55,04/04/2014 10:20,04/04/2014 13:48,04/04/2014 17:40,04/04/2014 22:52,05/04/2014 00:27,82.535,Tradicional,321.56,26,1,7.75,12.95,7.75,12.95,20.49,0.0,14.19,21.43,5.89,3.47,17.6,2014,4,4,2014-04-04,2,2013-II,II,1
77976,ATICO,TASA 411,04/04/2014 05:00,04/04/2014 06:17,04/04/2014 07:40,04/04/2014 12:40,04/04/2014 18:40,04/04/2014 19:30,04/04/2014 22:45,324.23,Tradicional,444.09,73,2,12.38,13.22,10.64,11.47,19.5,0.0,14.17,19.94,4.21,3.39,19.09,2014,4,4,2014-04-04,2,2013-II,II,0
77979,ATICO,TASA 418,04/04/2014 08:41,04/04/2014 12:44,04/04/2014 14:00,04/04/2014 17:02,04/04/2014 22:50,05/04/2014 01:13,05/04/2014 01:58,50.76,Tradicional,430.91,12,2,10.1,12.48,9.17,11.55,25.8,0.0,13.84,16.37,4.21,3.39,20.57,2014,4,4,2014-04-04,2,2013-II,II,0
77980,MATARANI,TASA 416,04/04/2014 05:00,04/04/2014 07:25,04/04/2014 07:50,04/04/2014 13:53,04/04/2014 16:54,04/04/2014 17:29,04/04/2014 20:56,306.645,Tradicional,421.36,73,2,9.48,10.07,8.38,8.97,16.64,25.91,12.68,13.41,5.89,3.47,17.24,2014,4,4,2014-04-04,2,2013-II,II,0
78011,MATARANI,TASA 111,05/04/2014 05:00,05/04/2014 11:35,05/04/2014 11:45,05/04/2014 14:37,05/04/2014 22:50,06/04/2014 02:21,06/04/2014 03:16,72.945,Tradicional,189.81,38,2,11.25,14.77,10.32,13.84,21.72,12.64,12.71,13.5,4.12,3.26,19.38,2014,5,4,2014-05-04,2,2013-II,II,0
78018,MATARANI,TASA 34,05/04/2014 05:00,05/04/2014 11:27,05/04/2014 11:35,05/04/2014 15:39,05/04/2014 23:32,06/04/2014 02:24,06/04/2014 03:44,107.645,Tradicional,334.38,32,2,12.08,14.95,10.81,13.68,25.56,4.84,13.13,15.54,4.12,3.26,19.57,2014,5,4,2014-05-04,2,2013-II,II,1
78019,ATICO,TASA 416,05/04/2014 00:42,05/04/2014 06:30,05/04/2014 08:10,05/04/2014 13:15,05/04/2014 18:17,05/04/2014 19:07,05/04/2014 21:05,206.21,Tradicional,421.36,49,3,11.78,12.62,10.41,11.25,21.14,0.0,13.48,16.84,4.7,3.59,19.94,2014,5,4,2014-05-04,2,2013-II,II,0
78020,MATARANI,TASA 37,05/04/2014 03:13,05/04/2014 08:40,05/04/2014 09:25,05/04/2014 16:01,05/04/2014 22:53,06/04/2014 00:45,06/04/2014 02:18,137.35,Tradicional,321.56,43,3,14.22,16.08,12.49,14.35,25.28,0.0,13.56,16.38,4.12,3.26,20.01,2014,5,4,2014-05-04,2,2013-II,II,1
78021,ATICO,TASA 43,05/04/2014 04:00,05/04/2014 06:00,05/04/2014 07:50,05/04/2014 15:50,05/04/2014 20:02,05/04/2014 21:23,05/04/2014 22:50,221.005,Tradicional,401.08,55,4,14.03,15.38,9.67,11.02,29.8,0.78,13.2,15.7,4.7,3.59,20.13,2014,5,4,2014-05-04,2,2013-II,II,1
78022,ATICO,TASA 411,05/04/2014 04:00,05/04/2014 06:20,05/04/2014 08:10,05/04/2014 16:00,05/04/2014 20:15,05/04/2014 23:01,06/04/2014 00:12,135.995,Tradicional,444.09,31,3,13.92,16.68,9.78,12.54,32.8,0.0,13.7,16.94,4.7,3.59,18.93,2014,5,4,2014-05-04,2,2013-II,II,0
78023,ATICO,TASA 310,05/04/2014 06:00,05/04/2014 07:30,05/04/2014 09:00,05/04/2014 12:00,05/04/2014 17:30,05/04/2014 18:12,05/04/2014 18:56,45.14,Tradicional,336.4,13,1,10.0,10.7,10.0,10.7,22.12,1.59,13.81,17.24,4.7,3.59,19.6,2014,5,4,2014-05-04,2,2013-II,II,0
78025,ATICO,TASA 418,05/04/2014 07:21,05/04/2014 08:00,05/04/2014 09:25,05/04/2014 15:12,05/04/2014 20:13,05/04/2014 20:48,05/04/2014 22:57,202.33,Tradicional,430.91,47,3,12.22,12.8,9.59,10.17,28.0,0.0,14.05,18.2,4.7,3.59,20.66,2014,5,4,2014-05-04,2,2013-II,II,0
78026,MATARANI,TASA 413,05/04/2014 08:00,05/04/2014 08:40,05/04/2014 10:30,05/04/2014 16:20,05/04/2014 22:41,06/04/2014 00:32,06/04/2014 02:08,115.85,Tradicional,447.5,26,2,14.02,15.87,12.32,14.17,25.63,0.0,13.14,15.56,4.12,3.26,20.47,2014,5,4,2014-05-04,2,2013-II,II,0
78027,ATICO,TASA 210,05/04/2014 08:00,05/04/2014 11:40,05/04/2014 13:50,05/04/2014 15:28,05/04/2014 20:56,05/04/2014 23:42,06/04/2014 01:20,87.575,Tradicional,290.58,30,1,9.27,12.03,9.27,12.03,18.9,0.0,13.74,20.09,4.7,3.59,18.83,2014,5,4,2014-05-04,2,2013-II,II,0
78029,ATICO,TASA 35,05/04/2014 08:00,05/04/2014 11:50,05/04/2014 13:10,05/04/2014 16:02,05/04/2014 21:21,06/04/2014 00:24,06/04/2014 01:25,86.71,Tradicional,322.75,27,2,9.52,12.57,8.12,11.17,25.16,3.33,13.32,16.94,4.7,3.59,19.27,2014,5,4,2014-05-04,2,2013-II,II,1
78052,ILO,TASA 17,06/04/2014 05:00,06/04/2014 06:00,06/04/2014 07:40,06/04/2014 18:02,06/04/2014 18:40,06/04/2014 21:18,06/04/2014 21:46,46.92,Tradicional,193.69,24,2,12.67,15.3,9.67,12.3,26.44,0.0,14.74,19.28,6.44,3.49,19.52,2014,6,4,2014-06-04,2,2013-II,II,0
78053,MATARANI,TASA 310,06/04/2014 05:30,06/04/2014 07:00,06/04/2014 07:20,06/04/2014 10:25,06/04/2014 17:07,06/04/2014 17:52,06/04/2014 19:51,241.17,Tradicional,336.4,72,2,10.12,10.87,8.59,9.34,23.59,4.55,12.72,13.45,4.43,3.48,18.9,2014,6,4,2014-06-04,2,2013-II,II,0
78054,MATARANI,TASA 43,06/04/2014 05:00,06/04/2014 06:12,06/04/2014 06:25,06/04/2014 11:56,06/04/2014 17:07,06/04/2014 17:40,06/04/2014 19:41,351.745,Tradicional,401.08,88,3,10.92,11.47,8.12,8.67,21.9,5.6,12.71,13.26,4.43,3.48,18.23,2014,6,4,2014-06-04,2,2013-II,II,1
78055,ATICO,TASA 416,06/04/2014 05:20,06/04/2014 07:00,06/04/2014 07:30,06/04/2014 12:37,06/04/2014 17:00,06/04/2014 22:08,06/04/2014 23:39,202.525,Tradicional,421.36,48,3,10.0,15.13,8.64,13.77,21.97,16.34,12.56,13.0,4.67,3.89,18.43,2014,6,4,2014-06-04,2,2013-II,II,0
78056,ATICO,TASA 418,06/04/2014 05:30,06/04/2014 07:18,06/04/2014 07:30,06/04/2014 12:33,06/04/2014 16:10,06/04/2014 18:30,06/04/2014 19:32,125.305,Tradicional,430.91,29,2,8.87,11.2,7.77,10.11,21.61,4.2,13.48,17.54,4.67,3.89,19.68,2014,6,4,2014-06-04,2,2013-II,II,0
78057,ATICO,TASA 61,06/04/2014 05:20,06/04/2014 07:00,06/04/2014 07:18,06/04/2014 11:17,06/04/2014 15:45,06/04/2014 17:51,06/04/2014 23:25,535.425,Tradicional,590.91,91,2,8.75,10.85,6.78,8.88,20.43,4.2,12.87,17.19,4.67,3.89,17.7,2014,6,4,2014-06-04,2,2013-II,II,1
78058,ATICO,TASA 411,06/04/2014 04:00,06/04/2014 05:50,06/04/2014 06:00,06/04/2014 13:14,06/04/2014 17:15,06/04/2014 23:42,07/04/2014 03:32,336.625,Tradicional,444.09,76,3,11.42,17.87,6.7,13.15,23.15,10.88,12.65,18.85,4.67,3.89,17.98,2014,6,4,2014-06-04,2,2013-II,II,0
78060,ATICO,TASA 210,06/04/2014 07:20,06/04/2014 09:00,06/04/2014 09:25,06/04/2014 16:00,06/04/2014 20:55,07/04/2014 03:42,07/04/2014 05:54,135.815,Tradicional,290.58,47,3,11.92,18.7,9.17,15.95,26.76,3.26,13.4,19.32,4.67,3.89,18.83,2014,6,4,2014-06-04,2,2013-II,II,0
78061,MATARANI,TASA 413,06/04/2014 10:00,06/04/2014 11:10,06/04/2014 12:40,06/04/2014 13:05,06/04/2014 18:34,06/04/2014 22:00,06/04/2014 23:24,89.83,Tradicional,447.5,20,1,7.4,10.83,7.4,10.83,25.22,14.85,12.41,12.62,4.43,3.48,19.2,2014,6,4,2014-06-04,2,2013-II,II,0
78062,MATARANI,TASA 37,06/04/2014 10:00,06/04/2014 11:00,06/04/2014 12:40,06/04/2014 13:07,06/04/2014 19:30,06/04/2014 23:15,07/04/2014 00:32,96.56,Tradicional,321.56,30,1,8.5,12.25,8.5,12.25,26.79,13.33,12.53,13.18,4.43,3.48,17.5,2014,6,4,2014-06-04,2,2013-II,II,1
78064,MATARANI,TASA 111,06/04/2014 09:00,06/04/2014 09:30,06/04/2014 11:12,06/04/2014 13:12,06/04/2014 20:21,07/04/2014 00:48,07/04/2014 01:46,74.705,Tradicional,189.81,39,1,10.85,15.3,10.85,15.3,28.88,2.2,13.24,15.69,4.43,3.48,19.5,2014,6,4,2014-06-04,2,2013-II,II,0
78065,ATICO,TASA 34,06/04/2014 09:30,06/04/2014 10:46,06/04/2014 11:18,06/04/2014 16:11,06/04/2014 19:50,07/04/2014 03:51,07/04/2014 04:54,116.21,Tradicional,334.38,35,1,9.07,17.08,9.07,17.08,32.71,11.19,12.81,14.52,4.67,3.89,18.4,2014,6,4,2014-06-04,2,2013-II,II,1
78066,ATICO,TASA 44,06/04/2014 06:50,06/04/2014 08:10,06/04/2014 10:35,06/04/2014 11:04,06/04/2014 14:20,06/04/2014 19:52,06/04/2014 21:56,388.16,Tradicional,399.94,97,1,6.17,11.7,6.17,11.7,22.3,16.38,13.26,18.29,4.67,3.89,19.7,2014,6,4,2014-06-04,2,2013-II,II,1
78067,ATICO,TASA 45,06/04/2014 08:30,06/04/2014 09:45,06/04/2014 10:05,06/04/2014 13:08,06/04/2014 14:10,06/04/2014 15:05,06/04/2014 18:18,154.91,Tradicional,364.84,42,1,4.42,5.33,4.42,5.33,14.66,2.68,13.15,15.04,4.67,3.89,19.5,2014,6,4,2014-06-04,2,2013-II,II,1
78085,MATARANI,TASA 35,06/04/2014 06:30,06/04/2014 08:20,06/04/2014 08:41,06/04/2014 11:02,06/04/2014 18:25,06/04/2014 20:16,06/04/2014 23:07,249.395,Tradicional,322.75,77,2,10.08,11.93,9.7,11.55,26.68,2.22,13.36,16.44,4.43,3.48,18.42,2014,6,4,2014-06-04,2,2013-II,II,1
78095,ILO,TASA 38,07/04/2014 05:00,07/04/2014 09:55,07/04/2014 11:05,07/04/2014 14:39,07/04/2014 17:40,07/04/2014 18:29,07/04/2014 19:42,106.505,Tradicional,322.06,33,2,7.75,8.57,5.69,6.51,18.23,0.0,14.89,20.48,6.19,3.29,20.4,2014,7,4,2014-07-04,2,2014-I,I,0
78097,ILO,TASA 17,07/04/2014 05:00,07/04/2014 06:30,07/04/2014 07:35,07/04/2014 15:38,07/04/2014 18:55,07/04/2014 22:00,07/04/2014 23:16,106.845,Tradicional,193.69,55,2,12.42,15.5,9.53,12.61,24.21,0.0,15.61,22.15,6.19,3.29,18.83,2014,7,4,2014-07-04,2,2014-I,I,0
78098,MATARANI,TASA 418,07/04/2014 05:00,07/04/2014 05:20,07/04/2014 06:35,07/04/2014 10:50,07/04/2014 15:52,07/04/2014 16:24,07/04/2014 18:35,218.15,Tradicional,430.91,51,2,10.53,11.07,8.69,9.22,19.73,1.06,13.32,16.81,4.38,4.1,18.83,2014,7,4,2014-07-04,2,2014-I,I,0
78100,ATICO,TASA 44,07/04/2014 05:00,07/04/2014 05:32,07/04/2014 07:05,07/04/2014 10:55,07/04/2014 15:27,07/04/2014 21:03,07/04/2014 23:36,389.175,Tradicional,399.94,97,2,9.92,15.52,6.96,12.56,15.56,0.71,13.41,18.09,4.59,3.56,17.88,2014,7,4,2014-07-04,2,2014-I,I,1
78101,ATICO,TASA 45,07/04/2014 06:00,07/04/2014 07:18,07/04/2014 07:39,07/04/2014 13:01,07/04/2014 17:46,08/04/2014 04:25,08/04/2014 06:42,353.1,Tradicional,364.84,97,2,10.47,21.12,8.64,19.29,22.69,4.96,13.45,16.41,4.59,3.56,17.7,2014,7,4,2014-07-04,2,2014-I,I,1
78102,ATICO,TASA 61,07/04/2014 04:10,07/04/2014 05:50,07/04/2014 06:15,07/04/2014 11:13,07/04/2014 15:59,07/04/2014 22:25,08/04/2014 03:06,557.45,Tradicional,590.91,94,3,10.15,16.58,8.53,14.96,27.82,2.5,13.25,18.58,4.59,3.56,17.9,2014,7,4,2014-07-04,2,2014-I,I,1
78103,ILO,TASA 43,07/04/2014 03:30,07/04/2014 04:50,07/04/2014 05:22,07/04/2014 10:33,07/04/2014 20:10,07/04/2014 23:23,08/04/2014 02:13,368.095,Tradicional,401.08,92,2,15.33,18.55,13.0,16.22,38.35,0.0,14.12,18.97,6.19,3.29,18.66,2014,7,4,2014-07-04,2,2014-I,I,1
78104,MATARANI,TASA 310,07/04/2014 04:00,07/04/2014 05:00,07/04/2014 07:00,07/04/2014 09:16,07/04/2014 15:50,07/04/2014 16:22,07/04/2014 18:49,296.995,Tradicional,336.4,88,2,10.83,11.37,10.05,10.59,17.54,0.92,13.37,17.22,4.38,4.1,19.2,2014,7,4,2014-07-04,2,2014-I,I,0
78105,MATARANI,TASA 413,07/04/2014 06:00,07/04/2014 07:00,07/04/2014 08:30,07/04/2014 11:53,07/04/2014 17:39,07/04/2014 19:23,07/04/2014 22:23,243.02,Tradicional,447.5,54,2,10.65,12.38,8.6,10.33,23.48,1.11,13.1,14.9,4.38,4.1,18.47,2014,7,4,2014-07-04,2,2014-I,I,0
78106,MATARANI,TASA 35,07/04/2014 03:56,07/04/2014 05:50,07/04/2014 06:40,07/04/2014 09:05,07/04/2014 15:57,07/04/2014 18:49,07/04/2014 22:19,291.955,Tradicional,322.75,90,2,10.12,12.98,9.55,12.42,24.98,0.0,13.32,16.98,4.38,4.1,18.7,2014,7,4,2014-07-04,2,2014-I,I,1
78107,MATARANI,TASA 37,07/04/2014 06:00,07/04/2014 10:00,07/04/2014 12:00,07/04/2014 12:50,07/04/2014 19:29,08/04/2014 00:44,08/04/2014 03:49,204.495,Tradicional,321.56,64,1,9.48,14.73,9.48,14.73,22.19,0.0,14.02,15.16,4.38,4.1,18.83,2014,7,4,2014-07-04,2,2014-I,I,1
78110,ATICO,TASA 416,07/04/2014 08:00,07/04/2014 09:15,07/04/2014 09:35,07/04/2014 11:59,07/04/2014 15:55,07/04/2014 23:48,08/04/2014 01:24,240.405,Tradicional,421.36,57,2,6.67,14.55,6.01,13.89,23.35,10.0,12.84,17.12,4.59,3.56,18.35,2014,7,4,2014-07-04,2,2014-I,I,0
78111,MATARANI,TASA 111,07/04/2014 06:30,07/04/2014 07:20,07/04/2014 09:10,07/04/2014 15:16,07/04/2014 23:59,08/04/2014 08:21,08/04/2014 10:50,178.035,Tradicional,189.81,94,2,16.65,25.02,15.02,14.05,34.22,6.83,12.81,11.11,3.76,4.24,18.83,2014,7,4,2014-07-04,2,2014-I,I,0
78112,ATICO,TASA 411,07/04/2014 05:00,07/04/2014 06:50,07/04/2014 08:45,07/04/2014 09:18,07/04/2014 11:19,07/04/2014 14:51,07/04/2014 17:34,343.935,Tradicional,444.09,77,1,4.48,8.02,4.48,8.02,19.37,11.11,13.29,16.29,4.59,3.56,19.1,2014,7,4,2014-07-04,2,2014-I,I,0
78113,ATICO,TASA 34,07/04/2014 08:00,07/04/2014 08:40,07/04/2014 09:55,07/04/2014 10:39,07/04/2014 12:30,07/04/2014 17:36,07/04/2014 19:57,253.14,Tradicional,334.38,76,1,3.83,8.93,3.83,8.93,12.43,27.21,12.44,16.89,4.59,3.56,19.8,2014,7,4,2014-07-04,2,2014-I,I,1
78114,ATICO,TASA 210,07/04/2014 08:40,07/04/2014 11:00,07/04/2014 11:55,07/04/2014 13:00,07/04/2014 15:12,07/04/2014 18:32,07/04/2014 20:47,212.02,Tradicional,290.58,73,1,4.2,7.53,4.2,7.53,16.0,5.15,13.51,17.62,4.59,3.56,18.83,2014,7,4,2014-07-04,2,2014-I,I,0
78143,ILO,TASA 38,08/04/2014 05:00,08/04/2014 08:00,08/04/2014 09:20,08/04/2014 13:33,08/04/2014 16:10,08/04/2014 19:40,08/04/2014 20:38,112.9,Tradicional,322.06,35,2,8.17,11.67,6.43,9.93,24.36,0.0,14.55,18.74,5.82,3.39,20.36,2014,8,4,2014-08-04,2,2014-I,I,0
78144,ILO,TASA 17,08/04/2014 05:00,08/04/2014 06:38,08/04/2014 09:05,08/04/2014 09:52,08/04/2014 13:30,08/04/2014 14:56,08/04/2014 16:41,170.205,Tradicional,193.69,88,1,6.87,8.3,6.87,8.3,19.99,1.48,14.59,19.35,5.82,3.39,19.8,2014,8,4,2014-08-04,2,2014-I,I,0
78145,ATICO,TASA 411,08/04/2014 07:00,08/04/2014 08:30,08/04/2014 08:45,08/04/2014 16:00,08/04/2014 16:39,08/04/2014 21:14,08/04/2014 22:20,124.33,Tradicional,444.09,28,2,8.15,12.73,7.0,11.59,16.99,7.53,12.76,13.85,5.07,3.51,18.51,2014,8,4,2014-08-04,2,2014-I,I,0
78146,ATICO,TASA 34,08/04/2014 10:00,08/04/2014 11:25,08/04/2014 11:38,08/04/2014 16:47,08/04/2014 18:12,08/04/2014 23:41,09/04/2014 00:33,83.965,Tradicional,334.38,25,2,6.78,12.27,5.89,11.38,25.37,11.76,12.32,16.5,5.07,3.51,19.75,2014,8,4,2014-08-04,2,2014-I,I,1
78148,ATICO,TASA 44,08/04/2014 07:00,08/04/2014 08:12,08/04/2014 08:24,08/04/2014 16:18,08/04/2014 17:16,08/04/2014 22:36,08/04/2014 23:27,92.91,Tradicional,399.94,23,3,9.07,14.4,7.03,12.36,22.58,6.0,12.88,15.8,5.07,3.51,18.26,2014,8,4,2014-08-04,2,2014-I,I,1
78149,ATICO,TASA 210,08/04/2014 09:00,08/04/2014 10:40,08/04/2014 10:55,08/04/2014 16:48,08/04/2014 18:31,09/04/2014 00:44,09/04/2014 01:30,40.055,Tradicional,290.58,14,2,7.85,14.07,6.6,12.82,17.13,7.02,12.75,16.53,5.07,3.51,18.83,2014,8,4,2014-08-04,2,2014-I,I,0
78150,ATICO,TASA 416,08/04/2014 07:30,08/04/2014 08:50,08/04/2014 09:00,08/04/2014 15:59,08/04/2014 16:20,08/04/2014 20:15,08/04/2014 21:09,85.49,Tradicional,421.36,20,3,7.5,11.42,5.32,9.24,18.68,22.52,12.58,13.72,5.07,3.51,19.09,2014,8,4,2014-08-04,2,2014-I,I,0
78151,ATICO,TASA 61,08/04/2014 07:00,08/04/2014 08:10,08/04/2014 08:20,08/04/2014 09:13,08/04/2014 11:00,08/04/2014 19:06,08/04/2014 20:02,91.275,Tradicional,590.91,15,1,2.83,10.93,2.83,10.93,16.33,10.84,12.39,12.62,5.07,3.51,16.8,2014,8,4,2014-08-04,2,2014-I,I,1
78154,MATARANI,TASA 413,08/04/2014 07:00,08/04/2014 08:10,08/04/2014 09:30,08/04/2014 17:05,08/04/2014 22:01,08/04/2014 22:44,09/04/2014 00:01,84.565,Tradicional,447.5,19,2,13.85,14.57,9.18,9.9,29.32,5.49,13.08,15.66,3.76,4.24,18.9,2014,8,4,2014-08-04,2,2014-I,I,0
78155,MATARANI,TASA 418,08/04/2014 08:30,08/04/2014 09:50,08/04/2014 10:10,08/04/2014 17:07,08/04/2014 21:30,08/04/2014 22:24,08/04/2014 23:14,74.715,Tradicional,430.91,17,2,11.67,12.57,9.25,10.15,25.91,5.49,12.67,13.93,3.76,4.24,19.8,2014,8,4,2014-08-04,2,2014-I,I,0
78156,MATARANI,TASA 35,09/04/2014 04:00,09/04/2014 04:50,09/04/2014 06:05,09/04/2014 09:56,09/04/2014 17:19,09/04/2014 18:18,09/04/2014 20:10,171.885,Tradicional,322.75,53,3,12.48,13.47,10.08,11.06,26.71,1.06,14.1,14.92,5.0,3.8,18.68,2014,9,4,2014-09-04,2,2014-I,I,1
78157,ATICO,TASA 310,08/04/2014 05:00,08/04/2014 06:00,08/04/2014 07:15,08/04/2014 16:05,08/04/2014 19:13,09/04/2014 01:39,09/04/2014 02:34,77.34,Tradicional,336.4,23,3,13.22,19.65,8.9,15.33,28.55,5.56,12.63,16.44,5.07,3.51,19.17,2014,8,4,2014-08-04,2,2014-I,I,0
78158,MATARANI,TASA 37,08/04/2014 10:00,08/04/2014 10:10,08/04/2014 11:50,08/04/2014 17:18,08/04/2014 23:20,08/04/2014 23:39,09/04/2014 01:11,106.39,Tradicional,321.56,33,3,13.17,13.48,10.94,11.26,22.54,0.0,13.85,18.56,3.76,4.24,18.32,2014,8,4,2014-08-04,2,2014-I,I,1
78163,ATICO,TASA 45,08/04/2014 11:50,08/04/2014 13:20,08/04/2014 13:31,08/04/2014 17:07,08/04/2014 20:10,09/04/2014 02:47,09/04/2014 03:28,71.57,Tradicional,364.84,20,2,6.83,13.45,4.98,11.6,20.33,2.74,12.66,15.66,5.07,3.51,19.7,2014,8,4,2014-08-04,2,2014-I,I,1
78180,ILO,TASA 111,09/04/2014 05:00,09/04/2014 06:29,09/04/2014 06:43,09/04/2014 13:42,09/04/2014 15:00,09/04/2014 19:06,09/04/2014 20:15,127.1,Tradicional,189.81,67,3,8.52,12.62,7.35,11.45,26.16,1.52,14.15,17.82,4.97,3.68,19.0,2014,9,4,2014-09-04,2,2014-I,I,0
78183,MATARANI,TASA 411,09/04/2014 04:30,09/04/2014 06:30,09/04/2014 08:10,09/04/2014 08:49,09/04/2014 15:00,09/04/2014 15:45,09/04/2014 18:14,338.87,Tradicional,444.09,76,1,8.5,9.25,8.5,9.25,18.95,1.1,13.45,15.91,5.0,3.8,18.7,2014,9,4,2014-09-04,2,2014-I,I,0
78184,ATICO,TASA 416,09/04/2014 05:00,09/04/2014 06:45,09/04/2014 06:55,09/04/2014 12:20,09/04/2014 14:58,09/04/2014 16:25,09/04/2014 17:43,239.12,Tradicional,421.36,57,3,8.22,9.67,5.12,6.57,20.68,1.72,13.85,16.89,4.98,3.78,18.83,2014,9,4,2014-09-04,2,2014-I,I,0
78185,ATICO,TASA 44,09/04/2014 07:00,09/04/2014 08:25,09/04/2014 08:56,09/04/2014 11:29,09/04/2014 15:18,09/04/2014 17:57,09/04/2014 20:52,381.79,Tradicional,399.94,95,2,6.88,9.53,5.68,8.33,17.51,2.19,13.73,14.96,4.98,3.78,18.15,2014,9,4,2014-09-04,2,2014-I,I,1
78186,ILO,TASA 415,09/04/2014 04:00,09/04/2014 05:27,09/04/2014 07:40,09/04/2014 13:39,09/04/2014 14:20,09/04/2014 15:54,09/04/2014 17:11,122.355,Tradicional,435.8,28,2,8.88,10.45,6.78,8.35,26.16,1.55,13.95,16.65,4.97,3.68,17.33,2014,9,4,2014-09-04,2,2014-I,I,1
78187,MATARANI,TASA 38,09/04/2014 04:00,09/04/2014 05:50,09/04/2014 07:00,09/04/2014 12:11,09/04/2014 17:42,09/04/2014 18:32,09/04/2014 19:55,126.56,Tradicional,322.06,39,3,11.87,12.7,10.01,10.84,25.54,5.53,13.28,15.47,5.0,3.8,18.19,2014,9,4,2014-09-04,2,2014-I,I,0
78188,MATARANI,TASA 413,09/04/2014 06:00,09/04/2014 10:00,09/04/2014 11:25,09/04/2014 16:36,09/04/2014 23:54,10/04/2014 02:51,10/04/2014 04:16,161.4,Tradicional,447.5,36,2,13.9,16.85,10.99,13.94,27.7,10.53,12.7,13.89,5.0,3.8,20.36,2014,9,4,2014-09-04,2,2014-I,I,0
78189,MATARANI,TASA 418,09/04/2014 04:00,09/04/2014 06:27,09/04/2014 07:40,09/04/2014 13:39,09/04/2014 20:19,09/04/2014 22:33,10/04/2014 00:26,228.165,Tradicional,430.91,53,3,13.87,16.1,10.94,13.18,22.85,6.67,12.79,14.88,5.0,3.8,19.32,2014,9,4,2014-09-04,2,2014-I,I,0
78190,MATARANI,TASA 43,09/04/2014 05:00,09/04/2014 06:20,09/04/2014 06:44,09/04/2014 13:53,09/04/2014 17:55,09/04/2014 20:30,09/04/2014 22:18,171.61,Tradicional,401.08,43,4,11.58,14.17,9.4,11.98,19.49,1.11,13.14,15.97,5.0,3.8,17.7,2014,9,4,2014-09-04,2,2014-I,I,1
78191,MATARANI,TASA 17,09/04/2014 05:00,09/04/2014 06:50,09/04/2014 06:57,09/04/2014 09:46,09/04/2014 16:42,09/04/2014 16:55,09/04/2014 18:26,148.25,Tradicional,193.69,77,2,9.87,10.08,9.37,9.58,19.77,2.73,13.56,16.64,5.0,3.8,17.63,2014,9,4,2014-09-04,2,2014-I,I,0
78192,MATARANI,TASA 37,09/04/2014 07:30,09/04/2014 09:10,09/04/2014 09:30,09/04/2014 16:23,10/04/2014 00:03,10/04/2014 00:56,10/04/2014 02:37,169.64,Tradicional,321.56,53,3,14.88,15.77,11.51,12.4,26.55,2.13,13.44,16.5,5.0,3.8,18.82,2014,9,4,2014-09-04,2,2014-I,I,1
78195,ATICO,TASA 210,09/04/2014 07:00,09/04/2014 09:00,09/04/2014 09:35,09/04/2014 12:48,09/04/2014 16:39,09/04/2014 22:32,10/04/2014 00:57,276.615,Tradicional,290.58,95,2,7.65,13.53,5.63,11.51,18.67,2.19,14.04,15.8,4.98,3.78,18.83,2014,9,4,2014-09-04,2,2014-I,I,0
78196,ATICO,TASA 34,09/04/2014 05:40,09/04/2014 05:59,09/04/2014 06:15,09/04/2014 08:43,09/04/2014 12:26,09/04/2014 14:41,09/04/2014 16:18,192.88,Tradicional,334.38,58,2,6.45,8.7,5.45,7.7,22.14,1.47,13.72,20.51,4.98,3.78,19.09,2014,9,4,2014-09-04,2,2014-I,I,1
78198,ATICO,TASA 310,09/04/2014 05:00,09/04/2014 06:00,09/04/2014 07:10,09/04/2014 14:26,09/04/2014 17:53,10/04/2014 01:08,10/04/2014 02:56,217.315,Tradicional,336.4,65,4,11.88,19.13,7.9,15.15,20.31,9.72,12.84,17.8,4.98,3.78,19.01,2014,9,4,2014-09-04,2,2014-I,I,0
78199,ATICO,TASA 45,09/04/2014 07:00,09/04/2014 08:20,09/04/2014 09:01,09/04/2014 12:55,09/04/2014 15:39,09/04/2014 19:47,09/04/2014 22:22,254.485,Tradicional,364.84,70,2,7.32,11.45,5.31,9.44,15.02,19.33,12.39,16.18,4.98,3.78,19.0,2014,9,4,2014-09-04,2,2014-I,I,1
78212,ATICO,TASA 61,09/04/2014 11:00,09/04/2014 12:21,09/04/2014 12:35,09/04/2014 17:06,09/04/2014 23:10,10/04/2014 03:05,10/04/2014 05:49,253.25,Tradicional,590.91,43,3,10.82,14.73,9.31,13.22,24.28,5.8,13.23,14.72,4.98,3.78,18.38,2014,9,4,2014-09-04,2,2014-I,I,1
78228,ATICO,TASA 44,10/04/2014 08:00,10/04/2014 09:25,10/04/2014 09:48,10/04/2014 15:34,10/04/2014 17:39,10/04/2014 23:41,11/04/2014 01:10,207.2,Tradicional,399.94,52,3,8.23,14.27,4.85,10.88,23.19,1.68,13.93,17.31,4.68,3.89,19.29,2014,10,4,2014-10-04,2,,,1
78229,ATICO,TASA 45,10/04/2014 07:30,10/04/2014 09:11,10/04/2014 09:39,10/04/2014 16:01,10/04/2014 18:06,11/04/2014 02:18,11/04/2014 05:17,303.86,Tradicional,364.84,83,3,8.92,17.12,6.31,14.51,23.2,1.01,13.85,20.73,4.68,3.89,19.85,2014,10,4,2014-10-04,2,,,1
78230,MATARANI,TASA 416,10/04/2014 06:00,10/04/2014 08:10,10/04/2014 09:30,10/04/2014 14:58,10/04/2014 22:21,11/04/2014 02:12,11/04/2014 03:50,210.135,Tradicional,421.36,50,3,14.18,18.03,11.19,15.04,34.48,1.1,13.33,15.85,4.36,3.55,20.32,2014,10,4,2014-10-04,2,,,0
78231,ATICO,TASA 210,10/04/2014 08:00,10/04/2014 10:20,10/04/2014 10:55,10/04/2014 16:06,10/04/2014 18:22,11/04/2014 02:17,11/04/2014 03:30,111.015,Tradicional,290.58,38,2,8.03,15.95,5.7,13.62,31.13,7.41,13.36,15.42,4.68,3.89,18.83,2014,10,4,2014-10-04,2,,,0
78232,MATARANI,TASA 34,10/04/2014 08:00,10/04/2014 10:30,10/04/2014 10:47,10/04/2014 16:40,11/04/2014 03:09,11/04/2014 04:18,11/04/2014 07:41,319.415,Tradicional,334.38,96,3,16.65,17.8,14.06,15.21,34.46,5.0,13.21,15.28,4.36,3.55,20.26,2014,10,4,2014-10-04,2,,,1
78233,MATARANI,TASA 220,10/04/2014 14:34,10/04/2014 06:00,10/04/2014 08:00,10/04/2014 14:35,10/04/2014 17:10,10/04/2014 17:39,10/04/2014 18:45,66.695,Tradicional,213.26,31,2,11.17,11.65,7.42,7.9,22.25,0.0,12.58,18.08,4.36,3.55,19.11,2014,10,4,2014-10-04,2,,,0
78234,MATARANI,TASA 111,10/04/2014 09:00,10/04/2014 10:20,10/04/2014 11:20,10/04/2014 14:53,10/04/2014 17:33,10/04/2014 20:10,10/04/2014 20:36,24.225,Tradicional,189.81,13,1,7.22,9.83,7.22,9.83,20.51,0.53,12.72,16.2,4.36,3.55,19.4,2014,10,4,2014-10-04,2,,,0
78235,MATARANI,TASA 415,10/04/2014 09:00,10/04/2014 10:50,10/04/2014 11:25,10/04/2014 15:07,10/04/2014 15:19,10/04/2014 17:39,10/04/2014 18:17,37.89,Tradicional,435.8,9,2,4.48,6.82,3.91,6.24,18.84,6.25,12.79,14.81,4.36,3.55,18.6,2014,10,4,2014-10-04,2,,,1
78236,MATARANI,TASA 418,10/04/2014 06:00,10/04/2014 08:08,10/04/2014 09:30,10/04/2014 14:37,10/04/2014 23:05,11/04/2014 00:57,11/04/2014 02:40,248.575,Tradicional,430.91,58,3,14.95,16.82,11.67,13.54,31.44,4.35,13.13,15.28,4.36,3.55,20.67,2014,10,4,2014-10-04,2,,,0
78238,MATARANI,TASA 17,10/04/2014 08:00,10/04/2014 10:20,10/04/2014 11:20,10/04/2014 15:06,10/04/2014 17:46,10/04/2014 20:44,10/04/2014 21:20,23.685,Tradicional,193.69,12,1,7.43,10.4,7.43,10.4,17.36,10.53,12.67,15.21,4.36,3.55,19.4,2014,10,4,2014-10-04,2,,,0
78239,ATICO,TASA 43,10/04/2014 04:00,10/04/2014 05:35,10/04/2014 06:15,10/04/2014 13:50,10/04/2014 15:04,10/04/2014 16:14,10/04/2014 18:39,379.42,Tradicional,401.08,95,2,9.48,10.65,7.17,8.34,23.98,1.65,13.62,16.69,4.68,3.89,19.12,2014,10,4,2014-10-04,2,,,1
78240,ATICO,TASA 35,10/04/2014 07:00,10/04/2014 10:25,10/04/2014 13:30,10/04/2014 13:42,10/04/2014 16:34,10/04/2014 19:07,10/04/2014 21:06,196.79,Tradicional,322.75,61,1,6.15,8.7,6.15,8.7,16.61,0.0,14.38,16.76,4.68,3.89,19.7,2014,10,4,2014-10-04,2,,,1
78241,MATARANI,TASA 38,10/04/2014 08:00,10/04/2014 10:40,10/04/2014 12:20,10/04/2014 15:05,10/04/2014 17:17,10/04/2014 18:25,10/04/2014 19:10,24.27,Tradicional,322.06,8,1,6.62,7.75,6.62,7.75,19.37,0.0,12.78,14.72,4.36,3.55,19.6,2014,10,4,2014-10-04,2,,,0
78243,ATICO,TASA 37,10/04/2014 10:00,10/04/2014 13:10,10/04/2014 15:05,10/04/2014 18:26,10/04/2014 18:50,11/04/2014 06:08,11/04/2014 07:19,65.335,Tradicional,321.56,20,1,5.67,16.97,5.67,16.97,32.18,9.43,13.01,20.94,4.68,3.89,20.24,2014,10,4,2014-10-04,2,,,1
78244,ATICO,TASA 413,10/04/2014 12:00,10/04/2014 14:40,10/04/2014 16:00,10/04/2014 18:24,10/04/2014 18:48,11/04/2014 03:37,11/04/2014 09:46,72.49,Tradicional,447.5,16,1,4.13,12.95,4.13,12.95,19.97,6.54,13.22,19.39,4.68,3.89,20.4,2014,10,4,2014-10-04,2,,,0
78245,MATARANI,TASA 310,10/04/2014 05:00,10/04/2014 08:40,10/04/2014 09:20,10/04/2014 10:37,10/04/2014 20:02,10/04/2014 22:08,11/04/2014 00:08,228.53,Tradicional,336.4,68,1,11.37,13.47,11.37,13.47,26.0,0.0,13.34,15.62,4.36,3.55,20.4,2014,10,4,2014-10-04,2,,,0
78246,ATICO,TASA 61,10/04/2014 08:20,10/04/2014 09:36,10/04/2014 09:48,10/04/2014 16:09,10/04/2014 17:35,10/04/2014 21:16,10/04/2014 23:25,226.03,Tradicional,590.91,38,2,7.98,11.67,6.83,10.52,28.03,0.0,14.12,15.88,4.68,3.89,19.68,2014,10,4,2014-10-04,2,,,1
78271,ATICO,TASA 415,11/04/2014 05:00,11/04/2014 07:50,11/04/2014 08:07,11/04/2014 12:58,11/04/2014 13:28,11/04/2014 20:32,11/04/2014 22:35,206.04,Tradicional,435.8,47,2,5.63,12.7,3.63,10.7,21.05,5.43,13.33,19.77,4.52,4.04,18.52,2014,11,4,2014-11-04,2,,,1
78272,ILO,TASA 38,11/04/2014 09:00,11/04/2014 11:05,11/04/2014 12:35,11/04/2014 17:50,11/04/2014 21:00,12/04/2014 01:26,12/04/2014 03:02,156.375,Tradicional,322.06,49,3,9.92,14.35,7.55,11.98,23.47,0.0,14.32,17.98,5.96,3.55,20.32,2014,11,4,2014-11-04,2,,,0
78274,ATICO,TASA 35,11/04/2014 06:00,11/04/2014 07:50,11/04/2014 12:15,11/04/2014 12:58,11/04/2014 14:02,11/04/2014 23:17,12/04/2014 00:49,206.475,Tradicional,322.75,64,1,6.2,15.45,6.2,15.45,24.75,0.0,13.84,17.4,4.52,4.04,19.2,2014,11,4,2014-11-04,2,,,1
78275,ATICO,TASA 61,11/04/2014 03:00,11/04/2014 04:36,11/04/2014 06:35,11/04/2014 08:34,11/04/2014 09:30,11/04/2014 15:12,11/04/2014 18:22,398.585,Tradicional,590.91,67,2,4.9,10.6,4.75,10.45,17.32,14.74,12.63,13.49,4.52,4.04,18.98,2014,11,4,2014-11-04,2,,,1
78276,MATARANI,TASA 44,11/04/2014 03:30,11/04/2014 06:00,11/04/2014 06:30,11/04/2014 08:00,11/04/2014 16:41,11/04/2014 17:57,11/04/2014 21:36,342.24,Tradicional,399.94,86,1,10.68,11.95,10.68,11.95,23.88,6.67,12.92,13.78,4.46,3.35,18.9,2014,11,4,2014-11-04,2,,,1
78279,ILO,TASA 111,11/04/2014 10:00,11/04/2014 14:30,11/04/2014 16:02,11/04/2014 17:02,11/04/2014 20:20,11/04/2014 22:12,11/04/2014 22:37,29.53,Tradicional,189.81,16,1,5.83,7.7,5.83,7.7,21.82,0.0,15.27,22.19,5.96,3.55,20.4,2014,11,4,2014-11-04,2,,,0
78280,ILO,TASA 17,11/04/2014 09:00,11/04/2014 11:26,11/04/2014 12:35,11/04/2014 16:40,11/04/2014 20:15,11/04/2014 21:27,11/04/2014 21:59,47.03,Tradicional,193.69,24,2,8.82,10.02,6.37,7.57,20.99,0.56,14.18,17.64,5.96,3.55,19.25,2014,11,4,2014-11-04,2,,,0
78281,MATARANI,TASA 411,11/04/2014 05:00,11/04/2014 06:25,11/04/2014 09:10,11/04/2014 09:44,11/04/2014 19:44,12/04/2014 00:57,12/04/2014 03:35,372.42,Tradicional,444.09,84,1,13.32,18.53,13.32,18.53,35.95,3.33,12.93,14.89,4.46,3.35,19.1,2014,11,4,2014-11-04,2,,,0
78283,ILO,TASA 220,11/04/2014 09:00,11/04/2014 13:50,11/04/2014 15:30,11/04/2014 17:43,11/04/2014 21:00,12/04/2014 00:42,12/04/2014 01:48,80.895,Tradicional,213.26,38,2,7.17,10.87,5.83,9.53,26.64,0.0,14.8,18.0,5.96,3.55,20.0,2014,11,4,2014-11-04,2,,,0
78285,MATARANI,TASA 210,11/04/2014 05:10,11/04/2014 08:00,11/04/2014 08:45,11/04/2014 09:01,11/04/2014 20:55,12/04/2014 01:11,12/04/2014 03:01,155.125,Tradicional,290.58,53,1,12.92,17.18,12.92,17.18,34.1,4.26,12.72,14.3,4.46,3.35,18.83,2014,11,4,2014-11-04,2,,,0
78288,MATARANI,TASA 45,11/04/2014 05:30,11/04/2014 07:05,11/04/2014 08:03,11/04/2014 10:28,11/04/2014 18:40,11/04/2014 22:02,12/04/2014 00:17,349.82,Tradicional,364.84,96,2,11.58,14.95,10.76,14.12,28.09,0.0,13.61,17.04,4.46,3.35,19.17,2014,11,4,2014-11-04,2,,,1
78309,ATICO,TASA 413,11/04/2014 10:00,11/04/2014 10:00,11/04/2014 10:23,11/04/2014 13:40,11/04/2014 19:23,12/04/2014 02:10,12/04/2014 04:18,260.78,Tradicional,447.5,58,2,9.38,16.17,8.92,15.71,33.8,4.86,13.27,14.08,4.52,4.04,19.39,2014,11,4,2014-11-04,2,,,0
78310,ATICO,TASA 37,11/04/2014 08:00,11/04/2014 09:20,11/04/2014 10:00,11/04/2014 13:00,11/04/2014 13:47,11/04/2014 22:41,12/04/2014 00:33,104.08,Tradicional,321.56,32,1,4.45,13.35,4.45,13.35,23.15,1.89,13.59,19.26,4.52,4.04,18.8,2014,11,4,2014-11-04,2,,,1
78373,ILO,TASA 111,13/04/2014 05:00,13/04/2014 10:08,13/04/2014 10:54,13/04/2014 13:33,13/04/2014 16:50,13/04/2014 18:13,13/04/2014 19:22,132.135,Tradicional,189.81,70,2,6.7,8.08,5.88,7.26,14.58,2.19,14.19,17.15,6.79,3.19,19.6,2014,4,13,2014-04-13,2,2013-II,II,0
78374,ILO,TASA 220,13/04/2014 05:00,13/04/2014 09:45,13/04/2014 10:20,13/04/2014 14:00,13/04/2014 16:30,13/04/2014 17:01,13/04/2014 18:51,190.125,Tradicional,213.26,89,2,6.75,7.27,5.98,6.5,19.8,0.0,15.07,20.95,6.79,3.19,19.0,2014,4,13,2014-04-13,2,2013-II,II,0
78375,ILO,TASA 38,13/04/2014 05:00,13/04/2014 09:08,13/04/2014 09:30,13/04/2014 14:17,13/04/2014 16:30,13/04/2014 17:01,13/04/2014 18:06,130.0,Tradicional,322.06,40,3,7.37,7.88,5.48,6.0,16.91,1.03,14.81,19.76,6.79,3.19,19.43,2014,4,13,2014-04-13,2,2013-II,II,0
78376,ILO,TASA 17,13/04/2014 05:00,13/04/2014 10:08,13/04/2014 10:54,13/04/2014 15:05,13/04/2014 17:45,13/04/2014 19:24,13/04/2014 20:19,107.4,Tradicional,193.69,55,2,7.62,9.27,6.37,8.02,17.54,1.09,14.29,17.98,6.79,3.19,18.68,2014,4,13,2014-04-13,2,2013-II,II,0
78392,ILO,TASA 17,14/04/2014 05:00,14/04/2014 07:30,14/04/2014 07:55,14/04/2014 11:21,14/04/2014 13:40,14/04/2014 15:17,14/04/2014 16:58,187.495,Tradicional,193.69,97,2,6.17,7.78,4.71,6.33,18.1,0.0,15.23,22.21,5.98,3.64,19.57,2014,4,14,2014-04-14,2,2013-II,II,0
78394,MATARANI,TASA 38,14/04/2014 05:00,14/04/2014 07:30,14/04/2014 07:55,14/04/2014 14:00,14/04/2014 22:18,14/04/2014 22:48,15/04/2014 01:01,244.505,Tradicional,322.06,76,3,14.8,15.3,13.37,13.87,22.0,1.05,13.76,18.21,5.38,3.7,20.12,2014,4,14,2014-04-14,2,2013-II,II,0
78395,MATARANI,TASA 220,14/04/2014 05:44,14/04/2014 07:30,14/04/2014 07:50,14/04/2014 15:18,14/04/2014 22:20,14/04/2014 23:11,15/04/2014 00:33,115.12,Tradicional,213.26,54,3,14.83,15.68,10.99,11.84,20.0,1.05,13.76,16.57,5.38,3.7,19.78,2014,4,14,2014-04-14,2,2013-II,II,0
78398,ILO,TASA 111,14/04/2014 05:00,14/04/2014 07:37,14/04/2014 08:10,14/04/2014 11:15,14/04/2014 13:50,14/04/2014 17:02,14/04/2014 18:55,180.79,Tradicional,189.81,95,2,6.22,9.42,4.84,8.04,18.22,0.0,14.6,18.96,5.98,3.64,20.96,2014,4,14,2014-04-14,2,2013-II,II,0
78418,MATARANI,TASA 44,15/04/2014 05:00,15/04/2014 06:45,15/04/2014 06:52,15/04/2014 14:56,15/04/2014 19:30,15/04/2014 20:36,15/04/2014 21:40,93.99,Tradicional,399.94,24,3,12.75,13.85,8.52,9.62,19.47,0.0,14.3,21.04,5.78,3.62,18.46,2014,4,15,2014-04-15,2,2013-II,II,1
78419,MATARANI,TASA 45,15/04/2014 05:00,15/04/2014 06:10,15/04/2014 06:25,15/04/2014 14:55,15/04/2014 19:50,15/04/2014 21:47,15/04/2014 23:03,124.925,Tradicional,364.84,34,3,13.67,15.62,10.02,11.97,23.36,0.0,14.1,20.14,5.78,3.62,18.66,2014,4,15,2014-04-15,2,2013-II,II,1
78421,ILO,TASA 43,15/04/2014 05:00,15/04/2014 06:35,15/04/2014 06:50,15/04/2014 16:32,15/04/2014 17:53,15/04/2014 20:34,15/04/2014 22:02,189.385,Tradicional,401.08,47,3,11.3,13.98,7.23,9.92,22.18,0.0,15.11,10.6,5.48,3.47,19.05,2014,4,15,2014-04-15,2,2013-II,II,1
78422,ILO,TASA 34,15/04/2014 05:00,15/04/2014 08:22,15/04/2014 08:29,15/04/2014 14:42,15/04/2014 16:02,15/04/2014 17:20,15/04/2014 18:05,56.155,Tradicional,334.38,17,2,7.67,8.97,4.71,6.01,25.0,0.0,15.48,24.42,5.48,3.47,18.58,2014,4,15,2014-04-15,2,2013-II,II,1
78423,ILO,TASA 411,15/04/2014 05:00,15/04/2014 06:40,15/04/2014 06:55,15/04/2014 14:30,15/04/2014 16:00,15/04/2014 17:10,15/04/2014 18:04,84.185,Tradicional,444.09,19,2,9.33,10.5,6.25,7.42,18.0,0.0,15.19,21.73,5.48,3.47,18.7,2014,4,15,2014-04-15,2,2013-II,II,0
78424,ILO,TASA 17,15/04/2014 04:00,15/04/2014 06:27,15/04/2014 06:40,15/04/2014 13:49,15/04/2014 17:02,15/04/2014 18:08,15/04/2014 18:47,58.41,Tradicional,193.69,30,2,10.58,11.68,8.0,9.1,20.3,0.0,14.85,20.31,5.48,3.47,18.85,2014,4,15,2014-04-15,2,2013-II,II,0
78425,ILO,TASA 416,15/04/2014 05:00,15/04/2014 07:30,15/04/2014 07:40,15/04/2014 12:54,15/04/2014 13:06,15/04/2014 15:59,15/04/2014 17:04,81.725,Tradicional,421.36,19,2,5.6,8.48,3.66,6.54,17.0,0.0,15.02,21.21,5.48,3.47,18.58,2014,4,15,2014-04-15,2,2013-II,II,0
78426,ATICO,TASA 35,16/04/2014 02:00,16/04/2014 08:20,16/04/2014 09:38,16/04/2014 14:20,16/04/2014 16:25,16/04/2014 20:36,16/04/2014 22:09,97.25,Tradicional,322.75,30,2,8.08,12.27,6.22,10.4,19.47,4.21,13.3,22.67,5.18,3.9,18.83,2014,4,16,2014-04-16,2,2013-II,II,1
78427,MATARANI,TASA 37,16/04/2014 09:00,16/04/2014 11:15,16/04/2014 13:20,16/04/2014 13:48,16/04/2014 23:50,17/04/2014 02:40,17/04/2014 06:30,285.325,Tradicional,321.56,89,1,12.58,15.42,12.58,15.42,21.93,4.4,12.88,13.52,4.72,3.81,19.0,2014,4,16,2014-04-16,2,2013-II,II,1
78428,ILO,TASA 111,15/04/2014 05:00,15/04/2014 07:06,15/04/2014 07:15,15/04/2014 15:55,15/04/2014 18:38,16/04/2014 02:35,16/04/2014 03:22,53.77,Tradicional,189.81,28,3,11.53,19.48,6.81,14.76,20.86,0.57,13.83,16.29,5.48,3.47,20.32,2014,4,15,2014-04-15,2,2013-II,II,0
78429,ILO,TASA 210,15/04/2014 05:00,15/04/2014 13:30,15/04/2014 13:40,15/04/2014 15:48,15/04/2014 17:15,15/04/2014 18:23,15/04/2014 19:13,20.435,Tradicional,290.58,7,1,3.75,4.88,3.75,4.88,20.0,0.0,15.04,21.01,5.48,3.47,18.83,2014,4,15,2014-04-15,2,2013-II,II,0
78438,ATICO,TASA 38,16/04/2014 08:00,16/04/2014 08:20,16/04/2014 10:00,16/04/2014 14:00,16/04/2014 16:13,16/04/2014 17:46,16/04/2014 20:36,271.4,Tradicional,322.06,84,2,7.88,9.43,7.35,8.9,20.79,2.99,13.39,15.24,5.18,3.9,19.56,2014,4,16,2014-04-16,2,2013-II,II,0
78440,ATICO,TASA 220,16/04/2014 09:00,16/04/2014 10:00,16/04/2014 12:30,16/04/2014 13:50,16/04/2014 16:00,16/04/2014 20:20,16/04/2014 22:09,210.255,Tradicional,213.26,99,1,6.0,10.33,6.0,10.33,17.3,9.15,13.06,14.45,5.18,3.9,18.83,2014,4,16,2014-04-16,2,2013-II,II,0
78444,MATARANI,TASA 310,16/04/2014 09:00,16/04/2014 10:00,16/04/2014 11:55,16/04/2014 16:42,17/04/2014 00:20,17/04/2014 03:21,17/04/2014 06:00,200.36,Tradicional,336.4,60,1,14.33,17.35,14.33,17.35,20.93,5.56,12.98,14.41,4.72,3.81,19.2,2014,4,16,2014-04-16,2,2013-II,II,0
78445,MATARANI,TASA 413,16/04/2014 08:00,16/04/2014 09:30,16/04/2014 11:10,16/04/2014 14:45,16/04/2014 23:48,17/04/2014 06:09,17/04/2014 09:13,415.89,Tradicional,447.5,93,2,14.3,20.65,13.08,19.43,31.87,3.28,13.13,15.41,4.72,3.81,19.6,2014,4,16,2014-04-16,2,2013-II,II,0
78446,ATICO,TASA 61,16/04/2014 08:00,16/04/2014 09:00,16/04/2014 10:25,16/04/2014 14:40,16/04/2014 16:50,16/04/2014 22:09,17/04/2014 02:43,548.585,Tradicional,590.91,93,3,7.83,13.15,6.36,11.68,20.31,3.36,13.5,18.69,5.18,3.9,18.22,2014,4,16,2014-04-16,2,2013-II,II,1
78455,MATARANI,TASA 418,16/04/2014 08:30,16/04/2014 09:20,16/04/2014 11:10,16/04/2014 14:20,16/04/2014 22:45,16/04/2014 23:24,17/04/2014 02:25,362.115,Tradicional,430.91,84,2,13.42,14.07,11.92,12.57,18.82,6.56,13.02,14.69,4.72,3.81,19.22,2014,4,16,2014-04-16,2,2013-II,II,0
78476,MATARANI,TASA 44,16/04/2014 04:00,16/04/2014 08:39,16/04/2014 10:50,16/04/2014 13:32,16/04/2014 21:06,17/04/2014 00:36,17/04/2014 03:13,401.545,Tradicional,399.94,100,2,12.45,15.95,12.02,15.52,23.93,0.0,13.34,15.95,4.72,3.81,18.68,2014,4,16,2014-04-16,2,2013-II,II,1
78477,MATARANI,TASA 45,16/04/2014 08:00,16/04/2014 08:40,16/04/2014 11:00,16/04/2014 12:53,16/04/2014 19:30,16/04/2014 21:00,17/04/2014 00:20,370.075,Tradicional,364.84,101,2,10.83,12.33,10.3,11.8,23.27,0.0,14.43,17.73,4.72,3.81,19.31,2014,4,16,2014-04-16,2,2013-II,II,1
78479,ILO,TASA 416,16/04/2014 05:00,16/04/2014 08:00,16/04/2014 08:10,16/04/2014 12:13,16/04/2014 13:13,16/04/2014 21:31,16/04/2014 22:24,36.9,Tradicional,421.36,9,1,5.22,13.52,5.22,13.52,21.32,0.0,14.76,19.51,5.74,3.67,21.0,2014,4,16,2014-04-16,2,2013-II,II,0
78480,ILO,TASA 411,16/04/2014 05:00,16/04/2014 07:50,16/04/2014 08:10,16/04/2014 12:12,16/04/2014 12:57,16/04/2014 18:59,16/04/2014 20:02,50.62,Tradicional,444.09,11,1,5.12,11.15,5.12,11.15,22.43,0.0,15.09,20.98,5.74,3.67,20.4,2014,4,16,2014-04-16,2,2013-II,II,0
78481,MATARANI,TASA 34,16/04/2014 05:00,16/04/2014 07:11,16/04/2014 07:40,16/04/2014 09:52,16/04/2014 15:48,16/04/2014 16:32,16/04/2014 17:38,131.83,Tradicional,334.38,39,1,8.62,9.35,8.62,9.35,16.94,0.0,14.64,20.81,4.72,3.81,20.0,2014,4,16,2014-04-16,2,2013-II,II,1
78485,ILO,TASA 43,16/04/2014 05:00,16/04/2014 06:50,16/04/2014 07:02,16/04/2014 12:30,16/04/2014 12:40,16/04/2014 18:14,16/04/2014 18:56,66.17,Tradicional,401.08,16,1,5.83,11.4,5.83,11.4,23.28,0.0,15.2,21.72,5.74,3.67,20.5,2014,4,16,2014-04-16,2,2013-II,II,1
78520,ATICO,TASA 415,17/04/2014 06:00,17/04/2014 06:50,17/04/2014 07:12,17/04/2014 16:40,17/04/2014 17:45,18/04/2014 02:17,18/04/2014 03:36,95.63,Tradicional,435.8,22,2,10.92,19.45,9.47,18.0,24.85,1.83,13.52,18.66,5.07,3.77,16.42,2014,4,17,2014-04-17,2,2013-II,II,1
78521,ILO,TASA 411,18/04/2014 01:00,18/04/2014 02:50,18/04/2014 04:03,18/04/2014 09:41,18/04/2014 13:05,18/04/2014 18:32,18/04/2014 22:22,191.395,Tradicional,444.09,43,3,10.25,15.7,8.04,13.49,26.88,4.41,14.04,17.19,5.61,3.79,19.27,2014,4,18,2014-04-18,2,2013-II,II,0
78522,MATARANI,TASA 416,17/04/2014 05:00,17/04/2014 06:00,17/04/2014 06:15,17/04/2014 13:11,17/04/2014 18:45,17/04/2014 18:59,17/04/2014 19:52,97.635,Tradicional,421.36,23,2,12.75,12.98,11.52,11.76,19.7,0.0,13.96,18.33,5.06,3.84,19.45,2014,4,17,2014-04-17,2,2013-II,II,0
78523,ATICO,TASA 43,17/04/2014 05:00,17/04/2014 06:00,17/04/2014 07:30,17/04/2014 15:40,17/04/2014 17:10,18/04/2014 03:38,18/04/2014 05:10,130.67,Tradicional,401.08,33,3,11.17,21.63,7.26,17.73,27.01,9.4,13.31,17.24,5.07,3.77,17.11,2014,4,17,2014-04-17,2,2013-II,II,1
78524,ILO,TASA 210,17/04/2014 05:00,17/04/2014 07:00,17/04/2014 07:35,17/04/2014 12:42,17/04/2014 14:41,17/04/2014 19:56,17/04/2014 21:26,145.255,Tradicional,290.58,50,1,7.68,12.93,7.68,12.93,25.43,0.0,14.94,18.81,6.73,3.43,18.83,2014,4,17,2014-04-17,2,2013-II,II,0
78525,ILO,TASA 111,17/04/2014 05:00,17/04/2014 06:50,17/04/2014 07:20,17/04/2014 12:41,17/04/2014 14:53,17/04/2014 20:22,17/04/2014 21:13,55.555,Tradicional,189.81,29,2,8.05,13.53,7.08,12.56,19.28,0.0,14.69,19.2,6.73,3.43,20.33,2014,4,17,2014-04-17,2,2013-II,II,0
78526,MATARANI,TASA 17,17/04/2014 04:00,17/04/2014 08:21,17/04/2014 09:10,17/04/2014 09:38,17/04/2014 19:15,17/04/2014 19:29,17/04/2014 21:25,176.24,Tradicional,193.69,91,1,10.9,11.13,10.9,11.13,17.92,0.0,13.78,18.19,5.06,3.84,18.92,2014,4,17,2014-04-17,2,2013-II,II,0
78539,MATARANI,TASA 45,18/04/2014 05:00,18/04/2014 06:20,18/04/2014 08:20,18/04/2014 09:08,18/04/2014 17:23,18/04/2014 18:42,18/04/2014 19:42,137.64,Tradicional,364.84,38,1,11.05,12.37,11.05,12.37,22.47,13.51,12.56,12.95,5.69,3.81,17.2,2014,4,18,2014-04-18,2,2013-II,II,1
78541,MATARANI,TASA 35,18/04/2014 05:00,18/04/2014 06:05,18/04/2014 07:15,18/04/2014 18:56,19/04/2014 01:43,19/04/2014 02:34,19/04/2014 05:11,304.99,Tradicional,322.75,94,4,19.63,20.48,15.5,16.35,23.77,2.22,13.13,15.4,5.69,3.81,17.51,2014,4,18,2014-04-18,2,2013-II,II,1
78542,MATARANI,TASA 38,18/04/2014 04:38,18/04/2014 06:50,18/04/2014 07:35,18/04/2014 10:12,18/04/2014 16:26,18/04/2014 17:00,18/04/2014 18:12,151.83,Tradicional,322.06,47,1,9.6,10.17,9.6,10.17,23.92,0.0,14.26,19.04,5.69,3.81,20.1,2014,4,18,2014-04-18,2,2013-II,II,0
78543,MATARANI,TASA 220,18/04/2014 05:00,18/04/2014 06:15,18/04/2014 08:10,18/04/2014 13:46,19/04/2014 00:15,19/04/2014 01:54,19/04/2014 03:47,138.445,Tradicional,213.26,65,3,18.0,19.65,16.3,17.95,23.2,9.68,12.58,14.09,5.69,3.81,17.39,2014,4,18,2014-04-18,2,2013-II,II,0
78544,ATICO,TASA 61,17/04/2014 05:00,17/04/2014 12:30,17/04/2014 13:40,17/04/2014 16:30,17/04/2014 17:30,18/04/2014 01:25,18/04/2014 02:09,39.89,Tradicional,590.91,7,1,5.0,12.92,5.0,12.92,19.63,4.0,13.26,16.41,5.07,3.77,16.8,2014,4,17,2014-04-17,2,2013-II,II,1
78545,MATARANI,TASA 418,18/04/2014 05:00,18/04/2014 06:33,18/04/2014 08:00,18/04/2014 15:45,18/04/2014 23:32,18/04/2014 23:57,19/04/2014 01:15,114.13,Tradicional,430.91,26,3,16.98,17.4,14.87,15.29,21.6,2.22,13.24,16.34,5.69,3.81,17.7,2014,4,18,2014-04-18,2,2013-II,II,0
78546,ILO,TASA 44,18/04/2014 03:36,18/04/2014 03:54,18/04/2014 04:02,18/04/2014 08:43,18/04/2014 14:18,18/04/2014 21:33,18/04/2014 23:17,183.745,Tradicional,399.94,46,2,10.4,17.65,8.56,15.81,29.94,0.0,15.12,20.88,5.61,3.79,19.04,2014,4,18,2014-04-18,2,2013-II,II,1
78574,ILO,TASA 37,18/04/2014 02:00,18/04/2014 04:50,18/04/2014 05:15,18/04/2014 10:11,18/04/2014 12:31,18/04/2014 17:27,18/04/2014 18:39,106.11,Tradicional,321.56,33,2,7.68,12.62,6.77,11.7,19.93,6.54,13.74,14.95,5.61,3.79,19.25,2014,4,18,2014-04-18,2,2013-II,II,1
78575,ILO,TASA 310,18/04/2014 02:11,18/04/2014 06:20,18/04/2014 06:40,18/04/2014 11:00,18/04/2014 11:42,18/04/2014 14:57,18/04/2014 15:48,48.495,Tradicional,336.4,14,1,5.37,8.62,5.37,8.62,19.6,6.02,13.89,16.05,5.61,3.79,19.8,2014,4,18,2014-04-18,2,2013-II,II,0
78577,ILO,TASA 416,18/04/2014 04:00,18/04/2014 06:50,18/04/2014 07:00,18/04/2014 12:20,18/04/2014 13:02,18/04/2014 17:43,18/04/2014 18:30,23.09,Tradicional,421.36,5,1,6.2,10.88,6.2,10.88,29.37,2.14,13.74,15.41,5.61,3.79,20.8,2014,4,18,2014-04-18,2,2013-II,II,0
78578,ILO,TASA 17,19/04/2014 05:00,19/04/2014 06:12,19/04/2014 06:55,19/04/2014 10:27,19/04/2014 11:07,19/04/2014 12:43,19/04/2014 14:08,133.585,Tradicional,193.69,69,1,4.92,6.52,4.92,6.52,18.9,1.2,14.63,18.92,6.89,3.55,19.36,2014,4,19,2014-04-19,2,2013-II,II,0
78580,ILO,TASA 210,18/04/2014 04:00,18/04/2014 06:35,18/04/2014 06:50,18/04/2014 12:23,18/04/2014 12:08,18/04/2014 17:08,18/04/2014 17:40,22.065,Tradicional,290.58,8,1,5.55,10.55,5.55,10.55,19.99,0.0,14.12,19.62,5.61,3.79,18.83,2014,4,18,2014-04-18,2,2013-II,II,0
78581,ILO,TASA 111,18/04/2014 04:00,18/04/2014 05:23,18/04/2014 05:40,18/04/2014 10:52,18/04/2014 11:40,18/04/2014 14:02,18/04/2014 15:07,82.105,Tradicional,189.81,43,2,6.28,8.65,5.14,7.5,20.18,3.08,13.89,18.27,5.61,3.79,22.63,2014,4,18,2014-04-18,2,2013-II,II,0
78583,ATICO,TASA 61,18/04/2014 05:00,18/04/2014 05:45,18/04/2014 07:00,18/04/2014 13:00,18/04/2014 13:50,18/04/2014 22:01,18/04/2014 23:39,130.495,Tradicional,590.91,22,2,8.08,16.27,6.94,15.12,23.63,2.36,13.79,16.23,5.29,4.03,16.47,2014,4,18,2014-04-18,2,2013-II,II,1
78584,MATARANI,TASA 415,18/04/2014 04:00,18/04/2014 06:10,18/04/2014 08:15,18/04/2014 13:38,18/04/2014 23:06,18/04/2014 23:25,19/04/2014 01:58,318.39,Tradicional,435.8,73,2,16.93,17.25,13.08,13.4,19.85,3.3,12.9,15.02,5.69,3.81,16.53,2014,4,18,2014-04-18,2,2013-II,II,1
78585,ATICO,TASA 43,18/04/2014 06:30,18/04/2014 09:00,18/04/2014 10:30,18/04/2014 13:26,18/04/2014 14:20,18/04/2014 23:39,19/04/2014 01:01,155.625,Tradicional,401.08,39,2,5.33,14.65,4.27,13.59,22.11,3.25,13.76,16.27,5.29,4.03,17.16,2014,4,18,2014-04-18,2,2013-II,II,1
78665,ILO,TASA 111,20/04/2014 05:00,20/04/2014 07:40,20/04/2014 09:40,20/04/2014 12:51,20/04/2014 13:27,20/04/2014 17:22,20/04/2014 18:19,78.675,Tradicional,189.81,41,1,5.78,9.7,5.78,9.7,18.25,7.84,13.36,15.08,6.05,3.59,18.83,2014,4,20,2014-04-20,2,2013-II,II,0
78666,MATARANI,TASA 416,20/04/2014 06:00,20/04/2014 06:40,20/04/2014 08:10,20/04/2014 14:45,20/04/2014 18:30,20/04/2014 21:01,20/04/2014 23:49,395.945,Tradicional,421.36,94,3,11.83,14.35,8.03,10.55,21.22,1.11,12.89,13.33,4.17,3.86,18.33,2014,4,20,2014-04-20,2,2013-II,II,0
78668,MATARANI,TASA 411,20/04/2014 06:00,20/04/2014 06:40,20/04/2014 08:05,20/04/2014 10:51,20/04/2014 14:15,20/04/2014 15:31,20/04/2014 18:08,336.115,Tradicional,444.09,76,2,7.58,8.85,6.2,7.47,17.56,2.2,13.03,14.95,4.17,3.86,17.44,2014,4,20,2014-04-20,2,2013-II,II,0
78669,MATARANI,TASA 44,20/04/2014 06:00,20/04/2014 07:05,20/04/2014 08:20,20/04/2014 14:45,20/04/2014 20:19,20/04/2014 23:59,21/04/2014 01:53,171.575,Tradicional,399.94,43,3,13.23,16.9,10.78,14.45,27.88,0.0,13.06,17.44,4.17,3.86,17.52,2014,4,20,2014-04-20,2,2013-II,II,1
78670,ILO,TASA 17,20/04/2014 05:00,20/04/2014 07:10,20/04/2014 08:28,20/04/2014 12:52,20/04/2014 12:55,20/04/2014 16:09,20/04/2014 16:55,52.3,Tradicional,193.69,27,1,5.75,8.98,5.75,8.98,20.86,1.33,14.51,15.8,6.05,3.59,19.6,2014,4,20,2014-04-20,2,2013-II,II,0
78674,MATARANI,TASA 37,20/04/2014 06:30,20/04/2014 07:30,20/04/2014 08:50,20/04/2014 14:54,20/04/2014 18:10,20/04/2014 18:57,20/04/2014 20:10,136.735,Tradicional,321.56,43,3,10.67,11.45,8.19,8.98,23.4,0.0,13.58,17.25,4.17,3.86,18.03,2014,4,20,2014-04-20,2,2013-II,II,1
78675,MATARANI,TASA 38,20/04/2014 06:00,20/04/2014 06:50,20/04/2014 08:26,20/04/2014 12:32,20/04/2014 16:34,20/04/2014 17:18,20/04/2014 19:02,219.105,Tradicional,322.06,68,3,9.73,10.47,8.71,9.44,16.49,0.0,13.61,17.09,4.17,3.86,19.48,2014,4,20,2014-04-20,2,2013-II,II,0
78676,ILO,TASA 34,20/04/2014 05:00,20/04/2014 07:10,20/04/2014 08:10,20/04/2014 12:20,20/04/2014 12:45,20/04/2014 15:19,20/04/2014 15:58,21.03,Tradicional,334.38,6,1,5.58,8.15,5.58,8.15,17.98,6.9,13.78,19.12,6.05,3.59,20.0,2014,4,20,2014-04-20,2,2013-II,II,1
78677,MATARANI,TASA 310,20/04/2014 07:00,20/04/2014 08:00,20/04/2014 09:30,20/04/2014 15:27,20/04/2014 18:17,20/04/2014 19:20,20/04/2014 20:30,144.745,Tradicional,336.4,43,2,10.28,11.33,9.12,10.17,25.12,0.0,13.31,15.7,4.17,3.86,19.2,2014,4,20,2014-04-20,2,2013-II,II,0
78678,ILO,TASA 210,20/04/2014 05:00,20/04/2014 08:00,20/04/2014 09:30,20/04/2014 12:32,20/04/2014 13:20,20/04/2014 16:42,20/04/2014 17:20,11.245,Tradicional,290.58,4,1,5.33,8.7,5.33,8.7,17.24,0.0,13.99,16.17,6.05,3.59,18.83,2014,4,20,2014-04-20,2,2013-II,II,0
78679,MATARANI,TASA 45,21/04/2014 08:00,21/04/2014 09:20,21/04/2014 10:09,21/04/2014 17:18,21/04/2014 21:43,21/04/2014 23:32,22/04/2014 01:37,353.695,Tradicional,364.84,97,4,12.38,14.2,10.08,11.9,22.25,10.31,12.69,14.0,4.02,3.92,17.16,2014,4,21,2014-04-21,2,2013-II,II,1
78682,MATARANI,TASA 413,21/04/2014 08:00,21/04/2014 08:00,21/04/2014 09:45,21/04/2014 17:49,21/04/2014 22:43,22/04/2014 00:52,22/04/2014 02:23,154.215,Tradicional,447.5,34,2,14.72,16.87,11.72,13.87,24.74,16.16,12.4,12.61,4.02,3.92,17.65,2014,4,21,2014-04-21,2,2013-II,II,0
78713,MATARANI,TASA 34,21/04/2014 07:00,21/04/2014 07:45,21/04/2014 09:20,21/04/2014 15:27,21/04/2014 20:54,21/04/2014 21:32,21/04/2014 23:00,166.995,Tradicional,334.38,50,4,13.15,13.78,9.97,10.6,20.73,8.79,12.76,13.82,4.02,3.92,18.83,2014,4,21,2014-04-21,2,2013-II,II,1
78716,ILO,TASA 111,21/04/2014 02:00,21/04/2014 03:00,21/04/2014 07:00,21/04/2014 15:49,21/04/2014 17:10,21/04/2014 20:19,21/04/2014 21:30,76.89,Tradicional,189.81,41,2,14.17,17.32,5.87,9.02,23.28,0.0,13.93,15.47,5.78,3.57,16.1,2014,4,21,2014-04-21,2,2013-II,II,0
78720,ATICO,TASA 415,21/04/2014 10:00,21/04/2014 12:55,21/04/2014 13:55,21/04/2014 18:09,21/04/2014 23:10,22/04/2014 04:35,22/04/2014 05:59,118.97,Tradicional,435.8,27,3,10.25,15.67,8.22,13.64,28.46,9.68,13.23,18.97,6.11,3.98,16.71,2014,4,21,2014-04-21,2,2013-II,II,1
78722,MATARANI,TASA 418,21/04/2014 10:00,21/04/2014 11:00,21/04/2014 12:10,21/04/2014 17:39,21/04/2014 23:00,21/04/2014 23:16,22/04/2014 00:36,147.375,Tradicional,430.91,34,4,12.0,12.27,9.49,9.75,23.87,4.44,12.83,14.54,4.02,3.92,18.85,2014,4,21,2014-04-21,2,2013-II,II,0
78725,ATICO,TASA 220,21/04/2014 09:00,21/04/2014 10:30,21/04/2014 11:40,21/04/2014 18:18,21/04/2014 23:28,22/04/2014 06:09,22/04/2014 07:08,93.235,Tradicional,213.26,44,3,12.97,19.65,10.19,16.88,36.86,1.52,14.39,15.39,6.11,3.98,16.86,2014,4,21,2014-04-21,2,2013-II,II,0
78726,ATICO,TASA 35,21/04/2014 08:00,21/04/2014 13:00,21/04/2014 14:20,21/04/2014 17:48,21/04/2014 22:50,22/04/2014 02:59,22/04/2014 05:01,89.415,Tradicional,322.75,28,2,9.83,13.98,8.68,12.83,25.17,16.79,12.61,14.03,6.11,3.98,17.75,2014,4,21,2014-04-21,2,2013-II,II,1
78737,MATARANI,TASA 38,22/04/2014 09:30,22/04/2014 10:40,22/04/2014 10:55,22/04/2014 15:26,22/04/2014 22:58,22/04/2014 23:10,23/04/2014 00:55,224.005,Tradicional,322.06,70,3,12.3,12.5,10.66,10.86,23.68,1.11,13.07,16.1,5.08,3.82,19.31,2014,4,22,2014-04-22,2,2013-II,II,0
78738,MATARANI,TASA 310,22/04/2014 05:00,22/04/2014 07:30,22/04/2014 07:50,22/04/2014 18:36,23/04/2014 04:10,23/04/2014 07:16,23/04/2014 08:53,180.69,Tradicional,336.4,54,3,20.67,23.77,17.72,20.82,27.93,6.59,12.45,12.28,5.08,3.82,19.71,2014,4,22,2014-04-22,2,2013-II,II,0
78740,MATARANI,TASA 37,22/04/2014 09:00,22/04/2014 10:05,22/04/2014 10:37,22/04/2014 15:41,22/04/2014 23:00,22/04/2014 23:41,23/04/2014 02:04,278.45,Tradicional,321.56,87,2,12.92,13.6,11.6,12.28,25.46,0.0,13.81,18.72,5.08,3.82,18.95,2014,4,22,2014-04-22,2,2013-II,II,1
78741,MATARANI,TASA 416,21/04/2014 07:00,21/04/2014 07:50,21/04/2014 09:25,21/04/2014 14:09,21/04/2014 18:20,21/04/2014 18:46,21/04/2014 20:38,222.91,Tradicional,421.36,53,2,10.5,10.93,9.22,9.66,17.77,0.0,13.31,16.11,4.02,3.92,18.77,2014,4,21,2014-04-21,2,2013-II,II,0
78742,ILO,TASA 44,22/04/2014 02:50,22/04/2014 06:30,22/04/2014 07:05,22/04/2014 17:49,23/04/2014 04:14,23/04/2014 04:32,23/04/2014 06:56,328.52,Tradicional,399.94,82,5,21.73,22.03,17.24,17.54,38.0,9.09,12.72,15.0,5.51,3.49,17.01,2014,4,22,2014-04-22,2,2013-II,II,1
78748,ATICO,TASA 43,21/04/2014 09:50,21/04/2014 11:05,21/04/2014 11:15,21/04/2014 17:17,21/04/2014 17:24,21/04/2014 18:50,21/04/2014 19:44,47.24,Tradicional,401.08,12,1,6.32,7.75,6.32,7.75,16.2,7.25,13.29,13.57,6.11,3.98,17.5,2014,4,21,2014-04-21,2,2013-II,II,1
78749,ATICO,TASA 61,21/04/2014 09:30,21/04/2014 12:00,21/04/2014 12:07,21/04/2014 14:23,21/04/2014 15:26,21/04/2014 18:13,21/04/2014 18:39,28.825,Tradicional,590.91,5,1,3.43,6.22,3.43,6.22,14.3,2.94,13.41,15.11,6.11,3.98,17.2,2014,4,21,2014-04-21,2,2013-II,II,1
78777,ATICO,TASA 411,22/04/2014 10:00,22/04/2014 11:15,22/04/2014 11:25,22/04/2014 18:12,22/04/2014 19:48,23/04/2014 00:33,23/04/2014 01:48,117.485,Tradicional,444.09,26,2,8.55,13.3,4.86,9.61,27.72,0.9,14.01,18.36,5.72,3.58,17.55,2014,4,22,2014-04-22,2,2013-II,II,0
78778,ILO,TASA 17,22/04/2014 03:00,22/04/2014 05:33,22/04/2014 06:52,22/04/2014 11:32,22/04/2014 13:15,22/04/2014 14:22,22/04/2014 15:38,114.18,Tradicional,193.69,59,3,7.7,8.82,5.0,6.12,18.85,18.1,12.91,13.03,5.51,3.49,17.95,2014,4,22,2014-04-22,2,2013-II,II,0
78779,ILO,TASA 111,22/04/2014 03:00,22/04/2014 04:30,22/04/2014 04:45,22/04/2014 11:48,22/04/2014 13:25,22/04/2014 15:40,22/04/2014 17:19,117.265,Tradicional,189.81,62,3,8.92,11.17,7.12,9.37,23.32,6.5,13.44,13.7,5.51,3.49,18.88,2014,4,22,2014-04-22,2,2013-II,II,0
78782,MATARANI,TASA 416,22/04/2014 05:30,22/04/2014 07:30,22/04/2014 07:40,22/04/2014 12:18,22/04/2014 19:20,22/04/2014 20:26,22/04/2014 21:44,101.02,Tradicional,421.36,24,2,11.83,12.93,9.31,10.41,23.63,12.9,12.51,13.26,5.08,3.82,18.85,2014,4,22,2014-04-22,2,2013-II,II,0
78783,MATARANI,TASA 34,22/04/2014 09:00,22/04/2014 10:29,22/04/2014 10:45,22/04/2014 19:24,23/04/2014 01:43,23/04/2014 04:59,23/04/2014 07:08,252.03,Tradicional,334.38,75,3,15.23,18.5,12.07,15.34,26.03,0.0,13.55,17.02,5.08,3.82,18.14,2014,4,22,2014-04-22,2,2013-II,II,1
78785,ILO,TASA 210,22/04/2014 03:00,22/04/2014 04:00,22/04/2014 05:30,22/04/2014 13:49,22/04/2014 15:30,22/04/2014 18:30,22/04/2014 20:33,168.485,Tradicional,290.58,58,4,11.5,14.5,8.39,11.39,30.25,7.25,13.15,13.12,5.51,3.49,18.83,2014,4,22,2014-04-22,2,2013-II,II,0
78788,MATARANI,TASA 45,22/04/2014 05:20,22/04/2014 07:00,22/04/2014 07:18,22/04/2014 14:14,22/04/2014 20:20,22/04/2014 21:29,22/04/2014 22:56,231.325,Tradicional,364.84,63,3,13.33,14.48,8.85,10.0,26.84,0.0,13.42,17.12,5.08,3.82,18.64,2014,4,22,2014-04-22,2,2013-II,II,1
78789,MATARANI,TASA 418,22/04/2014 09:00,22/04/2014 10:30,22/04/2014 10:45,22/04/2014 17:56,23/04/2014 00:14,23/04/2014 02:25,23/04/2014 04:54,313.88,Tradicional,430.91,73,3,13.73,15.92,11.02,13.21,25.21,1.12,13.54,18.53,5.08,3.82,19.54,2014,4,22,2014-04-22,2,2013-II,II,0
78790,ATICO,TASA 413,22/04/2014 09:50,22/04/2014 11:05,22/04/2014 11:35,22/04/2014 14:56,22/04/2014 19:17,22/04/2014 23:45,23/04/2014 00:27,112.98,Tradicional,447.5,25,1,8.2,12.67,8.2,12.67,25.43,0.0,13.97,21.22,5.72,3.58,19.4,2014,4,22,2014-04-22,2,2013-II,II,0
78791,ILO,TASA 43,22/04/2014 05:00,22/04/2014 06:50,22/04/2014 07:55,22/04/2014 14:59,23/04/2014 02:15,23/04/2014 02:45,23/04/2014 05:32,341.805,Tradicional,401.08,85,4,19.42,19.92,14.64,15.14,30.56,0.0,14.22,16.46,5.51,3.49,18.29,2014,4,22,2014-04-22,2,2013-II,II,1
78792,ATICO,TASA 61,22/04/2014 05:00,22/04/2014 07:18,22/04/2014 07:23,22/04/2014 14:56,22/04/2014 19:17,22/04/2014 20:27,22/04/2014 22:51,421.525,Tradicional,590.91,71,3,11.98,13.15,7.26,8.43,28.23,0.0,14.77,20.29,5.72,3.58,18.87,2014,4,22,2014-04-22,2,2013-II,II,1
78793,MATARANI,TASA 35,22/04/2014 09:00,22/04/2014 11:00,22/04/2014 11:20,22/04/2014 18:30,23/04/2014 02:52,23/04/2014 06:18,23/04/2014 08:34,251.695,Tradicional,322.75,78,3,15.87,19.3,12.84,16.27,23.51,0.0,13.4,16.8,5.08,3.82,18.01,2014,4,22,2014-04-22,2,2013-II,II,1
78805,MATARANI,TASA 415,22/04/2014 09:00,22/04/2014 10:51,22/04/2014 11:05,22/04/2014 17:24,23/04/2014 00:15,23/04/2014 03:42,23/04/2014 06:08,315.235,Tradicional,435.8,72,3,13.4,16.85,10.17,13.62,24.74,0.0,13.66,17.69,5.08,3.82,18.12,2014,4,22,2014-04-22,2,2013-II,II,1
78839,MATARANI,TASA 45,23/04/2014 08:00,23/04/2014 09:37,23/04/2014 10:09,23/04/2014 17:27,23/04/2014 23:15,24/04/2014 04:21,24/04/2014 06:37,325.815,Tradicional,364.84,89,4,13.63,18.73,11.03,16.13,28.0,11.67,12.27,21.52,5.11,3.96,17.5,2014,4,23,2014-04-23,2,2013-II,II,1
78842,MATARANI,TASA 416,23/04/2014 06:20,23/04/2014 08:10,23/04/2014 08:50,23/04/2014 13:27,23/04/2014 20:26,23/04/2014 21:17,23/04/2014 23:46,303.655,Tradicional,421.36,72,3,12.27,13.12,10.72,11.57,20.36,20.21,12.38,13.69,5.11,3.96,17.43,2014,4,23,2014-04-23,2,2013-II,II,0
78844,ATICO,TASA 38,23/04/2014 06:00,23/04/2014 08:50,23/04/2014 09:10,23/04/2014 14:46,23/04/2014 17:12,23/04/2014 20:02,23/04/2014 20:46,111.895,Tradicional,322.06,35,1,8.37,11.2,8.37,11.2,22.8,10.18,12.83,12.55,5.76,3.71,18.1,2014,4,23,2014-04-23,2,2013-II,II,0
78847,PISCO SUR,TASA 412,23/04/2014 05:30,23/04/2014 07:10,23/04/2014 07:35,23/04/2014 16:07,23/04/2014 18:02,23/04/2014 19:40,23/04/2014 22:07,306.1,Tradicional,402.44,76,3,10.87,12.5,7.7,9.33,20.32,3.39,13.36,16.1,5.35,3.39,17.28,2014,4,23,2014-04-23,1,2013-II,II,0
78849,PISCO NORTE,TASA 426,23/04/2014 06:30,23/04/2014 08:30,23/04/2014 08:45,23/04/2014 16:06,23/04/2014 18:28,23/04/2014 19:22,23/04/2014 21:54,203.925,Tradicional,397.33,51,3,9.97,10.87,7.98,8.88,28.0,8.0,13.73,17.61,6.09,3.61,17.87,2014,4,23,2014-04-23,1,2013-II,II,0
78850,PISCO SUR,TASA 417,23/04/2014 06:10,23/04/2014 08:00,23/04/2014 08:30,23/04/2014 14:16,23/04/2014 16:38,23/04/2014 18:15,23/04/2014 20:54,351.56,Tradicional,441.12,80,3,8.63,10.25,6.12,7.73,19.18,8.82,13.42,16.98,5.35,3.39,18.29,2014,4,23,2014-04-23,1,2013-II,II,0
78851,PISCO SUR,TASA 31,24/04/2014 00:00,24/04/2014 07:30,24/04/2014 08:20,24/04/2014 09:18,24/04/2014 12:15,24/04/2014 13:52,24/04/2014 15:46,212.645,Tradicional,325.29,65,1,4.75,6.37,4.75,6.37,17.36,2.86,13.07,16.05,6.54,4.02,17.2,2014,4,24,2014-04-24,1,2013-II,II,0
78852,CALLAO,TASA 218,23/04/2014 04:30,23/04/2014 11:30,23/04/2014 11:38,23/04/2014 12:30,23/04/2014 14:47,23/04/2014 17:50,23/04/2014 18:11,34.57,Tradicional,201.81,17,1,3.28,6.33,3.28,6.33,19.97,21.15,12.83,19.48,10.23,4.47,18.0,2014,4,23,2014-04-23,1,2013-II,II,1
78853,CALLAO,TASA 414,23/04/2014 04:30,23/04/2014 10:30,23/04/2014 10:55,23/04/2014 12:30,23/04/2014 13:50,23/04/2014 15:36,23/04/2014 17:16,87.045,Tradicional,424.12,21,1,3.33,5.1,3.33,5.1,18.0,10.0,13.28,20.34,10.23,4.47,17.1,2014,4,23,2014-04-23,1,2013-II,II,1
78855,MATARANI,TASA 411,23/04/2014 05:00,23/04/2014 05:50,23/04/2014 06:10,23/04/2014 14:18,23/04/2014 21:15,23/04/2014 23:05,24/04/2014 01:11,288.06,Tradicional,444.09,65,4,15.42,17.25,12.04,13.88,21.37,13.98,12.6,14.18,5.11,3.96,17.47,2014,4,23,2014-04-23,2,2013-II,II,0
78856,ATICO,TASA 61,23/04/2014 05:00,23/04/2014 06:30,23/04/2014 08:00,23/04/2014 15:03,23/04/2014 18:32,23/04/2014 22:02,24/04/2014 02:21,383.4,Tradicional,590.91,65,3,12.03,15.53,9.16,12.66,32.0,4.5,13.38,18.07,5.76,3.71,17.17,2014,4,23,2014-04-23,2,2013-II,II,1
78857,MATARANI,TASA 413,23/04/2014 05:00,23/04/2014 07:10,23/04/2014 07:40,23/04/2014 13:26,23/04/2014 19:47,23/04/2014 20:03,23/04/2014 22:44,398.735,Tradicional,447.5,89,2,12.62,12.88,10.62,10.88,21.26,7.78,13.02,15.72,5.11,3.96,18.2,2014,4,23,2014-04-23,2,2013-II,II,0
78864,CALLAO,TASA 315,23/04/2014 04:30,23/04/2014 10:20,23/04/2014 10:40,23/04/2014 12:15,23/04/2014 13:38,23/04/2014 14:52,23/04/2014 15:24,34.045,Tradicional,360.91,9,1,3.3,4.53,3.3,4.53,17.52,10.64,13.13,19.93,10.23,4.47,18.0,2014,4,23,2014-04-23,1,2013-II,II,0
78874,ATICO,TASA 37,23/04/2014 09:00,23/04/2014 10:30,23/04/2014 11:00,23/04/2014 15:56,23/04/2014 19:21,23/04/2014 22:36,24/04/2014 00:02,175.715,Tradicional,321.56,55,3,8.85,12.1,7.41,10.66,24.98,15.65,12.74,17.71,5.76,3.71,17.91,2014,4,23,2014-04-23,2,2013-II,II,1
78877,ATICO,TASA 418,23/04/2014 13:00,23/04/2014 14:13,23/04/2014 14:30,23/04/2014 15:12,23/04/2014 18:15,23/04/2014 20:51,23/04/2014 21:40,84.125,Tradicional,430.91,20,1,4.03,6.63,4.03,6.63,13.8,11.03,12.58,14.42,5.76,3.71,18.4,2014,4,23,2014-04-23,2,2013-II,II,0
78879,ATICO,TASA 415,23/04/2014 12:00,23/04/2014 13:48,23/04/2014 13:50,23/04/2014 15:09,23/04/2014 18:17,23/04/2014 21:16,23/04/2014 21:59,40.585,Tradicional,435.8,9,1,4.48,7.47,4.48,7.47,16.02,17.42,12.76,15.78,5.76,3.71,17.8,2014,4,23,2014-04-23,2,2013-II,II,1
78895,CALLAO,TASA 419,23/04/2014 23:00,24/04/2014 07:00,24/04/2014 07:30,24/04/2014 16:00,25/04/2014 04:59,25/04/2014 17:04,25/04/2014 19:46,299.84,Frio,427.78,70,3,21.98,34.07,19.32,7.4,34.56,24.62,12.05,14.25,6.5,3.5,17.4,2014,4,24,2014-04-24,1,2013-II,II,0
78911,MATARANI,TASA 111,24/04/2014 06:30,24/04/2014 08:51,24/04/2014 09:10,24/04/2014 14:28,24/04/2014 20:54,25/04/2014 07:23,25/04/2014 08:53,131.635,Tradicional,189.81,69,3,12.05,22.53,9.44,19.93,44.75,0.0,13.36,15.71,5.02,3.89,18.35,2014,4,24,2014-04-24,2,2013-II,II,0
78912,MATARANI,TASA 210,24/04/2014 05:01,24/04/2014 09:10,24/04/2014 09:35,24/04/2014 16:52,24/04/2014 23:26,25/04/2014 04:22,25/04/2014 07:09,239.52,Tradicional,290.58,82,4,14.27,19.2,11.42,16.35,28.65,9.89,12.35,16.25,5.02,3.89,18.83,2014,4,24,2014-04-24,2,2013-II,II,0
78913,ATICO,TASA 44,24/04/2014 07:10,24/04/2014 08:57,24/04/2014 09:17,24/04/2014 16:52,24/04/2014 19:11,24/04/2014 19:59,24/04/2014 22:16,313.18,Tradicional,399.94,78,3,10.23,11.03,7.19,7.99,23.01,10.79,13.03,14.22,5.29,3.66,18.46,2014,4,24,2014-04-24,2,2013-II,II,1
78916,ATICO,TASA 43,24/04/2014 09:00,24/04/2014 10:15,24/04/2014 10:30,24/04/2014 18:25,24/04/2014 20:40,25/04/2014 02:33,25/04/2014 06:03,325.32,Tradicional,401.08,81,4,10.42,16.3,7.21,13.09,32.74,12.7,13.24,15.23,5.29,3.66,19.04,2014,4,24,2014-04-24,2,2013-II,II,1
78917,MATARANI,TASA 35,24/04/2014 06:30,24/04/2014 08:40,24/04/2014 09:00,24/04/2014 16:20,24/04/2014 23:40,25/04/2014 09:02,25/04/2014 11:58,310.715,Tradicional,322.75,96,5,15.0,24.37,12.38,13.02,45.91,0.0,13.54,15.6,4.65,4.08,18.35,2014,4,24,2014-04-24,2,2013-II,II,1
78918,MATARANI,TASA 34,24/04/2014 06:30,24/04/2014 08:58,24/04/2014 09:10,24/04/2014 14:49,24/04/2014 20:20,24/04/2014 23:36,25/04/2014 01:59,287.445,Tradicional,334.38,86,2,11.37,14.63,7.85,11.11,21.85,0.0,13.29,16.34,5.02,3.89,19.12,2014,4,24,2014-04-24,2,2013-II,II,1
78919,MATARANI,TASA 17,24/04/2014 07:40,24/04/2014 09:25,24/04/2014 10:25,24/04/2014 10:53,24/04/2014 17:57,24/04/2014 18:03,24/04/2014 19:31,179.61,Tradicional,193.69,93,1,8.53,8.63,8.53,8.63,16.57,0.0,13.42,16.19,5.02,3.89,18.5,2014,4,24,2014-04-24,2,2013-II,II,0
78920,MATARANI,TASA 310,24/04/2014 08:40,24/04/2014 10:00,24/04/2014 10:40,24/04/2014 13:15,24/04/2014 20:00,24/04/2014 21:10,24/04/2014 23:13,322.13,Tradicional,336.4,96,2,10.0,11.17,9.38,10.54,16.75,0.0,13.27,15.74,5.02,3.89,19.38,2014,4,24,2014-04-24,2,2013-II,II,0
78921,PISCO NORTE,TASA 425,23/04/2014 04:00,23/04/2014 06:19,23/04/2014 08:00,23/04/2014 14:15,23/04/2014 16:38,23/04/2014 17:21,23/04/2014 20:19,380.555,Tradicional,403.95,94,3,10.32,11.03,8.89,9.61,23.0,2.0,13.67,17.14,6.09,3.61,17.6,2014,4,23,2014-04-23,1,2013-II,II,1
78925,ILO,TASA 413,24/04/2014 08:00,24/04/2014 09:05,24/04/2014 09:38,24/04/2014 17:00,25/04/2014 04:18,25/04/2014 05:30,25/04/2014 08:19,326.0,Tradicional,447.5,73,3,19.22,20.42,15.28,16.48,43.9,0.0,13.96,15.98,5.05,3.74,19.47,2014,4,24,2014-04-24,2,2013-II,II,0
78926,PISCO SUR,TASA 414,24/04/2014 08:00,24/04/2014 12:25,24/04/2014 13:16,24/04/2014 13:26,24/04/2014 15:36,24/04/2014 17:01,24/04/2014 19:46,303.685,Tradicional,424.12,72,1,3.18,4.6,3.18,4.6,17.22,5.47,13.22,17.29,6.54,4.02,17.4,2014,4,24,2014-04-24,1,2013-II,II,1
78927,ILO,TASA 416,24/04/2014 05:30,24/04/2014 07:15,24/04/2014 07:30,24/04/2014 14:49,25/04/2014 01:00,25/04/2014 01:31,25/04/2014 03:51,317.935,Tradicional,421.36,75,4,17.75,18.27,14.22,14.74,27.27,0.45,14.01,16.45,5.05,3.74,18.64,2014,4,24,2014-04-24,2,2013-II,II,0
78928,MATARANI,TASA 37,24/04/2014 05:00,24/04/2014 06:34,24/04/2014 07:10,24/04/2014 13:38,25/04/2014 00:06,25/04/2014 13:35,25/04/2014 16:54,264.295,Tradicional,321.56,82,2,17.53,31.02,14.21,3.69,47.47,2.27,13.21,14.15,4.65,4.08,19.3,2014,4,24,2014-04-24,2,2013-II,II,1
78929,CALLAO,TASA 41,24/04/2014 07:20,24/04/2014 09:21,24/04/2014 09:51,24/04/2014 15:12,25/04/2014 03:39,25/04/2014 12:26,25/04/2014 14:57,348.925,Frio,481.1,73,2,18.3,27.08,17.43,2.21,29.89,2.04,13.53,19.9,6.5,3.5,17.83,2014,4,24,2014-04-24,1,2013-II,II,0
78930,PISCO SUR,TASA 218,24/04/2014 09:40,24/04/2014 13:21,24/04/2014 14:00,24/04/2014 14:38,24/04/2014 17:20,24/04/2014 19:51,24/04/2014 22:12,158.135,Tradicional,201.81,78,1,3.98,6.5,3.98,6.5,20.98,0.0,14.46,20.8,6.54,4.02,18.1,2014,4,24,2014-04-24,1,2013-II,II,1
78931,PISCO SUR,TASA 315,24/04/2014 05:40,24/04/2014 07:10,24/04/2014 07:50,24/04/2014 13:34,24/04/2014 15:55,24/04/2014 19:00,24/04/2014 21:15,257.28,Tradicional,360.91,71,3,8.75,11.83,6.8,9.88,21.86,1.63,13.68,17.32,6.54,4.02,17.27,2014,4,24,2014-04-24,1,2013-II,II,0
78932,PISCO SUR,TASA 425,24/04/2014 02:00,24/04/2014 07:29,24/04/2014 08:40,24/04/2014 09:17,24/04/2014 11:30,24/04/2014 13:52,24/04/2014 15:52,317.77,Tradicional,403.95,79,1,4.02,6.38,4.02,6.38,17.86,21.64,12.33,14.29,6.54,4.02,17.4,2014,4,24,2014-04-24,1,2013-II,II,1
78933,PISCO SUR,TASA 426,24/04/2014 06:00,24/04/2014 08:45,24/04/2014 09:00,24/04/2014 14:17,24/04/2014 16:35,24/04/2014 21:26,25/04/2014 00:53,325.31,Tradicional,397.33,82,3,7.83,12.68,5.28,10.13,19.7,0.0,13.99,18.55,6.54,4.02,17.88,2014,4,24,2014-04-24,1,2013-II,II,0
78934,PISCO SUR,TASA 412,24/04/2014 06:40,24/04/2014 09:25,24/04/2014 10:45,24/04/2014 11:49,24/04/2014 14:00,24/04/2014 15:53,24/04/2014 18:51,381.135,Tradicional,402.44,95,1,4.58,6.47,4.58,6.47,16.88,6.45,13.24,18.7,6.54,4.02,17.6,2014,4,24,2014-04-24,1,2013-II,II,0
78935,CALLAO,TASA 420,26/04/2014 05:00,26/04/2014 08:52,26/04/2014 09:30,26/04/2014 09:40,26/04/2014 17:25,26/04/2014 20:20,26/04/2014 23:22,220.73,Tradicional,375.88,59,1,8.55,11.47,8.55,11.47,22.2,0.0,13.27,19.53,9.89,3.6,17.6,2014,4,26,2014-04-26,1,2013-II,II,0
78936,PISCO NORTE,TASA 417,24/04/2014 05:00,24/04/2014 06:00,24/04/2014 07:35,24/04/2014 10:20,24/04/2014 12:25,24/04/2014 14:26,24/04/2014 17:14,345.605,Tradicional,441.12,78,2,6.42,8.43,4.28,6.29,21.0,8.0,13.32,16.02,6.85,3.82,19.25,2014,4,24,2014-04-24,1,2013-II,II,0
78937,MATARANI,TASA 415,24/04/2014 05:30,24/04/2014 08:00,24/04/2014 08:33,24/04/2014 15:00,25/04/2014 00:15,25/04/2014 10:23,25/04/2014 13:29,341.865,Tradicional,435.8,78,3,16.25,26.38,13.72,16.27,46.95,2.22,13.27,15.11,4.65,4.08,18.9,2014,4,24,2014-04-24,2,2013-II,II,1
78938,MATARANI,TASA 418,24/04/2014 06:00,24/04/2014 07:33,24/04/2014 08:00,24/04/2014 15:19,24/04/2014 22:30,25/04/2014 07:17,25/04/2014 10:15,371.18,Tradicional,430.91,86,3,14.95,23.73,12.94,21.72,44.45,6.67,12.93,14.66,5.02,3.89,19.98,2014,4,24,2014-04-24,2,2013-II,II,0
78939,MATARANI,TASA 38,24/04/2014 05:00,24/04/2014 06:35,24/04/2014 07:00,24/04/2014 11:11,24/04/2014 20:25,25/04/2014 02:31,25/04/2014 04:30,272.425,Tradicional,322.06,85,3,13.83,19.93,11.33,17.43,27.38,4.4,12.9,14.78,5.02,3.89,19.73,2014,4,24,2014-04-24,2,2013-II,II,0
78943,ILO,TASA 411,24/04/2014 06:00,24/04/2014 07:20,24/04/2014 07:40,24/04/2014 14:54,25/04/2014 01:00,25/04/2014 02:46,25/04/2014 05:24,319.305,Tradicional,444.09,72,4,17.67,19.43,15.93,17.7,30.69,0.0,13.99,16.28,5.05,3.74,18.12,2014,4,24,2014-04-24,2,2013-II,II,0
78944,PISCO NORTE,TASA 427,24/04/2014 08:00,24/04/2014 11:05,24/04/2014 11:20,24/04/2014 16:25,24/04/2014 17:27,24/04/2014 19:52,24/04/2014 21:43,123.33,Frio,430.11,29,1,6.37,8.78,6.37,8.78,26.0,0.0,14.19,18.76,6.85,3.82,16.5,2014,4,24,2014-04-24,1,2013-II,II,0
78945,ATICO,TASA 61,24/04/2014 08:00,24/04/2014 09:50,24/04/2014 10:06,24/04/2014 16:26,24/04/2014 19:40,25/04/2014 02:36,25/04/2014 05:26,574.055,Tradicional,590.91,97,2,9.83,16.77,7.72,14.65,31.47,2.08,13.95,20.33,5.29,3.66,18.19,2014,4,24,2014-04-24,2,2013-II,II,1
78946,PISCO SUR,TASA 424,24/04/2014 08:00,24/04/2014 10:50,24/04/2014 11:08,24/04/2014 18:09,24/04/2014 19:35,24/04/2014 22:21,24/04/2014 23:11,76.32,Tradicional,403.7,19,2,8.75,11.52,5.8,8.57,19.3,0.0,14.47,19.73,6.54,4.02,18.72,2014,4,24,2014-04-24,1,2013-II,II,0
78997,CALLAO,TASA 45,26/04/2014 01:00,26/04/2014 01:40,26/04/2014 03:25,26/04/2014 07:30,26/04/2014 19:41,26/04/2014 20:35,26/04/2014 22:42,345.365,Tradicional,364.84,95,2,18.02,18.92,16.99,17.89,32.89,0.0,13.44,20.33,9.89,3.6,17.85,2014,4,26,2014-04-26,1,2013-II,II,1
78998,PISCO SUR,TASA 417,25/04/2014 05:10,25/04/2014 07:00,25/04/2014 07:25,25/04/2014 14:42,25/04/2014 17:30,25/04/2014 19:35,25/04/2014 22:12,310.95,Tradicional,441.12,70,3,10.5,12.58,7.99,10.07,19.2,2.55,13.97,19.32,6.49,4.02,17.87,2014,4,25,2014-04-25,1,2013-II,II,0
