marea_id,boat_name,tipo_bodega,owner_group,frio_system_state,tdc_arrival,tvn_discharge,departure_port_date,Fecha_IC,CodUnico,val
,HUACHO 9,Tradicional,,,11.9,19.3,,24/04/2021,HUACHO 9-2021/04/24-19.3,19.3
,HUACHO 9,Tradicional,,,11.9,19.3,,24/04/2021,HUACHO 9-2021/04/24-19.3,19.3
,MODESTO,Tradicional,,,16.6,25.6,,24/04/2021,MODESTO-2021/04/24-25.6,25.6
,MODESTO 6,Tradicional,,,15.7,23.1,,24/04/2021,MODESTO 6-2021/04/24-23.1,23.1
,MODESTO,Tradicional,,,16.6,25.6,,24/04/2021,MODESTO-2021/04/24-25.6,25.6
,MODESTO 6,Tradicional,,,15.7,23.1,,24/04/2021,MODESTO 6-2021/04/24-23.1,23.1
,MODESTO,Tradicional,,,16.6,25.6,,24/04/2021,MODESTO-2021/04/24-25.6,25.6
,MODESTO 6,Tradicional,,,15.7,23.1,,24/04/2021,MODESTO 6-2021/04/24-23.1,23.1
,MODESTO,Tradicional,,,16.6,20.6,,25/04/2021,MODESTO-2021/04/25-20.6,20.6
,MODESTO 6,Tradicional,,,15.7,24.4,,25/04/2021,MODESTO 6-2021/04/25-24.4,24.4
,MODESTO,Tradicional,,,16.6,20.6,,25/04/2021,MODESTO-2021/04/25-20.6,20.6
,MODESTO 6,Tradicional,,,15.7,24.4,,25/04/2021,MODESTO 6-2021/04/25-24.4,24.4
,MODESTO,Tradicional,,,16.6,20.6,,25/04/2021,MODESTO-2021/04/25-20.6,20.6
,MODESTO 6,Tradicional,,,15.7,24.4,,25/04/2021,MODESTO 6-2021/04/25-24.4,24.4
,PALMAR-2,Tradicional,,,9.1,20.4,,25/04/2021,PALMAR-2-2021/04/25-20.4,20.4
,PALMAR-2,Tradicional,,,9.1,20.4,,25/04/2021,PALMAR-2-2021/04/25-20.4,20.4
,MODESTO,Tradicional,,,7.6,20.6,,25/04/2021,MODESTO-2021/04/25-20.6,20.6
,PALMAR-2,Tradicional,,,8.4,20.4,,25/04/2021,PALMAR-2-2021/04/25-20.4,20.4
,MODESTO,Tradicional,,,7.6,20.6,,25/04/2021,MODESTO-2021/04/25-20.6,20.6
,PALMAR-2,Tradicional,,,8.4,20.4,,25/04/2021,PALMAR-2-2021/04/25-20.4,20.4
,ROSA MARIA MS 1,Tradicional,,,5.9,23,,25/04/2021,ROSA MARIA MS 1-2021/04/25-23,23
,DON JOSE I,Tradicional,,,8.1,22.9,,25/04/2021,DON JOSE I-2021/04/25-22.9,22.9
,JOSE LUIS,Tradicional,,,10.1,18.8,,25/04/2021,JOSE LUIS-2021/04/25-18.8,18.8
,COQUI II,Tradicional,,,13.3,21.1,,25/04/2021,COQUI II-2021/04/25-21.1,21.1
,ROSA MARIA MS 1,Tradicional,,,5.9,23,,25/04/2021,ROSA MARIA MS 1-2021/04/25-23,23
,DON JOSE I,Tradicional,,,8.1,22.9,,25/04/2021,DON JOSE I-2021/04/25-22.9,22.9
,JOSE LUIS,Tradicional,,,10.1,18.8,,25/04/2021,JOSE LUIS-2021/04/25-18.8,18.8
,COQUI II,Tradicional,,,13.3,21.1,,25/04/2021,COQUI II-2021/04/25-21.1,21.1
,ROSA MARIA MS 1,Tradicional,,,5.9,23,,25/04/2021,ROSA MARIA MS 1-2021/04/25-23,23
,DON JOSE I,Tradicional,,,8.1,22.9,,25/04/2021,DON JOSE I-2021/04/25-22.9,22.9
,JOSE LUIS,Tradicional,,,10.1,18.8,,25/04/2021,JOSE LUIS-2021/04/25-18.8,18.8
,COQUI II,Tradicional,,,13.3,21.1,,25/04/2021,COQUI II-2021/04/25-21.1,21.1
,ROSA MARIA MS 1,Tradicional,,,5.9,23,,25/04/2021,ROSA MARIA MS 1-2021/04/25-23,23
,DON JOSE I,Tradicional,,,8.1,22.9,,25/04/2021,DON JOSE I-2021/04/25-22.9,22.9
,JOSE LUIS,Tradicional,,,10.1,18.8,,25/04/2021,JOSE LUIS-2021/04/25-18.8,18.8
,COQUI II,Tradicional,,,13.3,21.1,,25/04/2021,COQUI II-2021/04/25-21.1,21.1
,ROSA MARIA MS 1,Tradicional,,,5.9,23,,25/04/2021,ROSA MARIA MS 1-2021/04/25-23,23
,DON JOSE I,Tradicional,,,8.1,22.9,,25/04/2021,DON JOSE I-2021/04/25-22.9,22.9
,JOSE LUIS,Tradicional,,,10.1,18.8,,25/04/2021,JOSE LUIS-2021/04/25-18.8,18.8
,SAN JUDAS II,Tradicional,,,17.4,24.3,,25/04/2021,SAN JUDAS II-2021/04/25-24.3,24.3
,SAN JUDAS II,Tradicional,,,17.4,24.3,,25/04/2021,SAN JUDAS II-2021/04/25-24.3,24.3
,SAN JUDAS,Tradicional,,,19.8,29.5,,25/04/2021,SAN JUDAS-2021/04/25-29.5,29.5
,SAN JUDAS II,Tradicional,,,17.4,24.3,,25/04/2021,SAN JUDAS II-2021/04/25-24.3,24.3
,SAN JUDAS,Tradicional,,,19.8,29.5,,25/04/2021,SAN JUDAS-2021/04/25-29.5,29.5
,SAN JUDAS II,Tradicional,,,17.4,24.3,,25/04/2021,SAN JUDAS II-2021/04/25-24.3,24.3
,COQUI VI,Tradicional,,,20.7,28.1,,25/04/2021,COQUI VI-2021/04/25-28.1,28.1
,MALAGA 1,Tradicional,,,20,26.9,,25/04/2021,MALAGA 1-2021/04/25-26.9,26.9
,SAN JUDAS II,Tradicional,,,17.4,21.1,,26/04/2021,SAN JUDAS II-2021/04/26-21.1,21.1
,COQUI VI,Tradicional,,,20.7,28.1,,26/04/2021,COQUI VI-2021/04/26-28.1,28.1
,MALAGA 1,Tradicional,,,20,26.9,,26/04/2021,MALAGA 1-2021/04/26-26.9,26.9
,SAN JUDAS II,Tradicional,,,17.4,21.1,,26/04/2021,SAN JUDAS II-2021/04/26-21.1,21.1
,COQUI VI,Tradicional,,,20.7,28.1,,26/04/2021,COQUI VI-2021/04/26-28.1,28.1
,MALAGA 1,Tradicional,,,20,26.9,,26/04/2021,MALAGA 1-2021/04/26-26.9,26.9
,COQUI VI,Tradicional,,,20.7,28.1,,26/04/2021,COQUI VI-2021/04/26-28.1,28.1
,MALAGA 1,Tradicional,,,20,26.9,,26/04/2021,MALAGA 1-2021/04/26-26.9,26.9
,HUACHO 9,Tradicional,,,14.3,24.2,,26/04/2021,HUACHO 9-2021/04/26-24.2,24.2
,COQUI X,Tradicional,,,19.8,23.7,,26/04/2021,COQUI X-2021/04/26-23.7,23.7
,COQUI XII,Tradicional,,,19.5,24.4,,26/04/2021,COQUI XII-2021/04/26-24.4,24.4
,HUACHO 9,Tradicional,,,14.3,24.2,,26/04/2021,HUACHO 9-2021/04/26-24.2,24.2
,COQUI X,Tradicional,,,19.8,23.7,,26/04/2021,COQUI X-2021/04/26-23.7,23.7
,COQUI XII,Tradicional,,,19.5,24.4,,26/04/2021,COQUI XII-2021/04/26-24.4,24.4
,GUIAME MADRE MIA,Tradicional,,,5.1,23.5,,26/04/2021,GUIAME MADRE MIA-2021/04/26-23.5,23.5
,MI JESUS SANTOS,Tradicional,,,4.7,22,,26/04/2021,MI JESUS SANTOS-2021/04/26-22,22
,COQUI X,Tradicional,,,19.8,23.7,,26/04/2021,COQUI X-2021/04/26-23.7,23.7
,COQUI XII,Tradicional,,,19.5,24.4,,26/04/2021,COQUI XII-2021/04/26-24.4,24.4
,GUIAME MADRE MIA,Tradicional,,,5.1,23.5,,26/04/2021,GUIAME MADRE MIA-2021/04/26-23.5,23.5
,MI JESUS SANTOS,Tradicional,,,4.7,22,,26/04/2021,MI JESUS SANTOS-2021/04/26-22,22
,MODESTO 6,Tradicional,,,15.6,24.4,,26/04/2021,MODESTO 6-2021/04/26-24.4,24.4
,GUIAME MADRE MIA,Tradicional,,,5.1,23.5,,26/04/2021,GUIAME MADRE MIA-2021/04/26-23.5,23.5
,MI JESUS SANTOS,Tradicional,,,4.7,22,,26/04/2021,MI JESUS SANTOS-2021/04/26-22,22
,MODESTO 6,Tradicional,,,15.6,24.4,,26/04/2021,MODESTO 6-2021/04/26-24.4,24.4
,GUIAME MADRE MIA,Tradicional,,,5.1,23.5,,26/04/2021,GUIAME MADRE MIA-2021/04/26-23.5,23.5
,MI JESUS SANTOS,Tradicional,,,4.7,22,,26/04/2021,MI JESUS SANTOS-2021/04/26-22,22
,MI JUAN,Tradicional,,,7.8,20.4,,26/04/2021,MI JUAN-2021/04/26-20.4,20.4
,MI JESUS SANTOS,Tradicional,,,7.2,22,,26/04/2021,MI JESUS SANTOS-2021/04/26-22,22
,ROSA MARIA MS 1,Tradicional,,,5.7,22.5,,26/04/2021,ROSA MARIA MS 1-2021/04/26-22.5,22.5
,CRISTO TE AMA YE,Tradicional,,,7.9,22.2,,26/04/2021,CRISTO TE AMA YE-2021/04/26-22.2,22.2
,MI JUAN,Tradicional,,,7.8,20.4,,26/04/2021,MI JUAN-2021/04/26-20.4,20.4
,MI JESUS SANTOS,Tradicional,,,7.2,22,,26/04/2021,MI JESUS SANTOS-2021/04/26-22,22
,ROSA MARIA MS 1,Tradicional,,,5.7,22.5,,26/04/2021,ROSA MARIA MS 1-2021/04/26-22.5,22.5
,CRISTO TE AMA YE,Tradicional,,,7.9,22.2,,26/04/2021,CRISTO TE AMA YE-2021/04/26-22.2,22.2
,DON JOSE I,Tradicional,,,5,17,,26/04/2021,DON JOSE I-2021/04/26-17,17
,TASA 220,Tradicional,,,13,20.3,,26/04/2021,TASA 220-2021/04/26-20.3,20.3
,MI JOSUE,Tradicional,,,7.5,17.3,,26/04/2021,MI JOSUE-2021/04/26-17.3,17.3
,MODESTO,Tradicional,,,10.8,19.9,,26/04/2021,MODESTO-2021/04/26-19.9,19.9
,PALMAR-2,Tradicional,,,10.5,24.6,,26/04/2021,PALMAR-2-2021/04/26-24.6,24.6
,JOSE LUIS,Tradicional,,,8.9,23.8,,26/04/2021,JOSE LUIS-2021/04/26-23.8,23.8
,GUIAME MADRE MIA,Tradicional,,,6.9,23.5,,26/04/2021,GUIAME MADRE MIA-2021/04/26-23.5,23.5
,TASA 220,Tradicional,,,13,20.3,,26/04/2021,TASA 220-2021/04/26-20.3,20.3
,MI JOSUE,Tradicional,,,7.5,17.3,,26/04/2021,MI JOSUE-2021/04/26-17.3,17.3
,MODESTO,Tradicional,,,10.8,19.9,,26/04/2021,MODESTO-2021/04/26-19.9,19.9
,PALMAR-2,Tradicional,,,10.5,24.6,,26/04/2021,PALMAR-2-2021/04/26-24.6,24.6
,JOSE LUIS ,Tradicional,,,8.9,23.8,,26/04/2021,JOSE LUIS-2021/04/26-23.8,23.8
,GUIAME MADRE MIA,Tradicional,,,6.9,23.5,,26/04/2021,GUIAME MADRE MIA-2021/04/26-23.5,23.5
,TASA 220,Tradicional,,,13,20.3,,26/04/2021,TASA 220-2021/04/26-20.3,20.3
,TASA 426,Tradicional,,,13.2,21.6,,26/04/2021,TASA 426-2021/04/26-21.6,21.6
,TASA 426,Tradicional,,,13.2,21.6,,26/04/2021,TASA 426-2021/04/26-21.6,21.6
,SAN JUDAS II,Tradicional,,,10.2,21.1,,26/04/2021,SAN JUDAS II-2021/04/26-21.1,21.1
,SAN JUDAS II,Tradicional,,,10.2,21.1,,26/04/2021,SAN JUDAS II-2021/04/26-21.1,21.1
,TASA 35,Tradicional,,,15.4,25,,26/04/2021,TASA 35-2021/04/26-25,25
,SAN JUDAS II,Tradicional,,,10.2,21.1,,26/04/2021,SAN JUDAS II-2021/04/26-21.1,21.1
,TASA 35,Tradicional,,,15.4,25,,26/04/2021,TASA 35-2021/04/26-25,25
,TASA 37,Tradicional,,,15.8,24.3,,26/04/2021,TASA 37-2021/04/26-24.3,24.3
,TASA 37,Tradicional,,,15.8,24.3,,26/04/2021,TASA 37-2021/04/26-24.3,24.3
,COQUI IX,Tradicional,,,16.6,23.5,,26/04/2021,COQUI IX-2021/04/26-23.5,23.5
,COQUI IX,Tradicional,,,16.6,23.5,,26/04/2021,COQUI IX-2021/04/26-23.5,23.5
,JOSE LUIS ,Tradicional,,,5.3,18.6,,27/04/2021,JOSE LUIS-2021/04/27-18.6,18.6
,MI JOSUE,Tradicional,,,5.6,18.8,,27/04/2021,MI JOSUE-2021/04/27-18.8,18.8
,MODESTO,Tradicional,,,7.3,20.6,,27/04/2021,MODESTO-2021/04/27-20.6,20.6
,JOSE LUIS ,Tradicional,,,5.3,18.6,,27/04/2021,JOSE LUIS-2021/04/27-18.6,18.6
,MI JOSUE,Tradicional,,,5.6,18.8,,27/04/2021,MI JOSUE-2021/04/27-18.8,18.8
,MODESTO,Tradicional,,,7.3,20.6,,27/04/2021,MODESTO-2021/04/27-20.6,20.6
,JOSE LUIS ,Tradicional,,,5.3,18.6,,27/04/2021,JOSE LUIS-2021/04/27-18.6,18.6
,MI JOSUE,Tradicional,,,5.6,18.8,,27/04/2021,MI JOSUE-2021/04/27-18.8,18.8
,MODESTO,Tradicional,,,7.3,20.6,,27/04/2021,MODESTO-2021/04/27-20.6,20.6
,CRISTO TE AMA YE,Tradicional,,,7.2,21.8,,27/04/2021,CRISTO TE AMA YE-2021/04/27-21.8,21.8
,MI JUAN,Tradicional,,,9.5,21.1,,27/04/2021,MI JUAN-2021/04/27-21.1,21.1
,ROSA MARIA MS 1,Tradicional,,,8,22.7,,27/04/2021,ROSA MARIA MS 1-2021/04/27-22.7,22.7
,CRISTO TE AMA YE,Tradicional,,,7.2,21.8,,27/04/2021,CRISTO TE AMA YE-2021/04/27-21.8,21.8
,MI JUAN,Tradicional,,,9.5,21.1,,27/04/2021,MI JUAN-2021/04/27-21.1,21.1
,ROSA MARIA MS 1,Tradicional,,,8,22.7,,27/04/2021,ROSA MARIA MS 1-2021/04/27-22.7,22.7
,MODESTO 6,Tradicional,,,14,29.3,,27/04/2021,MODESTO 6-2021/04/27-29.3,29.3
,SAN JUDAS II,Tradicional,,,10.4,24.3,,27/04/2021,SAN JUDAS II-2021/04/27-24.3,24.3
,PALMAR-2,Tradicional,,,7.7,24.3,,27/04/2021,PALMAR-2-2021/04/27-24.3,24.3
,MI JOSE LUIS N 2,Tradicional,,,7.1,21.1,,27/04/2021,MI JOSE LUIS N 2-2021/04/27-21.1,21.1
,MODESTO 6,Tradicional,,,14,29.3,,27/04/2021,MODESTO 6-2021/04/27-29.3,29.3
,SAN JUDAS II,Tradicional,,,10.4,24.3,,27/04/2021,SAN JUDAS II-2021/04/27-24.3,24.3
,PALMAR-2,Tradicional,,,7.7,24.3,,27/04/2021,PALMAR-2-2021/04/27-24.3,24.3
,MI JOSE LUIS N 2,Tradicional,,,7.1,21.1,,27/04/2021,MI JOSE LUIS N 2-2021/04/27-21.1,21.1
,SAN JUDAS II,Tradicional,,,10.4,24.3,,27/04/2021,SAN JUDAS II-2021/04/27-24.3,24.3
,PALMAR-2,Tradicional,,,7.7,24.3,,27/04/2021,PALMAR-2-2021/04/27-24.3,24.3
,MI JOSE LUIS N 2,Tradicional,,,7.1,21.1,,27/04/2021,MI JOSE LUIS N 2-2021/04/27-21.1,21.1
,TASA 420,Tradicional,,,15.9,30.2,,27/04/2021,TASA 420-2021/04/27-30.2,30.2
,SAN JUDAS II,Tradicional,,,10.4,24.3,,27/04/2021,SAN JUDAS II-2021/04/27-24.3,24.3
,PALMAR-2,Tradicional,,,7.7,24.3,,27/04/2021,PALMAR-2-2021/04/27-24.3,24.3
,MI JOSE LUIS N 2,Tradicional,,,7.1,21.1,,27/04/2021,MI JOSE LUIS N 2-2021/04/27-21.1,21.1
,TASA 420,Tradicional,,,15.9,30.2,,27/04/2021,TASA 420-2021/04/27-30.2,30.2
,COQUI XII,Tradicional,,,17.5,34.6,,27/04/2021,COQUI XII-2021/04/27-34.6,34.6
,MODESTO 6,Tradicional,,,14,29.3,,27/04/2021,MODESTO 6-2021/04/27-29.3,29.3
,TASA 420,Tradicional,,,15.9,30.2,,27/04/2021,TASA 420-2021/04/27-30.2,30.2
,DON JOSE I,Tradicional,,,12.4,18.7,,27/04/2021,DON JOSE I-2021/04/27-18.7,18.7
,MODESTO 6,Tradicional,,,14,29.3,,27/04/2021,MODESTO 6-2021/04/27-29.3,29.3
,COQUI XII,Tradicional,,,15.9,34.6,,27/04/2021,COQUI XII-2021/04/27-34.6,34.6
,HUACHO 9,Tradicional,,,14,20.2,,27/04/2021,HUACHO 9-2021/04/27-20.2,20.2
,GUIAME MADRE MIA,Tradicional,,,6.2,17.4,,27/04/2021,GUIAME MADRE MIA-2021/04/27-17.4,17.4
,TASA 34,Tradicional,,,18.2,34.6,,27/04/2021,TASA 34-2021/04/27-34.6,34.6
,HUACHO 9,Tradicional,,,14,20.2,,27/04/2021,HUACHO 9-2021/04/27-20.2,20.2
,GUIAME MADRE MIA,Tradicional,,,6.2,17.4,,27/04/2021,GUIAME MADRE MIA-2021/04/27-17.4,17.4
,COQUI II,Tradicional,,,20.7,37.7,,27/04/2021,COQUI II-2021/04/27-37.7,37.7
,COQUI II,Tradicional,,,20.7,37.7,,27/04/2021,COQUI II-2021/04/27-37.7,37.7
,COQUI X,Tradicional,,,18.7,32.8,,27/04/2021,COQUI X-2021/04/27-32.8,32.8
,COQUI X,Tradicional,,,18.7,32.8,,28/04/2021,COQUI X-2021/04/28-32.8,32.8
,COQUI VI,Tradicional,,,21,21,,28/04/2021,COQUI VI-2021/04/28-21,21
,COQUI VI,Tradicional,,,21,21,,28/04/2021,COQUI VI-2021/04/28-21,21
,MI JOSE LUIS N 2,Tradicional,,,5.9,23.3,,28/04/2021,MI JOSE LUIS N 2-2021/04/28-23.3,23.3
,ROSA MARIA MS 1,Tradicional,,,5.2,21,,28/04/2021,ROSA MARIA MS 1-2021/04/28-21,21
,MODESTO,Tradicional,,,7.2,22.3,,28/04/2021,MODESTO-2021/04/28-22.3,22.3
,MI JUAN,Tradicional,,,5.5,23.5,,28/04/2021,MI JUAN-2021/04/28-23.5,23.5
,DON JOSE I,Tradicional,,,5.1,23.5,,28/04/2021,DON JOSE I-2021/04/28-23.5,23.5
,CRISTO TE AMA YE,Tradicional,,,4.7,19.4,,28/04/2021,CRISTO TE AMA YE-2021/04/28-19.4,19.4
,MI JOSE LUIS N 2,Tradicional,,,5.9,23.3,,28/04/2021,MI JOSE LUIS N 2-2021/04/28-23.3,23.3
,ROSA MARIA MS 1,Tradicional,,,5.2,21,,28/04/2021,ROSA MARIA MS 1-2021/04/28-21,21
,MODESTO,Tradicional,,,7.2,22.3,,28/04/2021,MODESTO-2021/04/28-22.3,22.3
,MI JUAN,Tradicional,,,5.5,23.5,,28/04/2021,MI JUAN-2021/04/28-23.5,23.5
,DON JOSE I,Tradicional,,,5.1,23.5,,28/04/2021,DON JOSE I-2021/04/28-23.5,23.5
,CRISTO TE AMA YE,Tradicional,,,4.7,19.4,,28/04/2021,CRISTO TE AMA YE-2021/04/28-19.4,19.4
,MI JOSE LUIS N 2,Tradicional,,,5.9,23.3,,28/04/2021,MI JOSE LUIS N 2-2021/04/28-23.3,23.3
,ROSA MARIA MS 1,Tradicional,,,5.2,21,,28/04/2021,ROSA MARIA MS 1-2021/04/28-21,21
,MI JESUS SANTOS ,Tradicional,,,7.9,19.9,,28/04/2021,MI JESUS SANTOS-2021/04/28-19.9,19.9
,RIMAC,Tradicional,,,9,20.1,,28/04/2021,RIMAC-2021/04/28-20.1,20.1
,JOSE LUIS,Tradicional,,,5.1,21,,28/04/2021,JOSE LUIS-2021/04/28-21,21
,MI JOSE LUIS N 2,Tradicional,,,5.9,23.3,,28/04/2021,MI JOSE LUIS N 2-2021/04/28-23.3,23.3
,ROSA MARIA MS 1,Tradicional,,,5.2,21,,28/04/2021,ROSA MARIA MS 1-2021/04/28-21,21
,MI JESUS SANTOS ,Tradicional,,,7.9,19.9,,28/04/2021,MI JESUS SANTOS-2021/04/28-19.9,19.9
,RIMAC,Tradicional,,,9,20.1,,28/04/2021,RIMAC-2021/04/28-20.1,20.1
,JOSE LUIS,Tradicional,,,5.1,21,,28/04/2021,JOSE LUIS-2021/04/28-21,21
,MI JESUS SANTOS ,Tradicional,,,7.9,19.9,,28/04/2021,MI JESUS SANTOS-2021/04/28-19.9,19.9
,RIMAC,Tradicional,,,9,20.1,,28/04/2021,RIMAC-2021/04/28-20.1,20.1
,JOSE LUIS,Tradicional,,,5.1,21,,28/04/2021,JOSE LUIS-2021/04/28-21,21
,MI JOSUE,Tradicional,,,9.2,23.2,,28/04/2021,MI JOSUE-2021/04/28-23.2,23.2
,PALMAR-2,Tradicional,,,8.2,24.3,,28/04/2021,PALMAR-2-2021/04/28-24.3,24.3
,GUIAME MADRE MIA,Tradicional,,,8.7,21.9,,28/04/2021,GUIAME MADRE MIA-2021/04/28-21.9,21.9
,MI JESUS SANTOS ,Tradicional,,,7.9,19.9,,28/04/2021,MI JESUS SANTOS-2021/04/28-19.9,19.9
,RIMAC,Tradicional,,,9,20.1,,28/04/2021,RIMAC-2021/04/28-20.1,20.1
,JOSE LUIS,Tradicional,,,5.1,21,,28/04/2021,JOSE LUIS-2021/04/28-21,21
,MI JOSUE,Tradicional,,,9.2,23.2,,28/04/2021,MI JOSUE-2021/04/28-23.2,23.2
,PALMAR-2,Tradicional,,,8.2,24.3,,28/04/2021,PALMAR-2-2021/04/28-24.3,24.3
,GUIAME MADRE MIA,Tradicional,,,8.7,21.9,,28/04/2021,GUIAME MADRE MIA-2021/04/28-21.9,21.9
,MODESTO 6,Tradicional,,,9.2,19.3,,28/04/2021,MODESTO 6-2021/04/28-19.3,19.3
,MI JESUS SANTOS ,Tradicional,,,7.9,19.9,,28/04/2021,MI JESUS SANTOS-2021/04/28-19.9,19.9
,RIMAC,Tradicional,,,9,20.1,,28/04/2021,RIMAC-2021/04/28-20.1,20.1
,JOSE LUIS,Tradicional,,,5.1,21,,28/04/2021,JOSE LUIS-2021/04/28-21,21
,TASA 415,Tradicional,,,14.3,24.9,,28/04/2021,TASA 415-2021/04/28-24.9,24.9
,MODESTO 6,Tradicional,,,9.2,19.3,,28/04/2021,MODESTO 6-2021/04/28-19.3,19.3
,TASA 415,Tradicional,,,14.3,24.9,,28/04/2021,TASA 415-2021/04/28-24.9,24.9
,HUACHO 9,Tradicional,,,8.6,19.9,,28/04/2021,HUACHO 9-2021/04/28-19.9,19.9
,TASA 415,Tradicional,,,14.3,24.9,,28/04/2021,TASA 415-2021/04/28-24.9,24.9
,HUACHO 9,Tradicional,,,8.6,19.9,,28/04/2021,HUACHO 9-2021/04/28-19.9,19.9
,HUACHO 9,Tradicional,,,8.6,19.9,,28/04/2021,HUACHO 9-2021/04/28-19.9,19.9
,COQUI VI,Tradicional,,,8.1,21,,28/04/2021,COQUI VI-2021/04/28-21,21
,COQUI VI,Tradicional,,,8.1,21,,28/04/2021,COQUI VI-2021/04/28-21,21
,COQUI VI,Tradicional,,,8.1,21,,28/04/2021,COQUI VI-2021/04/28-21,21
,PALMAR-2,Tradicional,,,5.7,22,,29/04/2021,PALMAR-2-2021/04/29-22,22
,MI JUAN,Tradicional,,,4.7,17.2,,29/04/2021,MI JUAN-2021/04/29-17.2,17.2
,HUACHO 9,Tradicional,,,7.2,21.5,,29/04/2021,HUACHO 9-2021/04/29-21.5,21.5
,PALMAR-2,Tradicional,,,5.7,22,,29/04/2021,PALMAR-2-2021/04/29-22,22
,MI JUAN,Tradicional,,,4.7,17.2,,29/04/2021,MI JUAN-2021/04/29-17.2,17.2
,HUACHO 9,Tradicional,,,7.2,21.5,,29/04/2021,HUACHO 9-2021/04/29-21.5,21.5
,PALMAR-2,Tradicional,,,5.7,22,,29/04/2021,PALMAR-2-2021/04/29-22,22
,MI JUAN,Tradicional,,,4.7,17.2,,29/04/2021,MI JUAN-2021/04/29-17.2,17.2
,HUACHO 9,Tradicional,,,7.2,21.5,,29/04/2021,HUACHO 9-2021/04/29-21.5,21.5
,PALMAR-2,Tradicional,,,5.7,22,,29/04/2021,PALMAR-2-2021/04/29-22,22
,MI JUAN,Tradicional,,,4.7,17.2,,29/04/2021,MI JUAN-2021/04/29-17.2,17.2
,MODESTO 6,Tradicional,,,9.4,20.9,,29/04/2021,MODESTO 6-2021/04/29-20.9,20.9
,MODESTO 6,Tradicional,,,9.4,20.9,,29/04/2021,MODESTO 6-2021/04/29-20.9,20.9
,COQUI II,Tradicional,,,9.6,20.2,,29/04/2021,COQUI II-2021/04/29-20.2,20.2
,MI JESUS SANTOS,Tradicional,,,5.3,18.8,,29/04/2021,MI JESUS SANTOS-2021/04/29-18.8,18.8
,MODESTO 6,Tradicional,,,9.4,20.9,,29/04/2021,MODESTO 6-2021/04/29-20.9,20.9
,COQUI II,Tradicional,,,9.6,20.2,,29/04/2021,COQUI II-2021/04/29-20.2,20.2
,MI JESUS SANTOS,Tradicional,,,5.3,18.8,,29/04/2021,MI JESUS SANTOS-2021/04/29-18.8,18.8
,MODESTO 6,Tradicional,,,9.4,20.9,,29/04/2021,MODESTO 6-2021/04/29-20.9,20.9
,MODESTO,Tradicional,,,9.6,19.8,,29/04/2021,MODESTO-2021/04/29-19.8,19.8
,SABINA BEATRIZ N 4,Tradicional,,,6.8,21.9,,29/04/2021,SABINA BEATRIZ N 4-2021/04/29-21.9,21.9
,GUIAME MADRE MIA,Tradicional,,,6.8,21.8,,29/04/2021,GUIAME MADRE MIA-2021/04/29-21.8,21.8
,TASA 37,Tradicional,,,7.1,21.8,,29/04/2021,TASA 37-2021/04/29-21.8,21.8
,MODESTO,Tradicional,,,9.6,19.8,,29/04/2021,MODESTO-2021/04/29-19.8,19.8
,SABINA BEATRIZ N 4,Tradicional,,,6.8,21.9,,29/04/2021,SABINA BEATRIZ N 4-2021/04/29-21.9,21.9
,GUIAME MADRE MIA,Tradicional,,,6.8,21.8,,29/04/2021,GUIAME MADRE MIA-2021/04/29-21.8,21.8
,TASA 37,Tradicional,,,7.1,21.8,,29/04/2021,TASA 37-2021/04/29-21.8,21.8
,TASA 415,Tradicional,,,11.5,23.6,,29/04/2021,TASA 415-2021/04/29-23.6,23.6
,MODESTO,Tradicional,,,9.6,19.8,,29/04/2021,MODESTO-2021/04/29-19.8,19.8
,SABINA BEATRIZ N 4,Tradicional,,,6.8,21.9,,29/04/2021,SABINA BEATRIZ N 4-2021/04/29-21.9,21.9
,GUIAME MADRE MIA,Tradicional,,,6.8,21.8,,29/04/2021,GUIAME MADRE MIA-2021/04/29-21.8,21.8
,TASA 37,Tradicional,,,7.1,21.8,,29/04/2021,TASA 37-2021/04/29-21.8,21.8
,TASA 415,Tradicional,,,11.5,23.6,,29/04/2021,TASA 415-2021/04/29-23.6,23.6
,TASA 415,Tradicional,,,11.5,23.6,,29/04/2021,TASA 415-2021/04/29-23.6,23.6
,JOSE LUIS,Tradicional,,,11.6,21.2,,29/04/2021,JOSE LUIS-2021/04/29-21.2,21.2
,CRISTO TE AMA YE,Tradicional,,,14.7,23.4,,29/04/2021,CRISTO TE AMA YE-2021/04/29-23.4,23.4
,MI JOSUE,Tradicional,,,13.1,23.5,,29/04/2021,MI JOSUE-2021/04/29-23.5,23.5
,MI JOSE LUIS N 2,Tradicional,,,9.9,22.9,,29/04/2021,MI JOSE LUIS N 2-2021/04/29-22.9,22.9
,JOSE LUIS,Tradicional,,,11.6,21.2,,29/04/2021,JOSE LUIS-2021/04/29-21.2,21.2
,CRISTO TE AMA YE,Tradicional,,,14.7,23.4,,29/04/2021,CRISTO TE AMA YE-2021/04/29-23.4,23.4
,MI JOSUE,Tradicional,,,13.1,23.5,,29/04/2021,MI JOSUE-2021/04/29-23.5,23.5
,MI JOSE LUIS N 2,Tradicional,,,9.9,22.9,,29/04/2021,MI JOSE LUIS N 2-2021/04/29-22.9,22.9
,COQUI X,Tradicional,,,16,23.6,,29/04/2021,COQUI X-2021/04/29-23.6,23.6
,JOSE LUIS,Tradicional,,,11.6,21.2,,29/04/2021,JOSE LUIS-2021/04/29-21.2,21.2
,CRISTO TE AMA YE,Tradicional,,,14.7,23.4,,29/04/2021,CRISTO TE AMA YE-2021/04/29-23.4,23.4
,MI JOSUE,Tradicional,,,13.1,23.5,,29/04/2021,MI JOSUE-2021/04/29-23.5,23.5
,MI JOSE LUIS N 2,Tradicional,,,9.9,22.9,,29/04/2021,MI JOSE LUIS N 2-2021/04/29-22.9,22.9
,COQUI X,Tradicional,,,16,23.6,,29/04/2021,COQUI X-2021/04/29-23.6,23.6
,JOSE LUIS,Tradicional,,,11.6,21.2,,29/04/2021,JOSE LUIS-2021/04/29-21.2,21.2
,CRISTO TE AMA YE,Tradicional,,,14.7,23.4,,29/04/2021,CRISTO TE AMA YE-2021/04/29-23.4,23.4
,MI JOSUE,Tradicional,,,13.1,23.5,,29/04/2021,MI JOSUE-2021/04/29-23.5,23.5
,MI JOSE LUIS N 2,Tradicional,,,9.9,22.9,,29/04/2021,MI JOSE LUIS N 2-2021/04/29-22.9,22.9
,COQUI X,Tradicional,,,16,23.6,,29/04/2021,COQUI X-2021/04/29-23.6,23.6
,COQUI X,Tradicional,,,16,23.6,,29/04/2021,COQUI X-2021/04/29-23.6,23.6
,TASA 220,Tradicional,,,14.2,24.2,,29/04/2021,TASA 220-2021/04/29-24.2,24.2
,TASA 425,Frio,,,14.4,23.3,,29/04/2021,TASA 425-2021/04/29-23.3,23.3
,COQUI VI,Tradicional,,,15.5,25.5,,29/04/2021,COQUI VI-2021/04/29-25.5,25.5
,TASA 415,Tradicional,,,11.5,23.6,,29/04/2021,TASA 415-2021/04/29-23.6,23.6
,RIMAC,Tradicional,,,9.5,22.5,,29/04/2021,RIMAC-2021/04/29-22.5,22.5
,TASA 220,Tradicional,,,14.2,24.2,,29/04/2021,TASA 220-2021/04/29-24.2,24.2
,TASA 425,Frio,,,14.4,23.3,,29/04/2021,TASA 425-2021/04/29-23.3,23.3
,COQUI VI,Tradicional,,,15.5,25.5,,29/04/2021,COQUI VI-2021/04/29-25.5,25.5
,TASA 415,Tradicional,,,11.5,23.6,,29/04/2021,TASA 415-2021/04/29-23.6,23.6
,RIMAC,Tradicional,,,9.5,22.5,,29/04/2021,RIMAC-2021/04/29-22.5,22.5
,TASA 220,Tradicional,,,14.2,24.2,,29/04/2021,TASA 220-2021/04/29-24.2,24.2
,TASA 425,Frio,,,14.4,23.3,,29/04/2021,TASA 425-2021/04/29-23.3,23.3
,DON JOSE I,Tradicional,,,18.8,20.1,,30/04/2021,DON JOSE I-2021/04/30-20.1,20.1
,MODESTO 7,Tradicional,,,11.8,28.2,,30/04/2021,MODESTO 7-2021/04/30-28.2,28.2
,TASA 413,Tradicional,,,18.5,25.1,,30/04/2021,TASA 413-2021/04/30-25.1,25.1
,MODESTO 7,Tradicional,,,11.8,28.2,,30/04/2021,MODESTO 7-2021/04/30-28.2,28.2
,TASA 413,Tradicional,,,18.5,25.1,,30/04/2021,TASA 413-2021/04/30-25.1,25.1
,MODESTO 7,Tradicional,,,11.8,28.2,,30/04/2021,MODESTO 7-2021/04/30-28.2,28.2
,TASA 413,Tradicional,,,18.5,25.1,,30/04/2021,TASA 413-2021/04/30-25.1,25.1
,MODESTO 7,Tradicional,,,11.8,28.2,,30/04/2021,MODESTO 7-2021/04/30-28.2,28.2
,TASA 420,Tradicional,,,23.2,34.7,,30/04/2021,TASA 420-2021/04/30-34.7,34.7
,ROSA MARIA MS 1,Tradicional,,,17.3,28.5,,30/04/2021,ROSA MARIA MS 1-2021/04/30-28.5,28.5
,TASA 420,Tradicional,,,23.2,34.7,,30/04/2021,TASA 420-2021/04/30-34.7,34.7
,TASA 420,Tradicional,,,23.2,34.7,,30/04/2021,TASA 420-2021/04/30-34.7,34.7
,DON JOSE I,Tradicional,,,3,20.1,,30/04/2021,DON JOSE I-2021/04/30-20.1,20.1
,PALMAR-2,Tradicional,,,5.1,20.9,,30/04/2021,PALMAR-2-2021/04/30-20.9,20.9
,DON JOSE I,Tradicional,,,3,20.1,,30/04/2021,DON JOSE I-2021/04/30-20.1,20.1
,PALMAR-2,Tradicional,,,5.1,20.9,,30/04/2021,PALMAR-2-2021/04/30-20.9,20.9
,TASA 415,Tradicional,,,5.5,19.3,,30/04/2021,TASA 415-2021/04/30-19.3,19.3
,MI BERTITA,Tradicional,,,7,20,,30/04/2021,MI BERTITA-2021/04/30-20,20
,MI JUAN,Tradicional,,,6.9,21.5,,30/04/2021,MI JUAN-2021/04/30-21.5,21.5
,TASA 415,Tradicional,,,5.5,19.3,,30/04/2021,TASA 415-2021/04/30-19.3,19.3
,MI BERTITA,Tradicional,,,7,20,,30/04/2021,MI BERTITA-2021/04/30-20,20
,MI JUAN,Tradicional,,,6.9,21.5,,30/04/2021,MI JUAN-2021/04/30-21.5,21.5
,RIMAC,Tradicional,,,7.8,21.8,,30/04/2021,RIMAC-2021/04/30-21.8,21.8
,MODESTO 6,Tradicional,,,7.9,22.8,,30/04/2021,MODESTO 6-2021/04/30-22.8,22.8
,MI JESUS SANTOS,Tradicional,,,7.8,19.8,,30/04/2021,MI JESUS SANTOS-2021/04/30-19.8,19.8
,COQUI X,Tradicional,,,13.1,22,,30/04/2021,COQUI X-2021/04/30-22,22
,ROSA MARIA,Tradicional,,,11.5,23.7,,30/04/2021,ROSA MARIA-2021/04/30-23.7,23.7
,RIMAC,Tradicional,,,7.8,21.8,,30/04/2021,RIMAC-2021/04/30-21.8,21.8
,MODESTO 6,Tradicional,,,7.9,22.8,,30/04/2021,MODESTO 6-2021/04/30-22.8,22.8
,MI JESUS SANTOS,Tradicional,,,7.8,19.8,,30/04/2021,MI JESUS SANTOS-2021/04/30-19.8,19.8
,COQUI X,Tradicional,,,13.1,22,,30/04/2021,COQUI X-2021/04/30-22,22
,ROSA MARIA,Tradicional,,,11.5,23.7,,30/04/2021,ROSA MARIA-2021/04/30-23.7,23.7
,RIMAC,Tradicional,,,7.8,21.8,,30/04/2021,RIMAC-2021/04/30-21.8,21.8
,MODESTO 6,Tradicional,,,7.9,22.8,,30/04/2021,MODESTO 6-2021/04/30-22.8,22.8
,MI JESUS SANTOS,Tradicional,,,7.8,19.8,,30/04/2021,MI JESUS SANTOS-2021/04/30-19.8,19.8
,COQUI X,Tradicional,,,13.1,22,,30/04/2021,COQUI X-2021/04/30-22,22
,ROSA MARIA,Tradicional,,,11.5,23.7,,30/04/2021,ROSA MARIA-2021/04/30-23.7,23.7
,MI JOSE LUIS N 2,Tradicional,,,9.8,19.1,,30/04/2021,MI JOSE LUIS N 2-2021/04/30-19.1,19.1
,HUACHO 9,Tradicional,,,9.9,23.9,,30/04/2021,HUACHO 9-2021/04/30-23.9,23.9
,COQUI X,Tradicional,,,13.1,22,,30/04/2021,COQUI X-2021/04/30-22,22
,ROSA MARIA,Tradicional,,,11.5,23.7,,30/04/2021,ROSA MARIA-2021/04/30-23.7,23.7
,MI JOSE LUIS N 2,Tradicional,,,9.8,19.1,,30/04/2021,MI JOSE LUIS N 2-2021/04/30-19.1,19.1
,HUACHO 9,Tradicional,,,9.9,23.9,,30/04/2021,HUACHO 9-2021/04/30-23.9,23.9
,COQUI X,Tradicional,,,13.1,22,,30/04/2021,COQUI X-2021/04/30-22,22
,ROSA MARIA,Tradicional,,,11.5,23.7,,30/04/2021,ROSA MARIA-2021/04/30-23.7,23.7
,MI JOSE LUIS N 2,Tradicional,,,9.8,19.1,,30/04/2021,MI JOSE LUIS N 2-2021/04/30-19.1,19.1
,HUACHO 9,Tradicional,,,9.9,23.9,,30/04/2021,HUACHO 9-2021/04/30-23.9,23.9
,TASA 315,Tradicional,,,10,23.8,,30/04/2021,TASA 315-2021/04/30-23.8,23.8
,MI JOSE LUIS N 2,Tradicional,,,9.8,19.1,,30/04/2021,MI JOSE LUIS N 2-2021/04/30-19.1,19.1
,HUACHO 9,Tradicional,,,9.9,23.9,,30/04/2021,HUACHO 9-2021/04/30-23.9,23.9
,TASA 315,Tradicional,,,10,23.8,,30/04/2021,TASA 315-2021/04/30-23.8,23.8
,TASA 315,Tradicional,,,10,23.8,,30/04/2021,TASA 315-2021/04/30-23.8,23.8
,COQUI XII,Tradicional,,,15.9,22.9,,30/04/2021,COQUI XII-2021/04/30-22.9,22.9
,MI JOSUE,Tradicional,,,9.9,21.5,,30/04/2021,MI JOSUE-2021/04/30-21.5,21.5
,TASA 315,Tradicional,,,10,23.8,,30/04/2021,TASA 315-2021/04/30-23.8,23.8
,COQUI XII,Tradicional,,,15.9,22.9,,30/04/2021,COQUI XII-2021/04/30-22.9,22.9
,MI JOSUE,Tradicional,,,9.9,21.5,,30/04/2021,MI JOSUE-2021/04/30-21.5,21.5
,COQUI II,Tradicional,,,15.1,22.8,,30/04/2021,COQUI II-2021/04/30-22.8,22.8
,SAN JUDAS,Tradicional,,,16.9,27.9,,30/04/2021,SAN JUDAS-2021/04/30-27.9,27.9
,ROSA MARIA MS 1,Tradicional,,,19.3,28.5,,30/04/2021,ROSA MARIA MS 1-2021/04/30-28.5,28.5
,COQUI VI,Tradicional,,,13.2,22.2,,30/04/2021,COQUI VI-2021/04/30-22.2,22.2
,COQUI II,Tradicional,,,15.1,22.8,,30/04/2021,COQUI II-2021/04/30-22.8,22.8
,COQUI II,Tradicional,,,15.1,22.8,,30/04/2021,COQUI II-2021/04/30-22.8,22.8
,SAN JUDAS,Tradicional,,,16.9,27.9,,30/04/2021,SAN JUDAS-2021/04/30-27.9,27.9
,ROSA MARIA MS 1,Tradicional,,,19.3,28.5,,30/04/2021,ROSA MARIA MS 1-2021/04/30-28.5,28.5
,COQUI VI,Tradicional,,,13.2,22.2,,30/04/2021,COQUI VI-2021/04/30-22.2,22.2
,COQUI II,Tradicional,,,15.1,22.8,,30/04/2021,COQUI II-2021/04/30-22.8,22.8
,COQUI II,Tradicional,,,15.1,22.8,,30/04/2021,COQUI II-2021/04/30-22.8,22.8
,SAN JUDAS,Tradicional,,,16.9,27.9,,30/04/2021,SAN JUDAS-2021/04/30-27.9,27.9
,ROSA MARIA MS 1,Tradicional,,,19.3,28.5,,30/04/2021,ROSA MARIA MS 1-2021/04/30-28.5,28.5
,COQUI VI,Tradicional,,,13.2,22.2,,30/04/2021,COQUI VI-2021/04/30-22.2,22.2
,COQUI II,Tradicional,,,15.1,22.8,,30/04/2021,COQUI II-2021/04/30-22.8,22.8
,JOSE LUIS ,Tradicional,,,10.3,20.5,,1/05/2021,JOSE LUIS-2021/05/01-20.5,20.5
,MALAGA 1,Tradicional,,,19.4,18.1,,1/05/2021,MALAGA 1-2021/05/01-18.1,18.1
,MODESTO 7,Tradicional,,,18.3,28.2,,1/05/2021,MODESTO 7-2021/05/01-28.2,28.2
,MALAGA 1,Tradicional,,,19.4,18.1,,1/05/2021,MALAGA 1-2021/05/01-18.1,18.1
,MODESTO 7,Tradicional,,,18.3,28.2,,1/05/2021,MODESTO 7-2021/05/01-28.2,28.2
,MALAGA 1,Tradicional,,,19.4,18.1,,1/05/2021,MALAGA 1-2021/05/01-18.1,18.1
,MODESTO 7,Tradicional,,,18.3,28.2,,1/05/2021,MODESTO 7-2021/05/01-28.2,28.2
,MALAGA 1,Tradicional,,,19.4,18.1,,1/05/2021,MALAGA 1-2021/05/01-18.1,18.1
,MODESTO 7,Tradicional,,,18.3,28.2,,1/05/2021,MODESTO 7-2021/05/01-28.2,28.2
,TASA 315,Tradicional,,,9.7,21.9,,1/05/2021,TASA 315-2021/05/01-21.9,21.9
,TASA 415,Tradicional,,,9.1,23.9,,1/05/2021,TASA 415-2021/05/01-23.9,23.9
,ROSA MARIA MS 1,Tradicional,,,4,19.1,,1/05/2021,ROSA MARIA MS 1-2021/05/01-19.1,19.1
,DON JOSE I,Tradicional,,,3.6,19.4,,1/05/2021,DON JOSE I-2021/05/01-19.4,19.4
,MI JESUS SANTOS,Tradicional,,,4.2,19.3,,1/05/2021,MI JESUS SANTOS-2021/05/01-19.3,19.3
,TASA 315,Tradicional,,,9.7,21.9,,1/05/2021,TASA 315-2021/05/01-21.9,21.9
,TASA 415,Tradicional,,,9.1,23.9,,1/05/2021,TASA 415-2021/05/01-23.9,23.9
,ROSA MARIA MS 1,Tradicional,,,4,19.1,,1/05/2021,ROSA MARIA MS 1-2021/05/01-19.1,19.1
,DON JOSE I,Tradicional,,,3.6,19.4,,1/05/2021,DON JOSE I-2021/05/01-19.4,19.4
,MI JESUS SANTOS,Tradicional,,,4.2,19.3,,1/05/2021,MI JESUS SANTOS-2021/05/01-19.3,19.3
,TASA 315,Tradicional,,,9.7,21.9,,1/05/2021,TASA 315-2021/05/01-21.9,21.9
,TASA 415,Tradicional,,,9.1,23.9,,1/05/2021,TASA 415-2021/05/01-23.9,23.9
,ROSA MARIA MS 1,Tradicional,,,4,19.1,,1/05/2021,ROSA MARIA MS 1-2021/05/01-19.1,19.1
,DON JOSE I,Tradicional,,,3.6,19.4,,1/05/2021,DON JOSE I-2021/05/01-19.4,19.4
,MI JESUS SANTOS,Tradicional,,,4.2,19.3,,1/05/2021,MI JESUS SANTOS-2021/05/01-19.3,19.3
,TASA 315,Tradicional,,,9.7,21.9,,1/05/2021,TASA 315-2021/05/01-21.9,21.9
,TASA 415,Tradicional,,,9.1,23.9,,1/05/2021,TASA 415-2021/05/01-23.9,23.9
,ROSA MARIA MS 1,Tradicional,,,4,19.1,,1/05/2021,ROSA MARIA MS 1-2021/05/01-19.1,19.1
,DON JOSE I,Tradicional,,,3.6,19.4,,1/05/2021,DON JOSE I-2021/05/01-19.4,19.4
,MI JESUS SANTOS,Tradicional,,,4.2,19.3,,1/05/2021,MI JESUS SANTOS-2021/05/01-19.3,19.3
,COQUI X,Tradicional,,,5.5,21.1,,1/05/2021,COQUI X-2021/05/01-21.1,21.1
,COQUI VI,Tradicional,,,9,24.2,,1/05/2021,COQUI VI-2021/05/01-24.2,24.2
,MODESTO,Tradicional,,,9.4,17.3,,1/05/2021,MODESTO-2021/05/01-17.3,17.3
,COQUI X,Tradicional,,,5.5,21.1,,1/05/2021,COQUI X-2021/05/01-21.1,21.1
,COQUI VI,Tradicional,,,9,24.2,,1/05/2021,COQUI VI-2021/05/01-24.2,24.2
,MODESTO,Tradicional,,,9.4,17.3,,1/05/2021,MODESTO-2021/05/01-17.3,17.3
,COQUI X,Tradicional,,,5.5,21.1,,1/05/2021,COQUI X-2021/05/01-21.1,21.1
,HUACHO 9,Tradicional,,,4.6,18.3,,1/05/2021,HUACHO 9-2021/05/01-18.3,18.3
,CRISTO TE AMA YE,Tradicional,,,5.4,18.2,,1/05/2021,CRISTO TE AMA YE-2021/05/01-18.2,18.2
,COQUI XII,Tradicional,,,6.3,21.9,,1/05/2021,COQUI XII-2021/05/01-21.9,21.9
,GUIAME MADRE MIA,Tradicional,,,8.2,19.3,,1/05/2021,GUIAME MADRE MIA-2021/05/01-19.3,19.3
,MI JOSE LUIS N 2,Tradicional,,,6.7,2.3,,1/05/2021,MI JOSE LUIS N 2-2021/05/01-2.3,2.3
,MI JOSUE,Tradicional,,,9.4,20.9,,1/05/2021,MI JOSUE-2021/05/01-20.9,20.9
,MALAGA 1,Tradicional,,,7.1,18.1,,1/05/2021,MALAGA 1-2021/05/01-18.1,18.1
,HUACHO 9,Tradicional,,,4.6,18.3,,1/05/2021,HUACHO 9-2021/05/01-18.3,18.3
,CRISTO TE AMA YE,Tradicional,,,5.4,18.2,,1/05/2021,CRISTO TE AMA YE-2021/05/01-18.2,18.2
,COQUI XII,Tradicional,,,6.3,21.9,,1/05/2021,COQUI XII-2021/05/01-21.9,21.9
,GUIAME MADRE MIA,Tradicional,,,8.2,19.3,,1/05/2021,GUIAME MADRE MIA-2021/05/01-19.3,19.3
,MI JOSE LUIS N 2,Tradicional,,,6.7,2.3,,1/05/2021,MI JOSE LUIS N 2-2021/05/01-2.3,2.3
,MI JOSUE,Tradicional,,,9.4,20.9,,1/05/2021,MI JOSUE-2021/05/01-20.9,20.9
,MALAGA 1,Tradicional,,,7.1,18.1,,1/05/2021,MALAGA 1-2021/05/01-18.1,18.1
,HUACHO 9,Tradicional,,,4.6,18.3,,1/05/2021,HUACHO 9-2021/05/01-18.3,18.3
,CRISTO TE AMA YE,Tradicional,,,5.4,18.2,,1/05/2021,CRISTO TE AMA YE-2021/05/01-18.2,18.2
,COQUI XII,Tradicional,,,6.3,21.9,,1/05/2021,COQUI XII-2021/05/01-21.9,21.9
,GUIAME MADRE MIA,Tradicional,,,8.2,19.3,,1/05/2021,GUIAME MADRE MIA-2021/05/01-19.3,19.3
,MI JOSE LUIS N 2,Tradicional,,,6.7,2.3,,1/05/2021,MI JOSE LUIS N 2-2021/05/01-2.3,2.3
,MI JOSUE,Tradicional,,,9.4,20.9,,1/05/2021,MI JOSUE-2021/05/01-20.9,20.9
,MALAGA 1,Tradicional,,,7.1,18.1,,1/05/2021,MALAGA 1-2021/05/01-18.1,18.1
,HUACHO 9,Tradicional,,,4.6,18.3,,1/05/2021,HUACHO 9-2021/05/01-18.3,18.3
,CRISTO TE AMA YE,Tradicional,,,5.4,18.2,,1/05/2021,CRISTO TE AMA YE-2021/05/01-18.2,18.2
,COQUI XII,Tradicional,,,6.3,21.9,,1/05/2021,COQUI XII-2021/05/01-21.9,21.9
,TASA 34,Tradicional,,,14.2,21.7,,1/05/2021,TASA 34-2021/05/01-21.7,21.7
,HUACHO 9,Tradicional,,,4.6,18.3,,1/05/2021,HUACHO 9-2021/05/01-18.3,18.3
,CRISTO TE AMA YE,Tradicional,,,5.4,18.2,,1/05/2021,CRISTO TE AMA YE-2021/05/01-18.2,18.2
,COQUI XII,Tradicional,,,6.3,21.9,,1/05/2021,COQUI XII-2021/05/01-21.9,21.9
,TASA 34,Tradicional,,,14.2,21.7,,1/05/2021,TASA 34-2021/05/01-21.7,21.7
,TASA 425,Frio,,,39.3,23.2,,1/05/2021,TASA 425-2021/05/01-23.2,23.2
,HUACHO 9,Tradicional,,,4.6,18.3,,1/05/2021,HUACHO 9-2021/05/01-18.3,18.3
,CRISTO TE AMA YE,Tradicional,,,5.4,18.2,,1/05/2021,CRISTO TE AMA YE-2021/05/01-18.2,18.2
,COQUI XII,Tradicional,,,6.3,21.9,,1/05/2021,COQUI XII-2021/05/01-21.9,21.9
,TASA 34,Tradicional,,,14.2,21.7,,1/05/2021,TASA 34-2021/05/01-21.7,21.7
,TASA 425,Frio,,,39.3,23.2,,1/05/2021,TASA 425-2021/05/01-23.2,23.2
,TASA 425,Frio,,,39.3,23.2,,1/05/2021,TASA 425-2021/05/01-23.2,23.2
,TASA 34,Tradicional,,,14.2,21.7,,1/05/2021,TASA 34-2021/05/01-21.7,21.7
,TASA 425,Frio,,,39.3,14.7,,2/05/2021,TASA 425-2021/05/02-14.7,14.7
,TASA 34,Tradicional,,,14.2,21.7,,2/05/2021,TASA 34-2021/05/02-21.7,21.7
,MI JUAN,Tradicional,,,15.9,24,,2/05/2021,MI JUAN-2021/05/02-24,24
,SANTA MARGARITA 2,Tradicional,,,14.2,22.9,,2/05/2021,SANTA MARGARITA 2-2021/05/02-22.9,22.9
,COQUI II,Tradicional,,,7.8,25.7,,2/05/2021,COQUI II-2021/05/02-25.7,25.7
,RIMAC,Tradicional,,,5.8,19.5,,2/05/2021,RIMAC-2021/05/02-19.5,19.5
,SAN JUDAS,Tradicional,,,8.8,19.4,,2/05/2021,SAN JUDAS-2021/05/02-19.4,19.4
,"
JOSE LUIS",Tradicional,,,4.3,25.6,,2/05/2021,"
JOSE LUIS-2021/05/02-25.6",25.6
,MI BERTITA,Tradicional,,,8.6,24.2,,2/05/2021,MI BERTITA-2021/05/02-24.2,24.2
,MI JUAN,Tradicional,,,15.9,24,,2/05/2021,MI JUAN-2021/05/02-24,24
,SANTA MARGARITA 2,Tradicional,,,14.2,22.9,,2/05/2021,SANTA MARGARITA 2-2021/05/02-22.9,22.9
,COQUI II,Tradicional,,,7.8,25.7,,2/05/2021,COQUI II-2021/05/02-25.7,25.7
,RIMAC,Tradicional,,,5.8,19.5,,2/05/2021,RIMAC-2021/05/02-19.5,19.5
,SAN JUDAS,Tradicional,,,8.8,19.4,,2/05/2021,SAN JUDAS-2021/05/02-19.4,19.4
,"
JOSE LUIS",Tradicional,,,4.3,25.6,,2/05/2021,"
JOSE LUIS-2021/05/02-25.6",25.6
,MI BERTITA,Tradicional,,,8.6,24.2,,2/05/2021,MI BERTITA-2021/05/02-24.2,24.2
,COQUI II,Tradicional,,,7.8,25.7,,2/05/2021,COQUI II-2021/05/02-25.7,25.7
,RIMAC,Tradicional,,,5.8,19.5,,2/05/2021,RIMAC-2021/05/02-19.5,19.5
,SAN JUDAS,Tradicional,,,8.8,19.4,,2/05/2021,SAN JUDAS-2021/05/02-19.4,19.4
,"
JOSE LUIS",Tradicional,,,4.3,25.6,,2/05/2021,"
JOSE LUIS-2021/05/02-25.6",25.6
,MI BERTITA,Tradicional,,,8.6,24.2,,2/05/2021,MI BERTITA-2021/05/02-24.2,24.2
,GUIAME MADRE MIA,Tradicional,,,5.4,19.2,,2/05/2021,GUIAME MADRE MIA-2021/05/02-19.2,19.2
,MI JOSE LUIS N 2,Tradicional,,,6.5,22.7,,2/05/2021,MI JOSE LUIS N 2-2021/05/02-22.7,22.7
,ROSA MARIA MS 1,Tradicional,,,5,22.2,,2/05/2021,ROSA MARIA MS 1-2021/05/02-22.2,22.2
,GUIAME MADRE MIA,Tradicional,,,5.4,19.2,,2/05/2021,GUIAME MADRE MIA-2021/05/02-19.2,19.2
,MI JOSE LUIS N 2,Tradicional,,,6.5,22.7,,2/05/2021,MI JOSE LUIS N 2-2021/05/02-22.7,22.7
,ROSA MARIA MS 1,Tradicional,,,5,22.2,,2/05/2021,ROSA MARIA MS 1-2021/05/02-22.2,22.2
,TASA 425,Frio,,,8.2,14.7,,2/05/2021,TASA 425-2021/05/02-14.7,14.7
,AURORA MARGARITA,Tradicional,,,10.5,23.8,,2/05/2021,AURORA MARGARITA-2021/05/02-23.8,23.8
,TASA 220,Tradicional,,,8.6,19.9,,2/05/2021,TASA 220-2021/05/02-19.9,19.9
,SAN JUAN BAUTISTA 3,Tradicional,,,6.9,19.5,,2/05/2021,SAN JUAN BAUTISTA 3-2021/05/02-19.5,19.5
,TASA 425,Frio,,,8.2,14.7,,2/05/2021,TASA 425-2021/05/02-14.7,14.7
,AURORA MARGARITA,Tradicional,,,10.5,23.8,,2/05/2021,AURORA MARGARITA-2021/05/02-23.8,23.8
,TASA 220,Tradicional,,,9.6,19.9,,2/05/2021,TASA 220-2021/05/02-19.9,19.9
,SAN JUAN BAUTISTA 3,Tradicional,,,7.9,19.5,,2/05/2021,SAN JUAN BAUTISTA 3-2021/05/02-19.5,19.5
,TASA 425,Frio,,,8.2,14.7,,2/05/2021,TASA 425-2021/05/02-14.7,14.7
,AURORA MARGARITA,Tradicional,,,10.5,23.8,,2/05/2021,AURORA MARGARITA-2021/05/02-23.8,23.8
,TASA 220,Tradicional,,,9.6,19.9,,2/05/2021,TASA 220-2021/05/02-19.9,19.9
,SAN JUAN BAUTISTA 3,Tradicional,,,7.9,19.5,,2/05/2021,SAN JUAN BAUTISTA 3-2021/05/02-19.5,19.5
,TASA 425,Frio,,,8.2,14.7,,2/05/2021,TASA 425-2021/05/02-14.7,14.7
,MODESTO,Tradicional,,,7,20.1,,2/05/2021,MODESTO-2021/05/02-20.1,20.1
,MODESTO 7,Tradicional,,,10.6,19.8,,2/05/2021,MODESTO 7-2021/05/02-19.8,19.8
,RIMAC,Tradicional,,,7,19.5,,2/05/2021,RIMAC-2021/05/02-19.5,19.5
,TASA 425,Frio,,,8.2,14.7,,2/05/2021,TASA 425-2021/05/02-14.7,14.7
,MODESTO,Tradicional,,,7,20.1,,2/05/2021,MODESTO-2021/05/02-20.1,20.1
,MODESTO 7,Tradicional,,,10.6,19.8,,2/05/2021,MODESTO 7-2021/05/02-19.8,19.8
,RIMAC,Tradicional,,,7,19.5,,2/05/2021,RIMAC-2021/05/02-19.5,19.5
,TASA 425,Frio,,,8.2,14.7,,2/05/2021,TASA 425-2021/05/02-14.7,14.7
,MI JESUS SANTOS,Tradicional,,,15.9,23.5,,2/05/2021,MI JESUS SANTOS-2021/05/02-23.5,23.5
,MI JUAN,Tradicional,,,16.9,24,,2/05/2021,MI JUAN-2021/05/02-24,24
,MI BERTITA,Tradicional,,,14.6,24.2,,2/05/2021,MI BERTITA-2021/05/02-24.2,24.2
,COQUI X,Tradicional,,,11.3,20.4,,2/05/2021,COQUI X-2021/05/02-20.4,20.4
,MI JESUS SANTOS,Tradicional,,,15.9,23.5,,2/05/2021,MI JESUS SANTOS-2021/05/02-23.5,23.5
,MI JUAN,Tradicional,,,16.9,24,,2/05/2021,MI JUAN-2021/05/02-24,24
,MI BERTITA,Tradicional,,,14.6,24.2,,2/05/2021,MI BERTITA-2021/05/02-24.2,24.2
,COQUI X,Tradicional,,,11.3,20.4,,2/05/2021,COQUI X-2021/05/02-20.4,20.4
,MI JESUS SANTOS,Tradicional,,,15.9,23.5,,2/05/2021,MI JESUS SANTOS-2021/05/02-23.5,23.5
,MI JUAN,Tradicional,,,16.9,24,,2/05/2021,MI JUAN-2021/05/02-24,24
,MI BERTITA,Tradicional,,,14.6,24.2,,2/05/2021,MI BERTITA-2021/05/02-24.2,24.2
,COQUI X,Tradicional,,,11.3,20.4,,2/05/2021,COQUI X-2021/05/02-20.4,20.4
,MI JESUS SANTOS,Tradicional,,,15.9,23.9,,3/05/2021,MI JESUS SANTOS-2021/05/03-23.9,23.9
,MI JUAN,Tradicional,,,16.9,25.1,,3/05/2021,MI JUAN-2021/05/03-25.1,25.1
,MI BERTITA,Tradicional,,,14.6,35,,3/05/2021,MI BERTITA-2021/05/03-35,35
,MI BERTITA,Tradicional,,,15.9,35,,3/05/2021,MI BERTITA-2021/05/03-35,35
,MI JUAN,Tradicional,,,16.9,25.1,,3/05/2021,MI JUAN-2021/05/03-25.1,25.1
,MI JESUS SANTOS,Tradicional,,,14.6,23.9,,3/05/2021,MI JESUS SANTOS-2021/05/03-23.9,23.9
,JOSE LUIS,Tradicional,,,11.7,22.5,,3/05/2021,JOSE LUIS-2021/05/03-22.5,22.5
,SANTA MARGARITA 2,Tradicional,,,14.9,22.9,,3/05/2021,SANTA MARGARITA 2-2021/05/03-22.9,22.9
,JOSE LUIS,Tradicional,,,11.7,22.5,,3/05/2021,JOSE LUIS-2021/05/03-22.5,22.5
,SANTA MARGARITA 2,Tradicional,,,14.9,22.9,,3/05/2021,SANTA MARGARITA 2-2021/05/03-22.9,22.9
,TERESA,Tradicional,,,20.3,27.6,,3/05/2021,TERESA-2021/05/03-27.6,27.6
,MODESTO 6,Tradicional,,,17,26.7,,3/05/2021,MODESTO 6-2021/05/03-26.7,26.7
,JOSE LUIS,Tradicional,,,11.7,22.5,,3/05/2021,JOSE LUIS-2021/05/03-22.5,22.5
,SANTA MARGARITA 2,Tradicional,,,14.9,22.9,,3/05/2021,SANTA MARGARITA 2-2021/05/03-22.9,22.9
,TERESA,Tradicional,,,20.3,27.6,,3/05/2021,TERESA-2021/05/03-27.6,27.6
,MODESTO 6,Tradicional,,,17,26.7,,3/05/2021,MODESTO 6-2021/05/03-26.7,26.7
,JOSE LUIS,Tradicional,,,11.7,22.5,,3/05/2021,JOSE LUIS-2021/05/03-22.5,22.5
,SANTA MARGARITA 2,Tradicional,,,14.9,22.9,,3/05/2021,SANTA MARGARITA 2-2021/05/03-22.9,22.9
,TERESA,Tradicional,,,20.3,27.6,,3/05/2021,TERESA-2021/05/03-27.6,27.6
,MODESTO 6,Tradicional,,,17,26.7,,3/05/2021,MODESTO 6-2021/05/03-26.7,26.7
,TERESA,Tradicional,,,20.3,27.6,,3/05/2021,TERESA-2021/05/03-27.6,27.6
,DON JOSE I,Tradicional,,,13.3,23.9,,3/05/2021,DON JOSE I-2021/05/03-23.9,23.9
,HUACHO 9,Tradicional,,,19.8,28.2,,3/05/2021,HUACHO 9-2021/05/03-28.2,28.2
,CRISTO TE AMA YE,Tradicional,,,16.2,22.5,,3/05/2021,CRISTO TE AMA YE-2021/05/03-22.5,22.5
,TERESA,Tradicional,,,20.3,27.6,,3/05/2021,TERESA-2021/05/03-27.6,27.6
,DON JOSE I,Tradicional,,,13.3,23.9,,3/05/2021,DON JOSE I-2021/05/03-23.9,23.9
,HUACHO 9,Tradicional,,,19.8,28.2,,3/05/2021,HUACHO 9-2021/05/03-28.2,28.2
,CRISTO TE AMA YE,Tradicional,,,16.2,22.5,,3/05/2021,CRISTO TE AMA YE-2021/05/03-22.5,22.5
,TERESA,Tradicional,,,20.3,27.6,,3/05/2021,TERESA-2021/05/03-27.6,27.6
,DON JOSE I,Tradicional,,,13.3,23.9,,3/05/2021,DON JOSE I-2021/05/03-23.9,23.9
,HUACHO 9,Tradicional,,,19.8,28.2,,3/05/2021,HUACHO 9-2021/05/03-28.2,28.2
,CRISTO TE AMA YE,Tradicional,,,16.2,22.5,,3/05/2021,CRISTO TE AMA YE-2021/05/03-22.5,22.5
,COQUI VI,Tradicional,,,29.7,43.6,,3/05/2021,COQUI VI-2021/05/03-43.6,43.6
,COQUI IX,Tradicional,,,29.7,35.9,,3/05/2021,COQUI IX-2021/05/03-35.9,35.9
,TERESA,Tradicional,,,20.3,27.6,,3/05/2021,TERESA-2021/05/03-27.6,27.6
,DON JOSE I,Tradicional,,,13.3,23.9,,3/05/2021,DON JOSE I-2021/05/03-23.9,23.9
,HUACHO 9,Tradicional,,,19.8,28.2,,3/05/2021,HUACHO 9-2021/05/03-28.2,28.2
,CRISTO TE AMA YE,Tradicional,,,16.2,22.5,,3/05/2021,CRISTO TE AMA YE-2021/05/03-22.5,22.5
,COQUI VI,Tradicional,,,29.7,43.6,,3/05/2021,COQUI VI-2021/05/03-43.6,43.6
,COQUI IX,Tradicional,,,29.7,35.9,,3/05/2021,COQUI IX-2021/05/03-35.9,35.9
,SAN JUDAS,Tradicional,,,28.8,49.7,,3/05/2021,SAN JUDAS-2021/05/03-49.7,49.7
,ISABEL II,Tradicional,,,24.6,36.8,,3/05/2021,ISABEL II-2021/05/03-36.8,36.8
,MALAGA 1,Tradicional,,,27.6,44.2,,3/05/2021,MALAGA 1-2021/05/03-44.2,44.2
,COQUI XII,Tradicional,,,23,36.6,,3/05/2021,COQUI XII-2021/05/03-36.6,36.6
,SAN JUDAS,Tradicional,,,28.8,49.7,,3/05/2021,SAN JUDAS-2021/05/03-49.7,49.7
,ISABEL II,Tradicional,,,24.6,36.8,,3/05/2021,ISABEL II-2021/05/03-36.8,36.8
,MALAGA 1,Tradicional,,,27.6,44.2,,3/05/2021,MALAGA 1-2021/05/03-44.2,44.2
,COQUI XII,Tradicional,,,23,36.6,,3/05/2021,COQUI XII-2021/05/03-36.6,36.6
,SAN JUDAS,Tradicional,,,28.8,49.7,,3/05/2021,SAN JUDAS-2021/05/03-49.7,49.7
,ISABEL II,Tradicional,,,24.6,36.8,,3/05/2021,ISABEL II-2021/05/03-36.8,36.8
,MALAGA 1,Tradicional,,,27.6,44.2,,3/05/2021,MALAGA 1-2021/05/03-44.2,44.2
,COQUI XII,Tradicional,,,23,36.6,,3/05/2021,COQUI XII-2021/05/03-36.6,36.6
,SAN JUDAS,Tradicional,,,28.8,49.7,,3/05/2021,SAN JUDAS-2021/05/03-49.7,49.7
,ISABEL II,Tradicional,,,24.6,36.8,,3/05/2021,ISABEL II-2021/05/03-36.8,36.8
,COQUI II,Tradicional,,,23.6,39.8,,3/05/2021,COQUI II-2021/05/03-39.8,39.8
,JOSE LUIS,Tradicional,,,10.9,22.5,,3/05/2021,JOSE LUIS-2021/05/03-22.5,22.5
,LORENA,Tradicional,,,17.2,21.8,,3/05/2021,LORENA-2021/05/03-21.8,21.8
,MI JUAN,Tradicional,,,14.7,25.1,,3/05/2021,MI JUAN-2021/05/03-25.1,25.1
,MI JESUS SANTOS,Tradicional,,,12,23.9,,3/05/2021,MI JESUS SANTOS-2021/05/03-23.9,23.9
,DON JOSE I,Tradicional,,,15.3,23.9,,3/05/2021,DON JOSE I-2021/05/03-23.9,23.9
,CRISTO TE AMA YE,Tradicional,,,11.7,22.5,,3/05/2021,CRISTO TE AMA YE-2021/05/03-22.5,22.5
,MILAGRO DE MI MADRE,Tradicional,,,14.1,21.7,,3/05/2021,MILAGRO DE MI MADRE-2021/05/03-21.7,21.7
,JOSE LUIS,Tradicional,,,10.9,22.5,,3/05/2021,JOSE LUIS-2021/05/03-22.5,22.5
,LORENA,Tradicional,,,17.2,21.8,,3/05/2021,LORENA-2021/05/03-21.8,21.8
,MI JUAN,Tradicional,,,14.7,25.1,,3/05/2021,MI JUAN-2021/05/03-25.1,25.1
,MI JESUS SANTOS,Tradicional,,,12,23.9,,3/05/2021,MI JESUS SANTOS-2021/05/03-23.9,23.9
,DON JOSE I,Tradicional,,,15.3,23.9,,3/05/2021,DON JOSE I-2021/05/03-23.9,23.9
,CRISTO TE AMA YE,Tradicional,,,11.7,22.5,,3/05/2021,CRISTO TE AMA YE-2021/05/03-22.5,22.5
,MILAGRO DE MI MADRE,Tradicional,,,14.1,21.7,,3/05/2021,MILAGRO DE MI MADRE-2021/05/03-21.7,21.7
,JOSE LUIS,Tradicional,,,10.9,22.5,,3/05/2021,JOSE LUIS-2021/05/03-22.5,22.5
,LORENA,Tradicional,,,17.2,21.8,,3/05/2021,LORENA-2021/05/03-21.8,21.8
,MI JUAN,Tradicional,,,14.7,25.1,,3/05/2021,MI JUAN-2021/05/03-25.1,25.1
,MI JESUS SANTOS,Tradicional,,,12,23.9,,3/05/2021,MI JESUS SANTOS-2021/05/03-23.9,23.9
,DON JOSE I,Tradicional,,,15.3,23.9,,3/05/2021,DON JOSE I-2021/05/03-23.9,23.9
,CRISTO TE AMA YE,Tradicional,,,11.7,22.5,,3/05/2021,CRISTO TE AMA YE-2021/05/03-22.5,22.5
,MILAGRO DE MI MADRE,Tradicional,,,14.1,21.7,,3/05/2021,MILAGRO DE MI MADRE-2021/05/03-21.7,21.7
,LORENA,Tradicional,,,17.2,21.8,,3/05/2021,LORENA-2021/05/03-21.8,21.8
,JOSE LUIS,Tradicional,,,10.9,22.5,,3/05/2021,JOSE LUIS-2021/05/03-22.5,22.5
,SANTA MARGARITA 2,Tradicional,,,18.5,23.8,,3/05/2021,SANTA MARGARITA 2-2021/05/03-23.8,23.8
,MI JOSE LUIS N 2,Tradicional,,,15.2,22.1,,3/05/2021,MI JOSE LUIS N 2-2021/05/03-22.1,22.1
,SANTA MARGARITA 2,Tradicional,,,18.5,23.8,,3/05/2021,SANTA MARGARITA 2-2021/05/03-23.8,23.8
,MI JOSE LUIS N 2,Tradicional,,,15.2,22.1,,3/05/2021,MI JOSE LUIS N 2-2021/05/03-22.1,22.1
,TASA 42,Frio,,,30.3,18.6,,3/05/2021,TASA 42-2021/05/03-18.6,18.6
,TASA 42,Frio,,,30.3,18.6,,3/05/2021,TASA 42-2021/05/03-18.6,18.6
,COQUI X,Tradicional,,,19.3,27.6,,3/05/2021,COQUI X-2021/05/03-27.6,27.6
,TASA 42,Frio,,,30.3,18.6,,3/05/2021,TASA 42-2021/05/03-18.6,18.6
,COQUI X,Tradicional,,,19.3,27.6,,3/05/2021,COQUI X-2021/05/03-27.6,27.6
,COQUI X,Tradicional,,,19.3,27.6,,3/05/2021,COQUI X-2021/05/03-27.6,27.6
,MODESTO 7,Tradicional,,,21.1,28,,3/05/2021,MODESTO 7-2021/05/03-28,28
,BENDICION DE MI MADRE,Tradicional,,,17.6,23.5,,3/05/2021,BENDICION DE MI MADRE-2021/05/03-23.5,23.5
,MOISES I,Tradicional,,,17.3,23.3,,3/05/2021,MOISES I-2021/05/03-23.3,23.3
,COQUI X,Tradicional,,,19.3,27.6,,3/05/2021,COQUI X-2021/05/03-27.6,27.6
,MODESTO 7,Tradicional,,,21.1,28,,3/05/2021,MODESTO 7-2021/05/03-28,28
,BENDICION DE MI MADRE,Tradicional,,,17.6,23.5,,3/05/2021,BENDICION DE MI MADRE-2021/05/03-23.5,23.5
,MOISES I,Tradicional,,,17.3,23.3,,3/05/2021,MOISES I-2021/05/03-23.3,23.3
,COQUI X,Tradicional,,,19.3,19.3,,4/05/2021,COQUI X-2021/05/04-19.3,19.3
,MODESTO 7,Tradicional,,,21.1,21.2,,4/05/2021,MODESTO 7-2021/05/04-21.2,21.2
,BENDICION DE MI MADRE,Tradicional,,,17.6,20.9,,4/05/2021,BENDICION DE MI MADRE-2021/05/04-20.9,20.9
,MOISES I,Tradicional,,,17.3,24,,4/05/2021,MOISES I-2021/05/04-24,24
,MODESTO 7,Tradicional,,,21.1,21.2,,4/05/2021,MODESTO 7-2021/05/04-21.2,21.2
,BENDICION DE MI MADRE,Tradicional,,,17.6,20.9,,4/05/2021,BENDICION DE MI MADRE-2021/05/04-20.9,20.9
,MOISES I,Tradicional,,,17.3,24,,4/05/2021,MOISES I-2021/05/04-24,24
,RIMAC,Tradicional,,,23,31.8,,4/05/2021,RIMAC-2021/05/04-31.8,31.8
,MI JOSUE,Tradicional,,,23.1,35.4,,4/05/2021,MI JOSUE-2021/05/04-35.4,35.4
,RIMAC,Tradicional,,,23,31.8,,4/05/2021,RIMAC-2021/05/04-31.8,31.8
,MI JOSUE,Tradicional,,,23.1,35.4,,4/05/2021,MI JOSUE-2021/05/04-35.4,35.4
,MODESTO 6,Tradicional,,,18.8,22.3,,4/05/2021,MODESTO 6-2021/05/04-22.3,22.3
,TASA 315,Tradicional,,,18.2,30.3,,4/05/2021,TASA 315-2021/05/04-30.3,30.3
,SAN JUAN BAUTISTA 3,Tradicional,,,22.7,35.5,,4/05/2021,SAN JUAN BAUTISTA 3-2021/05/04-35.5,35.5
,RIMAC,Tradicional,,,23,31.8,,4/05/2021,RIMAC-2021/05/04-31.8,31.8
,MI JOSUE,Tradicional,,,23.1,35.4,,4/05/2021,MI JOSUE-2021/05/04-35.4,35.4
,MODESTO 6,Tradicional,,,18.8,22.3,,4/05/2021,MODESTO 6-2021/05/04-22.3,22.3
,TASA 315,Tradicional,,,18.2,30.3,,4/05/2021,TASA 315-2021/05/04-30.3,30.3
,SAN JUAN BAUTISTA 3,Tradicional,,,22.7,35.5,,4/05/2021,SAN JUAN BAUTISTA 3-2021/05/04-35.5,35.5
,RIMAC,Tradicional,,,23,31.8,,4/05/2021,RIMAC-2021/05/04-31.8,31.8
,MI JOSUE,Tradicional,,,23.1,35.4,,4/05/2021,MI JOSUE-2021/05/04-35.4,35.4
,MODESTO 6,Tradicional,,,18.8,22.3,,4/05/2021,MODESTO 6-2021/05/04-22.3,22.3
,TASA 315,Tradicional,,,18.2,30.3,,4/05/2021,TASA 315-2021/05/04-30.3,30.3
,SAN JUAN BAUTISTA 3,Tradicional,,,22.7,35.5,,4/05/2021,SAN JUAN BAUTISTA 3-2021/05/04-35.5,35.5
,MODESTO,Tradicional,,,21.9,22.6,,4/05/2021,MODESTO-2021/05/04-22.6,22.6
,MI BERTITA,Tradicional,,,20,35,,4/05/2021,MI BERTITA-2021/05/04-35,35
,GUIAME MADRE MIA,Tradicional,,,18.8,30.2,,4/05/2021,GUIAME MADRE MIA-2021/05/04-30.2,30.2
,AURORA MARGARITA,Tradicional,,,17.9,24.4,,4/05/2021,AURORA MARGARITA-2021/05/04-24.4,24.4
,MODESTO 6,Tradicional,,,18.8,22.3,,4/05/2021,MODESTO 6-2021/05/04-22.3,22.3
,TASA 315,Tradicional,,,18.2,30.3,,4/05/2021,TASA 315-2021/05/04-30.3,30.3
,SAN JUAN BAUTISTA 3,Tradicional,,,22.7,35.5,,4/05/2021,SAN JUAN BAUTISTA 3-2021/05/04-35.5,35.5
,MODESTO,Tradicional,,,21.9,22.6,,4/05/2021,MODESTO-2021/05/04-22.6,22.6
,MI BERTITA,Tradicional,,,20,35,,4/05/2021,MI BERTITA-2021/05/04-35,35
,GUIAME MADRE MIA,Tradicional,,,18.8,30.2,,4/05/2021,GUIAME MADRE MIA-2021/05/04-30.2,30.2
,AURORA MARGARITA,Tradicional,,,17.9,24.4,,4/05/2021,AURORA MARGARITA-2021/05/04-24.4,24.4
,MODESTO,Tradicional,,,21.9,22.6,,4/05/2021,MODESTO-2021/05/04-22.6,22.6
,MI BERTITA,Tradicional,,,20,35,,4/05/2021,MI BERTITA-2021/05/04-35,35
,GUIAME MADRE MIA,Tradicional,,,18.8,30.2,,4/05/2021,GUIAME MADRE MIA-2021/05/04-30.2,30.2
,AURORA MARGARITA,Tradicional,,,17.9,24.4,,4/05/2021,AURORA MARGARITA-2021/05/04-24.4,24.4
,MODESTO,Tradicional,,,21.9,22.6,,4/05/2021,MODESTO-2021/05/04-22.6,22.6
,MI BERTITA,Tradicional,,,20,35,,4/05/2021,MI BERTITA-2021/05/04-35,35
,GUIAME MADRE MIA,Tradicional,,,18.8,30.2,,4/05/2021,GUIAME MADRE MIA-2021/05/04-30.2,30.2
,AURORA MARGARITA,Tradicional,,,17.9,24.4,,4/05/2021,AURORA MARGARITA-2021/05/04-24.4,24.4
,TERESA,Tradicional,,,20.2,34.5,,4/05/2021,TERESA-2021/05/04-34.5,34.5
,TASA 415,Tradicional,,,19.4,32.1,,4/05/2021,TASA 415-2021/05/04-32.1,32.1
,DON JOSE I,Tradicional,,,8.9,19.9,,4/05/2021,DON JOSE I-2021/05/04-19.9,19.9
,ROSA MARIA MS 1,Tradicional,,,9.7,23.8,,4/05/2021,ROSA MARIA MS 1-2021/05/04-23.8,23.8
,MODESTO 7,Tradicional,,,7.7,21.2,,4/05/2021,MODESTO 7-2021/05/04-21.2,21.2
,SANTA MARGARITA 2,Tradicional,,,12.5,23.8,,4/05/2021,SANTA MARGARITA 2-2021/05/04-23.8,23.8
,DON JOSE I,Tradicional,,,8.9,19.9,,4/05/2021,DON JOSE I-2021/05/04-19.9,19.9
,ROSA MARIA MS 1,Tradicional,,,9.7,23.8,,4/05/2021,ROSA MARIA MS 1-2021/05/04-23.8,23.8
,MODESTO 7,Tradicional,,,7.7,21.2,,4/05/2021,MODESTO 7-2021/05/04-21.2,21.2
,SANTA MARGARITA 2,Tradicional,,,12.5,23.8,,4/05/2021,SANTA MARGARITA 2-2021/05/04-23.8,23.8
,MODESTO 6,Tradicional,,,5.9,22.3,,4/05/2021,MODESTO 6-2021/05/04-22.3,22.3
,MOISES I,Tradicional,,,11.1,24,,4/05/2021,MOISES I-2021/05/04-24,24
,MODESTO,Tradicional,,,7.5,22.6,,4/05/2021,MODESTO-2021/05/04-22.6,22.6
,JOSE LUIS,Tradicional,,,5.4,19.6,,4/05/2021,JOSE LUIS-2021/05/04-19.6,19.6
,BENDICION DE MI MADRE,Tradicional,,,11.8,20.9,,4/05/2021,BENDICION DE MI MADRE-2021/05/04-20.9,20.9
,HUACHO 9,Tradicional,,,10,22.6,,4/05/2021,HUACHO 9-2021/05/04-22.6,22.6
,DON JOSE I,Tradicional,,,8.9,19.9,,4/05/2021,DON JOSE I-2021/05/04-19.9,19.9
,ROSA MARIA MS 1,Tradicional,,,9.7,23.8,,4/05/2021,ROSA MARIA MS 1-2021/05/04-23.8,23.8
,MODESTO 7,Tradicional,,,7.7,21.2,,4/05/2021,MODESTO 7-2021/05/04-21.2,21.2
,SANTA MARGARITA 2,Tradicional,,,12.5,26.3,,4/05/2021,SANTA MARGARITA 2-2021/05/04-26.3,26.3
,MODESTO 6,Tradicional,,,5.9,22.3,,4/05/2021,MODESTO 6-2021/05/04-22.3,22.3
,MOISES I,Tradicional,,,11.1,24,,4/05/2021,MOISES I-2021/05/04-24,24
,MODESTO,Tradicional,,,7.5,22.6,,4/05/2021,MODESTO-2021/05/04-22.6,22.6
,JOSE LUIS,Tradicional,,,5.4,19.6,,4/05/2021,JOSE LUIS-2021/05/04-19.6,19.6
,BENDICION DE MI MADRE,Tradicional,,,11.8,20.9,,4/05/2021,BENDICION DE MI MADRE-2021/05/04-20.9,20.9
,HUACHO 9,Tradicional,,,10,22.6,,4/05/2021,HUACHO 9-2021/05/04-22.6,22.6
,DON JOSE I,Tradicional,,,8.9,19.9,,4/05/2021,DON JOSE I-2021/05/04-19.9,19.9
,ROSA MARIA MS 1,Tradicional,,,9.7,23.8,,4/05/2021,ROSA MARIA MS 1-2021/05/04-23.8,23.8
,MODESTO 7,Tradicional,,,7.7,21.2,,4/05/2021,MODESTO 7-2021/05/04-21.2,21.2
,SANTA MARGARITA 2,Tradicional,,,12.5,26.3,,4/05/2021,SANTA MARGARITA 2-2021/05/04-26.3,26.3
,TASA 52,Frio,,,11.4,22,,4/05/2021,TASA 52-2021/05/04-22,22
,COQUI X,Tradicional,,,9.5,19.3,,4/05/2021,COQUI X-2021/05/04-19.3,19.3
,MODESTO 6,Tradicional,,,5.9,22.3,,4/05/2021,MODESTO 6-2021/05/04-22.3,22.3
,MOISES I,Tradicional,,,11.1,24,,4/05/2021,MOISES I-2021/05/04-24,24
,MODESTO,Tradicional,,,7.5,22.6,,4/05/2021,MODESTO-2021/05/04-22.6,22.6
,JOSE LUIS,Tradicional,,,5.4,19.6,,4/05/2021,JOSE LUIS-2021/05/04-19.6,19.6
,BENDICION DE MI MADRE,Tradicional,,,11.8,20.9,,4/05/2021,BENDICION DE MI MADRE-2021/05/04-20.9,20.9
,HUACHO 9,Tradicional,,,10,22.6,,4/05/2021,HUACHO 9-2021/05/04-22.6,22.6
,TASA 52,Frio,,,11.4,22,,4/05/2021,TASA 52-2021/05/04-22,22
,TASA 52,Frio,,,11.4,22,,4/05/2021,TASA 52-2021/05/04-22,22
,TASA 52,Frio,,,11.4,22,,4/05/2021,TASA 52-2021/05/04-22,22
,TASA 42,Frio,,,7.6,19.5,,4/05/2021,TASA 42-2021/05/04-19.5,19.5
,TASA 52,Frio,,,11.4,22,,4/05/2021,TASA 52-2021/05/04-22,22
,TASA 42,Frio,,,7.6,19.5,,4/05/2021,TASA 42-2021/05/04-19.5,19.5
,TASA 52,Frio,,,11.4,22,,4/05/2021,TASA 52-2021/05/04-22,22
,ISABEL II,Tradicional,,,12.2,26.7,,4/05/2021,ISABEL II-2021/05/04-26.7,26.7
,CRISTO TE AMA YE,Tradicional,,,13,23.2,,4/05/2021,CRISTO TE AMA YE-2021/05/04-23.2,23.2
,MI JUAN,Tradicional,,,10,24.3,,4/05/2021,MI JUAN-2021/05/04-24.3,24.3
,MI JESUS SANTOS,Tradicional,,,8,17.7,,4/05/2021,MI JESUS SANTOS-2021/05/04-17.7,17.7
,TASA 54,Frio,,,10.8,19.7,,4/05/2021,TASA 54-2021/05/04-19.7,19.7
,ISABEL II,Tradicional,,,12.2,26.7,,4/05/2021,ISABEL II-2021/05/04-26.7,26.7
,CRISTO TE AMA YE,Tradicional,,,13,23.2,,4/05/2021,CRISTO TE AMA YE-2021/05/04-23.2,23.2
,MI JUAN,Tradicional,,,10,24.3,,4/05/2021,MI JUAN-2021/05/04-24.3,24.3
,MI JESUS SANTOS,Tradicional,,,8,17.7,,4/05/2021,MI JESUS SANTOS-2021/05/04-17.7,17.7
,ISABEL II,Tradicional,,,12.2,26.7,,4/05/2021,ISABEL II-2021/05/04-26.7,26.7
,CRISTO TE AMA YE,Tradicional,,,13,23.2,,4/05/2021,CRISTO TE AMA YE-2021/05/04-23.2,23.2
,MI JUAN,Tradicional,,,10,24.3,,4/05/2021,MI JUAN-2021/05/04-24.3,24.3
,MI JESUS SANTOS,Tradicional,,,8,17.7,,4/05/2021,MI JESUS SANTOS-2021/05/04-17.7,17.7
,TASA 54,Frio,,,10.8,19.7,,4/05/2021,TASA 54-2021/05/04-19.7,19.7
,ISABEL II,Tradicional,,,12.2,26.7,,4/05/2021,ISABEL II-2021/05/04-26.7,26.7
,CRISTO TE AMA YE,Tradicional,,,13,23.2,,4/05/2021,CRISTO TE AMA YE-2021/05/04-23.2,23.2
,MI JUAN,Tradicional,,,10,24.3,,4/05/2021,MI JUAN-2021/05/04-24.3,24.3
,MI JESUS SANTOS,Tradicional,,,8,17.7,,4/05/2021,MI JESUS SANTOS-2021/05/04-17.7,17.7
,TASA 54,Frio,,,10.8,19.7,,4/05/2021,TASA 54-2021/05/04-19.7,19.7
,COQUI IX,Tradicional,,,19.9,18.2,,5/05/2021,COQUI IX-2021/05/05-18.2,18.2
,TASA 220,Tradicional,,,13.7,18.2,,5/05/2021,TASA 220-2021/05/05-18.2,18.2
,COQUI IX,Tradicional,,,19.9,18.2,,5/05/2021,COQUI IX-2021/05/05-18.2,18.2
,COQUI XII,Tradicional,,,17.1,27.1,,5/05/2021,COQUI XII-2021/05/05-27.1,27.1
,COQUI IX,Tradicional,,,19.9,18.2,,5/05/2021,COQUI IX-2021/05/05-18.2,18.2
,COQUI XII,Tradicional,,,17.1,27.1,,5/05/2021,COQUI XII-2021/05/05-27.1,27.1
,MI JUAN,Tradicional,,,6.4,19.4,,5/05/2021,MI JUAN-2021/05/05-19.4,19.4
,MALAGA 1,Tradicional,,,16.4,20.3,,5/05/2021,MALAGA 1-2021/05/05-20.3,20.3
,MALAGA 1,Tradicional,,,16.4,20.3,,5/05/2021,MALAGA 1-2021/05/05-20.3,20.3
,MALAGA 1,Tradicional,,,16.4,20.3,,5/05/2021,MALAGA 1-2021/05/05-20.3,20.3
,MI JESUS SANTOS,Tradicional,,,6.5,20.7,,5/05/2021,MI JESUS SANTOS-2021/05/05-20.7,20.7
,MI BERTITA,Tradicional,,,7.8,18.2,,5/05/2021,MI BERTITA-2021/05/05-18.2,18.2
,MALAGA 1,Tradicional,,,9.7,20.3,,5/05/2021,MALAGA 1-2021/05/05-20.3,20.3
,MI JESUS SANTOS,Tradicional,,,6.5,20.7,,5/05/2021,MI JESUS SANTOS-2021/05/05-20.7,20.7
,MI BERTITA,Tradicional,,,7.8,18.2,,5/05/2021,MI BERTITA-2021/05/05-18.2,18.2
,MALAGA 1,Tradicional,,,9.7,20.3,,5/05/2021,MALAGA 1-2021/05/05-20.3,20.3
,ROSA MARIA MS 1,Tradicional,,,4.4,19.1,,5/05/2021,ROSA MARIA MS 1-2021/05/05-19.1,19.1
,CRISTO TE AMA YE,Tradicional,,,9.4,19.1,,5/05/2021,CRISTO TE AMA YE-2021/05/05-19.1,19.1
,MI JOSUE,Tradicional,,,5.3,19.1,,5/05/2021,MI JOSUE-2021/05/05-19.1,19.1
,COQUI IX,Tradicional,,,5.5,18.2,,5/05/2021,COQUI IX-2021/05/05-18.2,18.2
,DON JOSE I,Tradicional,,,16,23.3,,5/05/2021,DON JOSE I-2021/05/05-23.3,23.3
,ROSA MARIA MS 1,Tradicional,,,4.4,19.1,,5/05/2021,ROSA MARIA MS 1-2021/05/05-19.1,19.1
,CRISTO TE AMA YE,Tradicional,,,9.4,19.1,,5/05/2021,CRISTO TE AMA YE-2021/05/05-19.1,19.1
,MI JOSUE,Tradicional,,,5.3,19.1,,5/05/2021,MI JOSUE-2021/05/05-19.1,19.1
,COQUI IX,Tradicional,,,5.5,18.2,,5/05/2021,COQUI IX-2021/05/05-18.2,18.2
,TASA 315,Tradicional,,,16,26.9,,5/05/2021,TASA 315-2021/05/05-26.9,26.9
,ROSA MARIA MS 1,Tradicional,,,4.4,19.1,,5/05/2021,ROSA MARIA MS 1-2021/05/05-19.1,19.1
,CRISTO TE AMA YE,Tradicional,,,9.4,19.1,,5/05/2021,CRISTO TE AMA YE-2021/05/05-19.1,19.1
,MI JOSUE,Tradicional,,,5.3,19.1,,5/05/2021,MI JOSUE-2021/05/05-19.1,19.1
,COQUI IX,Tradicional,,,5.5,18.2,,5/05/2021,COQUI IX-2021/05/05-18.2,18.2
,TASA 315,Tradicional,,,16,26.9,,5/05/2021,TASA 315-2021/05/05-26.9,26.9
,ROSA MARIA MS 1,Tradicional,,,4.4,19.1,,5/05/2021,ROSA MARIA MS 1-2021/05/05-19.1,19.1
,CRISTO TE AMA YE,Tradicional,,,9.4,19.1,,5/05/2021,CRISTO TE AMA YE-2021/05/05-19.1,19.1
,MI JOSUE,Tradicional,,,5.3,19.1,,5/05/2021,MI JOSUE-2021/05/05-19.1,19.1
,COQUI IX,Tradicional,,,5.5,18.2,,5/05/2021,COQUI IX-2021/05/05-18.2,18.2
,TASA 425,Frio,,,17.5,23.9,,5/05/2021,TASA 425-2021/05/05-23.9,23.9
,TASA 220,Tradicional,,,4.9,18.2,,5/05/2021,TASA 220-2021/05/05-18.2,18.2
,TASA 415,Tradicional,,,16.4,27.5,,5/05/2021,TASA 415-2021/05/05-27.5,27.5
,TASA 425,Frio,,,17.5,23.9,,5/05/2021,TASA 425-2021/05/05-23.9,23.9
,TASA 220,Tradicional,,,4.9,18.2,,5/05/2021,TASA 220-2021/05/05-18.2,18.2
,TASA 415,Tradicional,,,16.4,27.5,,5/05/2021,TASA 415-2021/05/05-27.5,27.5
,TASA 425,Frio,,,17.5,23.9,,5/05/2021,TASA 425-2021/05/05-23.9,23.9
,TASA 220,Tradicional,,,4.9,18.2,,5/05/2021,TASA 220-2021/05/05-18.2,18.2
,TASA 415,Tradicional,,,16.4,27.5,,5/05/2021,TASA 415-2021/05/05-27.5,27.5
,TASA 220,Tradicional,,,4.9,18.2,,5/05/2021,TASA 220-2021/05/05-18.2,18.2
,TASA 415,Tradicional,,,16.4,27.5,,5/05/2021,TASA 415-2021/05/05-27.5,27.5
,TASA 52,Frio,,,15.4,23.9,,5/05/2021,TASA 52-2021/05/05-23.9,23.9
,TASA 220,Tradicional,,,4.9,18.2,,5/05/2021,TASA 220-2021/05/05-18.2,18.2
,TASA 415,Tradicional,,,16.4,27.5,,5/05/2021,TASA 415-2021/05/05-27.5,27.5
,TASA 52,Frio,,,15.4,23.9,,5/05/2021,TASA 52-2021/05/05-23.9,23.9
,TASA 52,Frio,,,15.4,23.9,,5/05/2021,TASA 52-2021/05/05-23.9,23.9
,TASA 424,Tradicional,,,21.7,34.3,,5/05/2021,TASA 424-2021/05/05-34.3,34.3
,AURORA MARGARITA,Tradicional,,,17.3,30.5,,6/05/2021,AURORA MARGARITA-2021/05/06-30.5,30.5
,MI JOSE LUIS N 2,Tradicional,,,9.8,22.1,,6/05/2021,MI JOSE LUIS N 2-2021/05/06-22.1,22.1
,GUIAME MADRE MIA,Tradicional,,,11.2,24.1,,6/05/2021,GUIAME MADRE MIA-2021/05/06-24.1,24.1
,JOSE LUIS,Tradicional,,,21.5,35.2,,6/05/2021,JOSE LUIS-2021/05/06-35.2,35.2
,TASA 424,Tradicional,,,21.7,34.3,,6/05/2021,TASA 424-2021/05/06-34.3,34.3
,AURORA MARGARITA,Tradicional,,,17.3,30.5,,6/05/2021,AURORA MARGARITA-2021/05/06-30.5,30.5
,MI JOSE LUIS N 2,Tradicional,,,9.8,22.1,,6/05/2021,MI JOSE LUIS N 2-2021/05/06-22.1,22.1
,GUIAME MADRE MIA,Tradicional,,,11.2,24.1,,6/05/2021,GUIAME MADRE MIA-2021/05/06-24.1,24.1
,JOSE LUIS,Tradicional,,,21.5,35.2,,6/05/2021,JOSE LUIS-2021/05/06-35.2,35.2
,TASA 424,Tradicional,,,21.7,34.3,,6/05/2021,TASA 424-2021/05/06-34.3,34.3
,AURORA MARGARITA,Tradicional,,,17.3,30.5,,6/05/2021,AURORA MARGARITA-2021/05/06-30.5,30.5
,MI JOSE LUIS N 2,Tradicional,,,9.8,22.1,,6/05/2021,MI JOSE LUIS N 2-2021/05/06-22.1,22.1
,GUIAME MADRE MIA,Tradicional,,,11.2,24.1,,6/05/2021,GUIAME MADRE MIA-2021/05/06-24.1,24.1
,JOSE LUIS,Tradicional,,,21.5,35.2,,6/05/2021,JOSE LUIS-2021/05/06-35.2,35.2
,TASA 413,Tradicional,,,21.8,45.2,,6/05/2021,TASA 413-2021/05/06-45.2,45.2
,TASA 413,Tradicional,,,21.8,45.2,,6/05/2021,TASA 413-2021/05/06-45.2,45.2
,TASA 426,Tradicional,,,19.2,37.6,,6/05/2021,TASA 426-2021/05/06-37.6,37.6
,TASA 413,Tradicional,,,21.8,45.2,,6/05/2021,TASA 413-2021/05/06-45.2,45.2
,TASA 426,Tradicional,,,19.2,37.6,,6/05/2021,TASA 426-2021/05/06-37.6,37.6
,TASA 426,Tradicional,,,19.2,37.6,,6/05/2021,TASA 426-2021/05/06-37.6,37.6
,TASA 426,Tradicional,,,19.2,37.6,,6/05/2021,TASA 426-2021/05/06-37.6,37.6
,MI BERTITA,Tradicional,,,7.7,21.5,,6/05/2021,MI BERTITA-2021/05/06-21.5,21.5
,MODESTO 6,Tradicional,,,10.9,25.5,,6/05/2021,MODESTO 6-2021/05/06-25.5,25.5
,MODESTO 6,Tradicional,,,10.9,25.5,,6/05/2021,MODESTO 6-2021/05/06-25.5,25.5
,TASA 425,Frio,,,11.2,24.9,,6/05/2021,TASA 425-2021/05/06-24.9,24.9
,RIMAC,Tradicional,,,13.9,25.1,,6/05/2021,RIMAC-2021/05/06-25.1,25.1
,ROSA MARIA MS 1,Tradicional,,,7.7,23.8,,6/05/2021,ROSA MARIA MS 1-2021/05/06-23.8,23.8
,MI JOSE LUIS N 2,Tradicional,,,8.1,22.1,,6/05/2021,MI JOSE LUIS N 2-2021/05/06-22.1,22.1
,TASA 425,Frio,,,11.2,24.9,,6/05/2021,TASA 425-2021/05/06-24.9,24.9
,RIMAC,Tradicional,,,13.9,25.1,,6/05/2021,RIMAC-2021/05/06-25.1,25.1
,ROSA MARIA MS 1,Tradicional,,,7.7,23.8,,6/05/2021,ROSA MARIA MS 1-2021/05/06-23.8,23.8
,MI JOSE LUIS N 2,Tradicional,,,8.1,22.1,,6/05/2021,MI JOSE LUIS N 2-2021/05/06-22.1,22.1
,TASA 425,Frio,,,11.2,24.9,,6/05/2021,TASA 425-2021/05/06-24.9,24.9
,RIMAC,Tradicional,,,13.9,25.1,,6/05/2021,RIMAC-2021/05/06-25.1,25.1
,ROSA MARIA MS 1,Tradicional,,,7.7,23.8,,6/05/2021,ROSA MARIA MS 1-2021/05/06-23.8,23.8
,MI JOSE LUIS N 2,Tradicional,,,8.1,22.1,,6/05/2021,MI JOSE LUIS N 2-2021/05/06-22.1,22.1
,TASA 425,Frio,,,11.2,24.9,,6/05/2021,TASA 425-2021/05/06-24.9,24.9
,RIMAC,Tradicional,,,13.9,25.1,,6/05/2021,RIMAC-2021/05/06-25.1,25.1
,ROSA MARIA MS 1,Tradicional,,,7.7,23.8,,6/05/2021,ROSA MARIA MS 1-2021/05/06-23.8,23.8
,MI JOSE LUIS N 2,Tradicional,,,8.1,22.1,,6/05/2021,MI JOSE LUIS N 2-2021/05/06-22.1,22.1
,GUIAME MADRE MIA,Tradicional,,,10.8,24.1,,6/05/2021,GUIAME MADRE MIA-2021/05/06-24.1,24.1
,TASA 315,Tradicional,,,14.9,26.9,,6/05/2021,TASA 315-2021/05/06-26.9,26.9
,DON JOSE I,Tradicional,,,7.1,21.5,,6/05/2021,DON JOSE I-2021/05/06-21.5,21.5
,CRISTO TE AMA YE,Tradicional,,,7.8,19.7,,6/05/2021,CRISTO TE AMA YE-2021/05/06-19.7,19.7
,MI JUAN,Tradicional,,,7.8,22.3,,6/05/2021,MI JUAN-2021/05/06-22.3,22.3
,GUIAME MADRE MIA,Tradicional,,,10.8,24.1,,6/05/2021,GUIAME MADRE MIA-2021/05/06-24.1,24.1
,TASA 315,Tradicional,,,14.9,26.9,,6/05/2021,TASA 315-2021/05/06-26.9,26.9
,DON JOSE I,Tradicional,,,7.1,21.5,,6/05/2021,DON JOSE I-2021/05/06-21.5,21.5
,CRISTO TE AMA YE,Tradicional,,,7.8,19.7,,6/05/2021,CRISTO TE AMA YE-2021/05/06-19.7,19.7
,MI JUAN,Tradicional,,,7.8,22.3,,6/05/2021,MI JUAN-2021/05/06-22.3,22.3
,TASA 415,Tradicional,,,14.9,27.5,,6/05/2021,TASA 415-2021/05/06-27.5,27.5
,DON JOSE I,Tradicional,,,7.1,21.5,,6/05/2021,DON JOSE I-2021/05/06-21.5,21.5
,CRISTO TE AMA YE,Tradicional,,,7.8,19.7,,6/05/2021,CRISTO TE AMA YE-2021/05/06-19.7,19.7
,MI JUAN,Tradicional,,,7.8,22.3,,6/05/2021,MI JUAN-2021/05/06-22.3,22.3
,COQUI IX,Tradicional,,,20.4,34,,6/05/2021,COQUI IX-2021/05/06-34,34
,TASA 415,Tradicional,,,14.9,27.5,,6/05/2021,TASA 415-2021/05/06-27.5,27.5
,COQUI IX,Tradicional,,,14.9,34,,6/05/2021,COQUI IX-2021/05/06-34,34
,TASA 55,Frio,,,34.1,22.4,,6/05/2021,TASA 55-2021/05/06-22.4,22.4
,COQUI IX,Tradicional,,,14.9,34,,6/05/2021,COQUI IX-2021/05/06-34,34
,TASA 55,Frio,,,34.1,22.4,,6/05/2021,TASA 55-2021/05/06-22.4,22.4
,COQUI IX,Tradicional,,,14.9,34,,6/05/2021,COQUI IX-2021/05/06-34,34
,TASA 55,Frio,,,34.1,22.4,,6/05/2021,TASA 55-2021/05/06-22.4,22.4
,MI JESUS SANTOS,Tradicional,,,8,27.1,,7/05/2021,MI JESUS SANTOS-2021/05/07-27.1,27.1
,MI JOSUE,Tradicional,,,8.6,21.9,,7/05/2021,MI JOSUE-2021/05/07-21.9,21.9
,TASA 420,Tradicional,,,23.4,18.4,,7/05/2021,TASA 420-2021/05/07-18.4,18.4
,MI JESUS SANTOS,Tradicional,,,8,27.1,,7/05/2021,MI JESUS SANTOS-2021/05/07-27.1,27.1
,MI JOSUE,Tradicional,,,8.6,21.9,,7/05/2021,MI JOSUE-2021/05/07-21.9,21.9
,TASA 420,Tradicional,,,23.4,18.4,,7/05/2021,TASA 420-2021/05/07-18.4,18.4
,TASA 420,Tradicional,,,23.4,18.4,,7/05/2021,TASA 420-2021/05/07-18.4,18.4
,TASA 420,Tradicional,,,23.4,18.4,,7/05/2021,TASA 420-2021/05/07-18.4,18.4
,TASA 420,Tradicional,,,23.4,18.4,,7/05/2021,TASA 420-2021/05/07-18.4,18.4
,RIMAC,Tradicional,,,11.3,23.9,,7/05/2021,RIMAC-2021/05/07-23.9,23.9
,TASA 42,Frio,,,22.8,26.1,,7/05/2021,TASA 42-2021/05/07-26.1,26.1
,TASA 42,Frio,,,22.8,26.1,,7/05/2021,TASA 42-2021/05/07-26.1,26.1
,MI JOSE LUIS N 2,Tradicional,,,10.1,24.4,,7/05/2021,MI JOSE LUIS N 2-2021/05/07-24.4,24.4
,TASA 34,Tradicional,,,5.2,19.5,,7/05/2021,TASA 34-2021/05/07-19.5,19.5
,TASA 420,Tradicional,,,4.7,18.4,,7/05/2021,TASA 420-2021/05/07-18.4,18.4
,TASA 42,Frio,,,22.8,26.1,,7/05/2021,TASA 42-2021/05/07-26.1,26.1
,MI JOSE LUIS N 2,Tradicional,,,10.1,24.4,,7/05/2021,MI JOSE LUIS N 2-2021/05/07-24.4,24.4
,TASA 34,Tradicional,,,5.2,19.5,,7/05/2021,TASA 34-2021/05/07-19.5,19.5
,TASA 420,Tradicional,,,4.7,18.4,,7/05/2021,TASA 420-2021/05/07-18.4,18.4
,TASA 54,Frio,,,27,20.3,,7/05/2021,TASA 54-2021/05/07-20.3,20.3
,GUIAME MADRE MIA,Tradicional,,,12,24,,7/05/2021,GUIAME MADRE MIA-2021/05/07-24,24
,DON JOSE I,Tradicional,,,16.5,27,,7/05/2021,DON JOSE I-2021/05/07-27,27
,MI JESUS SANTOS,Tradicional,,,15.3,27.1,,7/05/2021,MI JESUS SANTOS-2021/05/07-27.1,27.1
,TASA 54,Frio,,,27,20.3,,7/05/2021,TASA 54-2021/05/07-20.3,20.3
,GUIAME MADRE MIA,Tradicional,,,12,24,,7/05/2021,GUIAME MADRE MIA-2021/05/07-24,24
,DON JOSE I,Tradicional,,,16.5,27,,7/05/2021,DON JOSE I-2021/05/07-27,27
,MI JESUS SANTOS,Tradicional,,,15.3,27.1,,7/05/2021,MI JESUS SANTOS-2021/05/07-27.1,27.1
,TASA 54,Frio,,,27,20.3,,7/05/2021,TASA 54-2021/05/07-20.3,20.3
,GUIAME MADRE MIA,Tradicional,,,12,24,,7/05/2021,GUIAME MADRE MIA-2021/05/07-24,24
,DON JOSE I,Tradicional,,,16.5,27,,7/05/2021,DON JOSE I-2021/05/07-27,27
,MI JESUS SANTOS,Tradicional,,,15.3,27.1,,7/05/2021,MI JESUS SANTOS-2021/05/07-27.1,27.1
,TASA 54,Frio,,,27,20.3,,7/05/2021,TASA 54-2021/05/07-20.3,20.3
,GUIAME MADRE MIA,Tradicional,,,12,24,,7/05/2021,GUIAME MADRE MIA-2021/05/07-24,24
,DON JOSE I,Tradicional,,,16.5,27,,7/05/2021,DON JOSE I-2021/05/07-27,27
,MI JESUS SANTOS,Tradicional,,,15.3,27.1,,7/05/2021,MI JESUS SANTOS-2021/05/07-27.1,27.1
,TASA 425,Frio,,,17.3,23.8,,7/05/2021,TASA 425-2021/05/07-23.8,23.8
,GUIAME MADRE MIA,Tradicional,,,12,24,,7/05/2021,GUIAME MADRE MIA-2021/05/07-24,24
,DON JOSE I,Tradicional,,,16.5,27,,7/05/2021,DON JOSE I-2021/05/07-27,27
,MI JESUS SANTOS,Tradicional,,,15.3,27.1,,7/05/2021,MI JESUS SANTOS-2021/05/07-27.1,27.1
,TASA 425,Frio,,,17.3,23.8,,7/05/2021,TASA 425-2021/05/07-23.8,23.8
,TASA 426,Tradicional,,,16.4,28,,7/05/2021,TASA 426-2021/05/07-28,28
,TASA 413,Tradicional,,,14.9,25.5,,7/05/2021,TASA 413-2021/05/07-25.5,25.5
,TASA 425,Frio,,,17.3,23.8,,7/05/2021,TASA 425-2021/05/07-23.8,23.8
,TASA 426,Tradicional,,,16.4,28,,7/05/2021,TASA 426-2021/05/07-28,28
,TASA 413,Tradicional,,,14.9,25.5,,7/05/2021,TASA 413-2021/05/07-25.5,25.5
,TASA 426,Tradicional,,,16.4,28,,7/05/2021,TASA 426-2021/05/07-28,28
,TASA 413,Tradicional,,,14.9,25.5,,7/05/2021,TASA 413-2021/05/07-25.5,25.5
,TASA 35,Tradicional,,,20.6,35.1,,7/05/2021,TASA 35-2021/05/07-35.1,35.1
,TASA 426,Tradicional,,,16.4,28,,7/05/2021,TASA 426-2021/05/07-28,28
,TASA 413,Tradicional,,,14.9,25.5,,7/05/2021,TASA 413-2021/05/07-25.5,25.5
,TASA 35,Tradicional,,,20.6,35.1,,7/05/2021,TASA 35-2021/05/07-35.1,35.1
,TASA 35,Tradicional,,,20.6,35.1,,8/05/2021,TASA 35-2021/05/08-35.1,35.1
,TASA 416,Tradicional,,,21,36.5,,8/05/2021,TASA 416-2021/05/08-36.5,36.5
,TASA 416,Tradicional,,,21,36.5,,8/05/2021,TASA 416-2021/05/08-36.5,36.5
,JOSE LUIS,Tradicional,,,18.2,32.7,,8/05/2021,JOSE LUIS-2021/05/08-32.7,32.7
,TASA 416,Tradicional,,,21,36.5,,8/05/2021,TASA 416-2021/05/08-36.5,36.5
,JOSE LUIS,Tradicional,,,18.2,32.7,,8/05/2021,JOSE LUIS-2021/05/08-32.7,32.7
,TASA 416,Tradicional,,,21,36.5,,8/05/2021,TASA 416-2021/05/08-36.5,36.5
,TASA 315,Tradicional,,,14.3,27.3,,8/05/2021,TASA 315-2021/05/08-27.3,27.3
,TASA 314,Tradicional,,,21.1,40.2,,8/05/2021,TASA 314-2021/05/08-40.2,40.2
,TASA 315,Tradicional,,,14.3,27.3,,8/05/2021,TASA 315-2021/05/08-27.3,27.3
,TASA 315,Tradicional,,,14.3,27.3,,8/05/2021,TASA 315-2021/05/08-27.3,27.3
,TASA 314,Tradicional,,,21.1,40.2,,8/05/2021,TASA 314-2021/05/08-40.2,40.2
,TASA 314,Tradicional,,,21.1,40.2,,8/05/2021,TASA 314-2021/05/08-40.2,40.2
,COQUI X,Tradicional,,,18.4,35.2,,8/05/2021,COQUI X-2021/05/08-35.2,35.2
,COQUI X,Tradicional,,,18.4,35.2,,8/05/2021,COQUI X-2021/05/08-35.2,35.2
,COQUI X,Tradicional,,,18.4,35.2,,8/05/2021,COQUI X-2021/05/08-35.2,35.2
,COQUI X,Tradicional,,,18.4,35.2,,8/05/2021,COQUI X-2021/05/08-35.2,35.2
,TASA 45,Frio,,,34.1,21.6,,8/05/2021,TASA 45-2021/05/08-21.6,21.6
,TASA 45,Frio,,,34.1,21.6,,8/05/2021,TASA 45-2021/05/08-21.6,21.6
,DON JOSE I,Tradicional,,,12.5,23.8,,8/05/2021,DON JOSE I-2021/05/08-23.8,23.8
,TASA 426,Tradicional,,,8.8,21.3,,8/05/2021,TASA 426-2021/05/08-21.3,21.3
,TASA 37,Tradicional,,,9.9,24.9,,8/05/2021,TASA 37-2021/05/08-24.9,24.9
,TASA 17,Tradicional,,,12,23.2,,8/05/2021,TASA 17-2021/05/08-23.2,23.2
,TASA 71,Frio,,,29.7,24.8,,8/05/2021,TASA 71-2021/05/08-24.8,24.8
,DON JOSE I,Tradicional,,,12.5,23.8,,8/05/2021,DON JOSE I-2021/05/08-23.8,23.8
,TASA 426,Tradicional,,,8.8,21.3,,8/05/2021,TASA 426-2021/05/08-21.3,21.3
,TASA 37,Tradicional,,,9.9,24.9,,8/05/2021,TASA 37-2021/05/08-24.9,24.9
,TASA 17,Tradicional,,,12,23.2,,8/05/2021,TASA 17-2021/05/08-23.2,23.2
,TASA 71,Frio,,,29.7,24.8,,8/05/2021,TASA 71-2021/05/08-24.8,24.8
,DON JOSE I,Tradicional,,,12.5,23.8,,8/05/2021,DON JOSE I-2021/05/08-23.8,23.8
,TASA 426,Tradicional,,,8.8,21.3,,8/05/2021,TASA 426-2021/05/08-21.3,21.3
,TASA 37,Tradicional,,,9.9,24.9,,8/05/2021,TASA 37-2021/05/08-24.9,24.9
,TASA 17,Tradicional,,,12,23.2,,8/05/2021,TASA 17-2021/05/08-23.2,23.2
,TASA 71,Frio,,,29.7,24.8,,8/05/2021,TASA 71-2021/05/08-24.8,24.8
,DON JOSE I,Tradicional,,,12.5,23.8,,8/05/2021,DON JOSE I-2021/05/08-23.8,23.8
,TASA 426,Tradicional,,,8.8,21.3,,8/05/2021,TASA 426-2021/05/08-21.3,21.3
,TASA 37,Tradicional,,,9.9,24.9,,8/05/2021,TASA 37-2021/05/08-24.9,24.9
,TASA 17,Tradicional,,,12,23.2,,8/05/2021,TASA 17-2021/05/08-23.2,23.2
,TASA 71,Frio,,,29.7,24.8,,8/05/2021,TASA 71-2021/05/08-24.8,24.8
,DON JOSE I,Tradicional,,,12.5,23.8,,8/05/2021,DON JOSE I-2021/05/08-23.8,23.8
,TASA 426,Tradicional,,,8.8,21.3,,8/05/2021,TASA 426-2021/05/08-21.3,21.3
,TASA 37,Tradicional,,,9.9,24.9,,8/05/2021,TASA 37-2021/05/08-24.9,24.9
,TASA 17,Tradicional,,,12,23.2,,8/05/2021,TASA 17-2021/05/08-23.2,23.2
,TASA 71,Frio,,,29.7,24.8,,8/05/2021,TASA 71-2021/05/08-24.8,24.8
,DON JOSE I,Tradicional,,,12.5,23.8,,8/05/2021,DON JOSE I-2021/05/08-23.8,23.8
,TASA 426,Tradicional,,,8.8,21.3,,8/05/2021,TASA 426-2021/05/08-21.3,21.3
,TASA 37,Tradicional,,,9.9,24.9,,8/05/2021,TASA 37-2021/05/08-24.9,24.9
,TASA 17,Tradicional,,,12,23.2,,8/05/2021,TASA 17-2021/05/08-23.2,23.2
,TASA 425,Frio,,,11.7,22.6,,8/05/2021,TASA 425-2021/05/08-22.6,22.6
,TASA 55,Frio,,,20.9,22,,8/05/2021,TASA 55-2021/05/08-22,22
,TASA 425,Frio,,,11.7,22.6,,8/05/2021,TASA 425-2021/05/08-22.6,22.6
,TASA 55,Frio,,,20.9,22,,8/05/2021,TASA 55-2021/05/08-22,22
,TASA 425,Frio,,,11.7,22.6,,8/05/2021,TASA 425-2021/05/08-22.6,22.6
,TASA 55,Frio,,,20.9,22,,8/05/2021,TASA 55-2021/05/08-22,22
,TASA 425,Frio,,,11.7,22.6,,8/05/2021,TASA 425-2021/05/08-22.6,22.6
,TASA 55,Frio,,,20.9,22,,8/05/2021,TASA 55-2021/05/08-22,22
,TASA 425,Frio,,,11.7,22.6,,9/05/2021,TASA 425-2021/05/09-22.6,22.6
,TASA 34,Tradicional,,,14.5,24.5,,9/05/2021,TASA 34-2021/05/09-24.5,24.5
,TASA 424,Tradicional,,,18.3,29.5,,9/05/2021,TASA 424-2021/05/09-29.5,29.5
,TASA 218,Tradicional,,,11.2,24.9,,9/05/2021,TASA 218-2021/05/09-24.9,24.9
,TASA 41,Frio,,,28.8,22.7,,9/05/2021,TASA 41-2021/05/09-22.7,22.7
,TASA 34,Tradicional,,,14.5,24.5,,9/05/2021,TASA 34-2021/05/09-24.5,24.5
,TASA 424,Tradicional,,,18.3,29.5,,9/05/2021,TASA 424-2021/05/09-29.5,29.5
,TASA 218,Tradicional,,,11.2,24.9,,9/05/2021,TASA 218-2021/05/09-24.9,24.9
,TASA 41,Frio,,,28.8,22.7,,9/05/2021,TASA 41-2021/05/09-22.7,22.7
,TASA 34,Tradicional,,,14.5,24.5,,9/05/2021,TASA 34-2021/05/09-24.5,24.5
,TASA 424,Tradicional,,,18.3,29.5,,9/05/2021,TASA 424-2021/05/09-29.5,29.5
,TASA 218,Tradicional,,,11.2,24.9,,9/05/2021,TASA 218-2021/05/09-24.9,24.9
,TASA 41,Frio,,,28.8,22.7,,9/05/2021,TASA 41-2021/05/09-22.7,22.7
,TASA 34,Tradicional,,,14.5,24.5,,9/05/2021,TASA 34-2021/05/09-24.5,24.5
,TASA 424,Tradicional,,,18.3,29.5,,9/05/2021,TASA 424-2021/05/09-29.5,29.5
,TASA 218,Tradicional,,,11.2,24.9,,9/05/2021,TASA 218-2021/05/09-24.9,24.9
,TASA 41,Frio,,,28.8,22.7,,9/05/2021,TASA 41-2021/05/09-22.7,22.7
,TASA 51,Frio,,,27.3,23,,9/05/2021,TASA 51-2021/05/09-23,23
,TASA 41,Frio,,,28.8,22.7,,9/05/2021,TASA 41-2021/05/09-22.7,22.7
,TASA 51,Frio,,,27.3,23,,9/05/2021,TASA 51-2021/05/09-23,23
,TASA 41,Frio,,,28.8,22.7,,9/05/2021,TASA 41-2021/05/09-22.7,22.7
,TASA 51,Frio,,,27.3,23,,9/05/2021,TASA 51-2021/05/09-23,23
,TASA 41,Frio,,,28.8,22.7,,9/05/2021,TASA 41-2021/05/09-22.7,22.7
,TASA 51,Frio,,,27.3,23,,9/05/2021,TASA 51-2021/05/09-23,23
,TASA 61,Frio,,,27.9,22.8,,9/05/2021,TASA 61-2021/05/09-22.8,22.8
,CRISTO TE AMA YE,Tradicional,,,7,21.6,,9/05/2021,CRISTO TE AMA YE-2021/05/09-21.6,21.6
,COQUI X,Tradicional,,,5.7,24.2,,9/05/2021,COQUI X-2021/05/09-24.2,24.2
,TASA 61,Frio,,,27.9,22.8,,9/05/2021,TASA 61-2021/05/09-22.8,22.8
,CRISTO TE AMA YE,Tradicional,,,7,21.6,,9/05/2021,CRISTO TE AMA YE-2021/05/09-21.6,21.6
,COQUI X,Tradicional,,,5.7,24.2,,9/05/2021,COQUI X-2021/05/09-24.2,24.2
,CRISTO TE AMA YE,Tradicional,,,7,21.6,,9/05/2021,CRISTO TE AMA YE-2021/05/09-21.6,21.6
,COQUI X,Tradicional,,,5.7,24.2,,9/05/2021,COQUI X-2021/05/09-24.2,24.2
,TASA 35,Tradicional,,,8.4,23.6,,9/05/2021,TASA 35-2021/05/09-23.6,23.6
,TASA 315,Tradicional,,,8.4,22.9,,9/05/2021,TASA 315-2021/05/09-22.9,22.9
,TASA 426,Tradicional,,,4.1,21.5,,9/05/2021,TASA 426-2021/05/09-21.5,21.5
,MI JOSUE,Tradicional,,,2.6,23.2,,9/05/2021,MI JOSUE-2021/05/09-23.2,23.2
,JOSE LUIS,Tradicional,,,6.9,23.7,,9/05/2021,JOSE LUIS-2021/05/09-23.7,23.7
,TASA 35,Tradicional,,,8.4,23.6,,9/05/2021,TASA 35-2021/05/09-23.6,23.6
,TASA 315,Tradicional,,,8.4,22.9,,9/05/2021,TASA 315-2021/05/09-22.9,22.9
,MI JOSUE,Tradicional,,,2.6,23.2,,9/05/2021,MI JOSUE-2021/05/09-23.2,23.2
,JOSE LUIS,Tradicional,,,6.9,23.7,,9/05/2021,JOSE LUIS-2021/05/09-23.7,23.7
,TASA 35,Tradicional,,,8.4,23.6,,9/05/2021,TASA 35-2021/05/09-23.6,23.6
,TASA 315,Tradicional,,,8.4,22.9,,9/05/2021,TASA 315-2021/05/09-22.9,22.9
,MI JOSUE,Tradicional,,,2.6,23.2,,9/05/2021,MI JOSUE-2021/05/09-23.2,23.2
,JOSE LUIS,Tradicional,,,6.9,23.7,,9/05/2021,JOSE LUIS-2021/05/09-23.7,23.7
,TASA 35,Tradicional,,,8.4,23.6,,9/05/2021,TASA 35-2021/05/09-23.6,23.6
,TASA 315,Tradicional,,,8.4,22.9,,9/05/2021,TASA 315-2021/05/09-22.9,22.9
,TASA 413,Tradicional,,,13.1,27.8,,9/05/2021,TASA 413-2021/05/09-27.8,27.8
,TASA 37,Tradicional,,,13.4,25.3,,9/05/2021,TASA 37-2021/05/09-25.3,25.3
,MI JOSUE,Tradicional,,,2.6,23.2,,9/05/2021,MI JOSUE-2021/05/09-23.2,23.2
,JOSE LUIS,Tradicional,,,8.4,23.7,,9/05/2021,JOSE LUIS-2021/05/09-23.7,23.7
,TASA 413,Tradicional,,,13.1,27.8,,9/05/2021,TASA 413-2021/05/09-27.8,27.8
,TASA 37,Tradicional,,,13.4,25.3,,9/05/2021,TASA 37-2021/05/09-25.3,25.3
,TASA 314,Tradicional,,,8.5,22,,9/05/2021,TASA 314-2021/05/09-22,22
,TASA 413,Tradicional,,,13.1,27.8,,9/05/2021,TASA 413-2021/05/09-27.8,27.8
,TASA 37,Tradicional,,,13.4,25.3,,9/05/2021,TASA 37-2021/05/09-25.3,25.3
,TASA 314,Tradicional,,,8.5,22,,9/05/2021,TASA 314-2021/05/09-22,22
,PALMAR-2,Tradicional,,,13,26.8,,9/05/2021,PALMAR-2-2021/05/09-26.8,26.8
,TASA 411,Tradicional,,,11.8,26.3,,9/05/2021,TASA 411-2021/05/09-26.3,26.3
,TASA 34,Tradicional,,,9.2,24.5,,9/05/2021,TASA 34-2021/05/09-24.5,24.5
,TASA 218,Tradicional,,,12.8,24.9,,9/05/2021,TASA 218-2021/05/09-24.9,24.9
,PALMAR-2,Tradicional,,,13,26.8,,9/05/2021,PALMAR-2-2021/05/09-26.8,26.8
,TASA 411,Tradicional,,,11.8,26.3,,9/05/2021,TASA 411-2021/05/09-26.3,26.3
,TASA 34,Tradicional,,,9.2,24.5,,9/05/2021,TASA 34-2021/05/09-24.5,24.5
,TASA 218,Tradicional,,,12.8,24.9,,9/05/2021,TASA 218-2021/05/09-24.9,24.9
,PALMAR-2,Tradicional,,,13,26.8,,9/05/2021,PALMAR-2-2021/05/09-26.8,26.8
,TASA 411,Tradicional,,,11.8,26.3,,9/05/2021,TASA 411-2021/05/09-26.3,26.3
,TASA 34,Tradicional,,,9.2,24.5,,9/05/2021,TASA 34-2021/05/09-24.5,24.5
,TASA 218,Tradicional,,,12.8,24.9,,9/05/2021,TASA 218-2021/05/09-24.9,24.9
,TASA 54,Frio,,,36.8,23.4,,9/05/2021,TASA 54-2021/05/09-23.4,23.4
,PALMAR-2,Tradicional,,,13,26.8,,9/05/2021,PALMAR-2-2021/05/09-26.8,26.8
,TASA 411,Tradicional,,,11.8,26.3,,9/05/2021,TASA 411-2021/05/09-26.3,26.3
,TASA 34,Tradicional,,,9.2,24.5,,9/05/2021,TASA 34-2021/05/09-24.5,24.5
,TASA 218,Tradicional,,,12.8,24.9,,9/05/2021,TASA 218-2021/05/09-24.9,24.9
,TASA 54,Frio,,,36.8,23.4,,9/05/2021,TASA 54-2021/05/09-23.4,23.4
,PALMAR-2,Tradicional,,,13,26.8,,9/05/2021,PALMAR-2-2021/05/09-26.8,26.8
,TASA 411,Tradicional,,,11.8,26.3,,9/05/2021,TASA 411-2021/05/09-26.3,26.3
,TASA 54,Frio,,,36.8,23.4,,9/05/2021,TASA 54-2021/05/09-23.4,23.4
,PALMAR-2,Tradicional,,,13,26.8,,9/05/2021,PALMAR-2-2021/05/09-26.8,26.8
,TASA 411,Tradicional,,,11.8,26.3,,9/05/2021,TASA 411-2021/05/09-26.3,26.3
,TASA 54,Frio,,,36.8,23.4,,9/05/2021,TASA 54-2021/05/09-23.4,23.4
,GUIAME MADRE MIA,Tradicional,,,6.1,19.7,,9/05/2021,GUIAME MADRE MIA-2021/05/09-19.7,19.7
,TASA 17,Tradicional,,,6,20.4,,9/05/2021,TASA 17-2021/05/09-20.4,20.4
,TASA 37,Tradicional,,,9.4,25.3,,10/05/2021,TASA 37-2021/05/10-25.3,25.3
,TASA 218,Tradicional,,,8.5,22.4,,10/05/2021,TASA 218-2021/05/10-22.4,22.4
,TASA 45,Frio,,,21.4,23.3,,10/05/2021,TASA 45-2021/05/10-23.3,23.3
,TASA 37,Tradicional,,,9.4,25.3,,10/05/2021,TASA 37-2021/05/10-25.3,25.3
,TASA 218,Tradicional,,,8.5,22.4,,10/05/2021,TASA 218-2021/05/10-22.4,22.4
,TASA 45,Frio,,,21.4,23.3,,10/05/2021,TASA 45-2021/05/10-23.3,23.3
,TASA 37,Tradicional,,,9.4,25.3,,10/05/2021,TASA 37-2021/05/10-25.3,25.3
,TASA 218,Tradicional,,,8.5,22.4,,10/05/2021,TASA 218-2021/05/10-22.4,22.4
,TASA 45,Frio,,,21.4,23.3,,10/05/2021,TASA 45-2021/05/10-23.3,23.3
,TASA 37,Tradicional,,,9.4,22.4,,10/05/2021,TASA 37-2021/05/10-22.4,22.4
,TASA 218,Tradicional,,,8.5,22.4,,10/05/2021,TASA 218-2021/05/10-22.4,22.4
,MODESTO 7,Tradicional,,,3.8,21.9,,10/05/2021,MODESTO 7-2021/05/10-21.9,21.9
,TASA 21,Tradicional,,,5.7,22.7,,10/05/2021,TASA 21-2021/05/10-22.7,22.7
,TASA 37,Tradicional,,,9.4,22.4,,10/05/2021,TASA 37-2021/05/10-22.4,22.4
,TASA 218,Tradicional,,,8.5,22.4,,10/05/2021,TASA 218-2021/05/10-22.4,22.4
,MODESTO 7,Tradicional,,,3.8,21.9,,10/05/2021,MODESTO 7-2021/05/10-21.9,21.9
,TASA 21,Tradicional,,,5.7,22.7,,10/05/2021,TASA 21-2021/05/10-22.7,22.7
,TASA 220,Tradicional,,,7.8,23.3,,10/05/2021,TASA 220-2021/05/10-23.3,23.3
,TASA 414,Tradicional,,,7.2,23.4,,10/05/2021,TASA 414-2021/05/10-23.4,23.4
,TASA 220,Tradicional,,,7.8,23.3,,10/05/2021,TASA 220-2021/05/10-23.3,23.3
,TASA 414,Tradicional,,,7.2,23.4,,10/05/2021,TASA 414-2021/05/10-23.4,23.4
,TASA 414,Tradicional,,,7.2,23.4,,10/05/2021,TASA 414-2021/05/10-23.4,23.4
,TASA 426,Tradicional,,,8.4,25.1,,10/05/2021,TASA 426-2021/05/10-25.1,25.1
,TASA 314,Tradicional,,,7.6,25.6,,10/05/2021,TASA 314-2021/05/10-25.6,25.6
,TASA 420,Tradicional,,,9.3,22.3,,10/05/2021,TASA 420-2021/05/10-22.3,22.3
,TASA 414,Tradicional,,,7.2,23.4,,10/05/2021,TASA 414-2021/05/10-23.4,23.4
,TASA 426,Tradicional,,,8.4,25.1,,10/05/2021,TASA 426-2021/05/10-25.1,25.1
,TASA 314,Tradicional,,,7.6,25.6,,10/05/2021,TASA 314-2021/05/10-25.6,25.6
,TASA 420,Tradicional,,,9.3,22.3,,10/05/2021,TASA 420-2021/05/10-22.3,22.3
,MACABI 10,Tradicional,,,11,24.7,,10/05/2021,MACABI 10-2021/05/10-24.7,24.7
,MODESTO 6,Tradicional,,,9.6,22.7,,10/05/2021,MODESTO 6-2021/05/10-22.7,22.7
,MACABI 5,Tradicional,,,10.4,20.2,,10/05/2021,MACABI 5-2021/05/10-20.2,20.2
,RIMAC,Tradicional,,,9.7,22.5,,10/05/2021,RIMAC-2021/05/10-22.5,22.5
,MACABI 10,Tradicional,,,11,24.7,,10/05/2021,MACABI 10-2021/05/10-24.7,24.7
,MODESTO 6,Tradicional,,,9.6,22.7,,10/05/2021,MODESTO 6-2021/05/10-22.7,22.7
,MACABI 5,Tradicional,,,10.4,20.2,,10/05/2021,MACABI 5-2021/05/10-20.2,20.2
,RIMAC,Tradicional,,,9.7,22.5,,10/05/2021,RIMAC-2021/05/10-22.5,22.5
,MACABI 10,Tradicional,,,11,24.7,,10/05/2021,MACABI 10-2021/05/10-24.7,24.7
,MODESTO 6,Tradicional,,,9.6,22.7,,10/05/2021,MODESTO 6-2021/05/10-22.7,22.7
,MACABI 5,Tradicional,,,10.4,20.2,,10/05/2021,MACABI 5-2021/05/10-20.2,20.2
,RIMAC,Tradicional,,,9.7,22.5,,10/05/2021,RIMAC-2021/05/10-22.5,22.5
,TASA 71,Frio,,,38.4,23.1,,10/05/2021,TASA 71-2021/05/10-23.1,23.1
,MACABI 10,Tradicional,,,11,24.7,,10/05/2021,MACABI 10-2021/05/10-24.7,24.7
,MODESTO 6,Tradicional,,,9.6,22.7,,10/05/2021,MODESTO 6-2021/05/10-22.7,22.7
,TASA 71,Frio,,,38.4,23.1,,10/05/2021,TASA 71-2021/05/10-23.1,23.1
,COQUI X,Tradicional,,,16.1,25.1,,10/05/2021,COQUI X-2021/05/10-25.1,25.1
,TASA 71,Frio,,,38.4,23.1,,10/05/2021,TASA 71-2021/05/10-23.1,23.1
,COQUI X,Tradicional,,,16.1,25.1,,10/05/2021,COQUI X-2021/05/10-25.1,25.1
,TASA 315,Tradicional,,,15.9,25,,10/05/2021,TASA 315-2021/05/10-25,25
,COQUI X,Tradicional,,,16.1,25.1,,10/05/2021,COQUI X-2021/05/10-25.1,25.1
,TASA 71,Frio,,,38.4,23.1,,10/05/2021,TASA 71-2021/05/10-23.1,23.1
,TASA 315,Tradicional,,,15.9,25,,10/05/2021,TASA 315-2021/05/10-25,25
,ROCIO,Tradicional,,,16,24.2,,11/05/2021,ROCIO-2021/05/11-24.2,24.2
,JOSE LUIS,Tradicional,,,13.7,24.2,,11/05/2021,JOSE LUIS-2021/05/11-24.2,24.2
,MALAGA 1,Tradicional,,,19.1,34.8,,11/05/2021,MALAGA 1-2021/05/11-34.8,34.8
,TASA 57,Frio,,,16.8,28.1,,11/05/2021,TASA 57-2021/05/11-28.1,28.1
,ROCIO,Tradicional,,,16,24.2,,11/05/2021,ROCIO-2021/05/11-24.2,24.2
,JOSE LUIS,Tradicional,,,13.7,24.2,,11/05/2021,JOSE LUIS-2021/05/11-24.2,24.2
,MALAGA 1,Tradicional,,,19.1,34.8,,11/05/2021,MALAGA 1-2021/05/11-34.8,34.8
,TASA 57,Frio,,,16.8,28.1,,11/05/2021,TASA 57-2021/05/11-28.1,28.1
,TASA 57,Frio,,,16.8,28.1,,11/05/2021,TASA 57-2021/05/11-28.1,28.1
,TASA 52,Frio,,,24.5,23.3,,11/05/2021,TASA 52-2021/05/11-23.3,23.3
,TASA 57,Frio,,,16.8,28.1,,11/05/2021,TASA 57-2021/05/11-28.1,28.1
,TASA 52,Frio,,,24.5,23.3,,11/05/2021,TASA 52-2021/05/11-23.3,23.3
,TASA 57,Frio,,,16.8,28.1,,11/05/2021,TASA 57-2021/05/11-28.1,28.1
,TASA 52,Frio,,,24.5,23.3,,11/05/2021,TASA 52-2021/05/11-23.3,23.3
,GUIAME MADRE MIA,Tradicional,,,15.8,30.9,,11/05/2021,GUIAME MADRE MIA-2021/05/11-30.9,30.9
,MI JOSUE,Tradicional,,,20.5,35.1,,11/05/2021,MI JOSUE-2021/05/11-35.1,35.1
,SAN JUDAS,Tradicional,,,17.1,33.7,,11/05/2021,SAN JUDAS-2021/05/11-33.7,33.7
,CRISTO TE AMA YE,Tradicional,,,18.1,33.6,,11/05/2021,CRISTO TE AMA YE-2021/05/11-33.6,33.6
,SANTA ROSA,Tradicional,,,11.5,24.2,,11/05/2021,SANTA ROSA-2021/05/11-24.2,24.2
,TEO,Tradicional,,,9.3,22.7,,11/05/2021,TEO-2021/05/11-22.7,22.7
,PALMAR-2,Tradicional,,,9.4,24.9,,11/05/2021,PALMAR-2-2021/05/11-24.9,24.9
,SANTA ROSA,Tradicional,,,11.5,24.2,,11/05/2021,SANTA ROSA-2021/05/11-24.2,24.2
,TEO,Tradicional,,,9.3,22.7,,11/05/2021,TEO-2021/05/11-22.7,22.7
,PALMAR-2,Tradicional,,,9.4,24.9,,11/05/2021,PALMAR-2-2021/05/11-24.9,24.9
,RIMAC,Tradicional,,,9.5,22.6,,11/05/2021,RIMAC-2021/05/11-22.6,22.6
,MODESTO 7,Tradicional,,,8.7,22.7,,11/05/2021,MODESTO 7-2021/05/11-22.7,22.7
,TASA 420,Tradicional,,,10.3,23.5,,11/05/2021,TASA 420-2021/05/11-23.5,23.5
,RIMAC,Tradicional,,,9.5,22.6,,11/05/2021,RIMAC-2021/05/11-22.6,22.6
,MODESTO 7,Tradicional,,,8.7,22.7,,11/05/2021,MODESTO 7-2021/05/11-22.7,22.7
,TASA 420,Tradicional,,,10.3,23.5,,11/05/2021,TASA 420-2021/05/11-23.5,23.5
,RIMAC,Tradicional,,,9.5,22.6,,11/05/2021,RIMAC-2021/05/11-22.6,22.6
,MODESTO 7,Tradicional,,,8.7,22.7,,11/05/2021,MODESTO 7-2021/05/11-22.7,22.7
,TASA 420,Tradicional,,,10.3,23.5,,11/05/2021,TASA 420-2021/05/11-23.5,23.5
,MACABI 10,Tradicional,,,5.2,21.9,,11/05/2021,MACABI 10-2021/05/11-21.9,21.9
,TASA 21,Tradicional,,,6.4,22.7,,11/05/2021,TASA 21-2021/05/11-22.7,22.7
,TASA 411,Tradicional,,,11.6,23.8,,11/05/2021,TASA 411-2021/05/11-23.8,23.8
,MACABI 10,Tradicional,,,5.2,21.9,,11/05/2021,MACABI 10-2021/05/11-21.9,21.9
,TASA 21,Tradicional,,,6.4,22.7,,11/05/2021,TASA 21-2021/05/11-22.7,22.7
,TASA 411,Tradicional,,,11.6,23.8,,11/05/2021,TASA 411-2021/05/11-23.8,23.8
,MACABI 10,Tradicional,,,5.2,21.9,,11/05/2021,MACABI 10-2021/05/11-21.9,21.9
,TASA 21,Tradicional,,,6.4,22.7,,11/05/2021,TASA 21-2021/05/11-22.7,22.7
,MODESTO 6,Tradicional,,,11.9,25.5,,11/05/2021,MODESTO 6-2021/05/11-25.5,25.5
,MODESTO 6,Tradicional,,,11.9,25.5,,11/05/2021,MODESTO 6-2021/05/11-25.5,25.5
,JAVIER,Tradicional,,,14.2,25.7,,11/05/2021,JAVIER-2021/05/11-25.7,25.7
,TEO,Tradicional,,,9.6,22.7,,11/05/2021,TEO-2021/05/11-22.7,22.7
,MODESTO 6,Tradicional,,,11.9,25.5,,11/05/2021,MODESTO 6-2021/05/11-25.5,25.5
,JAVIER,Tradicional,,,14.2,25.7,,11/05/2021,JAVIER-2021/05/11-25.7,25.7
,TEO,Tradicional,,,9.6,22.7,,11/05/2021,TEO-2021/05/11-22.7,22.7
,TASA 413,Tradicional,,,15.2,25.8,,11/05/2021,TASA 413-2021/05/11-25.8,25.8
,JAVIER,Tradicional,,,14.2,25.7,,11/05/2021,JAVIER-2021/05/11-25.7,25.7
,TEO,Tradicional,,,9.6,22.7,,11/05/2021,TEO-2021/05/11-22.7,22.7
,TASA 413,Tradicional,,,15.2,25.8,,11/05/2021,TASA 413-2021/05/11-25.8,25.8
,JAVIER,Tradicional,,,14.2,25.7,,11/05/2021,JAVIER-2021/05/11-25.7,25.7
,TEO,Tradicional,,,9.6,22.7,,11/05/2021,TEO-2021/05/11-22.7,22.7
,TASA 51,Frio,,,36.2,25.4,,11/05/2021,TASA 51-2021/05/11-25.4,25.4
,TASA 34,Tradicional,,,16.9,26.8,,11/05/2021,TASA 34-2021/05/11-26.8,26.8
,DON JOSE I,Tradicional,,,20.2,27.3,,11/05/2021,DON JOSE I-2021/05/11-27.3,27.3
,TASA 51,Frio,,,36.2,25.4,,11/05/2021,TASA 51-2021/05/11-25.4,25.4
,TASA 34,Tradicional,,,16.9,26.8,,11/05/2021,TASA 34-2021/05/11-26.8,26.8
,DON JOSE I,Tradicional,,,20.2,27.3,,11/05/2021,DON JOSE I-2021/05/11-27.3,27.3
,TASA 51,Frio,,,36.2,25.4,,11/05/2021,TASA 51-2021/05/11-25.4,25.4
,TASA 34,Tradicional,,,16.9,26.8,,11/05/2021,TASA 34-2021/05/11-26.8,26.8
,DON JOSE I,Tradicional,,,20.2,27.3,,11/05/2021,DON JOSE I-2021/05/11-27.3,27.3
,TASA 51,Frio,,,36.2,25.4,,12/05/2021,TASA 51-2021/05/12-25.4,25.4
,TASA 34,Tradicional,,,16.9,43.6,,12/05/2021,TASA 34-2021/05/12-43.6,43.6
,DON JOSE I,Tradicional,,,20.2,21,,12/05/2021,DON JOSE I-2021/05/12-21,21
,COQUI X,Tradicional,,,18,21,,12/05/2021,COQUI X-2021/05/12-21,21
,TASA 61,Frio,,,23.6,24.3,,12/05/2021,TASA 61-2021/05/12-24.3,24.3
,COQUI X,Tradicional,,,18,21,,12/05/2021,COQUI X-2021/05/12-21,21
,TASA 61,Frio,,,23.6,24.3,,12/05/2021,TASA 61-2021/05/12-24.3,24.3
,TASA 61,Frio,,,23.6,24.3,,12/05/2021,TASA 61-2021/05/12-24.3,24.3
,TASA 61,Frio,,,23.6,24.3,,12/05/2021,TASA 61-2021/05/12-24.3,24.3
,COQUI X,Tradicional,,,18,21,,12/05/2021,COQUI X-2021/05/12-21,21
,TASA 427,Frio,,,47.7,28.5,,12/05/2021,TASA 427-2021/05/12-28.5,28.5
,COQUI X,Tradicional,,,18,21,,12/05/2021,COQUI X-2021/05/12-21,21
,TASA 427,Frio,,,47.7,28.5,,12/05/2021,TASA 427-2021/05/12-28.5,28.5
,COQUI X,Tradicional,,,18,21,,12/05/2021,COQUI X-2021/05/12-21,21
,TASA 427,Frio,,,47.7,28.5,,12/05/2021,TASA 427-2021/05/12-28.5,28.5
,COQUI X,Tradicional,,,18,21,,12/05/2021,COQUI X-2021/05/12-21,21
,SANTA ROSA,Tradicional,,,13.3,25.8,,12/05/2021,SANTA ROSA-2021/05/12-25.8,25.8
,PALMAR-2,Tradicional,,,13.2,20.2,,12/05/2021,PALMAR-2-2021/05/12-20.2,20.2
,MACABI 5,Tradicional,,,17.8,32.8,,12/05/2021,MACABI 5-2021/05/12-32.8,32.8
,COQUI X,Tradicional,,,18,21,,12/05/2021,COQUI X-2021/05/12-21,21
,SANTA ROSA,Tradicional,,,13.3,25.8,,12/05/2021,SANTA ROSA-2021/05/12-25.8,25.8
,PALMAR-2,Tradicional,,,13.2,20.2,,12/05/2021,PALMAR-2-2021/05/12-20.2,20.2
,MACABI 5,Tradicional,,,17.8,32.8,,12/05/2021,MACABI 5-2021/05/12-32.8,32.8
,SANTA ROSA,Tradicional,,,13.3,25.8,,12/05/2021,SANTA ROSA-2021/05/12-25.8,25.8
,PALMAR-2,Tradicional,,,13.2,20.2,,12/05/2021,PALMAR-2-2021/05/12-20.2,20.2
,MACABI 5,Tradicional,,,17.8,32.8,,12/05/2021,MACABI 5-2021/05/12-32.8,32.8
,ROCIO,Tradicional,,,15,27.8,,12/05/2021,ROCIO-2021/05/12-27.8,27.8
,SANTA MARGARITA 2,Tradicional,,,5,19.7,,12/05/2021,SANTA MARGARITA 2-2021/05/12-19.7,19.7
,JOSE LUIS,Tradicional,,,6,21,,12/05/2021,JOSE LUIS-2021/05/12-21,21
,PALMAR-2,Tradicional,,,8.4,20.2,,12/05/2021,PALMAR-2-2021/05/12-20.2,20.2
,MI JOSUE,Tradicional,,,5.1,18.8,,12/05/2021,MI JOSUE-2021/05/12-18.8,18.8
,SANTA MARGARITA 2,Tradicional,,,5,19.7,,12/05/2021,SANTA MARGARITA 2-2021/05/12-19.7,19.7
,JOSE LUIS,Tradicional,,,6,21,,12/05/2021,JOSE LUIS-2021/05/12-21,21
,PALMAR-2,Tradicional,,,8.4,20.2,,12/05/2021,PALMAR-2-2021/05/12-20.2,20.2
,MI JOSUE,Tradicional,,,5.1,18.8,,12/05/2021,MI JOSUE-2021/05/12-18.8,18.8
,SANTA MARGARITA 2,Tradicional,,,5,19.7,,12/05/2021,SANTA MARGARITA 2-2021/05/12-19.7,19.7
,JOSE LUIS,Tradicional,,,6,21,,12/05/2021,JOSE LUIS-2021/05/12-21,21
,PALMAR-2,Tradicional,,,8.4,20.2,,12/05/2021,PALMAR-2-2021/05/12-20.2,20.2
,MI JOSUE,Tradicional,,,5.1,18.8,,12/05/2021,MI JOSUE-2021/05/12-18.8,18.8
,MODESTO 6,Tradicional,,,8.7,21.3,,12/05/2021,MODESTO 6-2021/05/12-21.3,21.3
,MODESTO 6,Tradicional,,,8.7,21.3,,12/05/2021,MODESTO 6-2021/05/12-21.3,21.3
,MALAGA 1,Tradicional,,,19.3,48.1,,12/05/2021,MALAGA 1-2021/05/12-48.1,48.1
,SANTA MARGARITA 2,Tradicional,,,5,19.7,,12/05/2021,SANTA MARGARITA 2-2021/05/12-19.7,19.7
,JOSE LUIS,Tradicional,,,6,21,,12/05/2021,JOSE LUIS-2021/05/12-21,21
,PALMAR-2,Tradicional,,,8.4,20.2,,12/05/2021,PALMAR-2-2021/05/12-20.2,20.2
,MI JOSUE,Tradicional,,,5.1,18.8,,12/05/2021,MI JOSUE-2021/05/12-18.8,18.8
,COQUI X,Tradicional,,,6.6,21,,12/05/2021,COQUI X-2021/05/12-21,21
,DON JOSE I,Tradicional,,,7.7,21,,12/05/2021,DON JOSE I-2021/05/12-21,21
,MI JOSE LUIS N 2,Tradicional,,,8.2,21.6,,12/05/2021,MI JOSE LUIS N 2-2021/05/12-21.6,21.6
,SANTA ROSA,Tradicional,,,11.5,25.8,,12/05/2021,SANTA ROSA-2021/05/12-25.8,25.8
,COQUI X,Tradicional,,,6.6,21,,12/05/2021,COQUI X-2021/05/12-21,21
,DON JOSE I,Tradicional,,,7.7,21,,12/05/2021,DON JOSE I-2021/05/12-21,21
,MI JOSE LUIS N 2,Tradicional,,,8.2,21.6,,12/05/2021,MI JOSE LUIS N 2-2021/05/12-21.6,21.6
,SANTA ROSA,Tradicional,,,11.5,25.8,,12/05/2021,SANTA ROSA-2021/05/12-25.8,25.8
,COQUI X,Tradicional,,,6.6,21,,12/05/2021,COQUI X-2021/05/12-21,21
,DON JOSE I,Tradicional,,,7.7,21,,12/05/2021,DON JOSE I-2021/05/12-21,21
,MI JOSE LUIS N 2,Tradicional,,,8.2,21.6,,12/05/2021,MI JOSE LUIS N 2-2021/05/12-21.6,21.6
,SANTA ROSA,Tradicional,,,11.5,25.8,,12/05/2021,SANTA ROSA-2021/05/12-25.8,25.8
,COQUI X,Tradicional,,,6.6,21,,12/05/2021,COQUI X-2021/05/12-21,21
,DON JOSE I,Tradicional,,,7.7,21,,12/05/2021,DON JOSE I-2021/05/12-21,21
,MI JOSE LUIS N 2,Tradicional,,,8.2,21.6,,12/05/2021,MI JOSE LUIS N 2-2021/05/12-21.6,21.6
,TASA 315,Tradicional,,,14.9,26.9,,12/05/2021,TASA 315-2021/05/12-26.9,26.9
,TASA 411,Tradicional,,,12.1,28.5,,12/05/2021,TASA 411-2021/05/12-28.5,28.5
,TASA 315,Tradicional,,,14.9,26.9,,12/05/2021,TASA 315-2021/05/12-26.9,26.9
,TASA 411,Tradicional,,,12.1,28.5,,12/05/2021,TASA 411-2021/05/12-28.5,28.5
,JAVIER,Tradicional,,,15.6,34.4,,12/05/2021,JAVIER-2021/05/12-34.4,34.4
,TASA 315,Tradicional,,,14.9,26.9,,12/05/2021,TASA 315-2021/05/12-26.9,26.9
,TASA 411,Tradicional,,,12.1,28.5,,12/05/2021,TASA 411-2021/05/12-28.5,28.5
,JAVIER,Tradicional,,,15.6,34.4,,12/05/2021,JAVIER-2021/05/12-34.4,34.4
,ROCIO,Tradicional,,,12.4,27.8,,12/05/2021,ROCIO-2021/05/12-27.8,27.8
,TASA 220,Tradicional,,,14.9,29.4,,12/05/2021,TASA 220-2021/05/12-29.4,29.4
,ROCIO,Tradicional,,,12.4,27.8,,12/05/2021,ROCIO-2021/05/12-27.8,27.8
,TASA 220,Tradicional,,,14.9,29.4,,12/05/2021,TASA 220-2021/05/12-29.4,29.4
,TASA 34,Tradicional,,,20.7,43.6,,13/05/2021,TASA 34-2021/05/13-43.6,43.6
,MACABI 5,Tradicional,,,15.6,32.8,,13/05/2021,MACABI 5-2021/05/13-32.8,32.8
,TASA 414,Tradicional,,,14.9,38.7,,13/05/2021,TASA 414-2021/05/13-38.7,38.7
,TASA 34,Tradicional,,,20.7,43.6,,13/05/2021,TASA 34-2021/05/13-43.6,43.6
,MACABI 5,Tradicional,,,15.6,32.8,,13/05/2021,MACABI 5-2021/05/13-32.8,32.8
,TASA 414,Tradicional,,,14.9,38.7,,13/05/2021,TASA 414-2021/05/13-38.7,38.7
,TASA 34,Tradicional,,,20.7,43.6,,13/05/2021,TASA 34-2021/05/13-43.6,43.6
,MACABI 5,Tradicional,,,15.6,32.8,,13/05/2021,MACABI 5-2021/05/13-32.8,32.8
,TASA 414,Tradicional,,,14.9,38.7,,13/05/2021,TASA 414-2021/05/13-38.7,38.7
,MODESTO 7,Tradicional,,,14.6,30.6,,13/05/2021,MODESTO 7-2021/05/13-30.6,30.6
,RIMAC,Tradicional,,,17.1,31.1,,13/05/2021,RIMAC-2021/05/13-31.1,31.1
,TASA 21,Tradicional,,,22.4,36.8,,13/05/2021,TASA 21-2021/05/13-36.8,36.8
,TASA 21,Tradicional,,,22.4,36.8,,13/05/2021,TASA 21-2021/05/13-36.8,36.8
,TASA 21,Tradicional,,,22.4,36.8,,13/05/2021,TASA 21-2021/05/13-36.8,36.8
,TASA 21,Tradicional,,,22.4,36.8,,13/05/2021,TASA 21-2021/05/13-36.8,36.8
,TASA 51,Frio,,,29.3,31.3,,13/05/2021,TASA 51-2021/05/13-31.3,31.3
,GUIAME MADRE MIA,Tradicional,,,6.5,19.7,,13/05/2021,GUIAME MADRE MIA-2021/05/13-19.7,19.7
,DON JOSE I,Tradicional,,,5.6,19.6,,13/05/2021,DON JOSE I-2021/05/13-19.6,19.6
,CRISTO TE AMA YE,Tradicional,,,9.5,20.9,,13/05/2021,CRISTO TE AMA YE-2021/05/13-20.9,20.9
,PALMAR-2,Tradicional,,,7.1,20.2,,13/05/2021,PALMAR-2-2021/05/13-20.2,20.2
,MODESTO,Tradicional,,,6.6,19.4,,13/05/2021,MODESTO-2021/05/13-19.4,19.4
,MI JOSUE,Tradicional,,,8.5,22,,13/05/2021,MI JOSUE-2021/05/13-22,22
,TASA 51,Frio,,,29.3,31.3,,13/05/2021,TASA 51-2021/05/13-31.3,31.3
,GUIAME MADRE MIA,Tradicional,,,6.5,19.7,,13/05/2021,GUIAME MADRE MIA-2021/05/13-19.7,19.7
,DON JOSE I,Tradicional,,,5.6,19.6,,13/05/2021,DON JOSE I-2021/05/13-19.6,19.6
,CRISTO TE AMA YE,Tradicional,,,9.5,20.9,,13/05/2021,CRISTO TE AMA YE-2021/05/13-20.9,20.9
,PALMAR-2,Tradicional,,,7.1,20.2,,13/05/2021,PALMAR-2-2021/05/13-20.2,20.2
,MODESTO,Tradicional,,,6.6,19.4,,13/05/2021,MODESTO-2021/05/13-19.4,19.4
,MI JOSUE,Tradicional,,,8.5,22,,13/05/2021,MI JOSUE-2021/05/13-22,22
,TASA 51,Frio,,,29.3,31.3,,13/05/2021,TASA 51-2021/05/13-31.3,31.3
,GUIAME MADRE MIA,Tradicional,,,6.5,19.7,,13/05/2021,GUIAME MADRE MIA-2021/05/13-19.7,19.7
,DON JOSE I,Tradicional,,,5.6,19.6,,13/05/2021,DON JOSE I-2021/05/13-19.6,19.6
,CRISTO TE AMA YE,Tradicional,,,9.5,20.9,,13/05/2021,CRISTO TE AMA YE-2021/05/13-20.9,20.9
,PALMAR-2,Tradicional,,,7.1,20.2,,13/05/2021,PALMAR-2-2021/05/13-20.2,20.2
,MODESTO,Tradicional,,,6.6,19.4,,13/05/2021,MODESTO-2021/05/13-19.4,19.4
,MI JOSUE,Tradicional,,,8.5,22,,13/05/2021,MI JOSUE-2021/05/13-22,22
,TASA 61,Frio,,,22,20.9,,13/05/2021,TASA 61-2021/05/13-20.9,20.9
,TASA 51,Frio,,,29.3,31.3,,13/05/2021,TASA 51-2021/05/13-31.3,31.3
,TASA 61,Frio,,,22,20.9,,13/05/2021,TASA 61-2021/05/13-20.9,20.9
,TASA 51,Frio,,,29.3,31.3,,13/05/2021,TASA 51-2021/05/13-31.3,31.3
,TASA 61,Frio,,,22,20.9,,13/05/2021,TASA 61-2021/05/13-20.9,20.9
,TASA 51,Frio,,,29.3,31.3,,13/05/2021,TASA 51-2021/05/13-31.3,31.3
,TASA 61,Frio,,,22,20.9,,13/05/2021,TASA 61-2021/05/13-20.9,20.9
,TASA 59,Frio,,,21.1,24.5,,13/05/2021,TASA 59-2021/05/13-24.5,24.5
,TASA 43,Frio,,,28.8,30.9,,13/05/2021,TASA 43-2021/05/13-30.9,30.9
,TASA 59,Frio,,,21.1,24.5,,13/05/2021,TASA 59-2021/05/13-24.5,24.5
,TASA 43,Frio,,,28.8,30.9,,13/05/2021,TASA 43-2021/05/13-30.9,30.9
,TASA 59,Frio,,,21.1,24.5,,13/05/2021,TASA 59-2021/05/13-24.5,24.5
,TASA 43,Frio,,,28.8,30.9,,13/05/2021,TASA 43-2021/05/13-30.9,30.9
,TASA 59,Frio,,,21.1,21.9,,14/05/2021,TASA 59-2021/05/14-21.9,21.9
,TASA 43,Frio,,,28.8,30.9,,14/05/2021,TASA 43-2021/05/14-30.9,30.9
,TASA 52,Frio,,,22.7,22,,14/05/2021,TASA 52-2021/05/14-22,22
,TASA 43,Frio,,,28.8,30.9,,14/05/2021,TASA 43-2021/05/14-30.9,30.9
,TASA 52,Frio,,,22.7,22,,14/05/2021,TASA 52-2021/05/14-22,22
,TASA 43,Frio,,,28.8,30.9,,14/05/2021,TASA 43-2021/05/14-30.9,30.9
,TASA 43,Frio,,,28.8,30.9,,14/05/2021,TASA 43-2021/05/14-30.9,30.9
,TASA 52,Frio,,,22.7,22,,14/05/2021,TASA 52-2021/05/14-22,22
,COQUI X,Tradicional,,,9.2,20.2,,14/05/2021,COQUI X-2021/05/14-20.2,20.2
,COQUI X,Tradicional,,,9.2,20.2,,14/05/2021,COQUI X-2021/05/14-20.2,20.2
,MI JOSE LUIS N 2,Tradicional,,,5.9,22.7,,14/05/2021,MI JOSE LUIS N 2-2021/05/14-22.7,22.7
,MODESTO,Tradicional,,,12.5,23.8,,14/05/2021,MODESTO-2021/05/14-23.8,23.8
,JOSE LUIS,Tradicional,,,7.2,22.6,,14/05/2021,JOSE LUIS-2021/05/14-22.6,22.6
,CRISTO TE AMA YE,Tradicional,,,16.3,30.8,,14/05/2021,CRISTO TE AMA YE-2021/05/14-30.8,30.8
,MODESTO 7,Tradicional,,,11.2,22.7,,14/05/2021,MODESTO 7-2021/05/14-22.7,22.7
,MODESTO 7,Tradicional,,,11.2,22.7,,14/05/2021,MODESTO 7-2021/05/14-22.7,22.7
,MI JOSE LUIS N 2,Tradicional,,,5.9,22.7,,14/05/2021,MI JOSE LUIS N 2-2021/05/14-22.7,22.7
,MODESTO,Tradicional,,,12.5,23.8,,14/05/2021,MODESTO-2021/05/14-23.8,23.8
,JOSE LUIS,Tradicional,,,7.2,22.6,,14/05/2021,JOSE LUIS-2021/05/14-22.6,22.6
,CRISTO TE AMA YE,Tradicional,,,16.3,30.8,,14/05/2021,CRISTO TE AMA YE-2021/05/14-30.8,30.8
,MODESTO 7,Tradicional,,,11.2,22.7,,14/05/2021,MODESTO 7-2021/05/14-22.7,22.7
,MODESTO 7,Tradicional,,,11.2,22.7,,14/05/2021,MODESTO 7-2021/05/14-22.7,22.7
,TASA 34,Tradicional,,,15.6,24.2,,14/05/2021,TASA 34-2021/05/14-24.2,24.2
,TASA 59,Frio,,,7.8,21.9,,14/05/2021,TASA 59-2021/05/14-21.9,21.9
,TASA 61,Frio,,,11.2,20.2,,14/05/2021,TASA 61-2021/05/14-20.2,20.2
,TASA 34,Tradicional,,,15.6,24.2,,14/05/2021,TASA 34-2021/05/14-24.2,24.2
,TASA 59,Frio,,,7.8,21.9,,14/05/2021,TASA 59-2021/05/14-21.9,21.9
,TASA 61,Frio,,,13.6,20.2,,14/05/2021,TASA 61-2021/05/14-20.2,20.2
,TASA 34,Tradicional,,,15.6,24.2,,14/05/2021,TASA 34-2021/05/14-24.2,24.2
,TASA 59,Frio,,,7.8,21.9,,14/05/2021,TASA 59-2021/05/14-21.9,21.9
,ROSA MARIA MS 1,Tradicional,,,18.8,33.2,,14/05/2021,ROSA MARIA MS 1-2021/05/14-33.2,33.2
,DON JOSE I,Tradicional,,,19.2,30.7,,14/05/2021,DON JOSE I-2021/05/14-30.7,30.7
,MODESTO 6,Tradicional,,,16.5,27.3,,14/05/2021,MODESTO 6-2021/05/14-27.3,27.3
,ROSA MARIA MS 1,Tradicional,,,18.8,33.2,,14/05/2021,ROSA MARIA MS 1-2021/05/14-33.2,33.2
,DON JOSE I,Tradicional,,,19.2,30.7,,14/05/2021,DON JOSE I-2021/05/14-30.7,30.7
,MODESTO 6,Tradicional,,,16.5,27.3,,14/05/2021,MODESTO 6-2021/05/14-27.3,27.3
,TASA 57,Frio,,,22.6,37.1,,14/05/2021,TASA 57-2021/05/14-37.1,37.1
,ROSA MARIA MS 1,Tradicional,,,18.8,33.2,,14/05/2021,ROSA MARIA MS 1-2021/05/14-33.2,33.2
,DON JOSE I,Tradicional,,,19.2,30.7,,14/05/2021,DON JOSE I-2021/05/14-30.7,30.7
,TASA 57,Frio,,,22.6,37.1,,14/05/2021,TASA 57-2021/05/14-37.1,37.1
,ROSA MARIA MS 1,Tradicional,,,18.8,33.2,,14/05/2021,ROSA MARIA MS 1-2021/05/14-33.2,33.2
,DON JOSE I,Tradicional,,,19.2,30.7,,14/05/2021,DON JOSE I-2021/05/14-30.7,30.7
,TASA 57,Frio,,,22.6,37.1,,14/05/2021,TASA 57-2021/05/14-37.1,37.1
,JAVIER,Tradicional,,,11.3,27.3,,14/05/2021,JAVIER-2021/05/14-27.3,27.3
,TASA 57,Frio,,,22.6,37.1,,14/05/2021,TASA 57-2021/05/14-37.1,37.1
,JAVIER,Tradicional,,,11.3,27.3,,14/05/2021,JAVIER-2021/05/14-27.3,27.3
,TASA 57,Frio,,,22.6,37.1,,14/05/2021,TASA 57-2021/05/14-37.1,37.1
,TASA 45,Frio,,,42.6,22,,15/05/2021,TASA 45-2021/05/15-22,22
,JAVIER,Tradicional,,,11.3,23.2,,15/05/2021,JAVIER-2021/05/15-23.2,23.2
,TASA 45,Frio,,,42.6,22,,15/05/2021,TASA 45-2021/05/15-22,22
,TASA 61,Frio,,,13.6,20.2,,15/05/2021,TASA 61-2021/05/15-20.2,20.2
,TASA 45,Frio,,,42.6,22,,15/05/2021,TASA 45-2021/05/15-22,22
,TASA 61,Frio,,,13.6,20.2,,15/05/2021,TASA 61-2021/05/15-20.2,20.2
,TASA 21,Tradicional,,,22.3,37.5,,15/05/2021,TASA 21-2021/05/15-37.5,37.5
,TASA 414,Tradicional,,,21.5,37.1,,15/05/2021,TASA 414-2021/05/15-37.1,37.1
,TASA 61,Frio,,,13.6,20.2,,15/05/2021,TASA 61-2021/05/15-20.2,20.2
,TASA 21,Tradicional,,,22.3,37.5,,15/05/2021,TASA 21-2021/05/15-37.5,37.5
,TASA 414,Tradicional,,,21.5,37.1,,15/05/2021,TASA 414-2021/05/15-37.1,37.1
,TASA 61,Frio,,,13.6,20.2,,15/05/2021,TASA 61-2021/05/15-20.2,20.2
,SAN JUDAS,Tradicional,,,19.1,31.9,,15/05/2021,SAN JUDAS-2021/05/15-31.9,31.9
,PALMAR-2,Tradicional,,,16.2,30.4,,15/05/2021,PALMAR-2-2021/05/15-30.4,30.4
,TASA 61,Frio,,,13.6,20.2,,15/05/2021,TASA 61-2021/05/15-20.2,20.2
,SAN JUDAS,Tradicional,,,19.1,31.9,,15/05/2021,SAN JUDAS-2021/05/15-31.9,31.9
,PALMAR-2,Tradicional,,,16.2,30.4,,15/05/2021,PALMAR-2-2021/05/15-30.4,30.4
,TASA 61,Frio,,,13.6,20.2,,15/05/2021,TASA 61-2021/05/15-20.2,20.2
,TEO,Tradicional,,,19,36.1,,15/05/2021,TEO-2021/05/15-36.1,36.1
,GUIAME MADRE MIA,Tradicional,,,17.9,33.8,,15/05/2021,GUIAME MADRE MIA-2021/05/15-33.8,33.8
,COQUI X,Tradicional,,,25.4,43.2,,15/05/2021,COQUI X-2021/05/15-43.2,43.2
,SANTA ROSA,Tradicional,,,22.9,34.2,,15/05/2021,SANTA ROSA-2021/05/15-34.2,34.2
,COQUI X,Tradicional,,,25.4,43.2,,15/05/2021,COQUI X-2021/05/15-43.2,43.2
,SANTA ROSA,Tradicional,,,22.9,34.2,,15/05/2021,SANTA ROSA-2021/05/15-34.2,34.2
,TEO,Tradicional,,,19.9,36.1,,15/05/2021,TEO-2021/05/15-36.1,36.1
,GUIAME MADRE MIA,Tradicional,,,17.9,33.8,,15/05/2021,GUIAME MADRE MIA-2021/05/15-33.8,33.8
,TASA 220,Tradicional,,,24.5,41.7,,15/05/2021,TASA 220-2021/05/15-41.7,41.7
,TEO,Tradicional,,,19.9,36.1,,15/05/2021,TEO-2021/05/15-36.1,36.1
,GUIAME MADRE MIA,Tradicional,,,17.9,33.8,,15/05/2021,GUIAME MADRE MIA-2021/05/15-33.8,33.8
,TASA 220,Tradicional,,,24.5,41.7,,15/05/2021,TASA 220-2021/05/15-41.7,41.7
,TEO,Tradicional,,,19.9,36.1,,15/05/2021,TEO-2021/05/15-36.1,36.1
,GUIAME MADRE MIA,Tradicional,,,17.9,33.8,,15/05/2021,GUIAME MADRE MIA-2021/05/15-33.8,33.8
,TEO,Tradicional,,,19.9,36.1,,15/05/2021,TEO-2021/05/15-36.1,36.1
,GUIAME MADRE MIA,Tradicional,,,17.9,33.8,,15/05/2021,GUIAME MADRE MIA-2021/05/15-33.8,33.8
,TASA 54,Frio,,,39.2,19.1,,15/05/2021,TASA 54-2021/05/15-19.1,19.1
,ROCIO,Tradicional,,,16.4,24.9,,15/05/2021,ROCIO-2021/05/15-24.9,24.9
,RIMAC,Tradicional,,,14.4,27.4,,15/05/2021,RIMAC-2021/05/15-27.4,27.4
,TASA 54,Frio,,,39.2,19.1,,15/05/2021,TASA 54-2021/05/15-19.1,19.1
,ROCIO,Tradicional,,,16.4,24.9,,15/05/2021,ROCIO-2021/05/15-24.9,24.9
,RIMAC,Tradicional,,,14.4,27.4,,15/05/2021,RIMAC-2021/05/15-27.4,27.4
,TASA 54,Frio,,,39.2,19.1,,15/05/2021,TASA 54-2021/05/15-19.1,19.1
,ROCIO,Tradicional,,,16.4,24.9,,15/05/2021,ROCIO-2021/05/15-24.9,24.9
,RIMAC,Tradicional,,,14.4,27.4,,15/05/2021,RIMAC-2021/05/15-27.4,27.4
,TASA 54,Frio,,,39.2,19.1,,15/05/2021,TASA 54-2021/05/15-19.1,19.1
