,marea_id,boat_name,tipo_bodega,owner_group,frio_system_state,tdc_arrival,tvn_discharge,departure_port_date,Fecha_IC,CodUnico,val,TDC-Desc,% Llenado,# Calas,tvn_pred,tvn_error
257,,TASA 425,Frio,,,14.4,23.3,,29/04/2021,TASA 425-2021/04/29-23.3,23.3,14.4,,,19.45875575319289,3.8412442468071113
262,,TASA 425,Frio,,,14.4,23.3,,29/04/2021,TASA 425-2021/04/29-23.3,23.3,14.4,,,19.45875575319289,3.8412442468071113
267,,TASA 425,Frio,,,14.4,23.3,,29/04/2021,TASA 425-2021/04/29-23.3,23.3,14.4,,,19.45875575319289,3.8412442468071113
405,,TASA 425,Frio,,,39.3,23.2,,1/05/2021,TASA 425-2021/05/01-23.2,23.2,39.3,,,24.958011924505676,1.7580119245056771
410,,TASA 425,Frio,,,39.3,23.2,,1/05/2021,TASA 425-2021/05/01-23.2,23.2,39.3,,,24.958011924505676,1.7580119245056771
411,,TASA 425,Frio,,,39.3,23.2,,1/05/2021,TASA 425-2021/05/01-23.2,23.2,39.3,,,24.958011924505676,1.7580119245056771
413,,TASA 425,Frio,,,39.3,14.7,,2/05/2021,TASA 425-2021/05/02-14.7,14.7,39.3,,,24.958011924505676,10.258011924505677
440,,TASA 425,Frio,,,8.2,14.7,,2/05/2021,TASA 425-2021/05/02-14.7,14.7,8.2,,,18.837081653241967,4.137081653241967
444,,TASA 425,Frio,,,8.2,14.7,,2/05/2021,TASA 425-2021/05/02-14.7,14.7,8.2,,,18.837081653241967,4.137081653241967
448,,TASA 425,Frio,,,8.2,14.7,,2/05/2021,TASA 425-2021/05/02-14.7,14.7,8.2,,,18.837081653241967,4.137081653241967
452,,TASA 425,Frio,,,8.2,14.7,,2/05/2021,TASA 425-2021/05/02-14.7,14.7,8.2,,,18.837081653241967,4.137081653241967
456,,TASA 425,Frio,,,8.2,14.7,,2/05/2021,TASA 425-2021/05/02-14.7,14.7,8.2,,,18.837081653241967,4.137081653241967
460,,TASA 425,Frio,,,8.2,14.7,,2/05/2021,TASA 425-2021/05/02-14.7,14.7,8.2,,,18.837081653241967,4.137081653241967
555,,TASA 42,Frio,,,30.3,18.6,,3/05/2021,TASA 42-2021/05/03-18.6,18.6,30.3,,,23.158011924505676,4.558011924505674
556,,TASA 42,Frio,,,30.3,18.6,,3/05/2021,TASA 42-2021/05/03-18.6,18.6,30.3,,,23.158011924505676,4.558011924505674
558,,TASA 42,Frio,,,30.3,18.6,,3/05/2021,TASA 42-2021/05/03-18.6,18.6,30.3,,,23.158011924505676,4.558011924505674
641,,TASA 52,Frio,,,11.4,22.0,,4/05/2021,TASA 52-2021/05/04-22,22.0,11.4,,,19.143268886904522,2.856731113095478
649,,TASA 52,Frio,,,11.4,22.0,,4/05/2021,TASA 52-2021/05/04-22,22.0,11.4,,,19.143268886904522,2.856731113095478
650,,TASA 52,Frio,,,11.4,22.0,,4/05/2021,TASA 52-2021/05/04-22,22.0,11.4,,,19.143268886904522,2.856731113095478
651,,TASA 52,Frio,,,11.4,22.0,,4/05/2021,TASA 52-2021/05/04-22,22.0,11.4,,,19.143268886904522,2.856731113095478
652,,TASA 42,Frio,,,7.6,19.5,,4/05/2021,TASA 42-2021/05/04-19.5,19.5,7.6,,,18.665409095501616,0.8345909044983841
653,,TASA 52,Frio,,,11.4,22.0,,4/05/2021,TASA 52-2021/05/04-22,22.0,11.4,,,19.143268886904522,2.856731113095478
654,,TASA 42,Frio,,,7.6,19.5,,4/05/2021,TASA 42-2021/05/04-19.5,19.5,7.6,,,18.665409095501616,0.8345909044983841
655,,TASA 52,Frio,,,11.4,22.0,,4/05/2021,TASA 52-2021/05/04-22,22.0,11.4,,,19.143268886904522,2.856731113095478
660,,TASA 54,Frio,,,10.8,19.7,,4/05/2021,TASA 54-2021/05/04-19.7,19.7,10.8,,,19.114958839482654,0.5850411605173456
669,,TASA 54,Frio,,,10.8,19.7,,4/05/2021,TASA 54-2021/05/04-19.7,19.7,10.8,,,19.114958839482654,0.5850411605173456
674,,TASA 54,Frio,,,10.8,19.7,,4/05/2021,TASA 54-2021/05/04-19.7,19.7,10.8,,,19.114958839482654,0.5850411605173456
710,,TASA 425,Frio,,,17.5,23.9,,5/05/2021,TASA 425-2021/05/05-23.9,23.9,17.5,,,20.23798534693364,3.6620146530663575
713,,TASA 425,Frio,,,17.5,23.9,,5/05/2021,TASA 425-2021/05/05-23.9,23.9,17.5,,,20.23798534693364,3.6620146530663575
716,,TASA 425,Frio,,,17.5,23.9,,5/05/2021,TASA 425-2021/05/05-23.9,23.9,17.5,,,20.23798534693364,3.6620146530663575
721,,TASA 52,Frio,,,15.4,23.9,,5/05/2021,TASA 52-2021/05/05-23.9,23.9,15.4,,,19.664281776304904,4.235718223695095
724,,TASA 52,Frio,,,15.4,23.9,,5/05/2021,TASA 52-2021/05/05-23.9,23.9,15.4,,,19.664281776304904,4.235718223695095
725,,TASA 52,Frio,,,15.4,23.9,,5/05/2021,TASA 52-2021/05/05-23.9,23.9,15.4,,,19.664281776304904,4.235718223695095
751,,TASA 425,Frio,,,11.2,24.9,,6/05/2021,TASA 425-2021/05/06-24.9,24.9,11.2,,,19.133542204679117,5.766457795320882
755,,TASA 425,Frio,,,11.2,24.9,,6/05/2021,TASA 425-2021/05/06-24.9,24.9,11.2,,,19.133542204679117,5.766457795320882
759,,TASA 425,Frio,,,11.2,24.9,,6/05/2021,TASA 425-2021/05/06-24.9,24.9,11.2,,,19.133542204679117,5.766457795320882
763,,TASA 425,Frio,,,11.2,24.9,,6/05/2021,TASA 425-2021/05/06-24.9,24.9,11.2,,,19.133542204679117,5.766457795320882
784,,TASA 55,Frio,,,34.1,22.4,,6/05/2021,TASA 55-2021/05/06-22.4,22.4,34.1,,,23.918011924505677,1.5180119245056787
786,,TASA 55,Frio,,,34.1,22.4,,6/05/2021,TASA 55-2021/05/06-22.4,22.4,34.1,,,23.918011924505677,1.5180119245056787
788,,TASA 55,Frio,,,34.1,22.4,,6/05/2021,TASA 55-2021/05/06-22.4,22.4,34.1,,,23.918011924505677,1.5180119245056787
799,,TASA 42,Frio,,,22.8,26.1,,7/05/2021,TASA 42-2021/05/07-26.1,26.1,22.8,,,21.658011924505676,4.441988075494326
800,,TASA 42,Frio,,,22.8,26.1,,7/05/2021,TASA 42-2021/05/07-26.1,26.1,22.8,,,21.658011924505676,4.441988075494326
804,,TASA 42,Frio,,,22.8,26.1,,7/05/2021,TASA 42-2021/05/07-26.1,26.1,22.8,,,21.658011924505676,4.441988075494326
808,,TASA 54,Frio,,,27.0,20.3,,7/05/2021,TASA 54-2021/05/07-20.3,20.3,27.0,,,22.498011924505676,2.198011924505675
812,,TASA 54,Frio,,,27.0,20.3,,7/05/2021,TASA 54-2021/05/07-20.3,20.3,27.0,,,22.498011924505676,2.198011924505675
816,,TASA 54,Frio,,,27.0,20.3,,7/05/2021,TASA 54-2021/05/07-20.3,20.3,27.0,,,22.498011924505676,2.198011924505675
820,,TASA 54,Frio,,,27.0,20.3,,7/05/2021,TASA 54-2021/05/07-20.3,20.3,27.0,,,22.498011924505676,2.198011924505675
824,,TASA 425,Frio,,,17.3,23.8,,7/05/2021,TASA 425-2021/05/07-23.8,23.8,17.3,,,20.17743879831265,3.6225612016873505
828,,TASA 425,Frio,,,17.3,23.8,,7/05/2021,TASA 425-2021/05/07-23.8,23.8,17.3,,,20.17743879831265,3.6225612016873505
831,,TASA 425,Frio,,,17.3,23.8,,7/05/2021,TASA 425-2021/05/07-23.8,23.8,17.3,,,20.17743879831265,3.6225612016873505
857,,TASA 45,Frio,,,34.1,21.6,,8/05/2021,TASA 45-2021/05/08-21.6,21.6,34.1,,,23.918011924505677,2.318011924505676
858,,TASA 45,Frio,,,34.1,21.6,,8/05/2021,TASA 45-2021/05/08-21.6,21.6,34.1,,,23.918011924505677,2.318011924505676
863,,TASA 71,Frio,,,29.7,24.8,,8/05/2021,TASA 71-2021/05/08-24.8,24.8,29.7,,,23.038011924505675,1.761988075494326
868,,TASA 71,Frio,,,29.7,24.8,,8/05/2021,TASA 71-2021/05/08-24.8,24.8,29.7,,,23.038011924505675,1.761988075494326
873,,TASA 71,Frio,,,29.7,24.8,,8/05/2021,TASA 71-2021/05/08-24.8,24.8,29.7,,,23.038011924505675,1.761988075494326
878,,TASA 71,Frio,,,29.7,24.8,,8/05/2021,TASA 71-2021/05/08-24.8,24.8,29.7,,,23.038011924505675,1.761988075494326
883,,TASA 71,Frio,,,29.7,24.8,,8/05/2021,TASA 71-2021/05/08-24.8,24.8,29.7,,,23.038011924505675,1.761988075494326
888,,TASA 425,Frio,,,11.7,22.6,,8/05/2021,TASA 425-2021/05/08-22.6,22.6,11.7,,,19.15911782812978,3.4408821718702214
889,,TASA 55,Frio,,,20.9,22.0,,8/05/2021,TASA 55-2021/05/08-22,22.0,20.9,,,21.251626889141534,0.7483731108584664
890,,TASA 425,Frio,,,11.7,22.6,,8/05/2021,TASA 425-2021/05/08-22.6,22.6,11.7,,,19.15911782812978,3.4408821718702214
891,,TASA 55,Frio,,,20.9,22.0,,8/05/2021,TASA 55-2021/05/08-22,22.0,20.9,,,21.251626889141534,0.7483731108584664
892,,TASA 425,Frio,,,11.7,22.6,,8/05/2021,TASA 425-2021/05/08-22.6,22.6,11.7,,,19.15911782812978,3.4408821718702214
893,,TASA 55,Frio,,,20.9,22.0,,8/05/2021,TASA 55-2021/05/08-22,22.0,20.9,,,21.251626889141534,0.7483731108584664
894,,TASA 425,Frio,,,11.7,22.6,,8/05/2021,TASA 425-2021/05/08-22.6,22.6,11.7,,,19.15911782812978,3.4408821718702214
895,,TASA 55,Frio,,,20.9,22.0,,8/05/2021,TASA 55-2021/05/08-22,22.0,20.9,,,21.251626889141534,0.7483731108584664
896,,TASA 425,Frio,,,11.7,22.6,,9/05/2021,TASA 425-2021/05/09-22.6,22.6,11.7,,,19.15911782812978,3.4408821718702214
900,,TASA 41,Frio,,,28.8,22.7,,9/05/2021,TASA 41-2021/05/09-22.7,22.7,28.8,,,22.858011924505675,0.1580119245056757
904,,TASA 41,Frio,,,28.8,22.7,,9/05/2021,TASA 41-2021/05/09-22.7,22.7,28.8,,,22.858011924505675,0.1580119245056757
908,,TASA 41,Frio,,,28.8,22.7,,9/05/2021,TASA 41-2021/05/09-22.7,22.7,28.8,,,22.858011924505675,0.1580119245056757
912,,TASA 41,Frio,,,28.8,22.7,,9/05/2021,TASA 41-2021/05/09-22.7,22.7,28.8,,,22.858011924505675,0.1580119245056757
913,,TASA 51,Frio,,,27.3,23.0,,9/05/2021,TASA 51-2021/05/09-23,23.0,27.3,,,22.558011924505674,0.4419880754943257
914,,TASA 41,Frio,,,28.8,22.7,,9/05/2021,TASA 41-2021/05/09-22.7,22.7,28.8,,,22.858011924505675,0.1580119245056757
915,,TASA 51,Frio,,,27.3,23.0,,9/05/2021,TASA 51-2021/05/09-23,23.0,27.3,,,22.558011924505674,0.4419880754943257
916,,TASA 41,Frio,,,28.8,22.7,,9/05/2021,TASA 41-2021/05/09-22.7,22.7,28.8,,,22.858011924505675,0.1580119245056757
917,,TASA 51,Frio,,,27.3,23.0,,9/05/2021,TASA 51-2021/05/09-23,23.0,27.3,,,22.558011924505674,0.4419880754943257
918,,TASA 41,Frio,,,28.8,22.7,,9/05/2021,TASA 41-2021/05/09-22.7,22.7,28.8,,,22.858011924505675,0.1580119245056757
919,,TASA 51,Frio,,,27.3,23.0,,9/05/2021,TASA 51-2021/05/09-23,23.0,27.3,,,22.558011924505674,0.4419880754943257
920,,TASA 61,Frio,,,27.9,22.8,,9/05/2021,TASA 61-2021/05/09-22.8,22.8,27.9,,,22.678011924505675,0.12198807549432544
923,,TASA 61,Frio,,,27.9,22.8,,9/05/2021,TASA 61-2021/05/09-22.8,22.8,27.9,,,22.678011924505675,0.12198807549432544
965,,TASA 54,Frio,,,36.8,23.4,,9/05/2021,TASA 54-2021/05/09-23.4,23.4,36.8,,,24.458011924505676,1.0580119245056778
970,,TASA 54,Frio,,,36.8,23.4,,9/05/2021,TASA 54-2021/05/09-23.4,23.4,36.8,,,24.458011924505676,1.0580119245056778
973,,TASA 54,Frio,,,36.8,23.4,,9/05/2021,TASA 54-2021/05/09-23.4,23.4,36.8,,,24.458011924505676,1.0580119245056778
976,,TASA 54,Frio,,,36.8,23.4,,9/05/2021,TASA 54-2021/05/09-23.4,23.4,36.8,,,24.458011924505676,1.0580119245056778
981,,TASA 45,Frio,,,21.4,23.3,,10/05/2021,TASA 45-2021/05/10-23.3,23.3,21.4,,,21.372052152645836,1.9279478473541651
984,,TASA 45,Frio,,,21.4,23.3,,10/05/2021,TASA 45-2021/05/10-23.3,23.3,21.4,,,21.372052152645836,1.9279478473541651
987,,TASA 45,Frio,,,21.4,23.3,,10/05/2021,TASA 45-2021/05/10-23.3,23.3,21.4,,,21.372052152645836,1.9279478473541651
1020,,TASA 71,Frio,,,38.4,23.1,,10/05/2021,TASA 71-2021/05/10-23.1,23.1,38.4,,,24.778011924505677,1.6780119245056753
1023,,TASA 71,Frio,,,38.4,23.1,,10/05/2021,TASA 71-2021/05/10-23.1,23.1,38.4,,,24.778011924505677,1.6780119245056753
1025,,TASA 71,Frio,,,38.4,23.1,,10/05/2021,TASA 71-2021/05/10-23.1,23.1,38.4,,,24.778011924505677,1.6780119245056753
1029,,TASA 71,Frio,,,38.4,23.1,,10/05/2021,TASA 71-2021/05/10-23.1,23.1,38.4,,,24.778011924505677,1.6780119245056753
1034,,TASA 57,Frio,,,16.8,28.1,,11/05/2021,TASA 57-2021/05/11-28.1,28.1,16.8,,,20.030220800123814,8.069779199876187
1038,,TASA 57,Frio,,,16.8,28.1,,11/05/2021,TASA 57-2021/05/11-28.1,28.1,16.8,,,20.030220800123814,8.069779199876187
1039,,TASA 57,Frio,,,16.8,28.1,,11/05/2021,TASA 57-2021/05/11-28.1,28.1,16.8,,,20.030220800123814,8.069779199876187
1040,,TASA 52,Frio,,,24.5,23.3,,11/05/2021,TASA 52-2021/05/11-23.3,23.3,24.5,,,21.998011924505676,1.3019880754943252
1041,,TASA 57,Frio,,,16.8,28.1,,11/05/2021,TASA 57-2021/05/11-28.1,28.1,16.8,,,20.030220800123814,8.069779199876187
1042,,TASA 52,Frio,,,24.5,23.3,,11/05/2021,TASA 52-2021/05/11-23.3,23.3,24.5,,,21.998011924505676,1.3019880754943252
1043,,TASA 57,Frio,,,16.8,28.1,,11/05/2021,TASA 57-2021/05/11-28.1,28.1,16.8,,,20.030220800123814,8.069779199876187
1044,,TASA 52,Frio,,,24.5,23.3,,11/05/2021,TASA 52-2021/05/11-23.3,23.3,24.5,,,21.998011924505676,1.3019880754943252
1085,,TASA 51,Frio,,,36.2,25.4,,11/05/2021,TASA 51-2021/05/11-25.4,25.4,36.2,,,24.338011924505675,1.0619880754943232
1088,,TASA 51,Frio,,,36.2,25.4,,11/05/2021,TASA 51-2021/05/11-25.4,25.4,36.2,,,24.338011924505675,1.0619880754943232
1091,,TASA 51,Frio,,,36.2,25.4,,11/05/2021,TASA 51-2021/05/11-25.4,25.4,36.2,,,24.338011924505675,1.0619880754943232
1094,,TASA 51,Frio,,,36.2,25.4,,12/05/2021,TASA 51-2021/05/12-25.4,25.4,36.2,,,24.338011924505675,1.0619880754943232
1098,,TASA 61,Frio,,,23.6,24.3,,12/05/2021,TASA 61-2021/05/12-24.3,24.3,23.6,,,21.818011924505676,2.481988075494325
1100,,TASA 61,Frio,,,23.6,24.3,,12/05/2021,TASA 61-2021/05/12-24.3,24.3,23.6,,,21.818011924505676,2.481988075494325
1101,,TASA 61,Frio,,,23.6,24.3,,12/05/2021,TASA 61-2021/05/12-24.3,24.3,23.6,,,21.818011924505676,2.481988075494325
1102,,TASA 61,Frio,,,23.6,24.3,,12/05/2021,TASA 61-2021/05/12-24.3,24.3,23.6,,,21.818011924505676,2.481988075494325
1104,,TASA 427,Frio,,,47.7,28.5,,12/05/2021,TASA 427-2021/05/12-28.5,28.5,47.7,,,26.638011924505676,1.8619880754943239
1106,,TASA 427,Frio,,,47.7,28.5,,12/05/2021,TASA 427-2021/05/12-28.5,28.5,47.7,,,26.638011924505676,1.8619880754943239
1108,,TASA 427,Frio,,,47.7,28.5,,12/05/2021,TASA 427-2021/05/12-28.5,28.5,47.7,,,26.638011924505676,1.8619880754943239
1182,,TASA 51,Frio,,,29.3,31.3,,13/05/2021,TASA 51-2021/05/13-31.3,31.3,29.3,,,22.958011924505676,8.341988075494324
1189,,TASA 51,Frio,,,29.3,31.3,,13/05/2021,TASA 51-2021/05/13-31.3,31.3,29.3,,,22.958011924505676,8.341988075494324
1196,,TASA 51,Frio,,,29.3,31.3,,13/05/2021,TASA 51-2021/05/13-31.3,31.3,29.3,,,22.958011924505676,8.341988075494324
1203,,TASA 61,Frio,,,22.0,20.9,,13/05/2021,TASA 61-2021/05/13-20.9,20.9,22.0,,,21.498011924505676,0.598011924505677
1204,,TASA 51,Frio,,,29.3,31.3,,13/05/2021,TASA 51-2021/05/13-31.3,31.3,29.3,,,22.958011924505676,8.341988075494324
1205,,TASA 61,Frio,,,22.0,20.9,,13/05/2021,TASA 61-2021/05/13-20.9,20.9,22.0,,,21.498011924505676,0.598011924505677
1206,,TASA 51,Frio,,,29.3,31.3,,13/05/2021,TASA 51-2021/05/13-31.3,31.3,29.3,,,22.958011924505676,8.341988075494324
1207,,TASA 61,Frio,,,22.0,20.9,,13/05/2021,TASA 61-2021/05/13-20.9,20.9,22.0,,,21.498011924505676,0.598011924505677
1208,,TASA 51,Frio,,,29.3,31.3,,13/05/2021,TASA 51-2021/05/13-31.3,31.3,29.3,,,22.958011924505676,8.341988075494324
1209,,TASA 61,Frio,,,22.0,20.9,,13/05/2021,TASA 61-2021/05/13-20.9,20.9,22.0,,,21.498011924505676,0.598011924505677
1210,,TASA 59,Frio,,,21.1,24.5,,13/05/2021,TASA 59-2021/05/13-24.5,24.5,21.1,,,21.301345086658586,3.1986549133414144
1211,,TASA 43,Frio,,,28.8,30.9,,13/05/2021,TASA 43-2021/05/13-30.9,30.9,28.8,,,22.858011924505675,8.041988075494324
1212,,TASA 59,Frio,,,21.1,24.5,,13/05/2021,TASA 59-2021/05/13-24.5,24.5,21.1,,,21.301345086658586,3.1986549133414144
1213,,TASA 43,Frio,,,28.8,30.9,,13/05/2021,TASA 43-2021/05/13-30.9,30.9,28.8,,,22.858011924505675,8.041988075494324
1214,,TASA 59,Frio,,,21.1,24.5,,13/05/2021,TASA 59-2021/05/13-24.5,24.5,21.1,,,21.301345086658586,3.1986549133414144
1215,,TASA 43,Frio,,,28.8,30.9,,13/05/2021,TASA 43-2021/05/13-30.9,30.9,28.8,,,22.858011924505675,8.041988075494324
1216,,TASA 59,Frio,,,21.1,21.9,,14/05/2021,TASA 59-2021/05/14-21.9,21.9,21.1,,,21.301345086658586,0.598654913341413
1217,,TASA 43,Frio,,,28.8,30.9,,14/05/2021,TASA 43-2021/05/14-30.9,30.9,28.8,,,22.858011924505675,8.041988075494324
1218,,TASA 52,Frio,,,22.7,22.0,,14/05/2021,TASA 52-2021/05/14-22,22.0,22.7,,,21.638011924505676,0.3619880754943239
1219,,TASA 43,Frio,,,28.8,30.9,,14/05/2021,TASA 43-2021/05/14-30.9,30.9,28.8,,,22.858011924505675,8.041988075494324
1220,,TASA 52,Frio,,,22.7,22.0,,14/05/2021,TASA 52-2021/05/14-22,22.0,22.7,,,21.638011924505676,0.3619880754943239
1221,,TASA 43,Frio,,,28.8,30.9,,14/05/2021,TASA 43-2021/05/14-30.9,30.9,28.8,,,22.858011924505675,8.041988075494324
1222,,TASA 43,Frio,,,28.8,30.9,,14/05/2021,TASA 43-2021/05/14-30.9,30.9,28.8,,,22.858011924505675,8.041988075494324
1223,,TASA 52,Frio,,,22.7,22.0,,14/05/2021,TASA 52-2021/05/14-22,22.0,22.7,,,21.638011924505676,0.3619880754943239
1239,,TASA 59,Frio,,,7.8,21.9,,14/05/2021,TASA 59-2021/05/14-21.9,21.9,7.8,,,18.730094225212383,3.1699057747876154
1240,,TASA 61,Frio,,,11.2,20.2,,14/05/2021,TASA 61-2021/05/14-20.2,20.2,11.2,,,19.133542204679117,1.0664577953208827
1242,,TASA 59,Frio,,,7.8,21.9,,14/05/2021,TASA 59-2021/05/14-21.9,21.9,7.8,,,18.730094225212383,3.1699057747876154
1243,,TASA 61,Frio,,,13.6,20.2,,14/05/2021,TASA 61-2021/05/14-20.2,20.2,13.6,,,19.33285413698603,0.8671458630139703
1245,,TASA 59,Frio,,,7.8,21.9,,14/05/2021,TASA 59-2021/05/14-21.9,21.9,7.8,,,18.730094225212383,3.1699057747876154
1252,,TASA 57,Frio,,,22.6,37.1,,14/05/2021,TASA 57-2021/05/14-37.1,37.1,22.6,,,21.618011924505677,15.481988075494325
1255,,TASA 57,Frio,,,22.6,37.1,,14/05/2021,TASA 57-2021/05/14-37.1,37.1,22.6,,,21.618011924505677,15.481988075494325
1258,,TASA 57,Frio,,,22.6,37.1,,14/05/2021,TASA 57-2021/05/14-37.1,37.1,22.6,,,21.618011924505677,15.481988075494325
1260,,TASA 57,Frio,,,22.6,37.1,,14/05/2021,TASA 57-2021/05/14-37.1,37.1,22.6,,,21.618011924505677,15.481988075494325
1262,,TASA 57,Frio,,,22.6,37.1,,14/05/2021,TASA 57-2021/05/14-37.1,37.1,22.6,,,21.618011924505677,15.481988075494325
1263,,TASA 45,Frio,,,42.6,22.0,,15/05/2021,TASA 45-2021/05/15-22,22.0,42.6,,,25.618011924505677,3.6180119245056765
1265,,TASA 45,Frio,,,42.6,22.0,,15/05/2021,TASA 45-2021/05/15-22,22.0,42.6,,,25.618011924505677,3.6180119245056765
1266,,TASA 61,Frio,,,13.6,20.2,,15/05/2021,TASA 61-2021/05/15-20.2,20.2,13.6,,,19.33285413698603,0.8671458630139703
1267,,TASA 45,Frio,,,42.6,22.0,,15/05/2021,TASA 45-2021/05/15-22,22.0,42.6,,,25.618011924505677,3.6180119245056765
1268,,TASA 61,Frio,,,13.6,20.2,,15/05/2021,TASA 61-2021/05/15-20.2,20.2,13.6,,,19.33285413698603,0.8671458630139703
1271,,TASA 61,Frio,,,13.6,20.2,,15/05/2021,TASA 61-2021/05/15-20.2,20.2,13.6,,,19.33285413698603,0.8671458630139703
1274,,TASA 61,Frio,,,13.6,20.2,,15/05/2021,TASA 61-2021/05/15-20.2,20.2,13.6,,,19.33285413698603,0.8671458630139703
1277,,TASA 61,Frio,,,13.6,20.2,,15/05/2021,TASA 61-2021/05/15-20.2,20.2,13.6,,,19.33285413698603,0.8671458630139703
1280,,TASA 61,Frio,,,13.6,20.2,,15/05/2021,TASA 61-2021/05/15-20.2,20.2,13.6,,,19.33285413698603,0.8671458630139703
1297,,TASA 54,Frio,,,39.2,19.1,,15/05/2021,TASA 54-2021/05/15-19.1,19.1,39.2,,,24.938011924505677,5.838011924505675
1300,,TASA 54,Frio,,,39.2,19.1,,15/05/2021,TASA 54-2021/05/15-19.1,19.1,39.2,,,24.938011924505677,5.838011924505675
1303,,TASA 54,Frio,,,39.2,19.1,,15/05/2021,TASA 54-2021/05/15-19.1,19.1,39.2,,,24.938011924505677,5.838011924505675
1306,,TASA 54,Frio,,,39.2,19.1,,15/05/2021,TASA 54-2021/05/15-19.1,19.1,39.2,,,24.938011924505677,5.838011924505675
1328,,TASA 42,Frio,,,19.9,36.1,,16/05/2021,TASA 42-2021/05/16-36.1,36.1,19.9,,,20.977259107001842,15.12274089299816
1330,,TASA 42,Frio,,,19.9,36.1,,16/05/2021,TASA 42-2021/05/16-36.1,36.1,19.9,,,20.977259107001842,15.12274089299816
1332,,TASA 42,Frio,,,19.9,36.1,,16/05/2021,TASA 42-2021/05/16-36.1,36.1,19.9,,,20.977259107001842,15.12274089299816
1334,,TASA 42,Frio,,,19.9,36.1,,16/05/2021,TASA 42-2021/05/16-36.1,36.1,19.9,,,20.977259107001842,15.12274089299816
1336,,TASA 42,Frio,,,19.9,36.1,,16/05/2021,TASA 42-2021/05/16-36.1,36.1,19.9,,,20.977259107001842,15.12274089299816
1343,,TASA 57,Frio,,,11.2,20.6,,16/05/2021,TASA 57-2021/05/16-20.6,20.6,11.2,,,19.133542204679117,1.4664577953208848
1346,,TASA 57,Frio,,,11.2,20.6,,16/05/2021,TASA 57-2021/05/16-20.6,20.6,11.2,,,19.133542204679117,1.4664577953208848
1349,,TASA 57,Frio,,,11.2,20.6,,16/05/2021,TASA 57-2021/05/16-20.6,20.6,11.2,,,19.133542204679117,1.4664577953208848
1352,,TASA 57,Frio,,,11.2,20.6,,16/05/2021,TASA 57-2021/05/16-20.6,20.6,11.2,,,19.133542204679117,1.4664577953208848
1357,,TASA 57,Frio,,,11.2,20.6,,16/05/2021,TASA 57-2021/05/16-20.6,20.6,11.2,,,19.133542204679117,1.4664577953208848
1364,,TASA 56,Frio,,,19.3,21.7,,16/05/2021,TASA 56-2021/05/16-21.7,21.7,19.3,,,20.797402793699234,0.902597206300765
1365,,TASA 56,Frio,,,19.3,21.7,,16/05/2021,TASA 56-2021/05/16-21.7,21.7,19.3,,,20.797402793699234,0.902597206300765
1366,,TASA 61,Frio,,,14.1,21.6,,16/05/2021,TASA 61-2021/05/16-21.6,21.6,14.1,,,19.40747707684345,2.1925229231565524
1367,,TASA 61,Frio,,,14.1,21.6,,16/05/2021,TASA 61-2021/05/16-21.6,21.6,14.1,,,19.40747707684345,2.1925229231565524
1368,,TASA 56,Frio,,,19.3,21.7,,16/05/2021,TASA 56-2021/05/16-21.7,21.7,19.3,,,20.797402793699234,0.902597206300765
1369,,TASA 61,Frio,,,14.1,21.6,,16/05/2021,TASA 61-2021/05/16-21.6,21.6,14.1,,,19.40747707684345,2.1925229231565524
1370,,TASA 56,Frio,,,19.3,21.7,,16/05/2021,TASA 56-2021/05/16-21.7,21.7,19.3,,,20.797402793699234,0.902597206300765
1371,,TASA 61,Frio,,,14.1,21.6,,17/05/2021,TASA 61-2021/05/17-21.6,21.6,14.1,,,19.40747707684345,2.1925229231565524
1372,,TASA 56,Frio,,,19.3,21.7,,17/05/2021,TASA 56-2021/05/17-21.7,21.7,19.3,,,20.797402793699234,0.902597206300765
1374,,TASA 427,Frio,,,14.6,22.3,,17/05/2021,TASA 427-2021/05/17-22.3,22.3,14.6,,,19.495651330505936,2.8043486694940647
1376,,TASA 427,Frio,,,14.6,22.3,,17/05/2021,TASA 427-2021/05/17-22.3,22.3,14.6,,,19.495651330505936,2.8043486694940647
1378,,TASA 427,Frio,,,14.6,22.3,,17/05/2021,TASA 427-2021/05/17-22.3,22.3,14.6,,,19.495651330505936,2.8043486694940647
1380,,TASA 45,Frio,,,20.0,21.8,,17/05/2021,TASA 45-2021/05/17-21.8,21.8,20.0,,,21.006326960000067,0.7936730399999341
1381,,TASA 45,Frio,,,20.0,21.8,,17/05/2021,TASA 45-2021/05/17-21.8,21.8,20.0,,,21.006326960000067,0.7936730399999341
1382,,TASA 427,Frio,,,14.6,22.3,,17/05/2021,TASA 427-2021/05/17-22.3,22.3,14.6,,,19.495651330505936,2.8043486694940647
1383,,TASA 427,Frio,,,14.6,22.3,,17/05/2021,TASA 427-2021/05/17-22.3,22.3,14.6,,,19.495651330505936,2.8043486694940647
1391,,TASA 59,Frio,,,31.8,22.0,,17/05/2021,TASA 59-2021/05/17-22,22.0,31.8,,,23.458011924505676,1.4580119245056764
1393,,TASA 59,Frio,,,31.8,22.0,,17/05/2021,TASA 59-2021/05/17-22,22.0,31.8,,,23.458011924505676,1.4580119245056764
1395,,TASA 59,Frio,,,31.8,22.0,,17/05/2021,TASA 59-2021/05/17-22,22.0,31.8,,,23.458011924505676,1.4580119245056764
1397,,TASA 59,Frio,,,31.8,22.0,,17/05/2021,TASA 59-2021/05/17-22,22.0,31.8,,,23.458011924505676,1.4580119245056764
1398,,TASA 52,Frio,,,25.2,22.6,,17/05/2021,TASA 52-2021/05/17-22.6,22.6,25.2,,,22.138011924505676,0.4619880754943253
1399,,TASA 52,Frio,,,25.2,22.6,,17/05/2021,TASA 52-2021/05/17-22.6,22.6,25.2,,,22.138011924505676,0.4619880754943253
1402,,TASA 52,Frio,,,25.2,22.6,,17/05/2021,TASA 52-2021/05/17-22.6,22.6,25.2,,,22.138011924505676,0.4619880754943253
1405,,TASA 52,Frio,,,25.2,22.6,,17/05/2021,TASA 52-2021/05/17-22.6,22.6,25.2,,,22.138011924505676,0.4619880754943253
1408,,TASA 51,Frio,,,59.4,24.2,,17/05/2021,TASA 51-2021/05/17-24.2,24.2,59.4,,,28.978011924505676,4.778011924505677
1409,,TASA 52,Frio,,,25.2,22.6,,17/05/2021,TASA 52-2021/05/17-22.6,22.6,25.2,,,22.138011924505676,0.4619880754943253
1410,,TASA 51,Frio,,,59.4,24.2,,17/05/2021,TASA 51-2021/05/17-24.2,24.2,59.4,,,28.978011924505676,4.778011924505677
1411,,TASA 42,Frio,,,38.6,22.1,,17/05/2021,TASA 42-2021/05/17-22.1,22.1,38.6,,,24.818011924505676,2.7180119245056744
1412,,TASA 51,Frio,,,59.4,24.2,,17/05/2021,TASA 51-2021/05/17-24.2,24.2,59.4,,,28.978011924505676,4.778011924505677
1413,,TASA 42,Frio,,,38.6,22.1,,17/05/2021,TASA 42-2021/05/17-22.1,22.1,38.6,,,24.818011924505676,2.7180119245056744
1414,,TASA 42,Frio,,,38.6,22.1,,17/05/2021,TASA 42-2021/05/17-22.1,22.1,38.6,,,24.818011924505676,2.7180119245056744
1416,,TASA 54,Frio,,,37.8,21.9,,17/05/2021,TASA 54-2021/05/17-21.9,21.9,37.8,,,24.658011924505676,2.758011924505677
1418,,TASA 54,Frio,,,37.8,21.9,,18/05/2021,TASA 54-2021/05/18-21.9,21.9,37.8,,,24.658011924505676,2.758011924505677
1420,,TASA 54,Frio,,,37.8,21.9,,18/05/2021,TASA 54-2021/05/18-21.9,21.9,37.8,,,24.658011924505676,2.758011924505677
1422,,TASA 54,Frio,,,37.8,21.9,,18/05/2021,TASA 54-2021/05/18-21.9,21.9,37.8,,,24.658011924505676,2.758011924505677
1424,,TASA 52,Frio,,,25.2,22.6,,18/05/2021,TASA 52-2021/05/18-22.6,22.6,25.2,,,22.138011924505676,0.4619880754943253
1426,,TASA 52,Frio,,,25.2,22.6,,18/05/2021,TASA 52-2021/05/18-22.6,22.6,25.2,,,22.138011924505676,0.4619880754943253
1428,,TASA 54,Frio,,,37.8,21.9,,18/05/2021,TASA 54-2021/05/18-21.9,21.9,37.8,,,24.658011924505676,2.758011924505677
1429,,TASA 52,Frio,,,25.2,22.6,,18/05/2021,TASA 52-2021/05/18-22.6,22.6,25.2,,,22.138011924505676,0.4619880754943253
1430,,TASA 52,Frio,,,25.2,22.6,,18/05/2021,TASA 52-2021/05/18-22.6,22.6,25.2,,,22.138011924505676,0.4619880754943253
1431,,TASA 55,Frio,,,45.6,23.0,,18/05/2021,TASA 55-2021/05/18-23,23.0,45.6,,,26.218011924505674,3.2180119245056744
1432,,TASA 55,Frio,,,45.6,23.0,,18/05/2021,TASA 55-2021/05/18-23,23.0,45.6,,,26.218011924505674,3.2180119245056744
1433,,TASA 55,Frio,,,45.6,23.0,,18/05/2021,TASA 55-2021/05/18-23,23.0,45.6,,,26.218011924505674,3.2180119245056744
1443,,TASA 425,Frio,,,25.0,22.2,,19/05/2021,TASA 425-2021/05/19-22.2,22.2,25.0,,,22.098011924505677,0.10198807549432232
1447,,TASA 425,Frio,,,25.0,22.2,,19/05/2021,TASA 425-2021/05/19-22.2,22.2,25.0,,,22.098011924505677,0.10198807549432232
1454,,TASA 425,Frio,,,25.0,22.2,,20/05/2021,TASA 425-2021/05/20-22.2,22.2,25.0,,,22.098011924505677,0.10198807549432232
1456,,TASA 419,Frio,,,26.4,23.2,,20/05/2021,TASA 419-2021/05/20-23.2,23.2,26.4,,,22.378011924505675,0.8219880754943247
1458,,TASA 419,Frio,,,26.4,23.2,,20/05/2021,TASA 419-2021/05/20-23.2,23.2,26.4,,,22.378011924505675,0.8219880754943247
1460,,TASA 419,Frio,,,26.4,23.2,,20/05/2021,TASA 419-2021/05/20-23.2,23.2,26.4,,,22.378011924505675,0.8219880754943247
1461,,TASA 419,Frio,,,26.4,23.2,,20/05/2021,TASA 419-2021/05/20-23.2,23.2,26.4,,,22.378011924505675,0.8219880754943247
1522,,TASA 57,Frio,,,17.0,27.7,,23/05/2021,TASA 57-2021/05/23-27.7,27.7,17.0,,,20.08831001486064,7.6116899851393605
1525,,TASA 57,Frio,,,17.0,27.7,,23/05/2021,TASA 57-2021/05/23-27.7,27.7,17.0,,,20.08831001486064,7.6116899851393605
1528,,TASA 57,Frio,,,17.0,27.7,,23/05/2021,TASA 57-2021/05/23-27.7,27.7,17.0,,,20.08831001486064,7.6116899851393605
1809,,TASA 53,Frio,,,15.2,20.2,,26/05/2021,TASA 53-2021/05/26-20.2,20.2,15.2,,,19.619057853266284,0.5809421467337152
1819,,TASA 55,Frio,,,13.2,21.2,,26/05/2021,TASA 55-2021/05/26-21.2,21.2,13.2,,,19.282694606304943,1.917305393695056
1825,,TASA 55,Frio,,,13.4,21.2,,26/05/2021,TASA 55-2021/05/26-21.2,21.2,13.4,,,19.306739394271816,1.8932606057281838
1831,,TASA 55,Frio,,,13.4,21.2,,26/05/2021,TASA 55-2021/05/26-21.2,21.2,13.4,,,19.306739394271816,1.8932606057281838
1837,,TASA 41,Frio,,,37.1,18.1,,26/05/2021,TASA 41-2021/05/26-18.1,18.1,37.1,,,24.518011924505675,6.418011924505674
1842,,TASA 41,Frio,,,37.1,18.1,,26/05/2021,TASA 41-2021/05/26-18.1,18.1,37.1,,,24.518011924505675,6.418011924505674
1847,,TASA 41,Frio,,,37.1,18.1,,26/05/2021,TASA 41-2021/05/26-18.1,18.1,37.1,,,24.518011924505675,6.418011924505674
1852,,TASA 56,Frio,,,24.3,20.2,,26/05/2021,TASA 56-2021/05/26-20.2,20.2,24.3,,,21.958011924505676,1.7580119245056771
1855,,TASA 56,Frio,,,24.3,20.2,,27/05/2021,TASA 56-2021/05/27-20.2,20.2,24.3,,,21.958011924505676,1.7580119245056771
1858,,TASA 56,Frio,,,24.3,20.2,,27/05/2021,TASA 56-2021/05/27-20.2,20.2,24.3,,,21.958011924505676,1.7580119245056771
1945,,TASA 45,Frio,,,45.3,25.1,,28/05/2021,TASA 45-2021/05/28-25.1,25.1,45.3,,,26.158011924505676,1.0580119245056743
1946,,TASA 43,Frio,,,38.9,28.4,,28/05/2021,TASA 43-2021/05/28-28.4,28.4,38.9,,,24.878011924505675,3.521988075494324
1947,,TASA 45,Frio,,,45.3,25.1,,28/05/2021,TASA 45-2021/05/28-25.1,25.1,45.3,,,26.158011924505676,1.0580119245056743
1948,,TASA 43,Frio,,,38.9,28.4,,28/05/2021,TASA 43-2021/05/28-28.4,28.4,38.9,,,24.878011924505675,3.521988075494324
1949,,TASA 45,Frio,,,45.3,25.1,,28/05/2021,TASA 45-2021/05/28-25.1,25.1,45.3,,,26.158011924505676,1.0580119245056743
1950,,TASA 43,Frio,,,38.9,28.4,,28/05/2021,TASA 43-2021/05/28-28.4,28.4,38.9,,,24.878011924505675,3.521988075494324
1951,,TASA 44,Frio,,,39.5,24.2,,28/05/2021,TASA 44-2021/05/28-24.2,24.2,39.5,,,24.998011924505676,0.7980119245056763
1952,,TASA 43,Frio,,,38.9,28.4,,28/05/2021,TASA 43-2021/05/28-28.4,28.4,38.9,,,24.878011924505675,3.521988075494324
1953,,TASA 44,Frio,,,39.5,24.2,,28/05/2021,TASA 44-2021/05/28-24.2,24.2,39.5,,,24.998011924505676,0.7980119245056763
1954,,TASA 43,Frio,,,38.9,28.4,,28/05/2021,TASA 43-2021/05/28-28.4,28.4,38.9,,,24.878011924505675,3.521988075494324
1955,,TASA 54,Frio,,,25.3,24.3,,28/05/2021,TASA 54-2021/05/28-24.3,24.3,25.3,,,22.158011924505676,2.141988075494325
1956,,TASA 44,Frio,,,39.5,24.2,,28/05/2021,TASA 44-2021/05/28-24.2,24.2,39.5,,,24.998011924505676,0.7980119245056763
1957,,TASA 54,Frio,,,25.3,24.3,,28/05/2021,TASA 54-2021/05/28-24.3,24.3,25.3,,,22.158011924505676,2.141988075494325
1959,,TASA 52,Frio,,,24.2,24.4,,28/05/2021,TASA 52-2021/05/28-24.4,24.4,24.2,,,21.938011924505677,2.4619880754943217
1960,,TASA 54,Frio,,,25.3,24.3,,28/05/2021,TASA 54-2021/05/28-24.3,24.3,25.3,,,22.158011924505676,2.141988075494325
1962,,TASA 52,Frio,,,24.6,24.4,,28/05/2021,TASA 52-2021/05/28-24.4,24.4,24.6,,,22.018011924505675,2.3819880754943235
1963,,TASA 54,Frio,,,25.3,24.3,,28/05/2021,TASA 54-2021/05/28-24.3,24.3,25.3,,,22.158011924505676,2.141988075494325
1965,,TASA 52,Frio,,,24.6,24.4,,28/05/2021,TASA 52-2021/05/28-24.4,24.4,24.6,,,22.018011924505675,2.3819880754943235
1972,,TASA 52,Frio,,,24.6,24.4,,28/05/2021,TASA 52-2021/05/28-24.4,24.4,24.6,,,22.018011924505675,2.3819880754943235
1979,,TASA 52,Frio,,,24.6,24.4,,28/05/2021,TASA 52-2021/05/28-24.4,24.4,24.6,,,22.018011924505675,2.3819880754943235
1992,,TASA 71,Frio,,,28.5,22.5,,28/05/2021,TASA 71-2021/05/28-22.5,22.5,28.5,,,22.798011924505676,0.29801192450567626
2000,,TASA 71,Frio,,,28.5,22.5,,28/05/2021,TASA 71-2021/05/28-22.5,22.5,28.5,,,22.798011924505676,0.29801192450567626
2006,,TASA 71,Frio,,,28.5,22.5,,28/05/2021,TASA 71-2021/05/28-22.5,22.5,28.5,,,22.798011924505676,0.29801192450567626
2007,,TASA 56,Frio,,,23.8,22.8,,28/05/2021,TASA 56-2021/05/28-22.8,22.8,23.8,,,21.858011924505675,0.9419880754943257
2008,,TASA 71,Frio,,,28.5,22.5,,28/05/2021,TASA 71-2021/05/28-22.5,22.5,28.5,,,22.798011924505676,0.29801192450567626
2009,,TASA 56,Frio,,,23.8,22.8,,28/05/2021,TASA 56-2021/05/28-22.8,22.8,23.8,,,21.858011924505675,0.9419880754943257
2010,,TASA 71,Frio,,,28.5,22.5,,28/05/2021,TASA 71-2021/05/28-22.5,22.5,28.5,,,22.798011924505676,0.29801192450567626
2011,,TASA 56,Frio,,,23.8,22.8,,28/05/2021,TASA 56-2021/05/28-22.8,22.8,23.8,,,21.858011924505675,0.9419880754943257
2012,,TASA 58,Frio,,,39.9,25.3,,28/05/2021,TASA 58-2021/05/28-25.3,25.3,39.9,,,25.078011924505674,0.22198807549432686
2013,,TASA 56,Frio,,,23.8,22.8,,28/05/2021,TASA 56-2021/05/28-22.8,22.8,23.8,,,21.858011924505675,0.9419880754943257
2014,,TASA 58,Frio,,,39.9,25.3,,28/05/2021,TASA 58-2021/05/28-25.3,25.3,39.9,,,25.078011924505674,0.22198807549432686
2015,,TASA 58,Frio,,,39.9,25.3,,28/05/2021,TASA 58-2021/05/28-25.3,25.3,39.9,,,25.078011924505674,0.22198807549432686
2016,,TASA 58,Frio,,,39.9,25.3,,28/05/2021,TASA 58-2021/05/28-25.3,25.3,39.9,,,25.078011924505674,0.22198807549432686
2017,,TASA 41,Frio,,,26.5,21.7,,28/05/2021,TASA 41-2021/05/28-21.7,21.7,26.5,,,22.398011924505674,0.6980119245056748
2018,,TASA 41,Frio,,,26.5,21.7,,28/05/2021,TASA 41-2021/05/28-21.7,21.7,26.5,,,22.398011924505674,0.6980119245056748
2019,,TASA 58,Frio,,,39.9,25.3,,28/05/2021,TASA 58-2021/05/28-25.3,25.3,39.9,,,25.078011924505674,0.22198807549432686
2020,,TASA 41,Frio,,,26.5,21.7,,29/05/2021,TASA 41-2021/05/29-21.7,21.7,26.5,,,22.398011924505674,0.6980119245056748
2021,,TASA 58,Frio,,,39.9,25.3,,29/05/2021,TASA 58-2021/05/29-25.3,25.3,39.9,,,25.078011924505674,0.22198807549432686
2022,,TASA 41,Frio,,,26.5,21.7,,29/05/2021,TASA 41-2021/05/29-21.7,21.7,26.5,,,22.398011924505674,0.6980119245056748
2024,,TASA 419,Frio,,,59.4,27.4,,29/05/2021,TASA 419-2021/05/29-27.4,27.4,59.4,,,28.978011924505676,1.5780119245056774
2025,,TASA 42,Frio,,,19.5,24.5,,29/05/2021,TASA 42-2021/05/29-24.5,24.5,19.5,,,20.858260277982353,3.641739722017647
2026,,TASA 419,Frio,,,59.4,27.4,,29/05/2021,TASA 419-2021/05/29-27.4,27.4,59.4,,,28.978011924505676,1.5780119245056774
2027,,TASA 42,Frio,,,19.5,24.5,,29/05/2021,TASA 42-2021/05/29-24.5,24.5,19.5,,,20.858260277982353,3.641739722017647
2028,,TASA 419,Frio,,,59.4,27.4,,29/05/2021,TASA 419-2021/05/29-27.4,27.4,59.4,,,28.978011924505676,1.5780119245056774
2029,,TASA 42,Frio,,,19.5,24.5,,29/05/2021,TASA 42-2021/05/29-24.5,24.5,19.5,,,20.858260277982353,3.641739722017647
2030,,TASA 419,Frio,,,59.4,27.4,,29/05/2021,TASA 419-2021/05/29-27.4,27.4,59.4,,,28.978011924505676,1.5780119245056774
2031,,TASA 57,Frio,,,16.5,28.7,,29/05/2021,TASA 57-2021/05/29-28.7,28.7,16.5,,,19.945412076832525,8.754587923167474
2032,,TASA 57,Frio,,,16.5,28.7,,29/05/2021,TASA 57-2021/05/29-28.7,28.7,16.5,,,19.945412076832525,8.754587923167474
2033,,TASA 57,Frio,,,16.5,28.7,,29/05/2021,TASA 57-2021/05/29-28.7,28.7,16.5,,,19.945412076832525,8.754587923167474
2034,,TASA 57,Frio,,,16.5,28.7,,29/05/2021,TASA 57-2021/05/29-28.7,28.7,16.5,,,19.945412076832525,8.754587923167474
2035,,TASA 57,Frio,,,16.5,28.7,,29/05/2021,TASA 57-2021/05/29-28.7,28.7,16.5,,,19.945412076832525,8.754587923167474
2036,,TASA 57,Frio,,,16.5,28.7,,29/05/2021,TASA 57-2021/05/29-28.7,28.7,16.5,,,19.945412076832525,8.754587923167474
2038,,TASA 52,Frio,,,18.4,19.4,,29/05/2021,TASA 52-2021/05/29-19.4,19.4,18.4,,,20.51733761205952,1.1173376120595222
2040,,TASA 52,Frio,,,18.4,19.4,,29/05/2021,TASA 52-2021/05/29-19.4,19.4,18.4,,,20.51733761205952,1.1173376120595222
2042,,TASA 52,Frio,,,18.4,19.4,,29/05/2021,TASA 52-2021/05/29-19.4,19.4,18.4,,,20.51733761205952,1.1173376120595222
2044,,TASA 52,Frio,,,18.4,19.4,,30/05/2021,TASA 52-2021/05/30-19.4,19.4,18.4,,,20.51733761205952,1.1173376120595222
2046,,TASA 52,Frio,,,18.4,19.4,,30/05/2021,TASA 52-2021/05/30-19.4,19.4,18.4,,,20.51733761205952,1.1173376120595222
2047,,TASA 53,Frio,,,28.7,20.6,,30/05/2021,TASA 53-2021/05/30-20.6,20.6,28.7,,,22.838011924505675,2.238011924505674
2049,,TASA 53,Frio,,,28.7,20.6,,30/05/2021,TASA 53-2021/05/30-20.6,20.6,28.7,,,22.838011924505675,2.238011924505674
2051,,TASA 53,Frio,,,28.4,20.6,,30/05/2021,TASA 53-2021/05/30-20.6,20.6,28.4,,,22.778011924505677,2.1780119245056753
2053,,TASA 53,Frio,,,28.7,20.6,,30/05/2021,TASA 53-2021/05/30-20.6,20.6,28.7,,,22.838011924505675,2.238011924505674
2055,,TASA 53,Frio,,,28.7,20.6,,30/05/2021,TASA 53-2021/05/30-20.6,20.6,28.7,,,22.838011924505675,2.238011924505674
2058,,TASA 53,Frio,,,28.7,20.6,,30/05/2021,TASA 53-2021/05/30-20.6,20.6,28.7,,,22.838011924505675,2.238011924505674
2061,,TASA 54,Frio,,,28.4,21.9,,30/05/2021,TASA 54-2021/05/30-21.9,21.9,28.4,,,22.778011924505677,0.8780119245056781
2064,,TASA 51,Frio,,,24.9,30.8,,30/05/2021,TASA 51-2021/05/30-30.8,30.8,24.9,,,22.078011924505674,8.721988075494327
2067,,TASA 51,Frio,,,24.9,30.8,,30/05/2021,TASA 51-2021/05/30-30.8,30.8,24.9,,,22.078011924505674,8.721988075494327
2069,,TASA 51,Frio,,,24.9,30.8,,30/05/2021,TASA 51-2021/05/30-30.8,30.8,24.9,,,22.078011924505674,8.721988075494327
2071,,TASA 51,Frio,,,24.9,30.8,,30/05/2021,TASA 51-2021/05/30-30.8,30.8,24.9,,,22.078011924505674,8.721988075494327
2072,,TASA 54,Frio,,,31.2,21.9,,30/05/2021,TASA 54-2021/05/30-21.9,21.9,31.2,,,23.338011924505675,1.4380119245056768
2073,,TASA 45,Frio,,,43.4,26.5,,30/05/2021,TASA 45-2021/05/30-26.5,26.5,43.4,,,25.778011924505677,0.7219880754943233
2074,,TASA 45,Frio,,,43.3,26.5,,30/05/2021,TASA 45-2021/05/30-26.5,26.5,43.3,,,25.758011924505674,0.7419880754943264
2075,,TASA 54,Frio,,,31.2,21.9,,30/05/2021,TASA 54-2021/05/30-21.9,21.9,31.2,,,23.338011924505675,1.4380119245056768
2076,,TASA 53,Frio,,,28.7,20.6,,30/05/2021,TASA 53-2021/05/30-20.6,20.6,28.7,,,22.838011924505675,2.238011924505674
2077,,TASA 54,Frio,,,31.2,21.9,,30/05/2021,TASA 54-2021/05/30-21.9,21.9,31.2,,,23.338011924505675,1.4380119245056768
2078,,TASA 53,Frio,,,28.7,20.6,,30/05/2021,TASA 53-2021/05/30-20.6,20.6,28.7,,,22.838011924505675,2.238011924505674
2079,,TASA 44,Frio,,,35.2,26.7,,30/05/2021,TASA 44-2021/05/30-26.7,26.7,35.2,,,24.138011924505676,2.561988075494323
2080,,TASA 54,Frio,,,31.2,21.9,,30/05/2021,TASA 54-2021/05/30-21.9,21.9,31.2,,,23.338011924505675,1.4380119245056768
2081,,TASA 44,Frio,,,35.2,26.7,,30/05/2021,TASA 44-2021/05/30-26.7,26.7,35.2,,,24.138011924505676,2.561988075494323
2082,,TASA 54,Frio,,,31.2,21.9,,30/05/2021,TASA 54-2021/05/30-21.9,21.9,31.2,,,23.338011924505675,1.4380119245056768
2083,,TASA 44,Frio,,,35.2,26.7,,30/05/2021,TASA 44-2021/05/30-26.7,26.7,35.2,,,24.138011924505676,2.561988075494323
2084,,TASA 44,Frio,,,35.2,26.7,,30/05/2021,TASA 44-2021/05/30-26.7,26.7,35.2,,,24.138011924505676,2.561988075494323
2085,,TASA 41,Frio,,,30.4,25.6,,30/05/2021,TASA 41-2021/05/30-25.6,25.6,30.4,,,23.178011924505675,2.421988075494326
2086,,TASA 41,Frio,,,30.4,25.6,,30/05/2021,TASA 41-2021/05/30-25.6,25.6,30.4,,,23.178011924505675,2.421988075494326
2087,,TASA 41,Frio,,,30.4,25.6,,30/05/2021,TASA 41-2021/05/30-25.6,25.6,30.4,,,23.178011924505675,2.421988075494326
2088,,TASA 61,Frio,,,17.7,22.4,,31/05/2021,TASA 61-2021/05/31-22.4,22.4,17.7,,,20.29926535097671,2.1007346490232877
2090,,TASA 61,Frio,,,17.7,22.4,,31/05/2021,TASA 61-2021/05/31-22.4,22.4,17.7,,,20.29926535097671,2.1007346490232877
2093,,TASA 61,Frio,,,17.7,22.4,,31/05/2021,TASA 61-2021/05/31-22.4,22.4,17.7,,,20.29926535097671,2.1007346490232877
2112,,TASA 43,Frio,,,27.7,23.1,,31/05/2021,TASA 43-2021/05/31-23.1,23.1,27.7,,,22.638011924505676,0.4619880754943253
2114,,TASA 43,Frio,,,27.7,23.1,,31/05/2021,TASA 43-2021/05/31-23.1,23.1,27.7,,,22.638011924505676,0.4619880754943253
2116,,TASA 43,Frio,,,27.7,23.1,,31/05/2021,TASA 43-2021/05/31-23.1,23.1,27.7,,,22.638011924505676,0.4619880754943253
2118,,TASA 43,Frio,,,27.7,23.1,,31/05/2021,TASA 43-2021/05/31-23.1,23.1,27.7,,,22.638011924505676,0.4619880754943253
2120,,TASA 54,Frio,,,22.6,20.1,,31/05/2021,TASA 54-2021/05/31-20.1,20.1,22.6,,,21.618011924505677,1.5180119245056751
2121,,TASA 427,Frio,,,21.4,23.0,,31/05/2021,TASA 427-2021/05/31-23,23.0,21.4,,,21.372052152645836,1.6279478473541644
2122,,TASA 54,Frio,,,22.6,20.1,,31/05/2021,TASA 54-2021/05/31-20.1,20.1,22.6,,,21.618011924505677,1.5180119245056751
2123,,TASA 427,Frio,,,21.4,23.0,,31/05/2021,TASA 427-2021/05/31-23,23.0,21.4,,,21.372052152645836,1.6279478473541644
2124,,TASA 54,Frio,,,22.6,20.1,,31/05/2021,TASA 54-2021/05/31-20.1,20.1,22.6,,,21.618011924505677,1.5180119245056751
2125,,TASA 427,Frio,,,21.4,23.0,,31/05/2021,TASA 427-2021/05/31-23,23.0,21.4,,,21.372052152645836,1.6279478473541644
2126,,TASA 51,Frio,,,24.9,22.4,,31/05/2021,TASA 51-2021/05/31-22.4,22.4,24.9,,,22.078011924505674,0.32198807549432473
2127,,TASA 54,Frio,,,22.6,20.1,,1/06/2021,TASA 54-2021/06/01-20.1,20.1,22.6,,,21.618011924505677,1.5180119245056751
2128,,TASA 427,Frio,,,21.4,23.0,,1/06/2021,TASA 427-2021/06/01-23,23.0,21.4,,,21.372052152645836,1.6279478473541644
2129,,TASA 51,Frio,,,24.9,22.4,,1/06/2021,TASA 51-2021/06/01-22.4,22.4,24.9,,,22.078011924505674,0.32198807549432473
2130,,TASA 54,Frio,,,22.6,20.1,,1/06/2021,TASA 54-2021/06/01-20.1,20.1,22.6,,,21.618011924505677,1.5180119245056751
2131,,TASA 427,Frio,,,21.4,23.0,,1/06/2021,TASA 427-2021/06/01-23,23.0,21.4,,,21.372052152645836,1.6279478473541644
2132,,TASA 51,Frio,,,24.9,22.4,,1/06/2021,TASA 51-2021/06/01-22.4,22.4,24.9,,,22.078011924505674,0.32198807549432473
2133,,TASA 54,Frio,,,22.6,20.1,,1/06/2021,TASA 54-2021/06/01-20.1,20.1,22.6,,,21.618011924505677,1.5180119245056751
2134,,TASA 427,Frio,,,21.4,23.0,,1/06/2021,TASA 427-2021/06/01-23,23.0,21.4,,,21.372052152645836,1.6279478473541644
2135,,TASA 51,Frio,,,24.9,22.4,,1/06/2021,TASA 51-2021/06/01-22.4,22.4,24.9,,,22.078011924505674,0.32198807549432473
2136,,TASA 54,Frio,,,22.6,20.1,,1/06/2021,TASA 54-2021/06/01-20.1,20.1,22.6,,,21.618011924505677,1.5180119245056751
2137,,TASA 51,Frio,,,24.9,22.4,,1/06/2021,TASA 51-2021/06/01-22.4,22.4,24.9,,,22.078011924505674,0.32198807549432473
2138,,TASA 54,Frio,,,22.6,20.1,,1/06/2021,TASA 54-2021/06/01-20.1,20.1,22.6,,,21.618011924505677,1.5180119245056751
2139,,TASA 51,Frio,,,24.9,22.4,,1/06/2021,TASA 51-2021/06/01-22.4,22.4,24.9,,,22.078011924505674,0.32198807549432473
2156,,TASA 44,Frio,,,33.3,22.3,,4/06/2021,TASA 44-2021/06/04-22.3,22.3,33.3,,,23.758011924505674,1.4580119245056729
2158,,TASA 44,Frio,,,33.3,22.3,,4/06/2021,TASA 44-2021/06/04-22.3,22.3,33.3,,,23.758011924505674,1.4580119245056729
2160,,TASA 44,Frio,,,33.3,22.3,,4/06/2021,TASA 44-2021/06/04-22.3,22.3,33.3,,,23.758011924505674,1.4580119245056729
2162,,TASA 41,Frio,,,37.9,22.9,,4/06/2021,TASA 41-2021/06/04-22.9,22.9,37.9,,,24.678011924505675,1.7780119245056767
2163,,TASA 41,Frio,,,37.9,22.9,,4/06/2021,TASA 41-2021/06/04-22.9,22.9,37.9,,,24.678011924505675,1.7780119245056767
2164,,TASA 51,Frio,,,21.6,21.2,,4/06/2021,TASA 51-2021/06/04-21.2,21.2,21.6,,,21.416425787839785,0.2164257878397855
2165,,TASA 41,Frio,,,37.9,22.9,,4/06/2021,TASA 41-2021/06/04-22.9,22.9,37.9,,,24.678011924505675,1.7780119245056767
2166,,TASA 51,Frio,,,21.6,21.2,,4/06/2021,TASA 51-2021/06/04-21.2,21.2,21.6,,,21.416425787839785,0.2164257878397855
2167,,TASA 41,Frio,,,37.9,22.9,,5/06/2021,TASA 41-2021/06/05-22.9,22.9,37.9,,,24.678011924505675,1.7780119245056767
2168,,TASA 51,Frio,,,21.6,21.2,,5/06/2021,TASA 51-2021/06/05-21.2,21.2,21.6,,,21.416425787839785,0.2164257878397855
2169,,TASA 41,Frio,,,37.9,22.9,,5/06/2021,TASA 41-2021/06/05-22.9,22.9,37.9,,,24.678011924505675,1.7780119245056767
2170,,TASA 51,Frio,,,21.6,21.2,,5/06/2021,TASA 51-2021/06/05-21.2,21.2,21.6,,,21.416425787839785,0.2164257878397855
2171,,TASA 41,Frio,,,37.9,22.9,,5/06/2021,TASA 41-2021/06/05-22.9,22.9,37.9,,,24.678011924505675,1.7780119245056767
2172,,TASA 51,Frio,,,21.6,21.2,,5/06/2021,TASA 51-2021/06/05-21.2,21.2,21.6,,,21.416425787839785,0.2164257878397855
2173,,TASA 41,Frio,,,37.9,22.9,,5/06/2021,TASA 41-2021/06/05-22.9,22.9,37.9,,,24.678011924505675,1.7780119245056767
2174,,TASA 51,Frio,,,21.6,21.2,,5/06/2021,TASA 51-2021/06/05-21.2,21.2,21.6,,,21.416425787839785,0.2164257878397855
2175,,TASA 54,Frio,,,22.5,18.8,,7/06/2021,TASA 54-2021/06/07-18.8,18.8,22.5,,,21.598011924505677,2.7980119245056763
2176,,TASA 54,Frio,,,22.5,18.8,,7/06/2021,TASA 54-2021/06/07-18.8,18.8,22.5,,,21.598011924505677,2.7980119245056763
2177,,TASA 52,Frio,,,26.4,17.7,,7/06/2021,TASA 52-2021/06/07-17.7,17.7,26.4,,,22.378011924505675,4.678011924505675
2178,,TASA 52,Frio,,,26.4,17.7,,7/06/2021,TASA 52-2021/06/07-17.7,17.7,26.4,,,22.378011924505675,4.678011924505675
2179,,TASA 54,Frio,,,22.5,18.8,,7/06/2021,TASA 54-2021/06/07-18.8,18.8,22.5,,,21.598011924505677,2.7980119245056763
2180,,TASA 52,Frio,,,26.4,17.7,,7/06/2021,TASA 52-2021/06/07-17.7,17.7,26.4,,,22.378011924505675,4.678011924505675
2181,,TASA 54,Frio,,,22.5,18.8,,7/06/2021,TASA 54-2021/06/07-18.8,18.8,22.5,,,21.598011924505677,2.7980119245056763
2182,,TASA 41,Frio,,,32.2,17.9,,7/06/2021,TASA 41-2021/06/07-17.9,17.9,32.2,,,23.538011924505675,5.638011924505676
2183,,TASA 427,Frio,,,45.5,20.0,,7/06/2021,TASA 427-2021/06/07-20,20.0,45.5,,,26.198011924505675,6.198011924505675
2184,,TASA 41,Frio,,,32.2,17.9,,7/06/2021,TASA 41-2021/06/07-17.9,17.9,32.2,,,23.538011924505675,5.638011924505676
2185,,TASA 427,Frio,,,45.5,20.0,,7/06/2021,TASA 427-2021/06/07-20,20.0,45.5,,,26.198011924505675,6.198011924505675
2186,,TASA 41,Frio,,,32.2,17.9,,7/06/2021,TASA 41-2021/06/07-17.9,17.9,32.2,,,23.538011924505675,5.638011924505676
2187,,TASA 427,Frio,,,45.5,20.0,,7/06/2021,TASA 427-2021/06/07-20,20.0,45.5,,,26.198011924505675,6.198011924505675
2188,,TASA 45,Frio,,,23.0,17.8,,7/06/2021,TASA 45-2021/06/07-17.8,17.8,23.0,,,21.698011924505675,3.898011924505674
2189,,TASA 427,Frio,,,45.5,20.0,,7/06/2021,TASA 427-2021/06/07-20,20.0,45.5,,,26.198011924505675,6.198011924505675
2190,,TASA 45,Frio,,,23.0,17.8,,7/06/2021,TASA 45-2021/06/07-17.8,17.8,23.0,,,21.698011924505675,3.898011924505674
2191,,TASA 427,Frio,,,45.5,20.0,,7/06/2021,TASA 427-2021/06/07-20,20.0,45.5,,,26.198011924505675,6.198011924505675
2192,,TASA 45,Frio,,,23.0,17.8,,7/06/2021,TASA 45-2021/06/07-17.8,17.8,23.0,,,21.698011924505675,3.898011924505674
2193,,TASA 42,Frio,,,26.0,16.7,,7/06/2021,TASA 42-2021/06/07-16.7,16.7,26.0,,,22.298011924505676,5.598011924505677
2194,,TASA 43,Frio,,,40.5,18.0,,7/06/2021,TASA 43-2021/06/07-18,18.0,40.5,,,25.198011924505675,7.198011924505675
2195,,TASA 42,Frio,,,26.0,16.7,,7/06/2021,TASA 42-2021/06/07-16.7,16.7,26.0,,,22.298011924505676,5.598011924505677
2196,,TASA 43,Frio,,,40.5,18.0,,7/06/2021,TASA 43-2021/06/07-18,18.0,40.5,,,25.198011924505675,7.198011924505675
2197,,TASA 42,Frio,,,26.0,16.7,,7/06/2021,TASA 42-2021/06/07-16.7,16.7,26.0,,,22.298011924505676,5.598011924505677
2198,,TASA 42,Frio,,,26.0,16.7,,7/06/2021,TASA 42-2021/06/07-16.7,16.7,26.0,,,22.298011924505676,5.598011924505677
2199,,TASA 43,Frio,,,40.5,18.0,,7/06/2021,TASA 43-2021/06/07-18,18.0,40.5,,,25.198011924505675,7.198011924505675
2200,,TASA 55,Frio,,,35.2,23.3,,7/06/2021,TASA 55-2021/06/07-23.3,23.3,35.2,,,24.138011924505676,0.8380119245056754
2201,,TASA 55,Frio,,,35.2,23.3,,7/06/2021,TASA 55-2021/06/07-23.3,23.3,35.2,,,24.138011924505676,0.8380119245056754
2202,,TASA 55,Frio,,,35.2,23.3,,7/06/2021,TASA 55-2021/06/07-23.3,23.3,35.2,,,24.138011924505676,0.8380119245056754
2203,,TASA 55,Frio,,,35.2,23.3,,7/06/2021,TASA 55-2021/06/07-23.3,23.3,35.2,,,24.138011924505676,0.8380119245056754
2204,,TASA 55,Frio,,,35.2,23.3,,7/06/2021,TASA 55-2021/06/07-23.3,23.3,35.2,,,24.138011924505676,0.8380119245056754
2205,,TASA 55,Frio,,,35.2,23.3,,7/06/2021,TASA 55-2021/06/07-23.3,23.3,35.2,,,24.138011924505676,0.8380119245056754
2206,,TASA 55,Frio,,,35.2,23.3,,7/06/2021,TASA 55-2021/06/07-23.3,23.3,35.2,,,24.138011924505676,0.8380119245056754
2207,,TASA 55,Frio,,,35.2,23.3,,7/06/2021,TASA 55-2021/06/07-23.3,23.3,35.2,,,24.138011924505676,0.8380119245056754
2208,,TASA 55,Frio,,,35.2,23.3,,7/06/2021,TASA 55-2021/06/07-23.3,23.3,35.2,,,24.138011924505676,0.8380119245056754
2213,,TASA 41,Frio,,,28.9,16.3,,9/06/2021,TASA 41-2021/06/09-16.3,16.3,28.9,,,22.878011924505675,6.578011924505674
2214,,TASA 51,Frio,,,27.9,21.0,,9/06/2021,TASA 51-2021/06/09-21,21.0,27.9,,,22.678011924505675,1.6780119245056753
2215,,TASA 41,Frio,,,28.9,16.3,,9/06/2021,TASA 41-2021/06/09-16.3,16.3,28.9,,,22.878011924505675,6.578011924505674
2216,,TASA 51,Frio,,,27.9,21.0,,9/06/2021,TASA 51-2021/06/09-21,21.0,27.9,,,22.678011924505675,1.6780119245056753
2217,,TASA 41,Frio,,,28.9,16.3,,9/06/2021,TASA 41-2021/06/09-16.3,16.3,28.9,,,22.878011924505675,6.578011924505674
2218,,TASA 51,Frio,,,27.9,21.0,,9/06/2021,TASA 51-2021/06/09-21,21.0,27.9,,,22.678011924505675,1.6780119245056753
2219,,TASA 51,Frio,,,27.9,21.0,,9/06/2021,TASA 51-2021/06/09-21,21.0,27.9,,,22.678011924505675,1.6780119245056753
2220,,TASA 53,Frio,,,22.6,24.7,,9/06/2021,TASA 53-2021/06/09-24.7,24.7,22.6,,,21.618011924505677,3.0819880754943227
2221,,TASA 51,Frio,,,27.9,21.0,,9/06/2021,TASA 51-2021/06/09-21,21.0,27.9,,,22.678011924505675,1.6780119245056753
2222,,TASA 53,Frio,,,22.6,24.7,,9/06/2021,TASA 53-2021/06/09-24.7,24.7,22.6,,,21.618011924505677,3.0819880754943227
2223,,TASA 51,Frio,,,27.9,21.0,,9/06/2021,TASA 51-2021/06/09-21,21.0,27.9,,,22.678011924505675,1.6780119245056753
2224,,TASA 53,Frio,,,22.6,24.7,,9/06/2021,TASA 53-2021/06/09-24.7,24.7,22.6,,,21.618011924505677,3.0819880754943227
2225,,TASA 55,Frio,,,24.1,19.5,,9/06/2021,TASA 55-2021/06/09-19.5,19.5,24.1,,,21.918011924505677,2.4180119245056773
2226,,TASA 53,Frio,,,22.6,24.7,,9/06/2021,TASA 53-2021/06/09-24.7,24.7,22.6,,,21.618011924505677,3.0819880754943227
2227,,TASA 55,Frio,,,24.1,19.5,,9/06/2021,TASA 55-2021/06/09-19.5,19.5,24.1,,,21.918011924505677,2.4180119245056773
2228,,TASA 53,Frio,,,22.6,24.7,,9/06/2021,TASA 53-2021/06/09-24.7,24.7,22.6,,,21.618011924505677,3.0819880754943227
2229,,TASA 55,Frio,,,22.8,19.5,,9/06/2021,TASA 55-2021/06/09-19.5,19.5,22.8,,,21.658011924505676,2.1580119245056757
2231,,TASA 55,Frio,,,22.8,19.5,,9/06/2021,TASA 55-2021/06/09-19.5,19.5,22.8,,,21.658011924505676,2.1580119245056757
2232,,TASA 45,Frio,,,30.9,22.6,,9/06/2021,TASA 45-2021/06/09-22.6,22.6,30.9,,,23.278011924505677,0.6780119245056753
2233,,TASA 45,Frio,,,30.9,22.6,,9/06/2021,TASA 45-2021/06/09-22.6,22.6,30.9,,,23.278011924505677,0.6780119245056753
2234,,TASA 45,Frio,,,30.9,22.6,,9/06/2021,TASA 45-2021/06/09-22.6,22.6,30.9,,,23.278011924505677,0.6780119245056753
2235,,TASA 51,Frio,,,25.1,22.4,,11/06/2021,TASA 51-2021/06/11-22.4,22.4,25.1,,,22.118011924505677,0.28198807549432203
2236,,TASA 58,Frio,,,12.4,17.9,,11/06/2021,TASA 58-2021/06/11-17.9,17.9,12.4,,,19.205688655545572,1.3056886555455733
2237,,TASA 51,Frio,,,25.1,22.4,,11/06/2021,TASA 51-2021/06/11-22.4,22.4,25.1,,,22.118011924505677,0.28198807549432203
2238,,TASA 58,Frio,,,12.4,17.9,,11/06/2021,TASA 58-2021/06/11-17.9,17.9,12.4,,,19.205688655545572,1.3056886555455733
2239,,TASA 51,Frio,,,25.1,22.4,,11/06/2021,TASA 51-2021/06/11-22.4,22.4,25.1,,,22.118011924505677,0.28198807549432203
2240,,TASA 58,Frio,,,12.4,17.9,,11/06/2021,TASA 58-2021/06/11-17.9,17.9,12.4,,,19.205688655545572,1.3056886555455733
2241,,TASA 51,Frio,,,25.1,22.4,,11/06/2021,TASA 51-2021/06/11-22.4,22.4,25.1,,,22.118011924505677,0.28198807549432203
2242,,TASA 58,Frio,,,12.4,17.9,,11/06/2021,TASA 58-2021/06/11-17.9,17.9,12.4,,,19.205688655545572,1.3056886555455733
2244,,TASA 58,Frio,,,12.4,17.9,,11/06/2021,TASA 58-2021/06/11-17.9,17.9,12.4,,,19.205688655545572,1.3056886555455733
2246,,TASA 54,Frio,,,15.3,18.9,,11/06/2021,TASA 54-2021/06/11-18.9,18.9,15.3,,,19.64142276006841,0.74142276006841
2248,,TASA 52,Frio,,,31.5,27.5,,11/06/2021,TASA 52-2021/06/11-27.5,27.5,31.5,,,23.398011924505674,4.101988075494326
2249,,TASA 54,Frio,,,15.3,18.9,,11/06/2021,TASA 54-2021/06/11-18.9,18.9,15.3,,,19.64142276006841,0.74142276006841
2250,,TASA 54,Frio,,,15.3,18.9,,11/06/2021,TASA 54-2021/06/11-18.9,18.9,15.3,,,19.64142276006841,0.74142276006841
2254,,TASA 54,Frio,,,15.3,18.9,,11/06/2021,TASA 54-2021/06/11-18.9,18.9,15.3,,,19.64142276006841,0.74142276006841
2258,,TASA 54,Frio,,,15.3,18.9,,11/06/2021,TASA 54-2021/06/11-18.9,18.9,15.3,,,19.64142276006841,0.74142276006841
2262,,TASA 54,Frio,,,15.3,18.9,,11/06/2021,TASA 54-2021/06/11-18.9,18.9,15.3,,,19.64142276006841,0.74142276006841
2269,,TASA 51,Frio,,,25.1,31.6,,12/06/2021,TASA 51-2021/06/12-31.6,31.6,25.1,,,22.118011924505677,9.481988075494325
2273,,TASA 51,Frio,,,25.1,31.6,,12/06/2021,TASA 51-2021/06/12-31.6,31.6,25.1,,,22.118011924505677,9.481988075494325
2277,,TASA 51,Frio,,,25.1,31.6,,12/06/2021,TASA 51-2021/06/12-31.6,31.6,25.1,,,22.118011924505677,9.481988075494325
2283,,TASA 42,Frio,,,46.0,32.0,,12/06/2021,TASA 42-2021/06/12-32,32.0,46.0,,,26.298011924505676,5.701988075494324
2284,,TASA 53,Frio,,,45.3,27.7,,12/06/2021,TASA 53-2021/06/12-27.7,27.7,45.3,,,26.158011924505676,1.5419880754943236
2285,,TASA 42,Frio,,,46.0,32.0,,12/06/2021,TASA 42-2021/06/12-32,32.0,46.0,,,26.298011924505676,5.701988075494324
2286,,TASA 53,Frio,,,45.3,27.7,,12/06/2021,TASA 53-2021/06/12-27.7,27.7,45.3,,,26.158011924505676,1.5419880754943236
2287,,TASA 61,Frio,,,46.2,31.3,,12/06/2021,TASA 61-2021/06/12-31.3,31.3,46.2,,,26.338011924505675,4.961988075494325
2288,,TASA 59,Frio,,,46.0,36.9,,12/06/2021,TASA 59-2021/06/12-36.9,36.9,46.0,,,26.298011924505676,10.601988075494322
2289,,TASA 61,Frio,,,46.2,31.3,,12/06/2021,TASA 61-2021/06/12-31.3,31.3,46.2,,,26.338011924505675,4.961988075494325
2290,,TASA 59,Frio,,,46.0,36.9,,12/06/2021,TASA 59-2021/06/12-36.9,36.9,46.0,,,26.298011924505676,10.601988075494322
2291,,TASA 61,Frio,,,46.2,31.3,,12/06/2021,TASA 61-2021/06/12-31.3,31.3,46.2,,,26.338011924505675,4.961988075494325
2292,,TASA 59,Frio,,,46.0,36.9,,12/06/2021,TASA 59-2021/06/12-36.9,36.9,46.0,,,26.298011924505676,10.601988075494322
2293,,TASA 42,Frio,,,46.0,32.0,,12/06/2021,TASA 42-2021/06/12-32,32.0,46.0,,,26.298011924505676,5.701988075494324
2294,,TASA 53,Frio,,,45.3,27.7,,12/06/2021,TASA 53-2021/06/12-27.7,27.7,45.3,,,26.158011924505676,1.5419880754943236
2295,,TASA 59,Frio,,,46.0,36.9,,12/06/2021,TASA 59-2021/06/12-36.9,36.9,46.0,,,26.298011924505676,10.601988075494322
2296,,TASA 427,Frio,,,51.0,29.1,,12/06/2021,TASA 427-2021/06/12-29.1,29.1,51.0,,,27.298011924505676,1.8019880754943252
2297,,TASA 59,Frio,,,46.0,36.9,,12/06/2021,TASA 59-2021/06/12-36.9,36.9,46.0,,,26.298011924505676,10.601988075494322
2298,,TASA 427,Frio,,,51.0,29.1,,12/06/2021,TASA 427-2021/06/12-29.1,29.1,51.0,,,27.298011924505676,1.8019880754943252
2299,,TASA 427,Frio,,,51.0,29.1,,12/06/2021,TASA 427-2021/06/12-29.1,29.1,51.0,,,27.298011924505676,1.8019880754943252
2300,,TASA 59,Frio,,,46.0,36.9,,12/06/2021,TASA 59-2021/06/12-36.9,36.9,46.0,,,26.298011924505676,10.601988075494322
2301,,TASA 427,Frio,,,51.0,29.1,,12/06/2021,TASA 427-2021/06/12-29.1,29.1,51.0,,,27.298011924505676,1.8019880754943252
2302,,TASA 427,Frio,,,51.0,29.1,,12/06/2021,TASA 427-2021/06/12-29.1,29.1,51.0,,,27.298011924505676,1.8019880754943252
2303,,TASA 427,Frio,,,51.0,29.1,,12/06/2021,TASA 427-2021/06/12-29.1,29.1,51.0,,,27.298011924505676,1.8019880754943252
2304,,TASA 427,Frio,,,51.0,29.1,,12/06/2021,TASA 427-2021/06/12-29.1,29.1,51.0,,,27.298011924505676,1.8019880754943252
2305,,TASA 58,Frio,,,42.8,25.1,,14/06/2021,TASA 58-2021/06/14-25.1,25.1,42.8,,,25.658011924505676,0.5580119245056743
2306,,TASA 56,Frio,,,52.8,33.3,,14/06/2021,TASA 56-2021/06/14-33.3,33.3,52.8,,,27.658011924505676,5.6419880754943215
2307,,TASA 58,Frio,,,42.8,25.1,,14/06/2021,TASA 58-2021/06/14-25.1,25.1,42.8,,,25.658011924505676,0.5580119245056743
2308,,TASA 56,Frio,,,52.8,33.3,,14/06/2021,TASA 56-2021/06/14-33.3,33.3,52.8,,,27.658011924505676,5.6419880754943215
2309,,TASA 56,Frio,,,52.8,33.3,,15/06/2021,TASA 56-2021/06/15-33.3,33.3,52.8,,,27.658011924505676,5.6419880754943215
2310,,TASA 52,Frio,,,33.4,31.9,,15/06/2021,TASA 52-2021/06/15-31.9,31.9,33.4,,,23.778011924505677,8.121988075494322
2311,,TASA 56,Frio,,,52.8,33.3,,15/06/2021,TASA 56-2021/06/15-33.3,33.3,52.8,,,27.658011924505676,5.6419880754943215
2312,,TASA 52,Frio,,,33.4,31.9,,15/06/2021,TASA 52-2021/06/15-31.9,31.9,33.4,,,23.778011924505677,8.121988075494322
2313,,TASA 56,Frio,,,52.8,33.3,,15/06/2021,TASA 56-2021/06/15-33.3,33.3,52.8,,,27.658011924505676,5.6419880754943215
2314,,TASA 56,Frio,,,52.8,33.3,,15/06/2021,TASA 56-2021/06/15-33.3,33.3,52.8,,,27.658011924505676,5.6419880754943215
2315,,TASA 44,Frio,,,55.3,35.0,,15/06/2021,TASA 44-2021/06/15-35,35.0,55.3,,,28.158011924505676,6.841988075494324
2316,,TASA 55,Frio,,,46.8,21.7,,15/06/2021,TASA 55-2021/06/15-21.7,21.7,46.8,,,26.458011924505676,4.758011924505677
2317,,TASA 44,Frio,,,55.3,35.0,,15/06/2021,TASA 44-2021/06/15-35,35.0,55.3,,,28.158011924505676,6.841988075494324
2318,,TASA 55,Frio,,,46.8,21.7,,15/06/2021,TASA 55-2021/06/15-21.7,21.7,46.8,,,26.458011924505676,4.758011924505677
2319,,TASA 44,Frio,,,55.3,35.0,,15/06/2021,TASA 44-2021/06/15-35,35.0,55.3,,,28.158011924505676,6.841988075494324
2320,,TASA 71,Frio,,,56.0,27.5,,15/06/2021,TASA 71-2021/06/15-27.5,27.5,56.0,,,28.298011924505676,0.7980119245056763
2321,,TASA 44,Frio,,,55.3,35.0,,15/06/2021,TASA 44-2021/06/15-35,35.0,55.3,,,28.158011924505676,6.841988075494324
2322,,TASA 71,Frio,,,56.0,27.5,,15/06/2021,TASA 71-2021/06/15-27.5,27.5,56.0,,,28.298011924505676,0.7980119245056763
2323,,TASA 71,Frio,,,56.0,27.5,,15/06/2021,TASA 71-2021/06/15-27.5,27.5,56.0,,,28.298011924505676,0.7980119245056763
2324,,TASA 45,Frio,,,41.5,23.7,,15/06/2021,TASA 45-2021/06/15-23.7,23.7,41.5,,,25.398011924505674,1.6980119245056748
2325,,TASA 71,Frio,,,56.0,27.5,,15/06/2021,TASA 71-2021/06/15-27.5,27.5,56.0,,,28.298011924505676,0.7980119245056763
2326,,TASA 45,Frio,,,41.5,23.7,,15/06/2021,TASA 45-2021/06/15-23.7,23.7,41.5,,,25.398011924505674,1.6980119245056748
2327,,TASA 71,Frio,,,56.0,27.5,,15/06/2021,TASA 71-2021/06/15-27.5,27.5,56.0,,,28.298011924505676,0.7980119245056763
2328,,TASA 45,Frio,,,41.5,23.7,,15/06/2021,TASA 45-2021/06/15-23.7,23.7,41.5,,,25.398011924505674,1.6980119245056748
2329,,TASA 61,Frio,,,37.2,25.2,,15/06/2021,TASA 61-2021/06/15-25.2,25.2,37.2,,,24.538011924505675,0.6619880754943246
2330,,TASA 71,Frio,,,56.0,27.5,,15/06/2021,TASA 71-2021/06/15-27.5,27.5,56.0,,,28.298011924505676,0.7980119245056763
2331,,TASA 45,Frio,,,41.5,23.7,,15/06/2021,TASA 45-2021/06/15-23.7,23.7,41.5,,,25.398011924505674,1.6980119245056748
2332,,TASA 61,Frio,,,37.2,25.2,,15/06/2021,TASA 61-2021/06/15-25.2,25.2,37.2,,,24.538011924505675,0.6619880754943246
2333,,TASA 45,Frio,,,41.5,23.7,,15/06/2021,TASA 45-2021/06/15-23.7,23.7,41.5,,,25.398011924505674,1.6980119245056748
2334,,TASA 61,Frio,,,37.2,25.2,,15/06/2021,TASA 61-2021/06/15-25.2,25.2,37.2,,,24.538011924505675,0.6619880754943246
2335,,TASA 61,Frio,,,37.2,25.2,,15/06/2021,TASA 61-2021/06/15-25.2,25.2,37.2,,,24.538011924505675,0.6619880754943246
2336,,TASA 43,Frio,,,24.3,20.5,,15/06/2021,TASA 43-2021/06/15-20.5,20.5,24.3,,,21.958011924505676,1.4580119245056764
2337,,TASA 43,Frio,,,24.3,20.5,,15/06/2021,TASA 43-2021/06/15-20.5,20.5,24.3,,,21.958011924505676,1.4580119245056764
2340,,TASA 41,Frio,,,43.8,26.1,,15/06/2021,TASA 41-2021/06/15-26.1,26.1,43.8,,,25.858011924505675,0.24198807549432644
2342,,TASA 41,Frio,,,43.8,26.1,,15/06/2021,TASA 41-2021/06/15-26.1,26.1,43.8,,,25.858011924505675,0.24198807549432644
2344,,TASA 41,Frio,,,43.8,26.1,,15/06/2021,TASA 41-2021/06/15-26.1,26.1,43.8,,,25.858011924505675,0.24198807549432644
2346,,TASA 41,Frio,,,43.8,26.1,,15/06/2021,TASA 41-2021/06/15-26.1,26.1,43.8,,,25.858011924505675,0.24198807549432644
2349,,TASA 427,Frio,,,44.1,25.3,,15/06/2021,TASA 427-2021/06/15-25.3,25.3,44.1,,,25.918011924505677,0.6180119245056765
2351,,TASA 427,Frio,,,44.1,25.3,,15/06/2021,TASA 427-2021/06/15-25.3,25.3,44.1,,,25.918011924505677,0.6180119245056765
2358,,TASA 58,Frio,,,42.8,21.2,,16/06/2021,TASA 58-2021/06/16-21.2,21.2,42.8,,,25.658011924505676,4.458011924505676
2359,,TASA 58,Frio,,,42.8,21.2,,16/06/2021,TASA 58-2021/06/16-21.2,21.2,42.8,,,25.658011924505676,4.458011924505676
2362,,TASA 58,Frio,,,22.7,21.2,,16/06/2021,TASA 58-2021/06/16-21.2,21.2,22.7,,,21.638011924505676,0.43801192450567683
2364,,TASA 58,Frio,,,22.7,21.2,,16/06/2021,TASA 58-2021/06/16-21.2,21.2,22.7,,,21.638011924505676,0.43801192450567683
2366,,TASA 58,Frio,,,22.7,21.2,,16/06/2021,TASA 58-2021/06/16-21.2,21.2,22.7,,,21.638011924505676,0.43801192450567683
2368,,TASA 58,Frio,,,22.7,21.2,,16/06/2021,TASA 58-2021/06/16-21.2,21.2,22.7,,,21.638011924505676,0.43801192450567683
2369,,TASA 52,Frio,,,26.2,22.8,,16/06/2021,TASA 52-2021/06/16-22.8,22.8,26.2,,,22.338011924505675,0.4619880754943253
2371,,TASA 52,Frio,,,26.2,22.8,,16/06/2021,TASA 52-2021/06/16-22.8,22.8,26.2,,,22.338011924505675,0.4619880754943253
2372,,TASA 52,Frio,,,26.2,22.8,,16/06/2021,TASA 52-2021/06/16-22.8,22.8,26.2,,,22.338011924505675,0.4619880754943253
2373,,TASA 55,Frio,,,24.5,23.6,,16/06/2021,TASA 55-2021/06/16-23.6,23.6,24.5,,,21.998011924505676,1.6019880754943259
2374,,TASA 52,Frio,,,26.2,22.8,,17/06/2021,TASA 52-2021/06/17-22.8,22.8,26.2,,,22.338011924505675,0.4619880754943253
2375,,TASA 55,Frio,,,24.5,23.6,,17/06/2021,TASA 55-2021/06/17-23.6,23.6,24.5,,,21.998011924505676,1.6019880754943259
2376,,TASA 419,Frio,,,49.1,27.3,,17/06/2021,TASA 419-2021/06/17-27.3,27.3,49.1,,,26.918011924505677,0.38198807549432345
2377,,TASA 52,Frio,,,26.2,22.8,,17/06/2021,TASA 52-2021/06/17-22.8,22.8,26.2,,,22.338011924505675,0.4619880754943253
2378,,TASA 419,Frio,,,49.1,27.3,,17/06/2021,TASA 419-2021/06/17-27.3,27.3,49.1,,,26.918011924505677,0.38198807549432345
2380,,TASA 42,Frio,,,24.8,24.3,,17/06/2021,TASA 42-2021/06/17-24.3,24.3,24.8,,,22.058011924505674,2.2419880754943264
2381,,TASA 419,Frio,,,49.1,27.3,,17/06/2021,TASA 419-2021/06/17-27.3,27.3,49.1,,,26.918011924505677,0.38198807549432345
2382,,TASA 42,Frio,,,24.8,24.3,,17/06/2021,TASA 42-2021/06/17-24.3,24.3,24.8,,,22.058011924505674,2.2419880754943264
2383,,TASA 419,Frio,,,49.1,27.3,,17/06/2021,TASA 419-2021/06/17-27.3,27.3,49.1,,,26.918011924505677,0.38198807549432345
2385,,TASA 55,Frio,,,24.5,23.6,,17/06/2021,TASA 55-2021/06/17-23.6,23.6,24.5,,,21.998011924505676,1.6019880754943259
2386,,TASA 45,Frio,,,40.3,28.2,,17/06/2021,TASA 45-2021/06/17-28.2,28.2,40.3,,,25.158011924505676,3.0419880754943236
2387,,TASA 51,Frio,,,36.4,25.8,,17/06/2021,TASA 51-2021/06/17-25.8,25.8,36.4,,,24.378011924505675,1.4219880754943262
2388,,TASA 45,Frio,,,40.3,28.2,,17/06/2021,TASA 45-2021/06/17-28.2,28.2,40.3,,,25.158011924505676,3.0419880754943236
2389,,TASA 51,Frio,,,36.4,25.8,,17/06/2021,TASA 51-2021/06/17-25.8,25.8,36.4,,,24.378011924505675,1.4219880754943262
2390,,TASA 51,Frio,,,36.4,25.8,,17/06/2021,TASA 51-2021/06/17-25.8,25.8,36.4,,,24.378011924505675,1.4219880754943262
2391,,TASA 45,Frio,,,40.3,28.2,,17/06/2021,TASA 45-2021/06/17-28.2,28.2,40.3,,,25.158011924505676,3.0419880754943236
2392,,TASA 51,Frio,,,36.4,25.8,,17/06/2021,TASA 51-2021/06/17-25.8,25.8,36.4,,,24.378011924505675,1.4219880754943262
2393,,TASA 45,Frio,,,40.3,28.2,,17/06/2021,TASA 45-2021/06/17-28.2,28.2,40.3,,,25.158011924505676,3.0419880754943236
2394,,TASA 43,Frio,,,36.9,28.7,,17/06/2021,TASA 43-2021/06/17-28.7,28.7,36.9,,,24.478011924505676,4.221988075494323
2395,,TASA 57,Frio,,,25.8,28.5,,17/06/2021,TASA 57-2021/06/17-28.5,28.5,25.8,,,22.258011924505677,6.241988075494323
2396,,TASA 43,Frio,,,36.9,28.7,,17/06/2021,TASA 43-2021/06/17-28.7,28.7,36.9,,,24.478011924505676,4.221988075494323
2397,,TASA 57,Frio,,,25.8,28.5,,17/06/2021,TASA 57-2021/06/17-28.5,28.5,25.8,,,22.258011924505677,6.241988075494323
2398,,TASA 59,Frio,,,40.5,19.4,,17/06/2021,TASA 59-2021/06/17-19.4,19.4,40.5,,,25.198011924505675,5.798011924505676
2399,,TASA 57,Frio,,,25.8,28.5,,17/06/2021,TASA 57-2021/06/17-28.5,28.5,25.8,,,22.258011924505677,6.241988075494323
2400,,TASA 59,Frio,,,40.5,19.4,,17/06/2021,TASA 59-2021/06/17-19.4,19.4,40.5,,,25.198011924505675,5.798011924505676
2401,,TASA 57,Frio,,,25.8,28.5,,17/06/2021,TASA 57-2021/06/17-28.5,28.5,25.8,,,22.258011924505677,6.241988075494323
2402,,TASA 59,Frio,,,40.5,19.4,,18/06/2021,TASA 59-2021/06/18-19.4,19.4,40.5,,,25.198011924505675,5.798011924505676
2403,,TASA 57,Frio,,,25.8,28.5,,18/06/2021,TASA 57-2021/06/18-28.5,28.5,25.8,,,22.258011924505677,6.241988075494323
2404,,TASA 53,Frio,,,31.3,21.0,,18/06/2021,TASA 53-2021/06/18-21,21.0,31.3,,,23.358011924505675,2.358011924505675
2405,,TASA 45,Frio,,,40.3,28.2,,18/06/2021,TASA 45-2021/06/18-28.2,28.2,40.3,,,25.158011924505676,3.0419880754943236
2406,,TASA 57,Frio,,,25.8,28.5,,18/06/2021,TASA 57-2021/06/18-28.5,28.5,25.8,,,22.258011924505677,6.241988075494323
2407,,TASA 53,Frio,,,31.3,21.0,,18/06/2021,TASA 53-2021/06/18-21,21.0,31.3,,,23.358011924505675,2.358011924505675
2408,,TASA 45,Frio,,,40.3,28.2,,18/06/2021,TASA 45-2021/06/18-28.2,28.2,40.3,,,25.158011924505676,3.0419880754943236
2409,,TASA 57,Frio,,,25.8,28.5,,18/06/2021,TASA 57-2021/06/18-28.5,28.5,25.8,,,22.258011924505677,6.241988075494323
2410,,TASA 53,Frio,,,31.3,21.0,,18/06/2021,TASA 53-2021/06/18-21,21.0,31.3,,,23.358011924505675,2.358011924505675
2411,,TASA 53,Frio,,,31.3,21.0,,18/06/2021,TASA 53-2021/06/18-21,21.0,31.3,,,23.358011924505675,2.358011924505675
2412,,TASA 45,Frio,,,40.3,28.2,,18/06/2021,TASA 45-2021/06/18-28.2,28.2,40.3,,,25.158011924505676,3.0419880754943236
2413,,TASA 427,Frio,,,39.0,28.3,,18/06/2021,TASA 427-2021/06/18-28.3,28.3,39.0,,,24.898011924505674,3.4019880754943266
2414,,TASA 53,Frio,,,31.3,21.0,,18/06/2021,TASA 53-2021/06/18-21,21.0,31.3,,,23.358011924505675,2.358011924505675
2415,,TASA 45,Frio,,,40.3,28.2,,18/06/2021,TASA 45-2021/06/18-28.2,28.2,40.3,,,25.158011924505676,3.0419880754943236
2416,,TASA 427,Frio,,,39.0,28.3,,18/06/2021,TASA 427-2021/06/18-28.3,28.3,39.0,,,24.898011924505674,3.4019880754943266
2417,,TASA 427,Frio,,,39.0,28.3,,18/06/2021,TASA 427-2021/06/18-28.3,28.3,39.0,,,24.898011924505674,3.4019880754943266
2433,,TASA 71,Frio,,,41.6,19.8,,18/06/2021,TASA 71-2021/06/18-19.8,19.8,41.6,,,25.418011924505677,5.6180119245056765
2434,,TASA 71,Frio,,,41.6,19.8,,19/06/2021,TASA 71-2021/06/19-19.8,19.8,41.6,,,25.418011924505677,5.6180119245056765
2435,,TASA 42,Frio,,,26.7,19.8,,19/06/2021,TASA 42-2021/06/19-19.8,19.8,26.7,,,22.438011924505677,2.638011924505676
2436,,TASA 71,Frio,,,41.6,19.8,,19/06/2021,TASA 71-2021/06/19-19.8,19.8,41.6,,,25.418011924505677,5.6180119245056765
2437,,TASA 42,Frio,,,26.7,19.8,,19/06/2021,TASA 42-2021/06/19-19.8,19.8,26.7,,,22.438011924505677,2.638011924505676
2438,,TASA 71,Frio,,,41.6,19.8,,19/06/2021,TASA 71-2021/06/19-19.8,19.8,41.6,,,25.418011924505677,5.6180119245056765
2439,,TASA 42,Frio,,,26.7,19.8,,19/06/2021,TASA 42-2021/06/19-19.8,19.8,26.7,,,22.438011924505677,2.638011924505676
2440,,TASA 71,Frio,,,41.6,19.8,,19/06/2021,TASA 71-2021/06/19-19.8,19.8,41.6,,,25.418011924505677,5.6180119245056765
2441,,TASA 42,Frio,,,26.7,19.8,,19/06/2021,TASA 42-2021/06/19-19.8,19.8,26.7,,,22.438011924505677,2.638011924505676
2442,,TASA 58,Frio,,,35.3,22.3,,19/06/2021,TASA 58-2021/06/19-22.3,22.3,35.3,,,24.158011924505676,1.858011924505675
2443,,TASA 55,Frio,,,36.2,24.2,,19/06/2021,TASA 55-2021/06/19-24.2,24.2,36.2,,,24.338011924505675,0.13801192450567612
2444,,TASA 58,Frio,,,35.3,22.3,,19/06/2021,TASA 58-2021/06/19-22.3,22.3,35.3,,,24.158011924505676,1.858011924505675
2445,,TASA 54,Frio,,,28.4,19.5,,19/06/2021,TASA 54-2021/06/19-19.5,19.5,28.4,,,22.778011924505677,3.2780119245056767
2446,,TASA 55,Frio,,,36.2,24.2,,19/06/2021,TASA 55-2021/06/19-24.2,24.2,36.2,,,24.338011924505675,0.13801192450567612
2447,,TASA 58,Frio,,,35.3,22.3,,19/06/2021,TASA 58-2021/06/19-22.3,22.3,35.3,,,24.158011924505676,1.858011924505675
2448,,TASA 54,Frio,,,28.4,19.5,,19/06/2021,TASA 54-2021/06/19-19.5,19.5,28.4,,,22.778011924505677,3.2780119245056767
2449,,TASA 55,Frio,,,36.2,24.2,,19/06/2021,TASA 55-2021/06/19-24.2,24.2,36.2,,,24.338011924505675,0.13801192450567612
2450,,TASA 58,Frio,,,35.3,22.3,,19/06/2021,TASA 58-2021/06/19-22.3,22.3,35.3,,,24.158011924505676,1.858011924505675
2451,,TASA 54,Frio,,,28.4,19.5,,19/06/2021,TASA 54-2021/06/19-19.5,19.5,28.4,,,22.778011924505677,3.2780119245056767
2452,,TASA 55,Frio,,,36.2,24.2,,19/06/2021,TASA 55-2021/06/19-24.2,24.2,36.2,,,24.338011924505675,0.13801192450567612
2453,,TASA 58,Frio,,,35.3,22.3,,19/06/2021,TASA 58-2021/06/19-22.3,22.3,35.3,,,24.158011924505676,1.858011924505675
2454,,TASA 54,Frio,,,28.4,19.5,,19/06/2021,TASA 54-2021/06/19-19.5,19.5,28.4,,,22.778011924505677,3.2780119245056767
2455,,TASA 55,Frio,,,36.2,24.2,,19/06/2021,TASA 55-2021/06/19-24.2,24.2,36.2,,,24.338011924505675,0.13801192450567612
2456,,TASA 54,Frio,,,28.4,19.5,,19/06/2021,TASA 54-2021/06/19-19.5,19.5,28.4,,,22.778011924505677,3.2780119245056767
2457,,TASA 54,Frio,,,28.4,19.5,,19/06/2021,TASA 54-2021/06/19-19.5,19.5,28.4,,,22.778011924505677,3.2780119245056767
2458,,TASA 55,Frio,,,36.2,24.2,,19/06/2021,TASA 55-2021/06/19-24.2,24.2,36.2,,,24.338011924505675,0.13801192450567612
2459,,TASA 54,Frio,,,28.4,19.5,,19/06/2021,TASA 54-2021/06/19-19.5,19.5,28.4,,,22.778011924505677,3.2780119245056767
2460,,TASA 54,Frio,,,28.4,19.5,,19/06/2021,TASA 54-2021/06/19-19.5,19.5,28.4,,,22.778011924505677,3.2780119245056767
2461,,TASA 55,Frio,,,36.2,24.2,,19/06/2021,TASA 55-2021/06/19-24.2,24.2,36.2,,,24.338011924505675,0.13801192450567612
2463,,TASA 54,Frio,,,28.4,19.5,,19/06/2021,TASA 54-2021/06/19-19.5,19.5,28.4,,,22.778011924505677,3.2780119245056767
2464,,TASA 54,Frio,,,28.4,19.5,,19/06/2021,TASA 54-2021/06/19-19.5,19.5,28.4,,,22.778011924505677,3.2780119245056767
2465,,TASA 51,Frio,,,43.1,27.9,,20/06/2021,TASA 51-2021/06/20-27.9,27.9,43.1,,,25.718011924505674,2.181988075494324
2466,,TASA 56,Frio,,,49.5,20.7,,20/06/2021,TASA 56-2021/06/20-20.7,20.7,49.5,,,26.998011924505676,6.298011924505676
2467,,TASA 51,Frio,,,43.1,27.9,,20/06/2021,TASA 51-2021/06/20-27.9,27.9,43.1,,,25.718011924505674,2.181988075494324
2468,,TASA 56,Frio,,,49.5,20.7,,20/06/2021,TASA 56-2021/06/20-20.7,20.7,49.5,,,26.998011924505676,6.298011924505676
2469,,TASA 51,Frio,,,43.1,27.9,,20/06/2021,TASA 51-2021/06/20-27.9,27.9,43.1,,,25.718011924505674,2.181988075494324
2470,,TASA 56,Frio,,,49.5,20.7,,20/06/2021,TASA 56-2021/06/20-20.7,20.7,49.5,,,26.998011924505676,6.298011924505676
2471,,TASA 58,Frio,,,19.5,19.1,,20/06/2021,TASA 58-2021/06/20-19.1,19.1,19.5,,,20.858260277982353,1.7582602779823517
2472,,TASA 51,Frio,,,43.1,27.9,,20/06/2021,TASA 51-2021/06/20-27.9,27.9,43.1,,,25.718011924505674,2.181988075494324
2473,,TASA 56,Frio,,,49.5,20.7,,20/06/2021,TASA 56-2021/06/20-20.7,20.7,49.5,,,26.998011924505676,6.298011924505676
2474,,TASA 51,Frio,,,43.1,27.9,,20/06/2021,TASA 51-2021/06/20-27.9,27.9,43.1,,,25.718011924505674,2.181988075494324
2476,,TASA 51,Frio,,,43.1,27.9,,20/06/2021,TASA 51-2021/06/20-27.9,27.9,43.1,,,25.718011924505674,2.181988075494324
2477,,TASA 58,Frio,,,19.5,22.3,,20/06/2021,TASA 58-2021/06/20-22.3,22.3,19.5,,,20.858260277982353,1.4417397220176476
2478,,TASA 54,Frio,,,21.6,19.9,,20/06/2021,TASA 54-2021/06/20-19.9,19.9,21.6,,,21.416425787839785,1.5164257878397862
2479,,TASA 43,Frio,,,42.8,34.6,,20/06/2021,TASA 43-2021/06/20-34.6,34.6,42.8,,,25.658011924505676,8.941988075494326
2480,,TASA 54,Frio,,,21.6,19.9,,20/06/2021,TASA 54-2021/06/20-19.9,19.9,21.6,,,21.416425787839785,1.5164257878397862
2481,,TASA 43,Frio,,,42.8,34.6,,20/06/2021,TASA 43-2021/06/20-34.6,34.6,42.8,,,25.658011924505676,8.941988075494326
2482,,TASA 43,Frio,,,42.8,34.6,,20/06/2021,TASA 43-2021/06/20-34.6,34.6,42.8,,,25.658011924505676,8.941988075494326
2483,,TASA 55,Frio,,,22.4,19.3,,20/06/2021,TASA 55-2021/06/20-19.3,19.3,22.4,,,21.578011924505674,2.278011924505673
2484,,TASA 43,Frio,,,42.8,34.6,,20/06/2021,TASA 43-2021/06/20-34.6,34.6,42.8,,,25.658011924505676,8.941988075494326
2485,,TASA 55,Frio,,,22.4,19.3,,20/06/2021,TASA 55-2021/06/20-19.3,19.3,22.4,,,21.578011924505674,2.278011924505673
2486,,TASA 44,Frio,,,54.8,37.9,,20/06/2021,TASA 44-2021/06/20-37.9,37.9,54.8,,,28.058011924505674,9.841988075494324
2487,,TASA 419,Frio,,,23.8,19.6,,20/06/2021,TASA 419-2021/06/20-19.6,19.6,23.8,,,21.858011924505675,2.2580119245056736
2488,,TASA 44,Frio,,,57.8,37.9,,20/06/2021,TASA 44-2021/06/20-37.9,37.9,57.8,,,28.658011924505676,9.241988075494323
2489,,TASA 44,Frio,,,57.8,37.9,,20/06/2021,TASA 44-2021/06/20-37.9,37.9,57.8,,,28.658011924505676,9.241988075494323
2515,,TASA 52,Frio,,,33.2,21.7,,23/06/2021,TASA 52-2021/06/23-21.7,21.7,33.2,,,23.738011924505678,2.0380119245056783
2516,,TASA 52,Frio,,,33.2,21.7,,23/06/2021,TASA 52-2021/06/23-21.7,21.7,33.2,,,23.738011924505678,2.0380119245056783
2517,,TASA 71,Frio,,,36.5,22.3,,23/06/2021,TASA 71-2021/06/23-22.3,22.3,36.5,,,24.398011924505674,2.0980119245056734
2518,,TASA 52,Frio,,,33.2,21.7,,23/06/2021,TASA 52-2021/06/23-21.7,21.7,33.2,,,23.738011924505678,2.0380119245056783
2519,,TASA 71,Frio,,,36.5,22.3,,23/06/2021,TASA 71-2021/06/23-22.3,22.3,36.5,,,24.398011924505674,2.0980119245056734
2520,,TASA 52,Frio,,,33.2,21.7,,23/06/2021,TASA 52-2021/06/23-21.7,21.7,33.2,,,23.738011924505678,2.0380119245056783
2521,,TASA 71,Frio,,,36.5,22.3,,23/06/2021,TASA 71-2021/06/23-22.3,22.3,36.5,,,24.398011924505674,2.0980119245056734
2522,,TASA 52,Frio,,,33.2,21.7,,23/06/2021,TASA 52-2021/06/23-21.7,21.7,33.2,,,23.738011924505678,2.0380119245056783
2523,,TASA 71,Frio,,,36.5,22.3,,23/06/2021,TASA 71-2021/06/23-22.3,22.3,36.5,,,24.398011924505674,2.0980119245056734
2524,,TASA 52,Frio,,,33.2,21.7,,23/06/2021,TASA 52-2021/06/23-21.7,21.7,33.2,,,23.738011924505678,2.0380119245056783
2525,,TASA 71,Frio,,,36.5,22.3,,23/06/2021,TASA 71-2021/06/23-22.3,22.3,36.5,,,24.398011924505674,2.0980119245056734
2526,,TASA 71,Frio,,,36.5,22.3,,23/06/2021,TASA 71-2021/06/23-22.3,22.3,36.5,,,24.398011924505674,2.0980119245056734
2527,,TASA 427,Frio,,,32.0,22.7,,23/06/2021,TASA 427-2021/06/23-22.7,22.7,32.0,,,23.498011924505676,0.7980119245056763
2528,,TASA 71,Frio,,,36.5,22.3,,23/06/2021,TASA 71-2021/06/23-22.3,22.3,36.5,,,24.398011924505674,2.0980119245056734
2529,,TASA 427,Frio,,,32.0,22.7,,23/06/2021,TASA 427-2021/06/23-22.7,22.7,32.0,,,23.498011924505676,0.7980119245056763
2530,,TASA 71,Frio,,,36.5,22.3,,23/06/2021,TASA 71-2021/06/23-22.3,22.3,36.5,,,24.398011924505674,2.0980119245056734
2531,,TASA 427,Frio,,,32.0,22.7,,23/06/2021,TASA 427-2021/06/23-22.7,22.7,32.0,,,23.498011924505676,0.7980119245056763
2532,,TASA 427,Frio,,,32.0,22.7,,23/06/2021,TASA 427-2021/06/23-22.7,22.7,32.0,,,23.498011924505676,0.7980119245056763
2543,,TASA 61,Frio,,,12.6,19.2,,25/06/2021,TASA 61-2021/06/25-19.2,19.2,12.6,,,19.222258486194193,0.02225848619419324
2549,,TASA 42,Frio,,,10.2,16.7,,25/06/2021,TASA 42-2021/06/25-16.7,16.7,10.2,,,19.08481926290324,2.384819262903239
2550,,TASA 54,Frio,,,12.5,16.3,,25/06/2021,TASA 54-2021/06/25-16.3,16.3,12.5,,,19.21376710595706,2.91376710595706
2552,,TASA 54,Frio,,,12.5,16.3,,25/06/2021,TASA 54-2021/06/25-16.3,16.3,12.5,,,19.21376710595706,2.91376710595706
2554,,TASA 52,Frio,,,32.9,22.2,,25/06/2021,TASA 52-2021/06/25-22.2,22.2,32.9,,,23.678011924505675,1.478011924505676
2555,,TASA 54,Frio,,,12.5,16.3,,25/06/2021,TASA 54-2021/06/25-16.3,16.3,12.5,,,19.21376710595706,2.91376710595706
2556,,TASA 52,Frio,,,32.9,22.2,,25/06/2021,TASA 52-2021/06/25-22.2,22.2,32.9,,,23.678011924505675,1.478011924505676
2557,,TASA 54,Frio,,,12.5,16.3,,25/06/2021,TASA 54-2021/06/25-16.3,16.3,12.5,,,19.21376710595706,2.91376710595706
2558,,TASA 52,Frio,,,32.9,22.2,,25/06/2021,TASA 52-2021/06/25-22.2,22.2,32.9,,,23.678011924505675,1.478011924505676
2561,,TASA 52,Frio,,,32.9,22.2,,25/06/2021,TASA 52-2021/06/25-22.2,22.2,32.9,,,23.678011924505675,1.478011924505676
2564,,TASA 56,Frio,,,50.7,20.2,,25/06/2021,TASA 56-2021/06/25-20.2,20.2,50.7,,,27.238011924505678,7.038011924505678
2567,,TASA 56,Frio,,,50.7,20.2,,25/06/2021,TASA 56-2021/06/25-20.2,20.2,50.7,,,27.238011924505678,7.038011924505678
2576,,TASA 55,Frio,,,45.4,23.4,,26/06/2021,TASA 55-2021/06/26-23.4,23.4,45.4,,,26.178011924505675,2.7780119245056767
2581,,TASA 55,Frio,,,45.4,23.4,,26/06/2021,TASA 55-2021/06/26-23.4,23.4,45.4,,,26.178011924505675,2.7780119245056767
2587,,TASA 59,Frio,,,48.5,25.6,,26/06/2021,TASA 59-2021/06/26-25.6,25.6,48.5,,,26.798011924505676,1.1980119245056748
2588,,TASA 419,Frio,,,51.6,36.2,,26/06/2021,TASA 419-2021/06/26-36.2,36.2,51.6,,,27.418011924505677,8.781988075494326
2589,,TASA 44,Frio,,,49.0,24.0,,26/06/2021,TASA 44-2021/06/26-24,24.0,49.0,,,26.898011924505674,2.898011924505674
2590,,TASA 59,Frio,,,48.5,25.6,,26/06/2021,TASA 59-2021/06/26-25.6,25.6,48.5,,,26.798011924505676,1.1980119245056748
2591,,TASA 419,Frio,,,51.6,36.2,,26/06/2021,TASA 419-2021/06/26-36.2,36.2,51.6,,,27.418011924505677,8.781988075494326
2592,,TASA 427,Frio,,,39.9,22.0,,26/06/2021,TASA 427-2021/06/26-22,22.0,39.9,,,25.078011924505674,3.078011924505674
2593,,TASA 59,Frio,,,48.5,25.6,,26/06/2021,TASA 59-2021/06/26-25.6,25.6,48.5,,,26.798011924505676,1.1980119245056748
2594,,TASA 419,Frio,,,51.6,36.2,,26/06/2021,TASA 419-2021/06/26-36.2,36.2,51.6,,,27.418011924505677,8.781988075494326
2595,,TASA 427,Frio,,,39.9,22.0,,26/06/2021,TASA 427-2021/06/26-22,22.0,39.9,,,25.078011924505674,3.078011924505674
2596,,TASA 59,Frio,,,48.5,25.6,,26/06/2021,TASA 59-2021/06/26-25.6,25.6,48.5,,,26.798011924505676,1.1980119245056748
2597,,TASA 419,Frio,,,51.6,36.2,,26/06/2021,TASA 419-2021/06/26-36.2,36.2,51.6,,,27.418011924505677,8.781988075494326
2598,,TASA 45,Frio,,,54.9,23.3,,26/06/2021,TASA 45-2021/06/26-23.3,23.3,54.9,,,28.078011924505674,4.778011924505673
2599,,TASA 58,Frio,,,56.0,30.4,,26/06/2021,TASA 58-2021/06/26-30.4,30.4,56.0,,,28.298011924505676,2.1019880754943223
2600,,TASA 51,Frio,,,51.0,33.8,,26/06/2021,TASA 51-2021/06/26-33.8,33.8,51.0,,,27.298011924505676,6.501988075494321
2601,,TASA 58,Frio,,,56.0,30.4,,26/06/2021,TASA 58-2021/06/26-30.4,30.4,56.0,,,28.298011924505676,2.1019880754943223
2602,,TASA 71,Frio,,,46.9,22.8,,26/06/2021,TASA 71-2021/06/26-22.8,22.8,46.9,,,26.478011924505676,3.6780119245056753
2603,,TASA 58,Frio,,,56.0,30.4,,26/06/2021,TASA 58-2021/06/26-30.4,30.4,56.0,,,28.298011924505676,2.1019880754943223
2604,,TASA 71,Frio,,,46.9,22.8,,26/06/2021,TASA 71-2021/06/26-22.8,22.8,46.9,,,26.478011924505676,3.6780119245056753
2605,,TASA 71,Frio,,,46.9,22.8,,26/06/2021,TASA 71-2021/06/26-22.8,22.8,46.9,,,26.478011924505676,3.6780119245056753
2606,,TASA 51,Frio,,,51.0,33.8,,26/06/2021,TASA 51-2021/06/26-33.8,33.8,51.0,,,27.298011924505676,6.501988075494321
2607,,TASA 71,Frio,,,46.9,22.8,,26/06/2021,TASA 71-2021/06/26-22.8,22.8,46.9,,,26.478011924505676,3.6780119245056753
2608,,TASA 51,Frio,,,51.0,33.8,,26/06/2021,TASA 51-2021/06/26-33.8,33.8,51.0,,,27.298011924505676,6.501988075494321
2609,,TASA 71,Frio,,,46.9,22.8,,26/06/2021,TASA 71-2021/06/26-22.8,22.8,46.9,,,26.478011924505676,3.6780119245056753
2610,,TASA 51,Frio,,,51.0,33.8,,26/06/2021,TASA 51-2021/06/26-33.8,33.8,51.0,,,27.298011924505676,6.501988075494321
2611,,TASA 51,Frio,,,51.0,33.8,,26/06/2021,TASA 51-2021/06/26-33.8,33.8,51.0,,,27.298011924505676,6.501988075494321
2688,,TASA 55,Frio,,,15.9,18.2,,27/06/2021,TASA 55-2021/06/27-18.2,18.2,15.9,,,19.78566050720903,1.585660507209031
2690,,TASA 425,Frio,,,28.3,22.7,,27/06/2021,TASA 425-2021/06/27-22.7,22.7,28.3,,,22.758011924505677,0.058011924505677825
2691,,TASA 43,Frio,,,33.7,19.8,,27/06/2021,TASA 43-2021/06/27-19.8,19.8,33.7,,,23.838011924505675,4.038011924505675
2692,,TASA 425,Frio,,,28.3,22.7,,27/06/2021,TASA 425-2021/06/27-22.7,22.7,28.3,,,22.758011924505677,0.058011924505677825
2693,,TASA 43,Frio,,,33.7,19.8,,27/06/2021,TASA 43-2021/06/27-19.8,19.8,33.7,,,23.838011924505675,4.038011924505675
2694,,TASA 425,Frio,,,28.3,22.7,,27/06/2021,TASA 425-2021/06/27-22.7,22.7,28.3,,,22.758011924505677,0.058011924505677825
2695,,TASA 43,Frio,,,33.7,19.8,,27/06/2021,TASA 43-2021/06/27-19.8,19.8,33.7,,,23.838011924505675,4.038011924505675
2696,,TASA 425,Frio,,,28.3,22.7,,27/06/2021,TASA 425-2021/06/27-22.7,22.7,28.3,,,22.758011924505677,0.058011924505677825
2697,,TASA 43,Frio,,,33.7,19.8,,27/06/2021,TASA 43-2021/06/27-19.8,19.8,33.7,,,23.838011924505675,4.038011924505675
2703,,TASA 56,Frio,,,31.9,21.6,,27/06/2021,TASA 56-2021/06/27-21.6,21.6,31.9,,,23.478011924505676,1.8780119245056746
2709,,TASA 56,Frio,,,31.9,21.6,,27/06/2021,TASA 56-2021/06/27-21.6,21.6,31.9,,,23.478011924505676,1.8780119245056746
2715,,TASA 51,Frio,,,21.9,20.6,,27/06/2021,TASA 51-2021/06/27-20.6,20.6,21.9,,,21.47854480124522,0.8785448012452193
2721,,TASA 51,Frio,,,21.9,20.6,,27/06/2021,TASA 51-2021/06/27-20.6,20.6,21.9,,,21.47854480124522,0.8785448012452193
2727,,TASA 51,Frio,,,21.9,20.6,,27/06/2021,TASA 51-2021/06/27-20.6,20.6,21.9,,,21.47854480124522,0.8785448012452193
2733,,TASA 44,Frio,,,31.0,22.7,,27/06/2021,TASA 44-2021/06/27-22.7,22.7,31.0,,,23.298011924505676,0.598011924505677
2734,,TASA 44,Frio,,,31.0,22.7,,27/06/2021,TASA 44-2021/06/27-22.7,22.7,31.0,,,23.298011924505676,0.598011924505677
2737,,TASA 44,Frio,,,31.0,22.7,,27/06/2021,TASA 44-2021/06/27-22.7,22.7,31.0,,,23.298011924505676,0.598011924505677
2740,,TASA 59,Frio,,,23.2,22.0,,27/06/2021,TASA 59-2021/06/27-22,22.0,23.2,,,21.738011924505674,0.261988075494326
2743,,TASA 59,Frio,,,23.2,22.0,,27/06/2021,TASA 59-2021/06/27-22,22.0,23.2,,,21.738011924505674,0.261988075494326
2746,,TASA 59,Frio,,,23.2,22.0,,28/06/2021,TASA 59-2021/06/28-22,22.0,23.2,,,21.738011924505674,0.261988075494326
2749,,TASA 59,Frio,,,23.2,22.0,,28/06/2021,TASA 59-2021/06/28-22,22.0,23.2,,,21.738011924505674,0.261988075494326
2756,,TASA 42,Frio,,,7.8,18.0,,28/06/2021,TASA 42-2021/06/28-18,18.0,7.8,,,18.730094225212383,0.7300942252123832
2760,,TASA 42,Frio,,,7.8,18.0,,28/06/2021,TASA 42-2021/06/28-18,18.0,7.8,,,18.730094225212383,0.7300942252123832
2763,,TASA 42,Frio,,,7.8,18.0,,28/06/2021,TASA 42-2021/06/28-18,18.0,7.8,,,18.730094225212383,0.7300942252123832
2767,,TASA 42,Frio,,,7.8,18.0,,28/06/2021,TASA 42-2021/06/28-18,18.0,7.8,,,18.730094225212383,0.7300942252123832
2788,,TASA 427,Frio,,,15.3,19.1,,28/06/2021,TASA 427-2021/06/28-19.1,19.1,15.3,,,19.64142276006841,0.5414227600684072
2799,,TASA 71,Frio,,,40.1,21.6,,28/06/2021,TASA 71-2021/06/28-21.6,21.6,40.1,,,25.118011924505677,3.518011924505675
2802,,TASA 71,Frio,,,40.1,21.6,,28/06/2021,TASA 71-2021/06/28-21.6,21.6,40.1,,,25.118011924505677,3.518011924505675
2805,,TASA 71,Frio,,,40.1,21.6,,28/06/2021,TASA 71-2021/06/28-21.6,21.6,40.1,,,25.118011924505677,3.518011924505675
2807,,TASA 71,Frio,,,40.1,21.6,,28/06/2021,TASA 71-2021/06/28-21.6,21.6,40.1,,,25.118011924505677,3.518011924505675
2810,,TASA 51,Frio,,,17.9,18.6,,28/06/2021,TASA 51-2021/06/28-18.6,18.6,17.9,,,20.361129699734022,1.7611296997340204
2812,,TASA 51,Frio,,,17.9,18.6,,28/06/2021,TASA 51-2021/06/28-18.6,18.6,17.9,,,20.361129699734022,1.7611296997340204
2814,,TASA 51,Frio,,,17.9,18.6,,28/06/2021,TASA 51-2021/06/28-18.6,18.6,17.9,,,20.361129699734022,1.7611296997340204
2827,,TASA 59,Frio,,,11.0,16.8,,29/06/2021,TASA 59-2021/06/29-16.8,16.8,11.0,,,19.124196636465825,2.3241966364658246
2831,,TASA 59,Frio,,,11.0,16.8,,29/06/2021,TASA 59-2021/06/29-16.8,16.8,11.0,,,19.124196636465825,2.3241966364658246
2833,,TASA 57,Frio,,,19.1,20.2,,29/06/2021,TASA 57-2021/06/29-20.2,20.2,19.1,,,20.735854465754286,0.5358544657542872
2837,,TASA 45,Frio,,,13.8,20.3,,29/06/2021,TASA 45-2021/06/29-20.3,20.3,13.8,,,19.361087148653837,0.9389128513461635
2838,,TASA 45,Frio,,,13.8,20.3,,29/06/2021,TASA 45-2021/06/29-20.3,20.3,13.8,,,19.361087148653837,0.9389128513461635
2839,,TASA 44,Frio,,,14.8,21.7,,29/06/2021,TASA 44-2021/06/29-21.7,21.7,14.8,,,19.534691420421296,2.165308579578703
2840,,TASA 42,Frio,,,17.1,20.4,,29/06/2021,TASA 42-2021/06/29-20.4,20.4,17.1,,,20.11777065847663,0.28222934152336876
2841,,TASA 45,Frio,,,13.8,20.3,,29/06/2021,TASA 45-2021/06/29-20.3,20.3,13.8,,,19.361087148653837,0.9389128513461635
2842,,TASA 44,Frio,,,14.8,21.7,,29/06/2021,TASA 44-2021/06/29-21.7,21.7,14.8,,,19.534691420421296,2.165308579578703
2843,,TASA 42,Frio,,,17.1,20.4,,29/06/2021,TASA 42-2021/06/29-20.4,20.4,17.1,,,20.11777065847663,0.28222934152336876
2846,,TASA 44,Frio,,,14.8,21.7,,29/06/2021,TASA 44-2021/06/29-21.7,21.7,14.8,,,19.534691420421296,2.165308579578703
2847,,TASA 42,Frio,,,17.1,20.4,,29/06/2021,TASA 42-2021/06/29-20.4,20.4,17.1,,,20.11777065847663,0.28222934152336876
2850,,TASA 44,Frio,,,14.8,21.7,,29/06/2021,TASA 44-2021/06/29-21.7,21.7,14.8,,,19.534691420421296,2.165308579578703
2851,,TASA 42,Frio,,,17.1,20.4,,29/06/2021,TASA 42-2021/06/29-20.4,20.4,17.1,,,20.11777065847663,0.28222934152336876
2852,,TASA 44,Frio,,,14.8,21.7,,29/06/2021,TASA 44-2021/06/29-21.7,21.7,14.8,,,19.534691420421296,2.165308579578703
2853,,TASA 42,Frio,,,17.1,20.4,,29/06/2021,TASA 42-2021/06/29-20.4,20.4,17.1,,,20.11777065847663,0.28222934152336876
2859,,TASA 43,Frio,,,5.0,16.5,,30/06/2021,TASA 43-2021/06/30-16.5,16.5,5.0,,,16.746680474375005,0.24668047437500462
2866,,TASA 54,Frio,,,10.7,17.1,,30/06/2021,TASA 54-2021/06/30-17.1,17.1,10.7,,,19.11028882562053,2.0102888256205276
2868,,TASA 54,Frio,,,10.7,17.1,,30/06/2021,TASA 54-2021/06/30-17.1,17.1,10.7,,,19.11028882562053,2.0102888256205276
2870,,TASA 54,Frio,,,10.7,17.1,,30/06/2021,TASA 54-2021/06/30-17.1,17.1,10.7,,,19.11028882562053,2.0102888256205276
2871,,TASA 59,Frio,,,9.4,17.9,,30/06/2021,TASA 59-2021/06/30-17.9,17.9,9.4,,,19.025505362295277,1.1255053622952786
2872,,TASA 59,Frio,,,9.4,17.9,,30/06/2021,TASA 59-2021/06/30-17.9,17.9,9.4,,,19.025505362295277,1.1255053622952786
2874,,TASA 55,Frio,,,15.3,17.9,,30/06/2021,TASA 55-2021/06/30-17.9,17.9,15.3,,,19.64142276006841,1.74142276006841
2875,,TASA 59,Frio,,,9.4,17.9,,30/06/2021,TASA 59-2021/06/30-17.9,17.9,9.4,,,19.025505362295277,1.1255053622952786
2877,,TASA 55,Frio,,,15.3,17.9,,30/06/2021,TASA 55-2021/06/30-17.9,17.9,15.3,,,19.64142276006841,1.74142276006841
2879,,TASA 55,Frio,,,15.3,17.9,,30/06/2021,TASA 55-2021/06/30-17.9,17.9,15.3,,,19.64142276006841,1.74142276006841
2884,,TASA 55,Frio,,,15.3,17.9,,30/06/2021,TASA 55-2021/06/30-17.9,17.9,15.3,,,19.64142276006841,1.74142276006841
2888,,TASA 51,Frio,,,16.1,22.2,,30/06/2021,TASA 51-2021/06/30-22.2,22.2,16.1,,,19.837317714827492,2.3626822851725073
2891,,TASA 51,Frio,,,16.1,22.2,,30/06/2021,TASA 51-2021/06/30-22.2,22.2,16.1,,,19.837317714827492,2.3626822851725073
2906,,TASA 41,Frio,,,39.9,22.0,,30/06/2021,TASA 41-2021/06/30-22,22.0,39.9,,,25.078011924505674,3.078011924505674
2911,,TASA 41,Frio,,,39.9,22.0,,30/06/2021,TASA 41-2021/06/30-22,22.0,39.9,,,25.078011924505674,3.078011924505674
2916,,TASA 41,Frio,,,39.9,22.0,,30/06/2021,TASA 41-2021/06/30-22,22.0,39.9,,,25.078011924505674,3.078011924505674
2918,,TASA 58,Frio,,,16.6,22.8,,30/06/2021,TASA 58-2021/06/30-22.8,22.8,16.6,,,19.97335050535125,2.826649494648752
2919,,TASA 61,Frio,,,22.7,19.6,,30/06/2021,TASA 61-2021/06/30-19.6,19.6,22.7,,,21.638011924505676,2.0380119245056747
2921,,TASA 58,Frio,,,16.6,22.8,,1/07/2021,TASA 58-2021/07/01-22.8,22.8,16.6,,,19.97335050535125,2.826649494648752
2922,,TASA 61,Frio,,,22.7,19.6,,1/07/2021,TASA 61-2021/07/01-19.6,19.6,22.7,,,21.638011924505676,2.0380119245056747
2924,,TASA 58,Frio,,,16.6,22.8,,1/07/2021,TASA 58-2021/07/01-22.8,22.8,16.6,,,19.97335050535125,2.826649494648752
2925,,TASA 61,Frio,,,22.7,19.6,,1/07/2021,TASA 61-2021/07/01-19.6,19.6,22.7,,,21.638011924505676,2.0380119245056747
2928,,TASA 58,Frio,,,16.6,22.8,,1/07/2021,TASA 58-2021/07/01-22.8,22.8,16.6,,,19.97335050535125,2.826649494648752
2929,,TASA 61,Frio,,,22.7,19.6,,1/07/2021,TASA 61-2021/07/01-19.6,19.6,22.7,,,21.638011924505676,2.0380119245056747
2930,,TASA 56,Frio,,,27.4,17.6,,1/07/2021,TASA 56-2021/07/01-17.6,17.6,27.4,,,22.578011924505674,4.978011924505672
2934,,TASA 56,Frio,,,27.4,17.6,,1/07/2021,TASA 56-2021/07/01-17.6,17.6,27.4,,,22.578011924505674,4.978011924505672
2937,,TASA 56,Frio,,,27.4,17.6,,1/07/2021,TASA 56-2021/07/01-17.6,17.6,27.4,,,22.578011924505674,4.978011924505672
2941,,TASA 56,Frio,,,27.4,17.6,,1/07/2021,TASA 56-2021/07/01-17.6,17.6,27.4,,,22.578011924505674,4.978011924505672
2944,,TASA 56,Frio,,,27.4,17.6,,1/07/2021,TASA 56-2021/07/01-17.6,17.6,27.4,,,22.578011924505674,4.978011924505672
2946,,TASA 425,Frio,,,21.4,22.2,,1/07/2021,TASA 425-2021/07/01-22.2,22.2,21.4,,,21.372052152645836,0.8279478473541637
2947,,TASA 71,Frio,,,24.6,18.5,,1/07/2021,TASA 71-2021/07/01-18.5,18.5,24.6,,,22.018011924505675,3.518011924505675
2949,,TASA 53,Frio,,,28.7,24.9,,1/07/2021,TASA 53-2021/07/01-24.9,24.9,28.7,,,22.838011924505675,2.061988075494323
2950,,TASA 425,Frio,,,24.6,22.2,,1/07/2021,TASA 425-2021/07/01-22.2,22.2,24.6,,,22.018011924505675,0.18198807549432416
2951,,TASA 71,Frio,,,24.6,18.5,,1/07/2021,TASA 71-2021/07/01-18.5,18.5,24.6,,,22.018011924505675,3.518011924505675
2953,,TASA 53,Frio,,,28.7,24.9,,1/07/2021,TASA 53-2021/07/01-24.9,24.9,28.7,,,22.838011924505675,2.061988075494323
2954,,TASA 425,Frio,,,24.6,22.2,,1/07/2021,TASA 425-2021/07/01-22.2,22.2,24.6,,,22.018011924505675,0.18198807549432416
2955,,TASA 71,Frio,,,24.6,18.5,,1/07/2021,TASA 71-2021/07/01-18.5,18.5,24.6,,,22.018011924505675,3.518011924505675
2956,,TASA 53,Frio,,,28.7,24.9,,1/07/2021,TASA 53-2021/07/01-24.9,24.9,28.7,,,22.838011924505675,2.061988075494323
2957,,TASA 425,Frio,,,24.6,22.2,,1/07/2021,TASA 425-2021/07/01-22.2,22.2,24.6,,,22.018011924505675,0.18198807549432416
2960,,TASA 425,Frio,,,24.6,22.2,,1/07/2021,TASA 425-2021/07/01-22.2,22.2,24.6,,,22.018011924505675,0.18198807549432416
2991,,TASA 57,Frio,,,32.0,22.0,,1/07/2021,TASA 57-2021/07/01-22,22.0,32.0,,,23.498011924505676,1.4980119245056756
2993,,TASA 57,Frio,,,32.0,22.0,,1/07/2021,TASA 57-2021/07/01-22,22.0,32.0,,,23.498011924505676,1.4980119245056756
3010,,TASA 61,Frio,,,27.1,18.5,,2/07/2021,TASA 61-2021/07/02-18.5,18.5,27.1,,,22.518011924505675,4.018011924505675
3015,,TASA 59,Frio,,,34.6,22.7,,2/07/2021,TASA 59-2021/07/02-22.7,22.7,34.6,,,24.018011924505675,1.3180119245056758
3016,,TASA 59,Frio,,,34.6,22.7,,2/07/2021,TASA 59-2021/07/02-22.7,22.7,34.6,,,24.018011924505675,1.3180119245056758
3017,,TASA 52,Frio,,,22.8,22.5,,2/07/2021,TASA 52-2021/07/02-22.5,22.5,22.8,,,21.658011924505676,0.8419880754943243
3018,,TASA 45,Frio,,,33.2,21.7,,2/07/2021,TASA 45-2021/07/02-21.7,21.7,33.2,,,23.738011924505678,2.0380119245056783
3019,,TASA 52,Frio,,,22.8,22.5,,2/07/2021,TASA 52-2021/07/02-22.5,22.5,22.8,,,21.658011924505676,0.8419880754943243
3020,,TASA 45,Frio,,,33.2,21.7,,2/07/2021,TASA 45-2021/07/02-21.7,21.7,33.2,,,23.738011924505678,2.0380119245056783
3021,,TASA 52,Frio,,,22.8,22.5,,2/07/2021,TASA 52-2021/07/02-22.5,22.5,22.8,,,21.658011924505676,0.8419880754943243
3024,,TASA 52,Frio,,,22.8,22.5,,2/07/2021,TASA 52-2021/07/02-22.5,22.5,22.8,,,21.658011924505676,0.8419880754943243
3027,,TASA 52,Frio,,,22.8,22.5,,2/07/2021,TASA 52-2021/07/02-22.5,22.5,22.8,,,21.658011924505676,0.8419880754943243
3030,,TASA 55,Frio,,,41.1,27.4,,2/07/2021,TASA 55-2021/07/02-27.4,27.4,41.1,,,25.318011924505676,2.0819880754943227
3031,,TASA 55,Frio,,,41.1,27.4,,2/07/2021,TASA 55-2021/07/02-27.4,27.4,41.1,,,25.318011924505676,2.0819880754943227
3034,,TASA 42,Frio,,,44.5,24.1,,2/07/2021,TASA 42-2021/07/02-24.1,24.1,44.5,,,25.998011924505676,1.8980119245056741
3035,,TASA 55,Frio,,,41.1,27.4,,2/07/2021,TASA 55-2021/07/02-27.4,27.4,41.1,,,25.318011924505676,2.0819880754943227
3036,,TASA 42,Frio,,,44.5,24.1,,2/07/2021,TASA 42-2021/07/02-24.1,24.1,44.5,,,25.998011924505676,1.8980119245056741
3038,,TASA 42,Frio,,,44.5,24.1,,2/07/2021,TASA 42-2021/07/02-24.1,24.1,44.5,,,25.998011924505676,1.8980119245056741
3043,,TASA 44,Frio,,,18.0,24.3,,3/07/2021,TASA 44-2021/07/03-24.3,24.3,18.0,,,20.39223340765443,3.9077665923455704
3071,,TASA 71,Frio,,,37.3,20.8,,3/07/2021,TASA 71-2021/07/03-20.8,20.8,37.3,,,24.558011924505674,3.7580119245056736
3074,,TASA 71,Frio,,,37.4,20.8,,3/07/2021,TASA 71-2021/07/03-20.8,20.8,37.4,,,24.578011924505674,3.778011924505673
3079,,TASA 71,Frio,,,37.4,20.8,,3/07/2021,TASA 71-2021/07/03-20.8,20.8,37.4,,,24.578011924505674,3.778011924505673
3084,,TASA 71,Frio,,,37.4,20.8,,3/07/2021,TASA 71-2021/07/03-20.8,20.8,37.4,,,24.578011924505674,3.778011924505673
3091,,TASA 71,Frio,,,37.4,20.8,,3/07/2021,TASA 71-2021/07/03-20.8,20.8,37.4,,,24.578011924505674,3.778011924505673
3098,,TASA 51,Frio,,,17.2,19.9,,3/07/2021,TASA 51-2021/07/03-19.9,19.9,17.2,,,20.147486045456972,0.2474860454569736
3101,,TASA 51,Frio,,,17.2,19.9,,3/07/2021,TASA 51-2021/07/03-19.9,19.9,17.2,,,20.147486045456972,0.2474860454569736
3113,,TASA 41,Frio,,,22.8,19.8,,3/07/2021,TASA 41-2021/07/03-19.8,19.8,22.8,,,21.658011924505676,1.858011924505675
3115,,TASA 41,Frio,,,22.8,19.8,,3/07/2021,TASA 41-2021/07/03-19.8,19.8,22.8,,,21.658011924505676,1.858011924505675
3117,,TASA 54,Frio,,,23.4,19.0,,3/07/2021,TASA 54-2021/07/03-19,19.0,23.4,,,21.778011924505677,2.7780119245056767
3119,,TASA 59,Frio,,,26.0,19.2,,4/07/2021,TASA 59-2021/07/04-19.2,19.2,26.0,,,22.298011924505676,3.098011924505677
3121,,TASA 59,Frio,,,26.0,19.2,,4/07/2021,TASA 59-2021/07/04-19.2,19.2,26.0,,,22.298011924505676,3.098011924505677
3123,,TASA 59,Frio,,,26.0,19.2,,4/07/2021,TASA 59-2021/07/04-19.2,19.2,26.0,,,22.298011924505676,3.098011924505677
3125,,TASA 59,Frio,,,26.0,19.2,,4/07/2021,TASA 59-2021/07/04-19.2,19.2,26.0,,,22.298011924505676,3.098011924505677
3134,,TASA 43,Frio,,,31.3,22.3,,4/07/2021,TASA 43-2021/07/04-22.3,22.3,31.3,,,23.358011924505675,1.0580119245056743
3137,,TASA 43,Frio,,,31.3,22.3,,4/07/2021,TASA 43-2021/07/04-22.3,22.3,31.3,,,23.358011924505675,1.0580119245056743
3140,,TASA 53,Frio,,,32.5,20.4,,4/07/2021,TASA 53-2021/07/04-20.4,20.4,32.5,,,23.598011924505677,3.1980119245056784
3143,,TASA 53,Frio,,,32.5,20.4,,4/07/2021,TASA 53-2021/07/04-20.4,20.4,32.5,,,23.598011924505677,3.1980119245056784
3146,,TASA 53,Frio,,,32.5,20.4,,4/07/2021,TASA 53-2021/07/04-20.4,20.4,32.5,,,23.598011924505677,3.1980119245056784
3150,,TASA 53,Frio,,,32.5,20.4,,4/07/2021,TASA 53-2021/07/04-20.4,20.4,32.5,,,23.598011924505677,3.1980119245056784
3154,,TASA 52,Frio,,,17.6,18.9,,4/07/2021,TASA 52-2021/07/04-18.9,18.9,17.6,,,20.268542895587146,1.3685428955871473
3155,,TASA 44,Frio,,,34.1,22.7,,4/07/2021,TASA 44-2021/07/04-22.7,22.7,34.1,,,23.918011924505677,1.218011924505678
3156,,TASA 52,Frio,,,17.6,18.9,,4/07/2021,TASA 52-2021/07/04-18.9,18.9,17.6,,,20.268542895587146,1.3685428955871473
3157,,TASA 44,Frio,,,34.1,22.7,,4/07/2021,TASA 44-2021/07/04-22.7,22.7,34.1,,,23.918011924505677,1.218011924505678
3162,,TASA 41,Frio,,,15.3,19.7,,4/07/2021,TASA 41-2021/07/04-19.7,19.7,15.3,,,19.64142276006841,0.0585772399315907
3163,,TASA 55,Frio,,,15.3,17.7,,4/07/2021,TASA 55-2021/07/04-17.7,17.7,15.3,,,19.64142276006841,1.9414227600684093
3164,,TASA 44,Frio,,,34.1,22.7,,4/07/2021,TASA 44-2021/07/04-22.7,22.7,34.1,,,23.918011924505677,1.218011924505678
3169,,TASA 41,Frio,,,15.3,19.7,,4/07/2021,TASA 41-2021/07/04-19.7,19.7,15.3,,,19.64142276006841,0.0585772399315907
3170,,TASA 55,Frio,,,15.3,17.7,,4/07/2021,TASA 55-2021/07/04-17.7,17.7,15.3,,,19.64142276006841,1.9414227600684093
3171,,TASA 44,Frio,,,34.1,22.7,,4/07/2021,TASA 44-2021/07/04-22.7,22.7,34.1,,,23.918011924505677,1.218011924505678
3176,,TASA 56,Frio,,,18.0,17.6,,4/07/2021,TASA 56-2021/07/04-17.6,17.6,18.0,,,20.39223340765443,2.792233407654429
3181,,TASA 56,Frio,,,18.0,17.6,,4/07/2021,TASA 56-2021/07/04-17.6,17.6,18.0,,,20.39223340765443,2.792233407654429
3186,,TASA 56,Frio,,,18.0,17.6,,4/07/2021,TASA 56-2021/07/04-17.6,17.6,18.0,,,20.39223340765443,2.792233407654429
3187,,TASA 54,Frio,,,24.1,17.7,,5/07/2021,TASA 54-2021/07/05-17.7,17.7,24.1,,,21.918011924505677,4.218011924505678
3188,,TASA 53,Frio,,,9.5,17.1,,5/07/2021,TASA 53-2021/07/05-17.1,17.1,9.5,,,19.034886753326703,1.9348867533267011
3189,,TASA 419,Frio,,,32.1,18.4,,5/07/2021,TASA 419-2021/07/05-18.4,18.4,32.1,,,23.518011924505675,5.1180119245056765
3190,,TASA 53,Frio,,,9.5,17.1,,5/07/2021,TASA 53-2021/07/05-17.1,17.1,9.5,,,19.034886753326703,1.9348867533267011
3191,,TASA 419,Frio,,,32.1,18.4,,5/07/2021,TASA 419-2021/07/05-18.4,18.4,32.1,,,23.518011924505675,5.1180119245056765
3192,,TASA 53,Frio,,,9.5,17.1,,5/07/2021,TASA 53-2021/07/05-17.1,17.1,9.5,,,19.034886753326703,1.9348867533267011
3193,,TASA 419,Frio,,,32.1,18.4,,5/07/2021,TASA 419-2021/07/05-18.4,18.4,32.1,,,23.518011924505675,5.1180119245056765
3194,,TASA 419,Frio,,,32.1,18.4,,5/07/2021,TASA 419-2021/07/05-18.4,18.4,32.1,,,23.518011924505675,5.1180119245056765
3195,,TASA 52,Frio,,,8.2,16.1,,5/07/2021,TASA 52-2021/07/05-16.1,16.1,8.2,,,18.837081653241967,2.7370816532419653
3197,,TASA 419,Frio,,,32.1,18.4,,5/07/2021,TASA 419-2021/07/05-18.4,18.4,32.1,,,23.518011924505675,5.1180119245056765
3199,,TASA 419,Frio,,,32.1,18.4,,5/07/2021,TASA 419-2021/07/05-18.4,18.4,32.1,,,23.518011924505675,5.1180119245056765
3201,,TASA 57,Frio,,,33.2,19.8,,5/07/2021,TASA 57-2021/07/05-19.8,19.8,33.2,,,23.738011924505678,3.938011924505677
3203,,TASA 57,Frio,,,33.2,19.8,,5/07/2021,TASA 57-2021/07/05-19.8,19.8,33.2,,,23.738011924505678,3.938011924505677
3205,,TASA 57,Frio,,,33.2,19.8,,5/07/2021,TASA 57-2021/07/05-19.8,19.8,33.2,,,23.738011924505678,3.938011924505677
3207,,TASA 57,Frio,,,33.2,19.8,,5/07/2021,TASA 57-2021/07/05-19.8,19.8,33.2,,,23.738011924505678,3.938011924505677
3208,,TASA 427,Frio,,,32.3,26.3,,5/07/2021,TASA 427-2021/07/05-26.3,26.3,32.3,,,23.558011924505674,2.7419880754943264
3211,,TASA 57,Frio,,,33.2,19.8,,5/07/2021,TASA 57-2021/07/05-19.8,19.8,33.2,,,23.738011924505678,3.938011924505677
3212,,TASA 427,Frio,,,32.3,26.3,,5/07/2021,TASA 427-2021/07/05-26.3,26.3,32.3,,,23.558011924505674,2.7419880754943264
3215,,TASA 57,Frio,,,33.2,19.8,,5/07/2021,TASA 57-2021/07/05-19.8,19.8,33.2,,,23.738011924505678,3.938011924505677
3216,,TASA 427,Frio,,,32.3,26.3,,5/07/2021,TASA 427-2021/07/05-26.3,26.3,32.3,,,23.558011924505674,2.7419880754943264
3219,,TASA 57,Frio,,,33.2,19.8,,5/07/2021,TASA 57-2021/07/05-19.8,19.8,33.2,,,23.738011924505678,3.938011924505677
3220,,TASA 427,Frio,,,32.3,26.3,,5/07/2021,TASA 427-2021/07/05-26.3,26.3,32.3,,,23.558011924505674,2.7419880754943264
3222,,TASA 57,Frio,,,33.2,19.8,,5/07/2021,TASA 57-2021/07/05-19.8,19.8,33.2,,,23.738011924505678,3.938011924505677
3223,,TASA 427,Frio,,,32.3,26.3,,5/07/2021,TASA 427-2021/07/05-26.3,26.3,32.3,,,23.558011924505674,2.7419880754943264
3225,,TASA 55,Frio,,,20.9,20.2,,5/07/2021,TASA 55-2021/07/05-20.2,20.2,20.9,,,21.251626889141534,1.0516268891415343
3227,,TASA 425,Frio,,,42.4,27.3,,6/07/2021,TASA 425-2021/07/06-27.3,27.3,42.4,,,25.578011924505674,1.7219880754943269
3229,,TASA 425,Frio,,,42.4,27.3,,6/07/2021,TASA 425-2021/07/06-27.3,27.3,42.4,,,25.578011924505674,1.7219880754943269
3231,,TASA 425,Frio,,,42.4,27.3,,6/07/2021,TASA 425-2021/07/06-27.3,27.3,42.4,,,25.578011924505674,1.7219880754943269
3234,,TASA 425,Frio,,,42.4,27.3,,6/07/2021,TASA 425-2021/07/06-27.3,27.3,42.4,,,25.578011924505674,1.7219880754943269
3236,,TASA 425,Frio,,,42.4,27.3,,6/07/2021,TASA 425-2021/07/06-27.3,27.3,42.4,,,25.578011924505674,1.7219880754943269
3238,,TASA 425,Frio,,,42.4,27.3,,6/07/2021,TASA 425-2021/07/06-27.3,27.3,42.4,,,25.578011924505674,1.7219880754943269
3239,,TASA 425,Frio,,,42.4,27.3,,6/07/2021,TASA 425-2021/07/06-27.3,27.3,42.4,,,25.578011924505674,1.7219880754943269
3240,,TASA 425,Frio,,,42.4,27.3,,6/07/2021,TASA 425-2021/07/06-27.3,27.3,42.4,,,25.578011924505674,1.7219880754943269
3241,,TASA 41,Frio,,,36.4,24.6,,6/07/2021,TASA 41-2021/07/06-24.6,24.6,36.4,,,24.378011924505675,0.22198807549432686
3242,,TASA 41,Frio,,,36.4,24.6,,6/07/2021,TASA 41-2021/07/06-24.6,24.6,36.4,,,24.378011924505675,0.22198807549432686
3243,,TASA 41,Frio,,,36.4,24.6,,6/07/2021,TASA 41-2021/07/06-24.6,24.6,36.4,,,24.378011924505675,0.22198807549432686
3246,,TASA 41,Frio,,,36.4,24.6,,6/07/2021,TASA 41-2021/07/06-24.6,24.6,36.4,,,24.378011924505675,0.22198807549432686
3249,,TASA 41,Frio,,,36.4,24.6,,6/07/2021,TASA 41-2021/07/06-24.6,24.6,36.4,,,24.378011924505675,0.22198807549432686
3252,,TASA 56,Frio,,,37.1,25.6,,6/07/2021,TASA 56-2021/07/06-25.6,25.6,37.1,,,24.518011924505675,1.0819880754943263
3255,,TASA 56,Frio,,,37.1,25.6,,6/07/2021,TASA 56-2021/07/06-25.6,25.6,37.1,,,24.518011924505675,1.0819880754943263
3256,,TASA 56,Frio,,,37.1,25.6,,6/07/2021,TASA 56-2021/07/06-25.6,25.6,37.1,,,24.518011924505675,1.0819880754943263
3257,,TASA 56,Frio,,,37.1,25.6,,6/07/2021,TASA 56-2021/07/06-25.6,25.6,37.1,,,24.518011924505675,1.0819880754943263
3258,,TASA 56,Frio,,,37.1,25.6,,6/07/2021,TASA 56-2021/07/06-25.6,25.6,37.1,,,24.518011924505675,1.0819880754943263
3259,,TASA 56,Frio,,,37.1,25.6,,6/07/2021,TASA 56-2021/07/06-25.6,25.6,37.1,,,24.518011924505675,1.0819880754943263
3260,,TASA 56,Frio,,,37.1,25.6,,6/07/2021,TASA 56-2021/07/06-25.6,25.6,37.1,,,24.518011924505675,1.0819880754943263
3261,,TASA 56,Frio,,,37.1,25.6,,6/07/2021,TASA 56-2021/07/06-25.6,25.6,37.1,,,24.518011924505675,1.0819880754943263
3262,,TASA 56,Frio,,,37.1,25.6,,6/07/2021,TASA 56-2021/07/06-25.6,25.6,37.1,,,24.518011924505675,1.0819880754943263
3264,,TASA 56,Frio,,,37.1,25.6,,7/07/2021,TASA 56-2021/07/07-25.6,25.6,37.1,,,24.518011924505675,1.0819880754943263
3265,,TASA 43,Frio,,,5.4,16.7,,7/07/2021,TASA 43-2021/07/07-16.7,16.7,5.4,,,17.21358267419948,0.5135826741994798
3266,,TASA 45,Frio,,,13.1,18.1,,7/07/2021,TASA 45-2021/07/07-18.1,18.1,13.1,,,19.27142907912149,1.1714290791214879
3268,,TASA 45,Frio,,,13.1,18.1,,7/07/2021,TASA 45-2021/07/07-18.1,18.1,13.1,,,19.27142907912149,1.1714290791214879
3270,,TASA 427,Frio,,,37.6,17.1,,7/07/2021,TASA 427-2021/07/07-17.1,17.1,37.6,,,24.618011924505677,7.518011924505675
3271,,TASA 52,Frio,,,45.6,19.6,,7/07/2021,TASA 52-2021/07/07-19.6,19.6,45.6,,,26.218011924505674,6.618011924505673
3272,,TASA 52,Frio,,,45.6,19.6,,7/07/2021,TASA 52-2021/07/07-19.6,19.6,45.6,,,26.218011924505674,6.618011924505673
3273,,TASA 52,Frio,,,45.6,19.6,,7/07/2021,TASA 52-2021/07/07-19.6,19.6,45.6,,,26.218011924505674,6.618011924505673
3274,,TASA 41,Frio,,,36.0,19.2,,8/07/2021,TASA 41-2021/07/08-19.2,19.2,36.0,,,24.298011924505676,5.098011924505677
3275,,TASA 41,Frio,,,36.0,19.2,,8/07/2021,TASA 41-2021/07/08-19.2,19.2,36.0,,,24.298011924505676,5.098011924505677
3276,,TASA 41,Frio,,,36.0,19.2,,8/07/2021,TASA 41-2021/07/08-19.2,19.2,36.0,,,24.298011924505676,5.098011924505677
3277,,TASA 41,Frio,,,36.0,19.2,,8/07/2021,TASA 41-2021/07/08-19.2,19.2,36.0,,,24.298011924505676,5.098011924505677
3278,,TASA 41,Frio,,,36.0,19.2,,8/07/2021,TASA 41-2021/07/08-19.2,19.2,36.0,,,24.298011924505676,5.098011924505677
3301,,TASA 57,Frio,,,12.3,20.2,,15/11/2021,TASA 57-2021/11/15-20.2,20.2,12.3,,,19.198006039309135,1.0019939606908643
3306,,TASA 57,Frio,,,12.3,20.2,,15/11/2021,TASA 57-2021/11/15-20.2,20.2,12.3,,,19.198006039309135,1.0019939606908643
3307,,TASA 57,Frio,,,12.3,20.2,,15/11/2021,TASA 57-2021/11/15-20.2,20.2,12.3,,,19.198006039309135,1.0019939606908643
